,State,Area,Event,Severity,Certainty,Urgency,Effective,Ends,Description
14,CO,Larimer County Below 6000 Feet/Northwest Weld County; Boulder And Jefferson Counties Below 6000 Feet/West Broomfield County; North Douglas County Below 6000 Feet/Denver/West Adams and Arapahoe Counties/East Broomfield County; Elbert/Central and East Douglas Counties Above 6000 Feet; Northeast Weld County; Central and South Weld County; Morgan County; Central and East Adams and Arapahoe Counties; North and Northeast Elbert County Below 6000 Feet/North Lincoln County; Southeast Elbert County Below 6000 Feet/South Lincoln County; Logan County; Washington County; Sedgwick County; Phillips County,Red Flag Warning,Severe,Likely,Expected,2022-04-06T03:17:00-06:00,2022-04-07T19:00:00-06:00,"['The National Weather Service in Denver has issued a Red Flag\nWarning for wind and low relative humidity, which is in effect\nfrom 11 AM to 7 PM MDT Thursday.', '* Affected Area...Fire Weather Zones 238, 239, 240, 241, 242,\n243, 244, 245, 246, 247, 248, 249, 250 and 251.', '* Timing...Wednesday, 9 AM until 9 PM.\nThursday, 11 AM until 8 PM.', '* Winds...North to northwest 35 to 45 mph with gusts up to 65 mph.', '* Relative Humidity...10 to 15 percent.', '* Impacts...Any fire that develops will likely spread rapidly.\nOutdoor burning should be avoided, as well as any activity\nthat may produce a spark and start a fast moving wildfire.']"
15,CO,Yuma; Kit Carson County; Cheyenne,Red Flag Warning,Severe,Likely,Expected,2022-04-06T03:11:00-06:00,2022-04-06T19:00:00-06:00,"['The National Weather Service in Goodland has issued a Red Flag\nWarning for wind and low relative humidity, which is in effect\nfrom 11 AM to 8 PM MDT Thursday. The Fire Weather Watch is no\nlonger in effect.', '* Affected Area...In Colorado...Fire Weather Zone 252 Yuma...\nFire Weather Zone 253 Kit Carson and Fire Weather Zone 254\nCheyenne.', '* Winds...For Wednesday, northwest 35 to 45 mph with gusts up to\n65 mph. For Thursday, north-northwest 35 to 45 mph with gusts\nup to 60 mph.', '* Relative Humidity...For Wednesday, as low as 16 percent. For\nThursday, as low as 18 percent.', '* Impacts...Any fires that start will have extreme fire behavior\nand spread rapidly. Outdoor burning is not advised. Abrupt\nchanges in wind direction and speed are not expected.']"
16,CO,Yuma; Kit Carson County; Cheyenne,Red Flag Warning,Severe,Likely,Expected,2022-04-06T03:11:00-06:00,2022-04-07T20:00:00-06:00,"['The National Weather Service in Goodland has issued a Red Flag\nWarning for wind and low relative humidity, which is in effect\nfrom 11 AM to 8 PM MDT Thursday. The Fire Weather Watch is no\nlonger in effect.', '* Affected Area...In Colorado...Fire Weather Zone 252 Yuma...\nFire Weather Zone 253 Kit Carson and Fire Weather Zone 254\nCheyenne.', '* Winds...For Wednesday, northwest 35 to 45 mph with gusts up to\n65 mph. For Thursday, north-northwest 35 to 45 mph with gusts\nup to 60 mph.', '* Relative Humidity...For Wednesday, as low as 16 percent. For\nThursday, as low as 18 percent.', '* Impacts...Any fires that start will have extreme fire behavior\nand spread rapidly. Outdoor burning is not advised. Abrupt\nchanges in wind direction and speed are not expected.']"
17,CO,Larimer County Below 6000 Feet/Northwest Weld County; Central and South Weld County; Central and East Adams and Arapahoe Counties,High Wind Warning,Severe,Likely,Expected,2022-04-06T03:04:00-06:00,2022-04-06T20:00:00-06:00,"['* WHAT...Northwest winds 30 to 40 mph with gusts up to 65 mph\nexpected.', '* WHERE...Fort Collins, Greeley, and Byers.', '* WHEN...From 9 AM this morning to 8 PM MDT this evening.', '* IMPACTS...Damaging winds will blow down trees and power lines.\nTravel will be difficult, especially for high profile vehicles.\nStrong winds will likely lead to rapid fire growth of any new\nfire. Blowing dust will reduce visibility to less than a quarter\nmile in places.']"
18,CO,Northeast Weld County; Morgan County; North and Northeast Elbert County Below 6000 Feet/North Lincoln County; Southeast Elbert County Below 6000 Feet/South Lincoln County; Logan County; Washington County; Sedgwick County; Phillips County,High Wind Warning,Severe,Likely,Expected,2022-04-06T03:04:00-06:00,2022-04-06T20:00:00-06:00,"['* WHAT...North to northwest winds 30 to 45 mph with gusts up to 65\nmph possible.', '* WHERE...Briggsdale, Fort Morgan, Limon, Southern Lincoln County,\nSterling, Akron, Julesburg, and Holyoke.', '* WHEN...For the High Wind Warning, from 9 AM this morning to 8 PM\nMDT this evening.\nFor the High Wind Watch, from Thursday morning through Thursday\nevening.', '* IMPACTS...Damaging winds will blow down trees and power lines.\nTravel will be difficult, especially for high profile vehicles.\nStrong winds will likely lead to rapid fire growth of any new\nfire. Blowing dust will reduce visibility to less than a quarter\nmile in places.']"
19,CO,Northeast Weld County; Morgan County; North and Northeast Elbert County Below 6000 Feet/North Lincoln County; Southeast Elbert County Below 6000 Feet/South Lincoln County; Logan County; Washington County; Sedgwick County; Phillips County,High Wind Watch,Severe,Possible,Future,2022-04-06T03:04:00-06:00,2022-04-07T19:00:00-06:00,"['* WHAT...North to northwest winds 30 to 45 mph with gusts up to 65\nmph possible.', '* WHERE...Briggsdale, Fort Morgan, Limon, Southern Lincoln County,\nSterling, Akron, Julesburg, and Holyoke.', '* WHEN...For the High Wind Warning, from 9 AM this morning to 8 PM\nMDT this evening.\nFor the High Wind Watch, from Thursday morning through Thursday\nevening.', '* IMPACTS...Damaging winds will blow down trees and power lines.\nTravel will be difficult, especially for high profile vehicles.\nStrong winds will likely lead to rapid fire growth of any new\nfire. Blowing dust will reduce visibility to less than a quarter\nmile in places.']"
0,FL,"Jefferson, FL; Madison, FL; Taylor, FL",Flood Warning,Severe,Observed,Immediate,2022-04-06T10:48:00-04:00,,"['* WHAT...Minor flooding is forecast.', '* WHERE...Aucilla River at Lamont (US 27).', '* WHEN...From this evening until further notice.', '* IMPACTS...At 53.0 feet, Minor lowland flooding begins.', '* ADDITIONAL DETAILS...\n- At 9:30 PM EDT Tuesday the stage was 52.5 feet.\n- Forecast...The river is expected to rise above flood stage\nthis evening and continue rising to a crest of 54.0 feet\nFriday evening.\n- Flood stage is 53.0 feet.\n- http://www.weather.gov/safety/flood']"
1,FL,"Escambia, AL; Escambia, FL",Flood Warning,Severe,Observed,Immediate,2022-04-06T09:35:00-05:00,2022-04-09T01:00:00-05:00,"['* WHAT...Minor flooding is forecast.', '* WHERE...Escambia River Near Century.', '* WHEN...From Thursday evening to early Saturday morning.', '* IMPACTS...At 17.0 feet, considerable flooding of lowlands occurs.', '* ADDITIONAL DETAILS...\n- At 9:05 AM CDT Wednesday the stage was 14.5 feet.\n- Forecast...The river is expected to rise above flood stage\ntomorrow evening to a crest of 17.1 feet early Friday\nmorning. It will then fall below flood stage Friday evening.\n- Flood stage is 17.0 feet.\n- http://www.weather.gov/safety/flood']"
2,FL,"Alachua, FL; Columbia, FL",Flood Warning,Severe,Observed,Immediate,2022-04-06T10:25:00-04:00,2022-04-09T14:00:00-04:00,"['* WHAT...Minor flooding is occurring and minor flooding is forecast.', ""* WHERE...Santa Fe River Near O'Leno State Park."", '* WHEN...Until early Saturday afternoon.', ""* IMPACTS...At 41.0 feet, Swimming becomes dangerous in the river in\nthe park area.\nAt 42.0 feet, Boat ramp at the end of Bible Camp Road begins to\nflood.\nAt 43.0 feet, Access to river gage becomes limited as the Bible\nCamp Road boat ramp becomes flooded and the last half mile of\nBible Camp Road begins to flood in Columbia County. Overland\nflooding begins past the Santa Fe River sink in the park and will\ncut-off access road to south end of the park.\nAt 45.0 feet, Numerous walking trails in O'leno State Park are\nflooded on the Alachua County side of the river. Flooding begins\nto affect local roads north of Buzzard Roost Prairie in Columbia\nCounty."", '* ADDITIONAL DETAILS...\n- At 9:15 AM EDT Wednesday the stage was 43.2 feet.\n- Recent Activity...The maximum river stage in the 24 hours\nending at 9:15 AM EDT Wednesday was 43.4 feet.\n- Forecast...The river is expected to rise to a crest of 43.2\nfeet this afternoon. It will then fall below flood stage\nSaturday morning.\n- Flood stage is 43.0 feet.\n- http://www.weather.gov/safety/flood']"
3,FL,"Columbia, FL; Gilchrist, FL",Flood Warning,Severe,Observed,Immediate,2022-04-06T10:25:00-04:00,2022-04-10T20:00:00-04:00,"['* WHAT...Minor flooding is occurring and minor flooding is forecast.', '* WHERE...Santa Fe River At Fort White.', '* WHEN...Until Sunday evening.', '* IMPACTS...At 23.0 feet, Minor damage to dwellings is possible due\nto boat wash.\nAt 23.3 feet, Florida Fish and Wildlife Commission begins\nenforcement of a no wake zone on the Santa Fe River from the\ncenterline of the US 27 Bridge downstream to one-half mile\nupstream from the State Road 47 Bridge.\nAt 25.0 feet, Damage to homes at low elevation as well as basement\nareas underneath homes on stilts is likely.', '* ADDITIONAL DETAILS...\n- At 9:45 AM EDT Wednesday the stage was 23.4 feet.\n- Recent Activity...The maximum river stage in the 24 hours\nending at 9:45 AM EDT Wednesday was 23.5 feet.\n- Forecast...The river is expected to fall below flood stage\nearly Sunday afternoon and continue falling to 22.9 feet\nMonday morning.\n- Flood stage is 23.0 feet.\n- http://www.weather.gov/safety/flood']"
4,FL,"Columbia, FL; Gilchrist, FL; Suwannee, FL",Flood Warning,Severe,Observed,Immediate,2022-04-06T10:25:00-04:00,,"['* WHAT...Minor flooding is occurring and minor flooding is forecast.', '* WHERE...Santa Fe River At Three Rivers Estates.', '* WHEN...Until further notice.', ""* IMPACTS...At 16.0 feet, Lowland flooding begins on SW Santa Fe\nDrive south of Santa Fe Road in Columbia County.\nAt 16.3 feet, Florida Fish and Wildlife Commission begins\nenforcement of a no wake zone on the Santa Fe River from the\nunnamed island 1.5 miles downstream of the Wilson's Spring Boat\nRamp to the confluence with the Suwannee River and on the\nIchetucknee River upstream to the US 27 bridge.\nAt 17.0 feet, Water begins to enter backyards of residences on\nSanta Fe Road in Columbia County and on River Run Road in Suwannee\nCounty.\nAt 18.0 feet, Water begins to flood River Run Road in Suwannee\nCounty.\nAt 18.8 feet, Florida Fish and Wildlife Commission expands the no\nwake zone restriction further upstream on the Santa Fe River from\nthe unnamed island 1.5 miles downstream on the Wilson's Spring\nBoat Ramp to one-half mile upstream of the State Road 47 bridge.\nAt 19.0 feet, Water begins to enter backyards of residences along\nthe Ichetucknee River.\nAt 19.8 feet, Waters begins to affect homes in the Hollingsworth\nBluff area at State Route 47.\nAt 20.0 feet, Access to homes on Santa Fe Road below SW Riverside\nAvenue becomes restricted in Columbia. Flooding begins on Santa Fe\nand Wilson Springs Road."", '* ADDITIONAL DETAILS...\n- At 8:00 AM EDT Wednesday the stage was 18.2 feet.\n- Recent Activity...The maximum river stage in the 24 hours\nending at 8:00 AM EDT Wednesday was 18.2 feet.\n- Forecast...The river is expected to remain steady above flood\nstage at 18.1 feet.\n- Flood stage is 17.0 feet.\n- http://www.weather.gov/safety/flood']"
5,FL,Mobile Coastal; Baldwin Coastal; Escambia Coastal; Santa Rosa Coastal; Okaloosa Coastal,Rip Current Statement,Moderate,Likely,Expected,2022-04-06T07:18:00-05:00,2022-04-07T18:00:00-05:00,"['* WHAT...Dangerous rip currents.', '* WHERE...In Alabama, Baldwin Coastal and Mobile Coastal\nCounties. In Florida, Santa Rosa Coastal, Okaloosa Coastal and\nEscambia Coastal Counties.', '* WHEN...Through Thursday afternoon.', '* IMPACTS...Rip currents can sweep even the best swimmers away\nfrom shore into deeper water.']"
6,FL,Pinellas; Coastal Hillsborough; Coastal Manatee; Coastal Sarasota; Coastal Charlotte; Coastal Lee,Rip Current Statement,Moderate,Likely,Expected,2022-04-06T08:06:00-04:00,2022-04-06T20:00:00-04:00,"['* WHAT...Dangerous rip currents.', '* WHERE...Pinellas, Coastal Hillsborough, Coastal Manatee,\nCoastal Sarasota, Coastal Charlotte and Coastal Lee Counties.', '* WHEN...Until 8 PM EDT this evening.', '* IMPACTS...Rip currents can sweep even the best swimmers away\nfrom shore into deeper water.']"
7,FL,"Baker, FL; Nassau, FL; Charlton, GA",Flood Warning,Severe,Observed,Immediate,2022-04-05T16:08:00-04:00,2022-04-08T08:00:00-04:00,"['* WHAT...Minor flooding is forecast.', ""* WHERE...St Mary's River At Macclenny."", '* WHEN...From late Wednesday night to Friday morning.', ""* IMPACTS...At 12.0 feet, Minor flooding of low lying areas and\ntimber lands including some properties along St. Mary's River\nBluff Road and the Cypress Landing Resort on the Georgia side.\nAt 14.0 feet, Flooding of bottomlands along the river and some\nlower access roads including the lower half of St. Mary's River\nBluff Road which cuts off 15 to 20 homes on the Georgia side."", '* ADDITIONAL DETAILS...\n- At 3:45 PM EDT Tuesday the stage was 8.1 feet.\n- Forecast...The river is expected to rise above flood stage\nearly Thursday morning to a crest of 12.3 feet early Thursday\nafternoon. It will then fall below flood stage early Friday\nmorning.\n- Flood stage is 12.0 feet.\n- http://www.weather.gov/safety/flood']"
8,FL,"Alachua, FL; Union, FL",Flood Warning,Severe,Observed,Immediate,2022-04-05T16:08:00-04:00,2022-04-10T02:00:00-04:00,"['RRA', '* WHAT...Minor flooding is forecast.', '* WHERE...Santa Fe River Near Worthington Springs.', '* WHEN...From Friday afternoon to early Sunday morning.', '* IMPACTS...At 56.0 feet, The boat ramp and floating dock at\nChastain-Seay Park in Worthington Springs begin to flood.\nAt 58.0 feet, Picnic Areas and campsites at Chastain-Seay Park in\nWorthington Springs begin to flood.\nAt 59.0 feet, Chastain-Seay Park in Worthington Springs is\ngenerally closed to the public as access roads within the park\nbecome flooded.\nAt 60.0 feet, A driveway near Southwest 102nd Court in Union\nCounty begins to flood at this level. Flooding along the river\ncontinues to impact boat ramps, docks and campgrounds in the area.', '* ADDITIONAL DETAILS...\n- At 3:15 PM EDT Tuesday the stage was 58.3 feet.\n- Forecast...The river is expected to rise above flood stage\nearly Friday afternoon to a crest of 59.2 feet early Saturday\nmorning. It will then fall below flood stage Saturday\nevening.\n- Flood stage is 59.0 feet.\n- http://www.weather.gov/safety/flood']"
9,FL,Mobile Coastal; Baldwin Coastal; Escambia Coastal; Santa Rosa Coastal; Okaloosa Coastal,Rip Current Statement,Moderate,Likely,Expected,2022-04-05T12:39:00-05:00,2022-04-07T18:00:00-05:00,"['* WHAT...For the High Surf Advisory, large breaking waves of 4\nto 6 feet in the surf zone. For the High Rip Current Risk,\ndangerous rip currents.', '* WHERE...In Alabama, Baldwin Coastal and Mobile Coastal\nCounties. In Florida, Santa Rosa Coastal, Okaloosa Coastal and\nEscambia Coastal Counties.', '* WHEN...For the High Surf Advisory, until midnight CDT tonight.\nFor the High Rip Current Risk, through Thursday afternoon.', '* IMPACTS...Dangerous swimming and surfing conditions and\nlocalized beach erosion. Rip currents can sweep even the best\nswimmers away from shore into deeper water.']"
10,FL,Mobile Coastal; Baldwin Coastal; Escambia Coastal; Santa Rosa Coastal; Okaloosa Coastal,Rip Current Statement,Moderate,Likely,Expected,2022-04-05T04:22:00-05:00,2022-04-07T18:00:00-05:00,"['* WHAT...For the High Surf Advisory, large breaking waves of 4\nto 6 feet expected in the surf zone. For the High Rip Current\nRisk, dangerous rip currents.', '* WHERE...In Alabama, Mobile Coastal and Baldwin Coastal\nCounties. In Florida, Escambia Coastal, Santa Rosa Coastal and\nOkaloosa Coastal Counties.', '* WHEN...For the High Surf Advisory, from noon today to midnight\nCDT tonight. For the High Rip Current Risk, through Thursday\nafternoon.', '* IMPACTS...Dangerous swimming and surfing conditions and\nlocalized beach erosion. Rip currents can sweep even the best\nswimmers away from shore into deeper water.']"
11,FL,Mobile Coastal; Baldwin Coastal; Escambia Coastal; Santa Rosa Coastal; Okaloosa Coastal,Rip Current Statement,Moderate,Likely,Expected,2022-04-04T12:59:00-05:00,2022-04-07T18:00:00-05:00,"['* WHAT...Dangerous rip currents expected.', '* WHERE...In Alabama, Baldwin Coastal and Mobile Coastal\nCounties. In Florida, Santa Rosa Coastal, Okaloosa Coastal and\nEscambia Coastal Counties.', '* WHEN...From 7 PM CDT this evening through Thursday afternoon.', '* IMPACTS...Rip currents can sweep even the best swimmers away\nfrom shore into deeper water.']"
12,FL,Mobile Coastal; Baldwin Coastal; Escambia Coastal; Santa Rosa Coastal; Okaloosa Coastal,Rip Current Statement,Moderate,Likely,Expected,2022-04-04T04:23:00-05:00,2022-04-07T18:00:00-05:00,"['* WHAT...Dangerous rip currents expected.', '* WHERE...In Alabama, Mobile Coastal and Baldwin Coastal\nCounties. In Florida, Escambia Coastal, Santa Rosa Coastal and\nOkaloosa Coastal Counties.', '* WHEN...From this evening through Thursday afternoon.', '* IMPACTS...Rip currents can sweep even the best swimmers away\nfrom shore into deeper water.']"
13,FL,South Walton; Coastal Bay; Coastal Gulf; Coastal Franklin,Rip Current Statement,Moderate,Likely,Expected,2022-04-04T01:51:00-04:00,2022-04-09T03:00:00-04:00,"['* WHAT...Dangerous rip currents.', '* WHERE...Walton, Bay, Gulf, and Franklin County Beaches.', '* WHEN...Through late Friday night.', '* IMPACTS...Rip currents can sweep even the best swimmers away\nfrom shore into deeper water.']"
0,GA,"Johnson, GA; Laurens, GA; Washington, GA; Wilkinson, GA",Flood Warning,Severe,Likely,Expected,2022-04-06T11:40:00-04:00,,"['* WHAT...Minor flooding is forecast.', '* WHERE...Oconee River near Dublin.', '* WHEN...From Saturday morning until further notice.', '* IMPACTS...At 24 feet, Minor flooding spreads further into the\nwoodlands and agricultural areas near the river upstream and\ndownstream from the gage on U.S. Highway 80. The flood waters will\nbe around one foot deep on Rex Miller Road...downstream left bank\nof the Highway 80 bridge and Old River Lane...upstream and left\nbank from the bridge. The water level will approach the\nfoundations of a few homes on these roads.', '* ADDITIONAL DETAILS...\n- At 10:45 AM EDT Wednesday the stage was 8.5 feet and rising.\n- Forecast...The river is expected to rise above flood stage\nlate Saturday morning and continue rising to 24.5 feet Sunday\nevening. Additional rises are possible thereafter.\n- Flood stage is 21 feet.\n- http://www.weather.gov/safety/flood']"
1,GA,"Troup, GA",Flood Warning,Severe,Observed,Immediate,2022-04-06T11:36:00-04:00,,"['* WHAT...Minor flooding is occurring.', '* WHERE...YellowJacket Creek near Hogansville.', '* WHEN...Until further notice.', '* IMPACTS...At 8 feet, Minor flooding begins of the marshy wetlands\nand woods along the creek upstream and downstream from the stream\ngage on the Hammett Road bridge.', '* ADDITIONAL DETAILS...\n- At 10:30 AM EDT Wednesday the stage was 8.2 feet and rising.\n- Forecast...No forecast is available for this location.\n- Flood stage is 8 feet.\n- http://www.weather.gov/safety/flood']"
2,GA,"Taliaferro, GA; Wilkes, GA",Flood Warning,Severe,Likely,Expected,2022-04-06T11:34:00-04:00,,"['* WHAT...Minor flooding is occurring.', '* WHERE...Little River near Washington.', '* WHEN...Until further notice.', '* IMPACTS...At 21 feet, Minor flooding continues in the woodlands\nand fields along the river upstream and downstream from the gage\nat Lundberg Road.', '* ADDITIONAL DETAILS...\n- At 11:00 AM EDT Wednesday the stage was 20.9 feet and rising\nslowly.\n- Forecast...No forecast is available for this location.\n- Flood stage is 19 feet.\n- http://www.weather.gov/safety/flood']"
3,GA,"Bibb, GA; Houston, GA; Jones, GA; Monroe, GA; Twiggs, GA",Flood Warning,Severe,Observed,Immediate,2022-04-06T11:29:00-04:00,2022-04-10T13:08:00-04:00,"['* WHAT...Minor flooding will continue.', '* WHERE...Ocmulgee River near Macon.', '* WHEN...Until early Sunday afternoon.', '* IMPACTS...At 23 feet, Minor flooding continues to expand. Large\nportions of the Macon GreenWay Ocmulgee Heritage Trail floods\nnorth of the Martin Luther King Boulevard bridge. The flood waters\nwill be up to 3 feet deep on portions of the trail. Large portions\nof agricultural lands east of Macon and well downstream will be\nunder 1 to 5 feet of water.', '* ADDITIONAL DETAILS...\n- At 10:30 AM EDT Wednesday the stage was 21.6 feet and rising.\n- Forecast...The river is expected to rise to a crest of 22.3\nfeet early Friday morning. It will then fall below flood\nstage Sunday morning.\n- Flood stage is 18 feet.\n- http://www.weather.gov/safety/flood']"
4,GA,"Johnson, GA; Washington, GA; Wilkinson, GA",Flood Warning,Severe,Observed,Immediate,2022-04-06T11:27:00-04:00,,"['* WHAT...Moderate flooding is forecast.', '* WHERE...Oconee River near Oconee.', '* WHEN...From Thursday morning until further notice.', '* IMPACTS...At 21 feet, Moderate flooding begins. The dirt parking\nlot by the Old Balls Ferry Road boat ramp is under one to three\nfeet of water. The end of Old Balls Ferry Road begins to flood.\nFlooding continues and spreads further into the woodlands near the\nriver.', '* ADDITIONAL DETAILS...\n- At 10:45 AM EDT Wednesday the stage was 11.4 feet and rising.\n- Forecast...The river is expected to rise above flood stage\nlate tomorrow morning and continue rising to a crest of 21.5\nfeet early Friday afternoon.\n- Flood stage is 17 feet.\n- http://www.weather.gov/safety/flood']"
5,GA,"Crawford, GA; Talbot, GA; Taylor, GA; Upson, GA",Flood Warning,Severe,Observed,Immediate,2022-04-06T11:22:00-04:00,2022-04-08T17:00:00-04:00,"['* WHAT...Minor flooding is forecast.', '* WHERE...Flint River near Carsonville Hwy. 19.', '* WHEN...From Thursday evening to Friday afternoon.', '* IMPACTS...At 18 feet, Flood Stage is reached. Minor flooding\nbegins along the river in the woodlands and low lying areas of\nfields upstream and downstream from the gage on U.S. Highway 19.\nThe water level will reach the top of a boat ramp by the bridge on\nthe Taylor County side of the river.', '* ADDITIONAL DETAILS...\n- At 9:45 AM EDT Wednesday the stage was 16.2 feet and rising.\n- Forecast...The river is expected to rise above flood stage\ntomorrow evening to a crest of 18.3 feet early Friday\nmorning. It will then fall below flood stage late Friday\nmorning.\n- Flood stage is 18 feet.\n- http://www.weather.gov/safety/flood']"
6,GA,"Baldwin, GA; Washington, GA; Wilkinson, GA",Flood Warning,Severe,Observed,Immediate,2022-04-06T11:06:00-04:00,2022-04-07T05:00:00-04:00,"['* WHAT...Minor flooding will continue.', '* WHERE...Oconee River near Milledgeville.', '* WHEN...Until late tonight.', '* IMPACTS...At 27 feet, Minor flooding continues in the woodlands\nand pasture upstream and downstream from the gage located around\none half mile upstream from the Georgia Highway 22 and 24 bridge.\nThe parking lot and the Oconee River Greenway Park just downstream\nfrom the bridge will be completely flooded with water several feet\ndeep. Sinclair Dam will have three to four gates open to reach\nthis height.', '* ADDITIONAL DETAILS...\n- At 10:45 AM EDT Wednesday the stage was 26.6 feet and\nfalling.\n- Forecast...The river is expected to fall below flood stage\nlate this evening and continue falling to 12.2 feet Monday\nmorning.\n- Flood stage is 22 feet.\n- http://www.weather.gov/safety/flood']"
7,GA,"Fayette, GA; Spalding, GA",Flood Warning,Severe,Observed,Immediate,2022-04-06T11:01:00-04:00,2022-04-07T09:00:00-04:00,"['* WHAT...Minor flooding is forecast.', '* WHERE...Flint River near Griffin.', '* WHEN...Until late tomorrow morning.', '* IMPACTS...At 12 feet, Flood stage is reached. Minor flooding\nbegins in the woodlands...fields and pasture upstream and\ndownstream from the gage on Georgia Highway 16 or Newnan Road.', '* ADDITIONAL DETAILS...\n- At 10:45 AM EDT Wednesday the stage was 10.9 feet and rising.\n- Forecast...The river will rise above flood stage this evening\nto 12.1 feet just after midnight tonight. It will then fall\nbelow flood stage late tonight to 10.7 feet and begin rising\nagain early tomorrow afternoon. It will rise to 11.2 feet\nFriday morning. It will then fall again and remain below\nflood stage.\n- Flood stage is 12 feet.\n- http://www.weather.gov/safety/flood']"
8,GA,"Forsyth, GA; Fulton, GA",Flood Warning,Severe,Observed,Immediate,2022-04-06T10:59:00-04:00,2022-04-07T21:30:00-04:00,"['* WHAT...Minor flooding will continue.', '* WHERE...Big Creek near Alpharetta.', '* WHEN...Until late tomorrow evening.', '* IMPACTS...At 8 feet, Minor flooding continues to expand further\ninto the woodlands and fields along the creek from near Cumming in\nsouth Forsyth County to Alpharetta and Roswell in north Fulton\nCounty. Additional portions of The Big Creek Greenway have minor\nflooding with 1 to 2 feet of water. Most of the walking and biking\npaths will be closed...especially upstream and downstream from the\ngage on Kimball Bridge Road and near Rock Mill Park. Portions of\nthe YMCA Campground off Preston Ridge Road will flood.', '* ADDITIONAL DETAILS...\n- At 10:45 AM EDT Wednesday the stage was 7.4 feet and nearly\nsteady.\n- Forecast...The river is expected to rise to a crest of 7.8\nfeet just after midnight tonight. It will then fall below\nflood stage tomorrow afternoon.\n- Flood stage is 7 feet.\n- http://www.weather.gov/safety/flood']"
