,State,Area,Event,Severity,Certainty,Urgency,Effective,Ends,Description
4,CO,Grand and Battlement Mesas; West Elk and Sawatch Mountains; Southwest San Juan Mountains,Winter Storm Watch,Severe,Possible,Future,2021-12-29T08:02:00-07:00,2022-01-01T05:00:00-07:00,"['* WHAT...Heavy snow possible. Total snow accumulations of 12\nto 24 inches with localized amounts of 3 feet possible. Winds\ncould gust as high as 40 mph.', '* WHERE...Southwest San Juan Mountains, Grand and Battlement\nMesas and West Elk and Sawatch Mountains.', '* WHEN...From this evening through late Friday night.', '* IMPACTS...Travel could be very difficult to impossible. Patchy\nblowing snow could significantly reduce visibility. The cold\nwind chills as low as 20 below zero could cause frostbite on\nexposed skin in as little as 30 minutes. A detailed map of the\nsnowfall can be found at: www.weather.gov/gjt/winter.']"
5,CO,Northwestern San Juan Mountains,Winter Storm Watch,Severe,Possible,Future,2021-12-29T08:02:00-07:00,2022-01-01T05:00:00-07:00,"['* WHAT...Heavy snow possible. Total snow accumulations of 12\nto 24 inches possible. Winds could gust as high as 40 mph.', '* WHERE...Northwest San Juan Mountains.', '* WHEN...From this evening through late Friday night.', '* IMPACTS...Travel could be very difficult to impossible. Patchy\nblowing snow could significantly reduce visibility. The cold\nwind chills as low as 25 below zero could cause frostbite on\nexposed skin in as little as 30 minutes. A detailed map of the\nsnowfall can be found at: www.weather.gov/gjt/winter.']"
6,CO,Elkhead and Park Mountains; Grand and Battlement Mesas; Gore and Elk Mountains/Central Mountain Valleys; West Elk and Sawatch Mountains; Flat Tops; Southwest San Juan Mountains; West Jackson and West Grand Counties Above 9000 Feet; Eastern San Juan Mountains Above 10000 Ft,Avalanche Watch,Unknown,Unknown,Unknown,2021-12-29T07:01:00-07:00,,"['THE FOLLOWING MESSAGE IS TRANSMITTED AT THE REQUEST OF THE\nCOLORADO AVALANCHE INFORMATION CENTER.', '* WHAT...Avalanche Watch', '* WHERE... CAIC Forecast Zones: Steamboat and Flat Tops, Aspen,\nGunnison, Grand Mesa, and South San Juan forecast zones', '\n* WHEN... Begin Wednesday December 29 At 7:00AM Expires Thursday\nDecember 30 at 8:00AM', '* IMPACTS... Widespread dangerous conditions are expected across\nlarge portions of Colorado on Thursday due to snowfall and strong\nwinds. The avalanche danger will rise to HIGH (Level 4 of 5).\nLarge natural and human triggered avalanches are likely.']"
7,CO,South and East Jackson/Larimer/North and Northeast Grand/Northwest Boulder Counties Above 9000 Feet; Larimer and Boulder Counties Between 6000 and 9000 Feet,High Wind Watch,Severe,Possible,Future,2021-12-29T03:26:00-07:00,2021-12-30T23:00:00-07:00,"['* WHAT...West winds 25 to 40 mph with gusts to 75 mph possible.', '* WHERE...Larimer and Boulder Counties Between 6000 and 9000 Feet\nand South and East Jackson/Larimer/North and Northeast\nGrand/Northwest Boulder Counties Above 9000 Feet Counties.', '* WHEN...From late tonight through Thursday evening.', '* IMPACTS...Damaging winds could blow down trees and power lines.\nWidespread power outages are possible. Travel could be difficult,\nespecially for high profile vehicles.']"
8,CO,West Jackson and West Grand Counties Above 9000 Feet; South and East Jackson/Larimer/North and Northeast Grand/Northwest Boulder Counties Above 9000 Feet; South and Southeast Grand/West Central and Southwest Boulder/Gilpin/Clear Creek/Summit/North and West Park Counties Above 9000 Feet,Winter Storm Watch,Severe,Possible,Future,2021-12-29T03:25:00-07:00,2022-01-01T05:00:00-07:00,"['* WHAT...Heavy snow likely. Total snow accumulations between 10 to\n20 inches expected, 8 to 16 inches for mountains of Summit County.\nHeaviest snow expected for the Park Range, Indian Peaks and Rocky\nMountain National Park, where locally higher totals will be\npossible. Strong west winds with gusts 60 to 70 mph also possible\non Thursday.', '* WHERE...Rabbit Ears Pass, Rocky Mountain National Park and the\nMedicine Bow Range, and The Mountains of Summit County, the\nMosquito Range, and the Indian Peaks.', '* WHEN...From this evening through late Friday night.', '* IMPACTS...Visibility may be near zero at times resulting in white\nout conditions. Travel may be treacherous and potentially\nlife-threatening. Travel could be very difficult to impossible.\nThe hazardous conditions could impact the Thursday morning and\nevening commutes. Gusty winds could bring down tree branches.']"
9,CO,La Garita Mountains Above 10000 Ft,Winter Weather Advisory,Moderate,Likely,Expected,2021-12-29T03:01:00-07:00,2021-12-29T11:00:00-07:00,"['* WHAT...For the Winter Weather Advisory, snow. Additional snow\naccumulations of 1 to 3 inches inches. For the Winter Storm\nWatch, heavy snow possible. Total snow accumulations of 6 to 12\ninches possible. Winds could gust as high as 45 mph.', '* WHERE...La Garita Mountains Above 10000 Feet.', '* WHEN...For the Winter Weather Advisory, until 11 AM MST\nWednesday. For the Winter Storm Watch, from late Wednesday\nnight through late Friday night.', '* IMPACTS...Plan on slippery road conditions. Patchy blowing\nsnow could significantly reduce visibility. The cold wind\nchills as low as 20 below zero could cause frostbite on\nexposed skin in as little as 30 minutes.']"
10,CO,Eastern Sawatch Mountains above 11000 Ft; Eastern San Juan Mountains Above 10000 Ft,Winter Storm Warning,Severe,Likely,Expected,2021-12-29T03:01:00-07:00,2021-12-29T11:00:00-07:00,"['* WHAT...For the Winter Storm Warning, heavy snow. Additional snow\naccumulations of 3 to 6 inches through this morning. For the\nWinter Storm Watch, heavy snow possible. Total snow\naccumulations of 1 to 2 feet possible. Winds could gust as high\nas 50 mph.', '* WHERE...Eastern Sawatch Mountains Above 11000 Feet and Eastern\nSan Juan Mountains Above 10000 Feet.', '* WHEN...For the Winter Storm Warning, until 11 AM MST\nWednesday. For the Winter Storm Watch, from late Wednesday\nnight through late Friday night.', '* IMPACTS...Travel could be very difficult. Areas of blowing snow\ncould significantly reduce visibility. The cold wind chills as\nlow as 25 below zero could cause frostbite on exposed skin in as\nlittle as 30 minutes.']"
11,CO,Eastern Sawatch Mountains above 11000 Ft; Eastern San Juan Mountains Above 10000 Ft,Winter Storm Watch,Severe,Possible,Future,2021-12-29T03:01:00-07:00,2022-01-01T05:00:00-07:00,"['* WHAT...For the Winter Storm Warning, heavy snow. Additional snow\naccumulations of 3 to 6 inches through this morning. For the\nWinter Storm Watch, heavy snow possible. Total snow\naccumulations of 1 to 2 feet possible. Winds could gust as high\nas 50 mph.', '* WHERE...Eastern Sawatch Mountains Above 11000 Feet and Eastern\nSan Juan Mountains Above 10000 Feet.', '* WHEN...For the Winter Storm Warning, until 11 AM MST\nWednesday. For the Winter Storm Watch, from late Wednesday\nnight through late Friday night.', '* IMPACTS...Travel could be very difficult. Areas of blowing snow\ncould significantly reduce visibility. The cold wind chills as\nlow as 25 below zero could cause frostbite on exposed skin in as\nlittle as 30 minutes.']"
12,CO,Western Mosquito Range/East Lake County Above 11000 Ft,Winter Storm Watch,Severe,Possible,Future,2021-12-29T03:01:00-07:00,2022-01-01T05:00:00-07:00,"['* WHAT...Heavy snow possible. Total snow accumulations of 6 to\n12 inches possible. Winds could gust as high as 45 mph.', '* WHERE...Western Mosquito Range and East Lake County Above\n11000 Feet.', '* WHEN...From late Wednesday night through late Friday night.', '* IMPACTS...Travel could be very difficult. Patchy blowing snow\ncould significantly reduce visibility. The cold wind chills as\nlow as 25 below zero could cause frostbite on exposed skin in\nas little as 30 minutes.']"
13,CO,La Garita Mountains Above 10000 Ft,Winter Storm Watch,Severe,Possible,Future,2021-12-29T03:01:00-07:00,2022-01-01T05:00:00-07:00,"['* WHAT...For the Winter Weather Advisory, snow. Additional snow\naccumulations of 1 to 3 inches inches. For the Winter Storm\nWatch, heavy snow possible. Total snow accumulations of 6 to 12\ninches possible. Winds could gust as high as 45 mph.', '* WHERE...La Garita Mountains Above 10000 Feet.', '* WHEN...For the Winter Weather Advisory, until 11 AM MST\nWednesday. For the Winter Storm Watch, from late Wednesday\nnight through late Friday night.', '* IMPACTS...Plan on slippery road conditions. Patchy blowing\nsnow could significantly reduce visibility. The cold wind\nchills as low as 20 below zero could cause frostbite on\nexposed skin in as little as 30 minutes.']"
14,CO,Northwestern San Juan Mountains,Winter Storm Watch,Severe,Possible,Future,2021-12-29T02:05:00-07:00,2022-01-01T05:00:00-07:00,"['* WHAT...For the Winter Weather Advisory above 8500 feet, snow.\nAdditional snow accumulations of 1 to 3 inches. For the Winter\nStorm Watch, heavy snow possible. Total snow accumulations of 12\nto 24 inches possible. Winds could gust as high as 40 mph.', '* WHERE...Northwest San Juan Mountains.', '* WHEN...For the Winter Weather Advisory, until 8 AM MST this\nmorning. For the Winter Storm Watch, from this evening through\nlate Friday night.', '* IMPACTS...Travel could be very difficult to impossible. Patchy\nblowing snow could significantly reduce visibility. A detailed\nmap of the snowfall can be found at: www.weather.gov/gjt/winter.']"
15,CO,Elkhead and Park Mountains,Winter Storm Watch,Severe,Possible,Future,2021-12-29T02:05:00-07:00,2022-01-01T05:00:00-07:00,"['* WHAT...Heavy snow possible. Total snow accumulations of 12 to\n24 inches with localized amounts of 3 feet possible. Winds\ncould gust as high as 45 mph.', '* WHERE...Elkhead and Park Mountains.', '* WHEN...From this evening through late Friday night.', '* IMPACTS...Travel could be very difficult to impossible. Patchy\nblowing snow could significantly reduce visibility. A detailed\nmap of the snowfall can be found at: www.weather.gov/gjt/winter.']"
16,CO,Gore and Elk Mountains/Central Mountain Valleys; Flat Tops,Winter Storm Watch,Severe,Possible,Future,2021-12-29T02:05:00-07:00,2022-01-01T05:00:00-07:00,"['* WHAT...For the Winter Weather Advisory, snow. Additional snow\naccumulations of 1 to 3 inches. For the Winter Storm Watch,\nheavy snow possible. Total snow accumulations of 12 to 24 inches\npossible. Winds could gust as high as 45 mph.', '* WHERE...Gore and Elk Mountains/Central Mountain Valleys and\nFlat Tops.', '* WHEN...For the Winter Weather Advisory, until 8 AM MST this\nmorning. For the Winter Storm Watch, from this evening through\nlate Friday night.', '* IMPACTS...Travel could be very difficult to impossible. Patchy\nblowing snow could significantly reduce visibility, especially\non ridge tops. A detailed map of the snowfall can be found at:\nwww.weather.gov/gjt/winter.']"
17,CO,Grand and Battlement Mesas; West Elk and Sawatch Mountains; Southwest San Juan Mountains,Winter Storm Watch,Severe,Possible,Future,2021-12-29T02:05:00-07:00,2022-01-01T05:00:00-07:00,"['* WHAT...For the Winter Storm Warning, moderate to heavy snow.\nAdditional snow accumulations of 2 to 5 inches. For the Winter\nStorm Watch, heavy snow possible. Total snow accumulations of 12\nto 24 inches with localized amounts of 3 feet possible. Winds\ncould gust as high as 40 mph.', '* WHERE...Grand and Battlement Mesas, West Elk and Sawatch\nMountains and Southwest San Juan Mountains.', '* WHEN...For the Winter Storm Warning, until 8 AM MST this\nmorning. For the Winter Storm Watch, from this evening through\nlate Friday night.', '* IMPACTS...Travel could be very difficult to impossible. Patchy\nblowing snow could significantly reduce visibility. A detailed\nmap of the snowfall can be found at:\nwww.weather.gov/gjt/winter.']"
18,CO,Roan and Tavaputs Plateaus,Winter Storm Watch,Severe,Possible,Future,2021-12-29T02:05:00-07:00,2022-01-01T05:00:00-07:00,"['* WHAT...For the Winter Weather Advisory, snow. Additional snow\naccumulations of 1 to 2 inches. For the Winter Storm Watch,\nheavy snow possible. Total snow accumulations of 8 to 14 inches\npossible. Winds could gust as high as 40 mph.', '* WHERE...Roan and Tavaputs Plateaus.', '* WHEN...For the Winter Weather Advisory, until 8 AM MST this\nmorning. For the Winter Storm Watch, from this evening through\nlate Friday night.', '* IMPACTS...Travel could be very difficult to impossible. Patchy\nblowing snow could significantly reduce visibility. A detailed\nmap of the snowfall can be found at:\nwww.weather.gov/gjt/winter.']"
19,CO,Uncompahgre Plateau/Dallas Divide,Winter Storm Watch,Severe,Possible,Future,2021-12-29T02:05:00-07:00,2022-01-01T05:00:00-07:00,"['* WHAT...For the Winter Weather Advisory, snow. Additional snow\naccumulations of 1 to 4 inches. For the Winter Storm Watch,\nheavy snow possible. Total snow accumulations of 12 to 24 inches\npossible. Winds could gust as high as 40 mph.', '* WHERE...Uncompahgre Plateau and Dallas Divide.', '* WHEN...For the Winter Weather Advisory, until 8 AM MST this\nmorning. For the Winter Storm Watch, from this evening through\nlate Friday night.', '* IMPACTS...Travel could be very difficult to impossible. Patchy\nblowing snow could significantly reduce visibility, especially\non ridge tops. A detailed map of the snowfall can be found at:\nwww.weather.gov/gjt/winter.']"
20,CO,Uncompahgre Plateau/Dallas Divide,Winter Weather Advisory,Moderate,Likely,Expected,2021-12-28T08:06:00-07:00,2021-12-29T17:00:00-07:00,"['* WHAT...Snow. Additional snow accumulations of 4 to 8 inches.\nWinds gusting as high as 40 mph.', '* WHERE...Uncompahgre Plateau and Dallas Divide.', '* WHEN...Until 5 PM MST Wednesday.', '* IMPACTS...Travel could be very difficult to impossible.\nBlowing snow will significantly reduce visibility, especially\non ridge tops. Gusty winds could bring down tree branches. A\ndetailed map of the snowfall can be found at:\nwww.weather.gov/gjt/winter.']"
21,CO,Northwestern San Juan Mountains,Winter Weather Advisory,Moderate,Likely,Expected,2021-12-28T08:06:00-07:00,2021-12-29T17:00:00-07:00,"['* WHAT...Snow. Additional snow accumulations of 4 to 8 inches.\nWinds gusting as high as 45 mph.', '* WHERE...Northwest San Juan Mountains.', '* WHEN...Until 5 PM MST Wednesday.', '* IMPACTS...Travel could be very difficult. Blowing snow will\nsignificantly reduce visibility, especially overnight. Wind\nchills as low as 20 below zero could cause frostbite on\nexposed skin in as little as 30 minutes. A detailed map of the\nsnowfall can be found at: www.weather.gov/gjt/winter.']"
22,CO,Grand and Battlement Mesas; West Elk and Sawatch Mountains; Southwest San Juan Mountains,Winter Storm Warning,Severe,Likely,Expected,2021-12-28T08:06:00-07:00,2021-12-29T17:00:00-07:00,"['* WHAT...Heavy snow. Additional snow accumulations of 6 to 12\ninches with locally higher amounts. Winds gusting as high as\n40 mph.', '* WHERE...Southwest San Juan Mountains, Grand and Battlement\nMesas and West Elk and Sawatch Mountains.', '* WHEN...Until 5 PM MST Wednesday.', '* IMPACTS...Travel could be very difficult to impossible.\nBlowing snow will significantly reduce visibility, especially\ntonight. A detailed map of the snowfall can be found at:\nwww.weather.gov/gjt/winter.']"
0,FL,Mobile Coastal; Baldwin Coastal; Escambia Coastal; Santa Rosa Coastal; Okaloosa Coastal,Rip Current Statement,Moderate,Likely,Expected,2021-12-29T05:46:00-06:00,2021-12-31T13:00:00-06:00,"['* WHAT...Dangerous rip currents.', '* WHERE...In Alabama, Baldwin Coastal and Mobile Coastal\nCounties. In Florida, Santa Rosa Coastal, Okaloosa Coastal and\nEscambia Coastal Counties.', '* WHEN...Through Friday afternoon.', '* IMPACTS...Rip currents can sweep even the best swimmers away\nfrom shore into deeper water.']"
1,FL,South Walton; Coastal Bay; Coastal Gulf; Coastal Franklin,Rip Current Statement,Moderate,Likely,Expected,2021-12-29T01:54:00-05:00,2021-12-30T07:00:00-05:00,"['* WHAT...Dangerous rip currents.', '* WHERE...All Florida panhandle and Big Bend beaches.', '* WHEN...Through Thursday morning.', '* IMPACTS...Rip currents can sweep even the best swimmers away\nfrom shore into deeper water.']"
0,GA,Meriwether; Pike; Upson; Lamar; Talbot,Special Weather Statement,Moderate,Observed,Expected,2021-12-29T11:01:00-05:00,,"['At 1058 AM EST, a line of strong thunderstorms was along a line\nextending from near Woodbury to Talbotton, and moving northeast at 40\nmph.', 'HAZARD...40 mph wind and heavy rain.', 'SOURCE...Radar indicated.', 'IMPACT...Expect minor damage to tree limbs and blowing around of\nlight, unsecured objects. Heavy rain may cause temporary\nstreet flooding especially in poor drainage areas.', 'Locations impacted include...\nThomaston, Barnesville, Zebulon, Talbotton, Manchester, Woodbury,\nMilner, Woodland, Molena, Yatesville, Orchard Hill, Meansville,\nAldora, Sunset Village, Lincoln Park, The Rock, Atwater, Sprewell\nBluff State Park, Logtown and Sunnyside.']"
0,GU,Guam; Rota; Tinian; Saipan,Rip Current Statement,Moderate,Likely,Expected,2021-12-29T16:00:00+10:00,2021-12-30T06:00:00+10:00,"['* WHAT...Large breaking waves up to 10 feet and dangerous rip\ncurrents.', '* WHERE...North, east, west facing reefs for the high rip current\nrisk. North and west facing reefs for the high surf advisory.', '* WHEN...Through 6 AM Thursday.', '* IMPACTS...Dangerous swimming and surfing conditions and\nlocalized beach erosion. Rip currents can sweep even the best\nswimmers away from shore into deeper water.', '* ADDITIONAL DETAILS...A long-period northwest and a northeast trade-\nwind swell will begin to subside late tonight and early Thursday\nmorning allowing surf to fall below hazardous levels.']"
1,GU,Guam; Rota; Tinian; Saipan,High Surf Advisory,Minor,Likely,Expected,2021-12-29T16:00:00+10:00,2021-12-30T06:00:00+10:00,"['* WHAT...Large breaking waves up to 10 feet and dangerous rip\ncurrents.', '* WHERE...North, east, west facing reefs for the high rip current\nrisk. North and west facing reefs for the high surf advisory.', '* WHEN...Through 6 AM Thursday.', '* IMPACTS...Dangerous swimming and surfing conditions and\nlocalized beach erosion. Rip currents can sweep even the best\nswimmers away from shore into deeper water.', '* ADDITIONAL DETAILS...A long-period northwest and a northeast trade-\nwind swell will begin to subside late tonight and early Thursday\nmorning allowing surf to fall below hazardous levels.']"
0,ID,Southern Clearwater Mountains,Winter Weather Advisory,Moderate,Likely,Expected,2021-12-29T08:15:00-07:00,2021-12-29T11:00:00-07:00,"['* WHAT...Snow. Additional snow accumulations of up to one inch.', '* WHERE...Dixie, Elk City, and Highway 12 Lowell to Lolo Pass.', '* WHEN...Until 10 AM PST this morning.', '* IMPACTS...Travel could be affected. The cold wind chills as\nlow as 10 below zero could result in hypothermia if\nprecautions are not taken.']"
1,ID,Lower Hells Canyon/Salmon River Region,Winter Weather Advisory,Moderate,Likely,Expected,2021-12-29T08:15:00-07:00,2021-12-29T11:00:00-07:00,"['* WHAT...Snow. Additional snow accumulations of up to one inch.', '* WHERE...Lower Hells Canyon/Salmon River Region.', '* WHEN...Until 10 AM PST this morning.', '* IMPACTS...Travel could be affected.']"
2,ID,Northern Clearwater Mountains,Winter Weather Advisory,Moderate,Likely,Expected,2021-12-29T08:15:00-07:00,2021-12-29T11:00:00-07:00,"['* WHAT...Snow. Additional snow accumulations of up to one inch.', '* WHERE...Elk River, Highway 11 Pierce to Headquarters, and\nPierce.', '* WHEN...Until 10 AM PST this morning.', '* IMPACTS...Travel could be affected.']"
3,ID,Orofino/Grangeville Region,Winter Weather Advisory,Moderate,Likely,Expected,2021-12-29T08:15:00-07:00,2021-12-29T11:00:00-07:00,"['* WHAT...Snow. Additional snow accumulations of up to one inch.', '* WHERE...Camas Prairie, Grangeville and vicinity, and Greer\nGrade.', '* WHEN...Until 10 AM PST this morning.', '* IMPACTS...Travel could be affected.']"
4,ID,Northern Panhandle; Coeur d'Alene Area; Idaho Palouse; Central Panhandle Mountains; Lewiston Area; Lewis and Southern Nez Perce Counties; Northeast Blue Mountains; Lower Garfield and Asotin Counties; Washington Palouse; Moses Lake Area; Upper Columbia Basin; Spokane Area; Northeast Mountains; Okanogan Highlands; Wenatchee Area; Okanogan Valley; Waterville Plateau; Central Chelan County; Western Chelan County; Western Okanogan County,Special Weather Statement,Moderate,Observed,Expected,2021-12-29T07:01:00-08:00,,"['Dangerously cold temperatures will impact Eastern Washington and\nNorth Idaho through the remainder of the workweek and into the\nfirst half of the weekend with a persistent arctic air mass. High\ntemperatures will only warm into the single digits and teens.\nMeanwhile overnight lows will likely drop into the single digits\nto below zero. Portions of the region will also see dangerous wind\nchills of minus ten to minus 20 early this morning and again on\nFriday.', 'With the extreme cold...frost bite and hypothermia will occur\nmuch faster. If outdoors, remember to dress in layers and cover\nexposed skin. Unprotected pipes will be susceptible to freezing\nand bursting. Take precautions to protect pets and livestock from\nextreme cold.', 'Areas of snow will continue to impact portions of the Inland\nNorthwest through the week with widespread moderate to locally\nheavy snow possible over southeast Washington and north-central\nIdaho on Thursday.']"
5,ID,Lewis and Southern Nez Perce Counties,Winter Weather Advisory,Moderate,Likely,Expected,2021-12-29T04:08:00-08:00,2021-12-29T10:00:00-08:00,"['* WHAT...Snow expected. Total snow accumulations between 1 and 2\ninches, with local amounts up to 3 to 4 inches near Winchester.', '* WHERE...Nezperce, Soldiers Meadow Road, Craigmont, Winchester, and\nKamiah.', '* WHEN...Until 10 AM PST this morning.', '* IMPACTS...Plan on slippery road conditions. The hazardous\nconditions could impact the Wednesday morning commute.']"
6,ID,Lewiston Area; Lower Garfield and Asotin Counties,Winter Weather Advisory,Moderate,Likely,Expected,2021-12-29T04:08:00-08:00,2021-12-29T10:00:00-08:00,"['* WHAT...Snow expected. Total snow accumulations between 1 and 3\ninches.', '* WHERE...Lewiston, Clarkston, Pomeroy, Lewiston Grade, Gifford,\nLapwai, Alpowa Summit, Culdesac, and Peck.', '* WHEN...Until 10 AM PST this morning.', '* IMPACTS...Plan on slippery road conditions. The hazardous\nconditions could impact the Wednesday morning commute.']"
7,ID,West Central Mountains; Baker County,Winter Weather Advisory,Moderate,Likely,Expected,2021-12-29T02:28:00-07:00,2021-12-29T11:00:00-07:00,"['* WHAT...Snow expected. Additional snow accumulations of 2 to\n4 inches, except up to 6 inches over the mountains.', '* WHERE...West Central Mountains zone.', '* WHEN...Through 11 AM MST Wednesday morning.', '* IMPACTS...Plan on slippery road conditions.']"
8,ID,Lower Treasure Valley; Boise Mountains; Malheur County; Oregon Lower Treasure Valley,Winter Weather Advisory,Moderate,Likely,Expected,2021-12-29T02:28:00-07:00,2021-12-29T17:00:00-07:00,"['* WHAT...Snow expected. Total snow accumulations of 2 to 4 inches,\nexcept up to 6 inches over the mountains.', '* WHERE...Portions of southeast Oregon and southwest and west\ncentral Idaho. The heavier amounts will be in Idaho north of\nthe Snake Basin.', '* WHEN...Through 5 PM MST /4 PM PST/ Wednesday afternoon.', '* IMPACTS...Plan on slippery road conditions, which may impact\nthe morning commute.']"
9,ID,Upper Weiser River,Winter Storm Warning,Severe,Likely,Expected,2021-12-29T02:28:00-07:00,2021-12-29T17:00:00-07:00,"['* WHAT...Heavy snow expected. Additional snow accumulations of\n4 to 6 inches.', '* WHERE...Upper Weiser River zone.', '* WHEN...Through 5 PM MST Wednesday afternoon.', '* IMPACTS...Travel could be very difficult.']"
10,ID,Upper Treasure Valley; Owyhee Mountains,Winter Weather Advisory,Moderate,Likely,Expected,2021-12-29T02:28:00-07:00,2021-12-29T17:00:00-07:00,"['* WHAT...Snow expected. Total snow accumulations of 2 to 4 inches,\nexcept up to 6 inches over the foothills and mountains.', '* WHERE...Upper Treasure Valley and Owyhee Mountains zones.', '* WHEN...Through 5 PM MST Wednesday afternoon.', '* IMPACTS...Plan on slippery road conditions, which may impact\nthe morning commute.']"
11,ID,Upper Snake River Plain,Winter Weather Advisory,Moderate,Likely,Expected,2021-12-29T02:12:00-07:00,2021-12-30T05:00:00-07:00,"['* WHAT...Snow expected. Total snow accumulations of 2 to 4 inches.\nWinds gusting as high as 35 mph will cause drifting snow and low\nvisibility in blowing snow.', '* WHERE...The upper Snake River plain, including the cities of\nIdaho Falls and Rexburg, and all towns up to Saint Anthony.', '* WHEN...Until 5 AM MST Thursday.', '* IMPACTS...Plan on slippery road conditions. Blowing snow will\nreduce visibility while driving. The only solution is to slow\ndown. Drifting snow may cause temporary road closures as efforts\nto clear snow are hampered. The hazardous conditions could\nimpact the morning or evening commute.']"
