,State,Area,Event,Severity,Certainty,Urgency,Effective,Ends,Description
31,IN,"Crawford, IL; Lawrence, IL; Knox, IN; Sullivan, IN",Flood Warning,Severe,Observed,Immediate,2022-03-07T15:52:00-05:00,2022-03-16T08:12:00-05:00,"['* WHAT...Minor flooding is forecast.', '* WHERE...Wabash River at Hutsonville Legacy Power Plant Site.', '* WHEN...Until Wednesday, March 16.', '* IMPACTS...At 20.0 feet, Leaverton Park in Palestine and park in\nHutsonville begin to flood.  Agricultural flooding spreads to\nhigher land.  Seep water is noticeable behind levees.  Some\nelevated river cottages are surrounded by water.  Several county\nor township roads east of Lincoln Heritage Trail between Palestine\nand Hutsonville in Crawford County Illinois are impassable.', '* ADDITIONAL DETAILS...\n- There is no current observed data.\n- Forecast...The river is expected to rise to a crest of 19.4\nfeet early Saturday morning. It will then fall below flood\nstage Tuesday, March 15.\n- Flood stage is 16.0 feet.\n- http://www.weather.gov/safety/flood']"
32,IN,"Tippecanoe, IN",Flood Warning,Severe,Likely,Expected,2022-03-07T11:35:00-05:00,2022-03-10T19:00:00-05:00,"['* WHAT...Minor flooding is forecast.', '* WHERE...Wildcat Creek near Lafayette.', '* WHEN...From late tonight to Thursday evening.', '* IMPACTS...At 10.0 feet, Flooding of lowland areas in progress in\nportions of Tippecanoe County.', '* ADDITIONAL DETAILS...\n- At 10:45 AM EST Monday the stage was 8.7 feet.\n- Forecast...The river is expected to rise above flood stage\njust after midnight tonight to a crest of 11.4 feet early\nWednesday morning. It will then fall below flood stage early\nThursday afternoon.\n- Flood stage is 10.0 feet.\n- http://www.weather.gov/safety/flood']"
33,IN,"Marion, IN; Morgan, IN",Flood Warning,Severe,Likely,Expected,2022-03-07T11:04:00-05:00,2022-03-10T11:00:00-05:00,"['* WHAT...Minor flooding is forecast.', '* WHERE...White River at Ravenswood.', '* WHEN...From Tuesday morning to late Thursday morning.', '* IMPACTS...At 7.0 feet, Water surrounds homes in River Edge\nEstates.  A few streets flood in Ravenswood.', '* ADDITIONAL DETAILS...\n- There is no current observed data.\n- Forecast...The river is expected to rise above flood stage\nlate tomorrow morning to a crest of 7.2 feet early Wednesday\nmorning. It will then fall below flood stage late Wednesday\nevening.\n- Flood stage is 6.0 feet.\n- http://www.weather.gov/safety/flood']"
34,IN,"Crawford, IL; Lawrence, IL; Knox, IN; Sullivan, IN",Flood Warning,Severe,Observed,Immediate,2022-03-06T20:35:00-06:00,2022-03-14T14:00:00-06:00,"['* WHAT...Minor flooding is occurring and minor flooding is forecast.', '* WHERE...Wabash River at Riverton.', '* WHEN...Until Monday, March 14.', '* IMPACTS...At 18.0 feet, Extensive lowland flooding is in\nprogress.  High water surrounds many river cabins.  Access to most\nriver cabins is by boat only.  Levees begin to protect farmland.\nExtensive flooding of Leaverton Park occurs in Palestine, Illinois.', '* ADDITIONAL DETAILS...\n- At 8:00 PM CST Sunday /9:00 PM EST Sunday/ the stage was 17.4\nfeet.\n- Recent Activity...The maximum river stage in the 24 hours\nending at 8:00 PM CST Sunday /9:00 PM EST Sunday/ was 18.2\nfeet.\n- Forecast...The river will fall to 16.6 feet and then begin\nrising tomorrow evening. It will then rise again to 16.9 feet\nTuesday morning. It will fall to 16.6 feet and then begin\nrising early Wednesday afternoon. It will then rise again to\n17.2 feet early Sunday morning. It will fall below flood\nstage Monday, March 14.\n- Flood stage is 15.0 feet.\n- http://www.weather.gov/safety/flood']"
0,IA,Clarke; Lucas; Monroe; Wapello; Taylor; Ringgold; Decatur; Wayne; Appanoose; Davis,Winter Weather Advisory,Moderate,Likely,Expected,2022-03-10T08:33:00-06:00,2022-03-10T18:00:00-06:00,"['* WHAT...Snow accumulations of 1 to 2 inches, with local amounts\nnear 3 inches possible along the Missouri border.', '* WHERE...Southern Iowa.', '* WHEN...Through 6 PM CST Today.', '* IMPACTS...Plan on slippery road conditions at times.']"
1,IA,Fremont; Page; Lancaster; Cass; Otoe; Saline; Jefferson; Gage; Johnson; Nemaha; Pawnee; Richardson,Winter Weather Advisory,Moderate,Likely,Expected,2022-03-10T08:07:00-06:00,2022-03-10T15:00:00-06:00,"['* WHAT...Light snow. Additional snow accumulations of mostly 1\ninch or less except amounts up to 2 inches possible near the\nKansas border.', '* WHERE...Portions of southeast Nebraska and southwest Iowa.', '* WHEN...Until 3 PM CST this afternoon.', '* IMPACTS...Plan on slippery road conditions. The hazardous\nconditions could impact the morning commute.']"
2,IA,Henry; Des Moines; Henderson; Warren; McDonough,Winter Weather Advisory,Moderate,Likely,Expected,2022-03-10T02:47:00-06:00,2022-03-11T06:00:00-06:00,"['* WHAT...Snow expected. Total snow accumulations of 2 to 4\ninches. Highest amounts south of a line from Keosauqua to\nMacomb.', '* WHERE...In Iowa, Henry IA and Des Moines Counties. In\nIllinois, Henderson, Warren and McDonough Counties.', '* WHEN...From 9 AM this morning to 6 AM CST Friday.', '* IMPACTS...Plan on slippery road conditions. The hazardous\nconditions could impact the evening commute.']"
3,IA,Jefferson; Van Buren; Lee; Hancock; Scotland; Clark,Winter Weather Advisory,Moderate,Likely,Expected,2022-03-10T02:47:00-06:00,2022-03-11T06:00:00-06:00,"['* WHAT...Snow expected. Total snow accumulations of 2 to 4\ninches. Highest amounts south of a line from Keosauqua to\nMacomb.', '* WHERE...Portions of northeast Missouri, southeast Iowa and\nwest central Illinois.', '* WHEN...From 9 AM this morning to 6 AM CST Friday.', '* IMPACTS...Plan on slippery road conditions. The hazardous\nconditions could impact the evening commute.']"
4,IA,Cass; Adair; Adams; Union; Clarke; Taylor; Ringgold; Decatur,Winter Weather Advisory,Moderate,Likely,Expected,2022-03-09T03:04:00-06:00,2022-03-10T18:00:00-06:00,"['* WHAT...Snow expected. Total snow accumulations of 1 to 3 inches\nwith local totals to 4 inches along the Iowa Missouri border.', '* WHERE...Southern Iowa south of Interstate 80 with the heavier 2\nto 4 inches south of Highway 34.', '* WHEN...From 6 PM this evening to 6 PM CST Thursday.', '* IMPACTS...Plan on slippery road conditions. The hazardous\nconditions could impact the morning or evening commute on\nThursday.', '* ADDITIONAL DETAILS...Some uncertainty with the track of the\nstorm and northerly extent of the snowfall remains. There is a\npossibility that more of the snow may stay farther south into\nMissouri. Please monitor later forecasts for additional\ninformation.']"
5,IA,Lucas; Monroe; Wapello; Wayne; Appanoose; Davis,Winter Weather Advisory,Moderate,Likely,Expected,2022-03-09T03:04:00-06:00,2022-03-10T18:00:00-06:00,"['* WHAT...Snow expected. Total snow accumulations of 2 to 3\ninches.', '* WHERE...Southern Iowa south of Interstate 80 with the heavier 2\nto 3 inches south of Highway 34.\nSome uncertainty with the track of the\nstorm and northerly extent of the snowfall remains. There is a\npossibility that more of the snow may stay farther south into\nMissouri. Please monitor later forecasts for additional\ninformation.\n* WHEN...From midnight tonight to 6 PM CST Thursday.', '* IMPACTS...Plan on slippery road conditions. The hazardous\nconditions could impact the morning or evening commute.', '* ADDITIONAL DETAILS...Some uncertainty with the track of the\nstorm and northerly extent of the snowfall remains. There is a\npossibility that more of the snow may stay farther south into\nMissouri. Please monitor later forecasts for additional\ninformation.']"
0,KS,Phillips; Smith; Jewell; Rooks; Osborne; Mitchell,Winter Storm Warning,Severe,Likely,Expected,2022-03-10T08:34:00-06:00,2022-03-10T12:00:00-06:00,"['* WHAT...Heavy snow. Additional snow accumulations of up to two\ninches, bringing storm total snow amounts to the 5 to 8 inch\nrange, with locally higher amounts in Rooks County.', '* WHERE...Portions of north central Kansas.', '* WHEN...Until noon CST today.', '* IMPACTS...Plan on slippery road conditions.', '* ADDITIONAL DETAILS...Wind speeds have lightened to less than 10\nMPH, so additional blowing or drifting snow is not expected.']"
1,KS,Cheyenne County; Greeley; Wichita,Winter Weather Advisory,Moderate,Likely,Expected,2022-03-10T04:39:00-07:00,2022-03-10T11:00:00-07:00,"['* WHAT...light snow will continue into this morning. Additional\nsnow accumulations of up to one inch.', '* WHERE...In Kansas, Wichita and Greeley Counties. In Colorado,\nCheyenne County.', '* WHEN...Until 11 AM MST /noon CST/ this morning.', '* IMPACTS...Plan on slippery road conditions. The hazardous\nconditions could impact the morning commute.']"
2,KS,Rawlins; Decatur; Norton; Thomas; Sheridan; Graham; Wallace; Logan; Gove; Hitchcock; Red Willow,Winter Storm Warning,Severe,Likely,Expected,2022-03-10T04:39:00-07:00,2022-03-10T11:00:00-07:00,"['* WHAT...light to occasionally moderate snow will continue into\nthis morning. Additional snow accumulations of up to two\ninches.', '* WHERE...Portions of northwest and west central Kansas and\nsouthwest Nebraska.', '* WHEN...Until 11 AM MST /noon CST/ this morning.', '* IMPACTS...Plan on slippery road conditions. The hazardous\nconditions could impact the morning commute.']"
3,KS,Russell; Lincoln; Barton; Ellsworth; Saline,Winter Storm Warning,Severe,Likely,Expected,2022-03-10T03:49:00-06:00,2022-03-10T18:00:00-06:00,"['* WHAT...Moderate snow is expected. Total snow accumulations of 6\nto 8 inches.', '* WHERE...Central Kansas.', '* WHEN...This morning to 6 PM CST This evening.', '* IMPACTS...Plan on slippery road conditions. Patchy blowing snow\ncould significantly reduce visibility. The hazardous conditions\nwill impact the morning commute.', '* ADDITIONAL DETAILS...Wind chill values will fall to near zero.']"
4,KS,Rice; McPherson; Marion; Chase; Reno; Harvey,Winter Weather Advisory,Moderate,Likely,Expected,2022-03-10T03:49:00-06:00,2022-03-10T18:00:00-06:00,"['* WHAT...Snow expected. Total snow accumulations of 1 to 3\ninches.', '* WHERE...Portions of Central and South Central Kansas.', '* WHEN...This morning to 6 PM CST This Evening.', '* IMPACTS...Plan on slippery road conditions. Patchy blowing\nsnow could significantly reduce visibility. The hazardous\nconditions could impact the Thursday morning commute.', '* ADDITIONAL DETAILS...Wind chill values will fall to near zero.']"
5,KS,Butler; Greenwood; Woodson; Allen; Kingman; Sedgwick; Harper; Sumner; Cowley; Elk; Wilson; Neosho; Chautauqua; Montgomery; Labette,Winter Weather Advisory,Moderate,Likely,Expected,2022-03-10T03:49:00-06:00,2022-03-11T12:00:00-06:00,"['* WHAT...Snow expected. Total snow accumulations of 2 to 4\ninches.', '* WHERE...Portions of South Central and Southeast Kansas.', '* WHEN...From 6 PM this evening to noon CST Friday.', '* IMPACTS...Plan on slippery road conditions. Patchy blowing\nsnow could significantly reduce visibility. The hazardous\nconditions could impact the Thursday morning commute.', '* ADDITIONAL DETAILS...Wind chill values will fall to near zero.']"
6,KS,Bourbon; Crawford; Cherokee; Benton; Morgan; Miller; Maries; Vernon; St. Clair; Hickory; Camden; Pulaski; Phelps; Barton; Cedar; Polk; Dallas; Laclede; Jasper; Dade,Winter Weather Advisory,Moderate,Likely,Expected,2022-03-10T03:17:00-06:00,2022-03-11T15:00:00-06:00,"['* WHAT...Snow expected. Total snow accumulations between 2 and 4\ninches.', '* WHERE...Portions of southeast Kansas. Portions of central, east\ncentral, southwest, and west central Missouri.', '* WHEN...From 6 PM this evening to 3 PM CST Friday.', '* IMPACTS...Roads, and especially bridges and overpasses, will\nlikely become slick and hazardous. Plan on slippery road\nconditions. The hazardous conditions could impact the Friday\nmorning commute.']"
7,KS,Linn; Atchison; Nodaway; Worth; Harrison; Mercer; Putnam; Schuyler; Sullivan; Adair; Macon; Randolph; Howard; Pettis; Cooper; Bates; Henry,Winter Weather Advisory,Moderate,Likely,Expected,2022-03-10T02:57:00-06:00,2022-03-11T06:00:00-06:00,"['* WHAT...Snow. Additional snow accumulations of 3 to 5 inches.', '* WHERE...Portions of east central Kansas and central, north\ncentral, northeast, northwest and west central Missouri.', '* WHEN...Until 6 AM CST Friday.', '* IMPACTS...Plan on slippery road conditions. The hazardous\nconditions could impact the morning or evening commute.']"
8,KS,Atchison; Miami; Doniphan; Leavenworth; Wyandotte; Johnson; Gentry; Holt; Andrew; De Kalb; Daviess; Grundy; Buchanan; Clinton; Caldwell; Livingston; Linn; Platte; Clay; Ray; Carroll; Chariton; Jackson; Lafayette; Saline; Cass; Johnson,Winter Storm Warning,Severe,Likely,Expected,2022-03-10T02:57:00-06:00,2022-03-11T06:00:00-06:00,"['* WHAT...Heavy snow. Additional snow accumulations of 5 to 7\ninches.', '* WHERE...Portions of east central and northeast Kansas and\ncentral, north central, northwest and west central Missouri.', '* WHEN...Until 6 AM CST Friday.', '* IMPACTS...Travel could be very difficult. The hazardous\nconditions could impact the morning or evening commute.']"
9,KS,Dickinson,Winter Storm Warning,Severe,Likely,Expected,2022-03-10T01:59:00-06:00,2022-03-10T18:00:00-06:00,"['* WHAT...Heavy snow. Additional snow accumulations of 4 to 6\ninches.', '* WHERE...Dickinson County.', '* WHEN...Until 6 PM CST this evening.', '* IMPACTS...Plan on slippery road conditions. The hazardous\nconditions could impact the morning or evening commute.']"
10,KS,Republic; Washington; Marshall; Nemaha; Brown; Cloud; Clay; Riley; Pottawatomie; Jackson; Ottawa; Geary; Wabaunsee,Winter Storm Warning,Severe,Likely,Expected,2022-03-10T01:59:00-06:00,2022-03-10T18:00:00-06:00,"['* WHAT...Heavy snow expected. Total snow accumulations of 5 to 7\ninches.', '* WHERE...Portions of east central, north central and northeast\nKansas.', '* WHEN...Until 6 PM CST this morning.', '* IMPACTS...Travel could be very difficult. The hazardous\nconditions could impact the morning or evening commute.']"
11,KS,Morris; Lyon,Winter Weather Advisory,Moderate,Likely,Expected,2022-03-10T01:59:00-06:00,2022-03-10T18:00:00-06:00,"['* WHAT...Snow expected. Total snow accumulations of 2 to 5\ninches.', '* WHERE...Morris and Lyon Counties.', '* WHEN...Until 6 PM CST this evening.', '* IMPACTS...Plan on slippery road conditions. The hazardous\nconditions could impact the morning or evening commute.']"
12,KS,Jefferson; Shawnee; Douglas,Winter Storm Warning,Severe,Likely,Expected,2022-03-10T01:59:00-06:00,2022-03-11T00:00:00-06:00,"['* WHAT...Heavy snow expected. Total snow accumulations of 4 to 7\ninches.', '* WHERE...Jefferson, Shawnee and Douglas Counties.', '* WHEN...Until midnight CST.', '* IMPACTS...Plan on slippery road conditions. The hazardous\nconditions could impact the morning or evening commute.']"
13,KS,Osage,Winter Weather Advisory,Moderate,Likely,Expected,2022-03-10T01:59:00-06:00,2022-03-11T00:00:00-06:00,"['* WHAT...Snow expected. Total snow accumulations of 2 to 5\ninches.', '* WHERE...Osage, Franklin, Coffey and Anderson Counties.', '* WHEN...Until midnight CST.', '* IMPACTS...Plan on slippery road conditions. The hazardous\nconditions could impact the morning or evening commute.']"
14,KS,Franklin; Coffey; Anderson,Winter Weather Advisory,Moderate,Likely,Expected,2022-03-10T01:59:00-06:00,2022-03-11T06:00:00-06:00,"['* WHAT...Snow expected. Total snow accumulations of 2 to 5\ninches.', '* WHERE...Osage, Franklin, Coffey and Anderson Counties.', '* WHEN...Until 6 AM CST Friday.', '* IMPACTS...Plan on slippery road conditions. The hazardous\nconditions could impact the morning or evening commute.']"
15,KS,Hamilton; Kearny; Finney; Hodgeman; Pawnee; Stafford; Edwards,Winter Weather Advisory,Moderate,Likely,Expected,2022-03-10T01:00:00-06:00,2022-03-10T12:00:00-06:00,"['* WHAT...Snow. Total snow accumulations of 1 to 4 inches. Winds\ngusting as high as 35-40 mph.', '* WHERE...Portions of south central and southwest Kansas.', '* WHEN...Until noon CST /11 AM MST/ Thursday.', '* IMPACTS...Plan on slippery road conditions. The hazardous\nconditions could impact the morning commute.']"
16,KS,Trego; Ellis; Scott; Lane; Ness; Rush,Winter Storm Warning,Severe,Likely,Expected,2022-03-10T01:00:00-06:00,2022-03-10T12:00:00-06:00,"['* WHAT...Heavy snow. Additional snow accumulations of 4 to 7\ninches. Winds gusting as high as 35-40 mph.', '* WHERE...Portions of central and west central Kansas.', '* WHEN...Until noon CST Thursday.', '* IMPACTS...Plan on slippery road conditions. Areas of blowing\nsnow could significantly reduce visibility. The hazardous\nconditions could impact the morning commute.']"
17,KS,Grant; Haskell; Gray; Ford; Kiowa; Pratt,Winter Weather Advisory,Moderate,Likely,Expected,2022-03-10T01:00:00-06:00,2022-03-11T06:00:00-06:00,"['* WHAT...Snow. Total snow accumulations of 1 to 4 inches. Winds\ngusting as high as 35-40 mph.', '* WHERE...Portions of south central and southwest Kansas.', '* WHEN...Until 6 AM CST Friday.', '* IMPACTS...Plan on slippery road conditions. The hazardous\nconditions could impact the morning commute.']"
18,KS,Stanton; Morton; Stevens; Seward; Meade; Clark; Comanche; Barber,Winter Weather Advisory,Moderate,Likely,Expected,2022-03-10T01:00:00-06:00,2022-03-11T06:00:00-06:00,"['* WHAT...Snow expected. Total snow accumulations of 1 to 4\ninches.', '* WHERE...Portions of south central and southwest Kansas.', '* WHEN...From noon today to 6 AM CST Friday.', '* IMPACTS...Plan on slippery road conditions. The hazardous\nconditions could impact the morning commute.']"
19,KS,Phillips; Smith; Jewell; Rooks; Osborne; Mitchell,Winter Storm Watch,Severe,Possible,Future,2022-03-08T03:20:00-06:00,2022-03-10T18:00:00-06:00,"['* WHAT...Heavy snow possible. Total snow accumulations of 4 to 7\ninches possible.', '* WHERE...Portions of north central Kansas.', '* WHEN...From Wednesday evening through Thursday afternoon.', '* IMPACTS...Plan on slippery road conditions with reduced\nvisibility. Most of the expected snow will fall Wednesday night\ninto Thursday morning, which could impact the Thursday morning\ncommute.', '* ADDITIONAL DETAILS...The wind will generally be northeasterly at\naround 15 mph with gusts of 20 to 25 mph. Therefore, some\nblowing and drifting snow will also be possible.']"
0,KY,Fleming; Montgomery; Bath; Rowan; Estill; Powell; Menifee; Rockcastle; Jackson; Wolfe; Lee,Winter Storm Watch,Severe,Possible,Future,2022-03-10T03:58:00-05:00,2022-03-12T12:00:00-05:00,"['* WHAT...Rain will develop and change to snow on Friday night.\nTotal snow accumulations of 3 to 5 inches are possible by the\ntime snow tapers off on Saturday.', '* WHERE...The Winter Storm Watch is for portions of east central,\nsouth central and southeast Kentucky.', '* WHEN...Rain will change to snow from northwest to southeast\nlate Friday night, with snow then tapering to scattered snow\nshowers on Saturday morning.', '* IMPACTS...Travel may become difficult.', '* ADDITIONAL DETAILS...Warm ground temperature will hinder snow\naccumulation. However, heavy snowfall rates will likely overcome\nthe initial melting and allow the snow to accumulate.']"
1,KY,Bracken; Robertson; Mason; Lewis; Pickaway; Fairfield; Ross; Hocking; Brown; Highland; Adams; Pike; Scioto,Winter Storm Watch,Severe,Possible,Future,2022-03-10T03:21:00-05:00,2022-03-12T13:00:00-05:00,"['* WHAT...Heavy snow possible. Total snow accumulations of 3 to 5\ninches possible.', '* WHERE...Portions of Central, South Central and Southwest Ohio\nand Northeast and Northern Kentucky.', '* WHEN...From Friday evening through Saturday afternoon.', '* IMPACTS...Travel could be very difficult.', '* ADDITIONAL DETAILS...After warm temperatures on Friday,\ntemperatures will fall below freezing Friday night as much\ncolder air moves in. Brisk conditions are then expected on\nSaturday with high temperatures remaining in the 20s.']"
2,KY,Scott; Harrison; Woodford; Fayette; Bourbon; Nicholas; Washington; Mercer; Jessamine; Clark; Marion; Boyle; Garrard; Madison; Taylor; Casey; Lincoln,Winter Storm Watch,Severe,Possible,Future,2022-03-10T03:09:00-05:00,2022-03-12T10:00:00-05:00,"['* WHAT...Heavy snow possible. Total snow accumulations of 3 to 6\ninches possible.', '* WHERE...Portions of east central, north central and south\ncentral Kentucky.', '* WHEN...From late Friday evening through Saturday morning.', '* IMPACTS...Travel could be very difficult.', '* ADDITIONAL DETAILS...Bitter cold wind chills in the teens\nexpected by Saturday morning.']"
3,KY,"Muhlenberg, KY",Flood Warning,Severe,Observed,Immediate,2022-03-09T20:34:00-06:00,2022-03-10T18:51:00-06:00,"['* WHAT...Minor flooding is occurring and minor flooding is forecast.', '* WHERE...Green River at Paradise.', '* WHEN...Until tomorrow evening.', '* ADDITIONAL DETAILS...\n- At 7:15 PM CST Wednesday the stage was 381.9 feet.\n- Forecast...The river is expected to fall below flood stage\ntomorrow afternoon and continue falling to 379.7 feet Monday\nevening.\n- Flood stage is 380.0 feet.\n- http://www.weather.gov/safety/flood']"
4,KY,"Fulton, KY; Mississippi, MO; New Madrid, MO",Flood Warning,Severe,Observed,Immediate,2022-03-09T20:17:00-06:00,2022-03-12T03:00:00-06:00,"['* WHAT...Minor flooding is occurring and minor flooding is forecast.', '* WHERE...Mississippi River at New Madrid.', '* WHEN...Until early Saturday morning.', '* IMPACTS...At 34.0 feet, Minor flooding occurs affecting mainly\nbottomland and surrounding low lying areas.', '* ADDITIONAL DETAILS...\n- At 7:00 PM CST Wednesday the stage was 35.2 feet.\n- Forecast...The river is cresting around 35.3 feet tonight. It\nwill then fall below flood stage late Friday evening.\n- Flood stage is 34.0 feet.\n- http://www.weather.gov/safety/flood']"
5,KY,"Pope, IL; Livingston, KY",Flood Warning,Severe,Observed,Immediate,2022-03-09T20:09:00-06:00,2022-03-11T09:00:00-06:00,"['* WHAT...Minor flooding is occurring and minor flooding is forecast.', '* WHERE...Ohio River at Smithland Dam.', '* WHEN...Until late Friday morning.', '* IMPACTS...At 40.0 feet, Minor flooding occurs affecting mainly\nbottomland and surrounding and low lying areas.', '* ADDITIONAL DETAILS...\n- At 7:00 PM CST Wednesday the stage was 41.7 feet.\n- Forecast...The river is expected to fall below flood stage\nearly Friday morning and continue falling to 34.6 feet\nSaturday, March 19.\n- Flood stage is 40.0 feet.\n- Flood History...This crest compares to a previous crest of\n42.4 feet on 03/10/2021.']"
6,KY,"Massac, IL; Pope, IL; Livingston, KY; McCracken, KY",Flood Warning,Severe,Observed,Immediate,2022-03-09T20:09:00-06:00,2022-03-16T18:00:00-06:00,"['* WHAT...Minor flooding is occurring and minor flooding is forecast.', '* WHERE...Ohio River at Paducah.', '* WHEN...Until Wednesday evening.', '* IMPACTS...At 43.0 feet, Moderate flooding occurs affecting several\nsmall unprotected towns.', '* ADDITIONAL DETAILS...\n- At 7:00 PM CST Wednesday the stage was 42.4 feet.\n- Forecast...The river is expected to fall below flood stage\nWednesday afternoon March 16.\n- Flood stage is 39.0 feet.']"
7,KY,"Pulaski, IL; Ballard, KY",Flood Warning,Severe,Observed,Immediate,2022-03-09T20:09:00-06:00,,"['* WHAT...Moderate flooding is occurring and moderate flooding is\nforecast.', '* WHERE...Ohio River at Olmsted Lock and Dam.', '* WHEN...Until further notice.', '* ADDITIONAL DETAILS...\n- At 7:00 PM CST Wednesday the stage was 43.6 feet.\n- Forecast...The river is expected to fall to 36.2 feet\nSaturday, March 19.\n- Flood stage is 36.0 feet.\n- Flood History...This crest compares to a previous crest of\n43.8 feet on 01/16/2020.']"
8,KY,"Alexander, IL; Pulaski, IL; Ballard, KY; Carlisle, KY; Fulton, KY; Hickman, KY; Mississippi, MO",Flood Warning,Severe,Observed,Immediate,2022-03-09T20:09:00-06:00,,"['* WHAT...Minor flooding is occurring and minor flooding is forecast.', '* WHERE...Ohio River at Cairo.', '* WHEN...Until further notice.', '* IMPACTS...At 40.0 feet, Minor flooding occurs affecting mainly\nagricultural bottomland and low lying areas.', '* ADDITIONAL DETAILS...\n- At 7:00 PM CST Wednesday the stage was 46.9 feet.\n- Forecast...The river is expected to fall to 41.0 feet\nSaturday, March 19.\n- Flood stage is 40.0 feet.\n- Flood History...This crest compares to a previous crest of\n47.0 feet on 04/04/2021.\n- http://www.weather.gov/safety/flood']"
9,KY,"Spencer, IN; Vanderburgh, IN; Warrick, IN; Daviess, KY; Henderson, KY",Flood Warning,Severe,Observed,Immediate,2022-03-09T19:59:00-06:00,2022-03-16T12:40:00-06:00,"['* WHAT...Minor flooding is occurring and minor flooding is forecast.', '* WHERE...Ohio River at Newburgh Dam.', '* WHEN...Until early Wednesday afternoon March 16.', '* ADDITIONAL DETAILS...\n- At 7:00 PM CST Wednesday the stage was 40.5 feet.\n- Forecast...The river is expected to rise to a crest of 42.5\nfeet early Friday morning. It will then fall below flood\nstage Wednesday March 16.\n- Flood stage is 38.0 feet.']"
10,KY,"Posey, IN; Vanderburgh, IN; Henderson, KY; Union, KY",Flood Warning,Severe,Observed,Immediate,2022-03-09T19:59:00-06:00,2022-03-17T22:12:00-06:00,"['* WHAT...Minor flooding is occurring and minor flooding is forecast.', '* WHERE...Ohio River at Mount Vernon.', '* WHEN...Until Thursday, March 17.', '* IMPACTS...At 40.0 feet, Farm land and some main roads are flooded\nin places southwest and west of Mt. Vernon.', '* ADDITIONAL DETAILS...\n- At 6:00 AM CST Wednesday the stage was 38.3 feet.\n- Forecast...The river is expected to rise to a crest of 41.1\nfeet Saturday morning. It will then fall below flood stage\nThursday, March 17.\n- Flood stage is 35.0 feet.']"
