,State,Area,Event,Severity,Certainty,Urgency,Effective,Ends,Description
2,FL,Glades; Hendry; Inland Palm Beach County; Metro Palm Beach County; Coastal Collier County; Inland Collier County; Inland Broward County; Metro Broward County; Inland Miami-Dade County; Metropolitan Miami Dade; Mainland Monroe; Coastal Palm Beach County; Coastal Broward County; Coastal Miami Dade County; Far South Miami-Dade County,Special Weather Statement,Moderate,Observed,Expected,2022-01-26T11:20:00-05:00,,"['...FREEZING TEMPERATURES POSSIBLE ACROSS PARTS OF SOUTH FLORIDA THIS\nWEEKEND...', 'A strong cold front is forecast to move down the Florida peninsula\nFriday night, and move off the southeast Florida coast during the\npre-dawn hours of Saturday. Following the passage of the front,\nmuch colder air driven by gusty northwest winds will push into\nSouth Florida and usher in the coldest temperatures of the season\nso far.', 'The source region of the air mass following the front is from\nnorthern Canada, and only limited modification of this air mass is\nexpected as it moves directly southward from the northern Plains\ninto Florida this weekend. As a result, temperatures on Saturday\nare forecast to not get out of the 50s over most of the area, and\neven southern areas around Miami may struggle to reach 60 degrees\nunder clearing skies and gusty northwest winds.', 'This will set the stage for the coldest night and morning which\nwill likely be Saturday night and Sunday morning. Current\nindications are that the probabilities for freezing temperatures\nearly Sunday morning are increasing over inland Southwest\nFlorida, primarily Glades, Hendry, inland Collier, and inland Palm\nBeach County well away from Lake Okeechobee. In these areas,\nduration of temperatures of 32 degrees or below could be as much\nas 4 hours. Over the rest of the area, low temperatures Sunday\nmorning are forecast to range from the mid 30s over the outlying\nsuburbs of the east and west coasts, upper 30s Gulf coast, and\nupper 30s to lower 40s over most of metro Southeast Florida.', 'Northwest winds will stay in the 5 to 10 mph range Saturday night\nand Sunday morning, and as high as 15 mph near the coasts. This\nwill cause lowest wind chill readings early Sunday to be in the\n20s around Lake Okeechobee, and near 30 to the lower 30s\nelsewhere.', 'Another cold night is expected Sunday night and Monday morning,\nand although it may not be as cold as Sunday morning, freezing\ntemperatures and frost may still be a possibility over interior\nareas around Lake Okeechobee.', 'Stay informed on the latest forecasts on the upcoming cold snap.', 'The next freeze outlook will be issued by midday Thursday.']"
3,FL,Inland Miami-Dade County; Metropolitan Miami Dade; Coastal Miami Dade County; Far South Miami-Dade County,Special Weather Statement,Moderate,Observed,Expected,2022-01-26T11:05:00-05:00,,"['A strong cold front is forecast to move down the Florida peninsula\nFriday night, and move off the southeast Florida coast during the\npre-dawn hours of Saturday. Following the passage of the front,\nmuch colder air driven by gusty northwest winds will push into\nSouth Florida and usher in the coldest temperatures of the season\nso far.', 'The source region of the air mass following the front is from\nnorthern Canada, and only limited modification of this air mass is\nexpected as it moves directly southward from the northern Plains\ninto Florida this weekend. As a result, temperatures on Saturday\nare forecast to not get out of the 50s over most of the area, and\neven southern areas around Miami may struggle to reach 60 degrees\nunder clearing skies and gusty northwest winds.', 'This will set the stage for the coldest night and morning which\nwill likely be Saturday night and Sunday morning. Current\nindications are that the probabilities for freezing temperatures\nearly Sunday morning are increasing over inland Southwest\nFlorida, primarily Glades, Hendry, inland Collier, and inland Palm\nBeach County well away from Lake Okeechobee. In these areas,\nduration of temperatures of 32 degrees or below could be as much\nas 4 hours. Over the rest of the area, low temperatures Sunday\nmorning are forecast to range from the mid 30s over the outlying\nsuburbs of the east and west coasts, upper 30s Gulf coast, and\nupper 30s to lower 40s over most of metro Southeast Florida.', 'Northwest winds will stay in the 5 to 10 mph range Saturday night\nand Sunday morning, and as high as 15 mph near the coasts. This\nwill cause lowest wind chill readings early Sunday to be in the\n20s around Lake Okeechobee, and near 30 to the lower 30s\nelsewhere.', 'Another cold night is expected Sunday night and Monday morning,\nand although it may not be as cold as Sunday morning, freezing\ntemperatures and frost may still be a possibility over interior\nareas around Lake Okeechobee.', 'Stay informed on the latest forecasts on the upcoming cold snap.', 'The next freeze outlook will be issued by midday Thursday.']"
0,GA,Coastal Nassau; Coastal Duval; Coastal St. Johns; Coastal Flagler; Coastal Glynn; Coastal Camden,Rip Current Statement,Moderate,Likely,Expected,2022-01-27T01:56:00-05:00,2022-01-28T03:00:00-05:00,"['* WHAT...Dangerous rip currents expected. Rough surf also\nexpected, especially for NE FL beaches.', '* WHERE...Southeast Georgia and Northeast Florida Beaches.', '* WHEN...Through late tonight.', '* IMPACTS...Rip currents can sweep even the best swimmers away\nfrom shore into deeper water.']"
0,ID,Shoshone/Lava Beds; Eastern Magic Valley; Raft River Region,Freezing Fog Advisory,Moderate,Likely,Expected,2022-01-27T02:05:00-07:00,2022-01-27T10:00:00-07:00,"['* WHAT...Visibility as low as one half mile or less in freezing\nfog.', '* WHERE...Shoshone, Richfield, Carey, Burley, Rupert, Heyburn,\nOakley, Malta, Rockland, and Holbrook', '* WHEN...Until 10 AM MST this morning.', '* IMPACTS...Hazardous driving conditions due to low visibility and\npotential frost on bridges.']"
1,ID,Upper Snake River Plain,Special Weather Statement,Moderate,Observed,Expected,2022-01-26T15:10:00-07:00,,"['An ice jam has been reported at the US 20 crossing of the Fall\nRiver in Fremont County, between St. Anthony and Ashton. At this\ntime, no flooding is occurring or imminent. Please report any\nsignificant flooding to local officials.']"
2,ID,Western Lemhi County; Eastern Lemhi County,Air Stagnation Advisory,Moderate,Likely,Expected,2022-01-26T13:12:00-07:00,2022-01-30T11:00:00-07:00,"['* WHAT...An extended period of stagnant air, with light winds\nand little vertical mixing, is expected expected.', '* WHERE...Lemhi County.', '* WHEN...From 5 AM Thursday to 11 AM MST Sunday.', '* IMPACTS...Periods of air stagnation can lead to the buildup of\npollutants near the surface.']"
0,IN,Lake,Winter Storm Watch,Severe,Possible,Future,2022-01-27T03:07:00-06:00,2022-01-28T14:00:00-06:00,"['* WHAT...Heavy lake effect snow possible. Total snow accumulations\nof 6 inches or more are possible near Lake Michigan.', '* WHERE...Lake IN County.', '* WHEN...From this evening through Friday afternoon.', '* IMPACTS...Plan on slippery road conditions. The hazardous\nconditions could impact the morning commute.', '* ADDITIONAL DETAILS...Lake effect snow is expected to develop\nlate this evening and continue into Friday morning. Snowfall\nrates of 1 to 2 inches per hour will be possible. Visibility\nless than one half mile is possible. This lake effect snow will\naffect Interstates 80, 90 and 94 in northwest Indiana.']"
0,IA,Emmet; Kossuth; Winnebago; Worth; Palo Alto; Hancock; Cerro Gordo; Humboldt; Wright; Franklin,Wind Chill Advisory,Moderate,Likely,Expected,2022-01-27T03:51:00-06:00,2022-01-28T09:00:00-06:00,"['* WHAT...Very cold wind chills expected. Wind chills as low as 20\nto 30 below zero.', '* WHERE...North Central Iowa.', '* WHEN...From midnight tonight to 9 AM CST Friday.', '* IMPACTS...The cold wind chills could cause frostbite on exposed\nskin in as little as 30 minutes.']"
0,KY,Fleming; Montgomery; Bath; Rowan; Estill; Powell; Menifee; Rockcastle; Jackson; Pulaski; Laurel; Wayne; McCreary; Whitley; Knox; Bell; Harlan; Elliott; Morgan; Johnson; Wolfe; Magoffin; Floyd; Lee; Breathitt; Knott; Owsley; Perry; Clay; Leslie; Letcher; Martin; Pike,Special Weather Statement,Moderate,Observed,Expected,2022-01-27T04:35:00-05:00,,"['The return of an Arctic cold front will bring snow to much of the\narea later tonight through Friday night. The snow will likely be\nheavier in the southeast parts of the area on Friday and Friday\nnight. This will probably result in an inch or two of snow\naccumulation for locations closer to the Virgina border. Travelers\nare urged to use caution and allow extra time to reach their\ndestinations tonight through Friday night.', 'In addition, the cold arctic air moving deeper into the area on\nFriday night will send temperatures to near 10 degrees by Saturday\nmorning. These chilly temperatures will combine with brisk\nnortherly winds Friday night to produce wind chill values near\nzero degrees into Saturday morning. Now is the time to prepare for\nthis renewed bout of very cold air.']"
0,MD,Montgomery,Test Message,Unknown,Unknown,Unknown,2022-01-27T14:11:26+00:00,,['Monitoring message only. Please disregard.']
1,MD,Dorchester; Wicomico; Somerset; Inland Worcester; Maryland Beaches; Accomack; Northampton,Winter Storm Watch,Severe,Possible,Future,2022-01-27T07:01:00-05:00,2022-01-29T19:00:00-05:00,"['* WHAT...Heavy snow possible. Total snow accumulations of 6 to\n10 inches possible with locally higher amounts. Winds could\ngust as high as 45 mph.', '* WHERE...Portions of southeast Maryland and eastern and\nsoutheast Virginia.', '* WHEN...From Friday evening through Saturday evening.', '* IMPACTS...Travel could be very difficult. Gusty winds could\nbring down tree branches.']"
2,MD,New Castle; Kent; Kent; Queen Anne's; Talbot; Caroline; Middlesex; Mercer; Salem; Gloucester; Camden; Northwestern Burlington; Cumberland; Delaware; Philadelphia; Eastern Montgomery; Lower Bucks,Winter Storm Watch,Severe,Possible,Future,2022-01-27T03:13:00-05:00,2022-01-29T19:00:00-05:00,"['* WHAT...Heavy snow possible. Total snow accumulations of 4 to 9\ninches possible. Winds could gust as high as 40 mph.', '* WHERE...The eastern shore of Maryland, northern and central\nDelaware, far southeastern Pennsylvania, and much of central and\nsouthern New Jersey.', '* WHEN...From Friday evening through Saturday evening.', '* IMPACTS...Travel could be very difficult.', '* ADDITIONAL DETAILS...Snow is expected to begin Friday evening in\nDelmarva and southern New Jersey, spreading northward overnight\ninto Saturday morning. Snow may be heavy at times through early\nafternoon before diminishing late in the day. Winds may generate\nareas of blowing snow and low visibilities at times. The storm\ntotal snow forecast remains very uncertain, so stay tuned to the\nlatest forecasts.']"
0,MA,Eastern Essex; Western Norfolk; Southeast Middlesex; Suffolk; Eastern Norfolk; Northern Bristol; Western Plymouth; Eastern Plymouth; Southern Bristol; Southern Plymouth; Barnstable; Dukes; Northwest Providence; Southeast Providence; Western Kent; Eastern Kent; Bristol; Washington; Newport; Block Island,Winter Storm Watch,Severe,Possible,Future,2022-01-27T03:33:00-05:00,2022-01-30T00:00:00-05:00,"['* WHAT...Heavy snow possible. Total snow accumulations of 8 to 17\ninches possible. Winds could gust as high as 60 mph, especially\non Cape Cod.', '* WHERE...Portions of northern Connecticut and central, eastern\nand northeastern Massachusetts.', '* WHEN...From late Friday night through Saturday evening.', '* IMPACTS...Travel could be very difficult to impossible. Strong\nwinds could cause tree damage.']"
1,MA,Tolland; Windham; Northern Worcester; Central Middlesex County; Western Essex; Southern Worcester; Northwest Middlesex County,Winter Storm Watch,Severe,Possible,Future,2022-01-27T03:33:00-05:00,2022-01-30T00:00:00-05:00,"['* WHAT...Heavy snow possible. Total snow accumulations of 8 to 17\ninches possible. Winds could gust as high as 60 mph, especially\non Cape Cod.', '* WHERE...Portions of northern Connecticut and central, eastern\nand northeastern Massachusetts.', '* WHEN...From late Friday night through Saturday evening.', '* IMPACTS...Travel could be very difficult to impossible. Strong\nwinds could cause tree damage.']"
0,MI,Emmet; Antrim; Kalkaska; Wexford; Charlevoix,Winter Weather Advisory,Moderate,Likely,Expected,2022-01-27T02:24:00-05:00,2022-01-27T17:00:00-05:00,"['* WHAT...Snow and blowing expected. Total snow accumulations of 1\nto 3 inches. Winds gusting as high as 35 mph will lead to areas\nof blowing snow.', '* WHERE...Emmet, Antrim, Kalkaska, Wexford and Charlevoix\nCounties.', '* WHEN...From 8 AM this morning to 5 PM EST this afternoon.', '* IMPACTS...Plan on slippery road conditions. Areas of blowing\nsnow will likely lead to significantly reduce visibility. The\nhazardous conditions could impact the evening commute.']"
1,MI,Leelanau; Benzie; Grand Traverse; Manistee,Winter Weather Advisory,Moderate,Likely,Expected,2022-01-27T02:24:00-05:00,2022-01-28T07:00:00-05:00,"['* WHAT...Snow and blowing snow expected. Total snow accumulations\nof 3 to 6 inches. Winds gusting as high as 35 mph will lead to\nareas of blowing snow.', '* WHERE...Leelanau, Benzie, Grand Traverse and Manistee Counties.', '* WHEN...From 8 AM this morning to 7 AM EST Friday.', '* IMPACTS...Plan on slippery road conditions. Areas of blowing\nsnow will likely lead to significantly reduce visibility. The\nhazardous conditions could impact the evening commute.']"
0,MN,Wilkin; Richland,Winter Weather Advisory,Moderate,Likely,Expected,2022-01-27T06:48:00-06:00,2022-01-27T12:00:00-06:00,"['* WHAT...Blowing/Drifting snow impacts expected at times,\nespecially in open country. Winds gusting as high as 40 mph.', '* WHERE...In Minnesota, Wilkin County. In North Dakota, Richland\nCounty.', '* WHEN...From midnight tonight to noon CST Thursday.', '* IMPACTS...Patchy blowing snow could reduce visibility. The\nhazardous conditions could impact the morning commute.']"
1,MN,Norman; Traill,Winter Weather Advisory,Moderate,Likely,Expected,2022-01-27T06:48:00-06:00,2022-01-27T12:00:00-06:00,"['* WHAT...NBlowing/Drifting snow impacts expected at times,\nespecially in open country. Winds gusting as high as 40 mph.', '* WHERE...The central Red River Valley.', '* WHEN...Until noon CST Thursday.', '* IMPACTS...Patchy blowing snow could reduce visibility. The\nhazardous conditions could impact the morning commute.']"
2,MN,Clay; Cass,Winter Weather Advisory,Moderate,Likely,Expected,2022-01-27T06:48:00-06:00,2022-01-27T12:00:00-06:00,"['* WHAT...Blowing/Drifting snow impacts expected at times,\nespecially in open country. Winds gusting as high as 40 mph.', '* WHERE...In Minnesota, Clay County. In North Dakota, Cass\nCounty.', '* WHEN...Until noon CST Thursday.', '* IMPACTS...Patchy blowing snow could reduce visibility. The\nhazardous conditions could impact the morning commute.']"
0,MT,Pryor/Northern Bighorn Mountains; Northeast Bighorn Mountains,Winter Weather Advisory,Moderate,Likely,Expected,2022-01-27T06:14:00-07:00,2022-01-27T12:00:00-07:00,"['* WHAT...Snow occurring. Additional snow accumulations up to two\ninches. Winds gusting as high as 30 mph.', '* WHERE...In Wyoming, Northeast Bighorn Mountains. In Montana,\nPryor/Northern Bighorn Mountains.', '* WHEN...Until Noon MST today.', '* IMPACTS...Travel on Highway 14 through Burgess Junction and in the\nStory area will be impacted by slick roads and poor visibility.']"
1,MT,Southern Rosebud; Southern Big Horn; Bighorn Canyon; Sheridan Foothills,Winter Weather Advisory,Moderate,Likely,Expected,2022-01-27T06:14:00-07:00,2022-01-27T12:00:00-07:00,"['* WHAT...Snow occurring. Additional snow accumulations up to one\ninch. Winds gusting as high as 30 mph.', '* WHERE...In Wyoming, Sheridan Foothills. In Montana, Bighorn\nCanyon, Southern Big Horn and Southern Rosebud.', '* WHEN...Until Noon MST today.', '* IMPACTS...Plan on slick and snow covered road conditions,\nincluding portions of I-90 and highway 212']"
2,MT,Livingston Area; Beartooth Foothills,Wind Advisory,Moderate,Likely,Expected,2022-01-27T02:05:00-07:00,2022-01-29T18:00:00-07:00,"['* WHAT...Southwest wind gusts up to 70 mph expected.', '* WHERE...Beartooth Foothills and Livingston Area.', '* WHEN...From 6 PM this evening to 6 PM MST Saturday. The strongest\nwind gusts will occur during the overnight and early morning hours.', '* IMPACTS...Gusty winds will blow around unsecured objects. Tree\nlimbs could be blown down and a few power outages may result.\nStrong crosswinds will make travel difficult along Interstate 90\nfrom Livingston to Big Timber and roads along the Beartooth\nFoothills.']"
0,NV,Lake Havasu and Fort Mohave; Lake Mead National Recreation Area; San Bernardino County-Upper Colorado River Valley; Lake Mead National Recreation Area,Lake Wind Advisory,Moderate,Likely,Expected,2022-01-27T01:06:00-08:00,2022-01-27T19:00:00-08:00,"['* WHAT...North winds 20 to 30 mph with gusts up to 45 mph\nexpected.', '* WHERE...In Arizona, Lake Havasu and Fort Mohave and Lake Mead\nNational Recreation Area. In California, San Bernardino County-\nUpper Colorado River Valley. In Nevada, Lake Mead National\nRecreation Area.', '* WHEN...From 11 AM PST /noon MST/ to 7 PM PST /8 PM MST/ today.', '* IMPACTS...Strong winds and rough waves on area lakes will\ncreate hazardous conditions for small craft.']"
0,NJ,Northern Fairfield; Northern New Haven; Northern Middlesex; Northern New London; Southern Fairfield; Southern New Haven; Southern Middlesex; Southern New London; Hudson; Northern Westchester; Southern Westchester; New York (Manhattan); Bronx; Richmond (Staten Is.); Kings (Brooklyn); Northwest Suffolk; Northeast Suffolk; Southwest Suffolk; Southeast Suffolk; Northern Queens; Northern Nassau; Southern Queens; Southern Nassau,Winter Storm Watch,Severe,Possible,Future,2022-01-27T03:30:00-05:00,2022-01-29T19:00:00-05:00,"['* WHAT...Heavy snow possible. Total snow accumulations of 6 to 12\ninches possible. Winds could gust as high as 45 mph.', '* WHERE...Portions of northeast New Jersey, southern Connecticut\nand southeast New York.', '* WHEN...From Friday evening through Saturday evening.', '* IMPACTS...Travel could be very difficult. Gusty winds could\nbring down tree branches.', '* ADDITIONAL DETAILS...There continues to be greater than usual\nforecast uncertainty with the track of this storm, and the axis\nof heaviest snowfall may shift in subsequent forecast updates.']"
1,NJ,Inland Sussex; Delaware Beaches; Western Monmouth; Eastern Monmouth; Ocean; Atlantic; Cape May; Atlantic Coastal Cape May; Coastal Atlantic; Coastal Ocean; Southeastern Burlington,Winter Storm Watch,Severe,Possible,Future,2022-01-27T03:13:00-05:00,2022-01-29T19:00:00-05:00,"['* WHAT...Heavy snow possible. Total snow accumulations of 6 to 12\ninches possible. Winds could gust as high as 45 mph.', '* WHERE...The coastal counties of New Jersey and Sussex County in\nDelaware.', '* WHEN...From Friday evening through Saturday evening.', '* IMPACTS...Travel could be very difficult to impossible.', '* ADDITIONAL DETAILS...Snow is expected to begin Friday evening in\nDelmarva and southern New Jersey, spreading northward overnight\ninto Saturday morning. Snow may be heavy at times through mid\nafternoon before diminishing Saturday evening. Strong winds may\ngenerate blowing snow and very low visibilities at times. The\nstorm total snow forecast remains very uncertain, so stay tuned\nto the latest forecasts.']"
2,NJ,New Castle; Kent; Kent; Queen Anne's; Talbot; Caroline; Middlesex; Mercer; Salem; Gloucester; Camden; Northwestern Burlington; Cumberland; Delaware; Philadelphia; Eastern Montgomery; Lower Bucks,Winter Storm Watch,Severe,Possible,Future,2022-01-27T03:13:00-05:00,2022-01-29T19:00:00-05:00,"['* WHAT...Heavy snow possible. Total snow accumulations of 4 to 9\ninches possible. Winds could gust as high as 40 mph.', '* WHERE...The eastern shore of Maryland, northern and central\nDelaware, far southeastern Pennsylvania, and much of central and\nsouthern New Jersey.', '* WHEN...From Friday evening through Saturday evening.', '* IMPACTS...Travel could be very difficult.', '* ADDITIONAL DETAILS...Snow is expected to begin Friday evening in\nDelmarva and southern New Jersey, spreading northward overnight\ninto Saturday morning. Snow may be heavy at times through early\nafternoon before diminishing late in the day. Winds may generate\nareas of blowing snow and low visibilities at times. The storm\ntotal snow forecast remains very uncertain, so stay tuned to the\nlatest forecasts.']"
0,NM,Chaves County Plains,Freezing Fog Advisory,Moderate,Likely,Expected,2022-01-27T03:14:00-07:00,2022-01-27T09:00:00-07:00,"['* WHAT...Visibility one quarter mile or less in freezing fog.', '* WHERE...Chaves County Plains including Roswell.', '* WHEN...Until 9 AM MST this morning.', '* IMPACTS...Low visibility and a glaze of ice on bridges and\noverpasses could make driving conditions hazardous.']"
1,NM,Otero Mesa; Western El Paso County; Northern Hudspeth Highlands/Hueco Mountains; Salt Basin; Southern Hudspeth Highlands,Wind Advisory,Moderate,Likely,Expected,2022-01-27T02:40:00-07:00,2022-01-28T07:00:00-07:00,"['* WHAT...Northeast winds 20 to 30 mph with gusts up to 50 mph\nexpected.', '* WHERE...Hudspeth County, southern Otero County, and areas west\nand east of the El Paso County', '* WHEN...From 8 PM this evening to 7 AM MST Friday.', '* ADDITIONAL DETAILS...Strongest winds will be along west slope\nareas, canyons, ridgelines of the Franklin, Hueco, Guadeloupe\nMountains and the Otero Mesa. Winds will gradually subside by\nearly Friday morning.']"
2,NM,Eddy County Plains; Northern Lea County; Central Lea County; Southern Lea County; Gaines; Dawson; Borden; Scurry; Andrews; Martin; Howard; Mitchell; Loving; Winkler; Ector; Midland; Glasscock; Ward; Crane; Upton; Reagan; Pecos; Eastern Culberson County; Reeves County Plains; Davis Mountains Foothills,Freezing Fog Advisory,Moderate,Likely,Expected,2022-01-27T02:02:00-06:00,2022-01-27T10:00:00-06:00,"['* WHAT...Visibility one quarter mile or less in freezing fog.', '* WHERE...Portions of southeast New Mexico and southwest and\nwestern Texas.', '* WHEN...Until 10 AM CST /9 AM MST/ this morning.', '* IMPACTS...Hazardous driving conditions due to low visibility and\npotential ice on bridges and overpasses.']"
0,NY,Northern Fairfield; Northern New Haven; Northern Middlesex; Northern New London; Southern Fairfield; Southern New Haven; Southern Middlesex; Southern New London; Hudson; Northern Westchester; Southern Westchester; New York (Manhattan); Bronx; Richmond (Staten Is.); Kings (Brooklyn); Northwest Suffolk; Northeast Suffolk; Southwest Suffolk; Southeast Suffolk; Northern Queens; Northern Nassau; Southern Queens; Southern Nassau,Winter Storm Watch,Severe,Possible,Future,2022-01-27T03:30:00-05:00,2022-01-29T19:00:00-05:00,"['* WHAT...Heavy snow possible. Total snow accumulations of 6 to 12\ninches possible. Winds could gust as high as 45 mph.', '* WHERE...Portions of northeast New Jersey, southern Connecticut\nand southeast New York.', '* WHEN...From Friday evening through Saturday evening.', '* IMPACTS...Travel could be very difficult. Gusty winds could\nbring down tree branches.', '* ADDITIONAL DETAILS...There continues to be greater than usual\nforecast uncertainty with the track of this storm, and the axis\nof heaviest snowfall may shift in subsequent forecast updates.']"
1,NY,Jefferson,Wind Chill Advisory,Moderate,Likely,Expected,2022-01-27T03:09:00-05:00,2022-01-27T10:00:00-05:00,"['* WHAT...For the Winter Weather Advisory, lake effect snow\nexpected. Total snow accumulations of 4 to 7 inches in the most\npersistent lake snows. For the Wind Chill Advisory, very cold\nwind chills. Wind chills as low as 25 below zero.', '* WHERE...Jefferson county.', '* WHEN...For the Winter Weather Advisory, from 7 PM this evening\nto 10 AM EST Friday. For the Wind Chill Advisory, until 10 AM\nEST this morning.', '* IMPACTS...Plan on slippery road conditions. The hazardous\nconditions could impact the morning or evening commute.']"
2,NY,Lewis,Wind Chill Advisory,Moderate,Likely,Expected,2022-01-27T03:09:00-05:00,2022-01-27T10:00:00-05:00,"['* WHAT...Very cold wind chills. Wind chills as low as 25 below\nzero.', '* WHERE...Lewis county.', '* WHEN...Until 10 AM EST this morning.', '* IMPACTS...The cold wind chills could cause frostbite on\nexposed skin in as little as 30 minutes.']"
3,NY,Jefferson,Winter Weather Advisory,Moderate,Likely,Expected,2022-01-27T03:09:00-05:00,2022-01-28T10:00:00-05:00,"['* WHAT...For the Winter Weather Advisory, lake effect snow\nexpected. Total snow accumulations of 4 to 7 inches in the most\npersistent lake snows. For the Wind Chill Advisory, very cold\nwind chills. Wind chills as low as 25 below zero.', '* WHERE...Jefferson county.', '* WHEN...For the Winter Weather Advisory, from 7 PM this evening\nto 10 AM EST Friday. For the Wind Chill Advisory, until 10 AM\nEST this morning.', '* IMPACTS...Plan on slippery road conditions. The hazardous\nconditions could impact the morning or evening commute.']"
4,NY,Oswego,Winter Weather Advisory,Moderate,Likely,Expected,2022-01-27T03:09:00-05:00,2022-01-28T13:00:00-05:00,"['* WHAT...Lake effect snow expected. Total snow accumulations of 4\nto 7 inches in the most persistent lake snows.', '* WHERE...Oswego county.', '* WHEN...From midnight tonight to 1 PM EST Friday.', '* IMPACTS...Travel could be very difficult. The hazardous\nconditions could impact the morning commute on Friday.']"
