,State,Area,Event,Severity,Certainty,Urgency,Effective,Ends,Description
14,OR,"Clatsop, OR; Columbia, OR; Pacific, WA; Wahkiakum, WA",Flood Warning,Severe,Likely,Expected,2022-01-07T02:50:00-08:00,2022-01-07T09:15:00-08:00,"['* WHAT...Small stream flooding and widespread lowland flooding\ncaused by excessive rainfall and snowmelt continues. Expect flood\nwaters to begin receding this morning, but it will be a gradual\nprocess as water works its way down each creek and river system.', '* WHERE...Clatsop County and far northwestern Columbia County in\nnorthwest Oregon and Pacific County and western portions of\nWahkiakum County in southwest Washington.', '* WHEN...Until 915 AM PST Friday.', '* IMPACTS...Flooding of rivers, creeks, streams, and other low-lying\nand flood-prone locations is imminent or occurring. Numerous roads\nremain closed due to flooding including portions of US101 in both\nPacific and Clatsop Counties, Washington Highway 4 and Washington\nHighway 6. Low-water crossings are inundated with water and may\nnot be passable.', '* ADDITIONAL DETAILS...\n- At 238 AM PST, Emergency management, the public and law\nenforcement have reported widespread flooding in the warned\narea.  Between 4 and 8 inches of rain have fallen over the\npast 24-30 hours.\n- Some locations that will experience flooding include...\nAstoria, Seaside, Warrenton, Cannon Beach, Long Beach,\nCathlamet, Grays River, Frances, Jewell, Ocean Park, Raymond,\nClatskanie, South Bend, Ilwaco, Rosburg, Knappa, Naselle,\nSkamokawa, Lebam and Hammond Town.\n- http://www.weather.gov/safety/flood']"
15,OR,Western Columbia River Gorge,Flash Flood Watch,Severe,Possible,Future,2022-01-07T02:15:00-08:00,2022-01-07T10:00:00-08:00,"['* WHAT...Flash flooding and debris flows caused by excessive\nrainfall and snowmelt are possible over the Eagle Creek Fire Burn\nArea.', '* WHERE...The western Columbia River Gorge on the Oregon side of the\nriver. The communities of Dodson and Warrendale are the most at\nrisk of experiencing additional debris flows and landslides early\nthis morning.', '* WHEN...Until 10 AM PST this morning.', '* IMPACTS...Residents in the vicinity of the Eagle Creek Burn Area,\nparticularly those in Dodson and Warrendale should be prepared to\nevacuate. Be sure to stay up to date with information from local\nauthorities. Soils are saturated and at a tipping point. Rainfall\nthis morning may result in additional debris flows.', '* ADDITIONAL DETAILS...\n- A combination of snowmelt and heavy rain early this morning\nmay lead to additional debris flows in the Eagle Creek burn\narea. Eight confirmed debris flows and landslides occurred\nThursday morning in the western Columbia River Gorge with a\nperiod of heavier rain and snowmelt. Additional debris flows\nand landslides are possible this morning.\n- http://www.weather.gov/safety/flood']"
16,OR,"Tillamook, OR",Flood Warning,Severe,Observed,Immediate,2022-01-07T00:55:00-08:00,2022-01-07T22:00:00-08:00,"['* WHAT...Minor flooding is occurring.', '* WHERE...Wilson River near Tillamook.', '* WHEN...Through Friday night', '* IMPACTS...Above 15.5 feet, expect widespread flooding in the north\npart of Tillamook along Hwy 101 to the vicinity of the Tillamook\nCheese Factory, especially during high tides. The most noticeable\nflood impacts are to low-lying roads and some buildings near\nDougherty Slough and the lower Wilson River. Widespread flooding\nof low lying dairy and pasture land and some rural access roads\noutside of Tillamook can be expected as well.', '* ADDITIONAL DETAILS...\n- At 12:30 AM PST Friday the stage was 13.1 feet.\n- Forecast...The river is continues to rise and should crest\naround 14 feet between 2-4am Friday. The river should then\nfall below minor flood stage Friday afternoon.\n- Minor flood stage is 12.0 feet.\n- http://www.weather.gov/safety/flood']"
17,OR,"Clatsop, OR; Tillamook, OR",Flood Warning,Severe,Observed,Immediate,2022-01-07T00:55:00-08:00,2022-01-08T13:04:00-08:00,"['* WHAT...Minor flooding is occurring.', '* WHERE...Nehalem River near Foss.', '* WHEN...Through Saturday afternoon', '* IMPACTS...Above 20.0 feet, flooding of some buildings in the town\nof Nehalem begins, with the situation worsening during the high\ntide. Also expect widespread low land flooding and numerous\nflooded rural roads from the Foss gauge station downstream to\nNehalem.', '* ADDITIONAL DETAILS...\n- At 12:30 AM PST Friday the stage was 17.3 feet.\n- Forecast...The river is expected to crest below moderate\nflood stage between 18 to 19 feet later Friday morning. The\nriver will then fall below flood stage Saturday morning.\n- Minor flood stage is 15.0 feet.\n- http://www.weather.gov/safety/flood']"
18,OR,Eastern Columbia River Gorge of Oregon; Lower Columbia Basin of Oregon; Foothills of the Northern Blue Mountains of Oregon; Foothills of the Southern Blue Mountains of Oregon; North Central Oregon; Eastern Columbia River Gorge of Washington; Kittitas Valley; Yakima Valley; Lower Columbia Basin of Washington; Foothills of the Blue Mountains of Washington; Simcoe Highlands,Wind Advisory,Moderate,Likely,Expected,2022-01-06T18:55:00-08:00,2022-01-07T21:00:00-08:00,"['* WHAT...Southwest winds 25 to 35 mph with gusts around 50 mph\nexpected.', '* WHERE...Portions of central, south central and southeast\nWashington and also north central and northeast Oregon.', '* WHEN...From 7 AM to 9 PM PST Friday.', '* IMPACTS...Gusty winds could blow around unsecured objects.\nTree limbs could be blown down and a few power outages may\nresult.']"
19,OR,"Coos, OR",Flood Warning,Severe,Observed,Immediate,2022-01-06T18:48:00-08:00,2022-01-07T17:00:00-08:00,"['* WHAT...Minor flooding is occurring and minor flooding is forecast\nto persist at least into Friday.', '* WHERE...Coquille River at Coquille.', '* WHEN...Until tomorrow afternoon.', '* IMPACTS...At 23.0 feet, Some farm buildings may be threatened and\nroads covered in low areas by rising water. Expect widespread\nflooding throughout the Coquille River floodplain.', '* ADDITIONAL DETAILS...\n- At 5:45 PM PST Thursday the stage was 22.4 feet.\n- Recent Activity...The maximum river stage in the 24 hours\nending at 5:45 PM PST Thursday was 23.0 feet.\n- Forecast...The river will oscillate above flood stage with a\nmaximum value of 22.4 feet this evening. It is expected to\nfall below flood stage late tomorrow morning.\n- Flood stage is 21.0 feet.\n- Flood History...This crest compares to a previous crest of\n22.4 feet on 02/19/1983.\n- http://www.weather.gov/safety/flood']"
20,OR,East Slopes of the Oregon Cascades,Winter Weather Advisory,Moderate,Likely,Expected,2022-01-06T18:37:00-08:00,2022-01-07T15:00:00-08:00,"['* WHAT...Snow expected. Total snow accumulations of 5 to 9 inches\nmainly along the crest of the Cascades. Winds gusting as high as\n40 mph on Friday.', '* WHERE...East Slopes of the Oregon Cascades.', '* WHEN...From 1 AM to 3 PM PST Friday.', '* IMPACTS...Travel could be very difficult. The hazardous\nconditions could impact the morning commute. Strong winds\ncould cause extensive damage to trees and power lines.']"
21,OR,"Benton, OR; Clackamas, OR; Clatsop, OR; Columbia, OR; Lane, OR; Lincoln, OR; Marion, OR; Multnomah, OR; Polk, OR; Tillamook, OR; Washington, OR; Yamhill, OR; Clark, WA; Cowlitz, WA; Pacific, WA; Wahkiakum, WA",Flood Advisory,Minor,Likely,Expected,2022-01-06T18:36:00-08:00,2022-01-07T16:00:00-08:00,"['* WHAT...Small stream flooding caused by excessive rainfall\ncontinues.', '* WHERE...Portions of northwest Oregon and southwest Washington,\nincluding the following counties, in northwest Oregon, Benton,\nClackamas, Clatsop, Columbia, Lane, Lincoln, Marion, Multnomah,\nPolk, Tillamook, Washington and Yamhill. In southwest Washington,\nClark, Cowlitz, Pacific and Wahkiakum.', '* WHEN...Until 400 PM PST Friday.', '* IMPACTS...Flooding of small streams and creeks, as well as areas\nwith poor drainage. Expect ponding of water in urban areas.', '* ADDITIONAL DETAILS...\n- At 619 PM PST, Snowmelt and/or periods of moderate to heavy\nrain will result in small stream flooding and flooding in\nareas of poor drainage overnight into Friday.\n- Additional rainfall amounts of a quarter to three quarters of\nan inch in the Willamette Valley and 1 to 3 inches in the\nCoast Range and Willapa Hills are still expected.\n- http://www.weather.gov/safety/flood']"
22,OR,Northern Oregon Cascades,Winter Storm Warning,Severe,Likely,Expected,2022-01-06T15:16:00-08:00,2022-01-07T22:00:00-08:00,"['CCA', '* WHAT...Heavy snow expected above 3000 feet. Total snow\naccumulations of 8 to 14 inches. West to southwest winds\ngusting as 45 to 60 mph Friday morning into the afternoon.', '* WHERE...Northern Oregon Cascades.', '* WHEN...From 6 AM to 10 PM PST Friday.', '* IMPACTS...Travel could be very difficult. Gusty winds could\ncause tree damage and potentially down power lines.']"
23,OR,Cascades in Lane County,Winter Weather Advisory,Moderate,Likely,Expected,2022-01-06T15:16:00-08:00,2022-01-08T00:00:00-08:00,"['CCA', '* WHAT...Snow expected above 3000 feet. Total snow accumulations\nof 4 to 9 inches. West to southwest winds gusting as high 45 to\n55 mph Friday.', '* WHERE...Cascades in Lane County.', '* WHEN...From noon Friday to midnight PST Friday night.', '* IMPACTS...Plan on slippery road conditions.']"
24,OR,Central and Eastern Lake County,Wind Advisory,Moderate,Likely,Expected,2022-01-06T14:25:00-08:00,2022-01-07T19:00:00-08:00,"['* WHAT...For the High Wind Warning, southwest winds 25 to 35 mph\nwith gusts up to 65 mph expected. For the Wind Advisory,\nsouthwest winds 20 to 30 mph with gusts up to 45 mph expected.', '* WHERE...For the High Wind Warning, highway 31 between Paisley\nand Summer Lake in addition to the Warner Mountains east of\nLakeview. For the Wind Advisory, other locations across Lake\nCounty including highways 395 and 140.', '* WHEN...From 1 AM to 7 PM PST Friday.', '* IMPACTS...Gusty winds could blow around unsecured objects. Tree\nlimbs could be blown down and a few power outages may result.\nTravel will be difficult, especially for high profile vehicles.', '* ADDITIONAL DETAILS...Snowfall amounts of 0.5 to 1 inch along\nhighway locations combined with the winds could lead to\ndifficult driving conditions from blowing snow creating\nvisibility reductions.', '* View the hazard area in detail at\nhttps://www.wrh.noaa.gov/map/?wfo=mfr']"
25,OR,South Central Oregon Coast; Curry County Coast,High Wind Warning,Severe,Likely,Expected,2022-01-06T14:25:00-08:00,2022-01-07T07:00:00-08:00,"['* WHAT...South winds 25 to 35 mph with gusts up to 60 mph\nexpected.', '* WHERE...Portions of the southern Oregon coast and coastal\nheadlands. This includes the communities of Gold Beach,\nBrookings, Cape Blanco, Ophir, and Reedsport. Portions of US\nHighway 101 will also be affected.', '* WHEN...From 7 PM to 7 AM PST Friday.', '* IMPACTS...Damaging winds can blow down trees and power lines.\nPower outages are possible. Travel will be difficult, especially\nfor high profile vehicles.', '* View the hazard area in detail at\nhttps://www.wrh.noaa.gov/map/?wfo=mfr']"
26,OR,Central and Eastern Lake County,High Wind Warning,Severe,Likely,Expected,2022-01-06T14:25:00-08:00,2022-01-07T19:00:00-08:00,"['* WHAT...For the High Wind Warning, southwest winds 25 to 35 mph\nwith gusts up to 65 mph expected. For the Wind Advisory,\nsouthwest winds 20 to 30 mph with gusts up to 45 mph expected.', '* WHERE...For the High Wind Warning, highway 31 between Paisley\nand Summer Lake in addition to the Warner Mountains east of\nLakeview. For the Wind Advisory, other locations across Lake\nCounty including highways 395 and 140.', '* WHEN...From 1 AM to 7 PM PST Friday.', '* IMPACTS...Gusty winds could blow around unsecured objects. Tree\nlimbs could be blown down and a few power outages may result.\nTravel will be difficult, especially for high profile vehicles.', '* ADDITIONAL DETAILS...Snowfall amounts of 0.5 to 1 inch along\nhighway locations combined with the winds could lead to\ndifficult driving conditions from blowing snow creating\nvisibility reductions.', '* View the hazard area in detail at\nhttps://www.wrh.noaa.gov/map/?wfo=mfr']"
27,OR,Modoc County; Northern and Eastern Klamath County and Western Lake County,Wind Advisory,Moderate,Likely,Expected,2022-01-06T14:25:00-08:00,2022-01-07T19:00:00-08:00,"['* WHAT...Southwest winds 20 to 30 mph with gusts up to 50 mph\nexpected.', '* WHERE...In California, Modoc County along the Warner Mountain\nRange. In Oregon, mostly the high terrain of Northeast Klamath\nCounty and Winter Rim in Western Lake County.', '* WHEN...From 1 AM to 7 PM PST Friday.', '* IMPACTS...Gusty winds could blow around unsecured objects.\nTree limbs could be blown down and a few power outages may\nresult.', '* ADDITIONAL DETAILS...Snowfall amounts of 0.5 to 1 inch along\nhighway locations combined with the winds could lead to\ndifficult driving conditions from blowing snow creating\nvisibility reductions.', '* View the hazard area in detail at\nhttps://www.wrh.noaa.gov/map/?wfo=mfr']"
28,OR,South Central Oregon Cascades; Siskiyou Mountains and Southern Oregon Cascades,Winter Weather Advisory,Moderate,Likely,Expected,2022-01-06T14:21:00-08:00,2022-01-07T16:00:00-08:00,"['* WHAT...Snow expected. Total snow accumulations of 5 to 9\ninches. Winds gusting as high as 45 mph over exposed terrain.', '* WHERE...Elevations above 5500 feet in the South Central Oregon\nCascades and the Siskiyou Mountains. This includes Mt.\nAshland, Crater Lake, Highway 62 and the Mt. Ashland Ski Road.', '* WHEN...From 10 PM to 4 PM PST Friday.', '* IMPACTS...Travel could be difficult with longer travel times.', '* ADDITIONAL DETAILS...Snowfall rates will approach an inch an\nhour at times Friday morning.', '* View the hazard area in detail at wrh.noaa.gov/map/?wfo=mfr']"
29,OR,Northern Oregon Cascades; Cascades in Lane County; Upper Hood River Valley; Central Columbia River Gorge; South Washington Cascades; Central Columbia River Gorge,Special Weather Statement,Moderate,Observed,Expected,2022-01-06T11:21:00-08:00,,"['Strong low pressure area will approach the region later tonight,\nbringing breezy southerly winds. But, as the low moves east of the\nCascades Friday morning, winds will turn westerly and increase.\nWest winds of 25 to 40 mph are expected over the higher terrain of\nthe Cascades, as well as through the Columbia River Gorge. Peak\ngusts will vary depending on terrain and canyons, but overall,\ngusts of 45 to 60 mph are likely. With these winds, there is the\npotential for tree damage. Spotty power outage are possible as\nwell.']"
30,OR,"Umatilla, OR; Union, OR; Wallowa, OR",Avalanche Warning,Unknown,Unknown,Unknown,2022-01-06T06:43:00-08:00,,"['THE FOLLOWING MESSAGE IS TRANSMITTED AT THE REQUEST OF THE WALLOWA\nAVALANCHE CENTER IN LA GRANDE, OREGON.', 'THE WALLOWA AVALANCHE CENTER IN LA GRANDE HAS ISSUED A BACKCOUNTRY\nAVALANCHE WARNING.', '* TIMING...IN EFFECT FROM 623 AM PST TO 600 PM PST TODAY.', '* AFFECTED AREA...THIS WARNING IS IN EFFECT FOR THE BLUE MOUNTAINS.', '* AVALANCHE DANGER...VERY DANGEROUS AVALANCHE CONDITIONS EXIST.\nNATURAL AVALANCHES ARE LIKELY AND HUMAN-TRIGGERED AVALANCHES ARE\nVERY LIKELY.', '* PRECAUTIONARY / PREPAREDNESS ACTIONS...VERY DANGEROUS AVALANCHE\nCONDITIONS. TRAVEL IN AVALANCHE TERRAIN IS NOT RECOMMENDED.\nAVALANCHES MAY RUN LONG DISTANCES AND CAN RUN INTO MATURE FORESTS,\nVALLEY FLOORS, OR FLAT TERRAIN.', 'FOR SPECIFIC INFORMATION ON THE REASONING BEHIND THIS WARNING OR\nFOR INFORMATION ON RECENT AVALANCHE ACTIVITY, PLEASE REFER TO THE\nWALLOWA AVALANCHE CENTER WEBSITE AT: WWW.WALLOWAAVALANCHECENTER.ORG.', 'YOU MAY ALSO VISIT WWW.AVALANCHE.ORG FOR THE LATEST AVALANCHE\nINFORMATION NATIONWIDE.']"
31,OR,Central Willamette Valley,Flood Watch,Severe,Possible,Future,2022-01-04T05:57:00-08:00,2022-01-08T16:00:00-08:00,"['* WHAT...Flooding is possible.', '* WHERE...S Yamhill River at McMinnville.', '* WHEN...From Friday morning to Saturday afternoon.', '* IMPACTS...Above 50.0 feet, expect lowland flooding at several\nlocations along the river from McMinnville to the confluence with\nthe Willamette River.', '* ADDITIONAL DETAILS...\n- At 4:00 AM PST Tuesday the stage was 36.6 feet.\n- Forecast...Flood stage may be reached by Friday.\n- Flood stage is 50.0 feet.\n- http://www.weather.gov/safety/flood']"
0,PA,Warren,Winter Weather Advisory,Moderate,Likely,Expected,2022-01-07T07:13:00-05:00,2022-01-08T01:00:00-05:00,"['* WHAT...Lake effect snow and areas of blowing snow expected.\nTotal snow accumulations of 3 to 5 inches. Locally higher\namounts and periods of very poor visibility are possible\nacross the perennial snowbelt of northwestern Warren County.', '* WHERE...Warren County.', '* WHEN...From 5 AM Friday to 1 AM EST Saturday.', '* IMPACTS...Plan on slippery road conditions. The hazardous\nconditions could impact the morning or evening commute.']"
1,PA,Wyoming; Lackawanna; Luzerne; Pike; Southern Wayne,Winter Weather Advisory,Moderate,Likely,Expected,2022-01-07T05:00:00-05:00,2022-01-07T10:00:00-05:00,"['* WHAT...Snow. Additional snow accumulations of up to half inch.', '* WHERE...Pike, Wyoming, Lackawanna, Luzerne and Southern Wayne\ncounties.', '* WHEN...Until 10 AM EST this morning.', '* IMPACTS...Plan on slippery road conditions. The hazardous\nconditions could impact the morning commute.', '* ADDITIONAL DETAILS...Snow will be tapering off over early this\nmorning, slick roads are possible early this morning.']"
2,PA,New Castle; Kent; Kent; Queen Anne's; Talbot; Caroline; Hunterdon; Somerset; Middlesex; Mercer; Delaware; Philadelphia; Western Chester; Eastern Chester; Western Montgomery; Eastern Montgomery; Upper Bucks; Lower Bucks,Winter Weather Advisory,Moderate,Likely,Expected,2022-01-07T02:43:00-05:00,2022-01-07T10:00:00-05:00,"['* WHAT...Snow. Additional snow accumulations of 2 to 4 inches.', '* WHERE...Portions of central, northern and northwest New\nJersey, southeast Pennsylvania, northeast Maryland and central\nand northern Delaware.', '* WHEN...Until 10 AM EST this morning.', '* IMPACTS...Plan on slippery road conditions. The hazardous\nconditions could impact the morning commute.', '* ADDITIONAL DETAILS...Snowfall rates may briefly approach 1 inch\nper hour rates through sunrise.']"
3,PA,Sussex; Warren; Morris; Berks; Lehigh; Northampton,Winter Weather Advisory,Moderate,Likely,Expected,2022-01-07T02:43:00-05:00,2022-01-07T10:00:00-05:00,"['* WHAT...Snow. Additional snow accumulations of 1 to 3 inches.', '* WHERE...Portions of northern New Jersey and east central\nPennsylvania.', '* WHEN...Until 10 AM EST this morning.', '* IMPACTS...Plan on slippery road conditions. The hazardous\nconditions could impact the morning commute.']"
4,PA,Carbon; Monroe,Winter Weather Advisory,Moderate,Likely,Expected,2022-01-07T02:43:00-05:00,2022-01-07T10:00:00-05:00,"['* WHAT...Snow. Additional snow accumulations of up to two inches.', '* WHERE...Carbon and Monroe.', '* WHEN...Until 10 AM EST this morning.', '* IMPACTS...Plan on slippery road conditions. The hazardous\nconditions could impact the morning commute.']"
5,PA,Crawford,Winter Weather Advisory,Moderate,Likely,Expected,2022-01-07T02:43:00-05:00,2022-01-08T01:00:00-05:00,"['* WHAT...Lake effect snow occurring. Additional snow\naccumulations of 3 to 5 inches.', '* WHERE...Crawford county.', '* WHEN...Until 1 AM EST Saturday.', '* IMPACTS...Plan on slippery road conditions. The hazardous\nconditions could impact the morning or evening commute.', '* ADDITIONAL DETAILS...The heaviest snow looks to occur through\nthe morning then bands of locally heavy lake effect snow will\npersist through the day.']"
6,PA,Northern Erie; Southern Erie,Lake Effect Snow Warning,Extreme,Likely,Expected,2022-01-07T02:43:00-05:00,2022-01-08T07:00:00-05:00,"['* WHAT...Heavy lake effect snow expected. Total snow accumulations\nof 5 to 10 inches with locally higher possible.', '* WHERE...Northern Erie and Southern Erie counties.', '* WHEN...Until 7 AM EST Saturday.', '* IMPACTS...Travel could be very difficult. The hazardous\nconditions could impact the morning or evening commute.', '* ADDITIONAL DETAILS...The heaviest snow looks to occur through\nthe morning then bands of locally heavy lake effect snow will\npersist through the day.']"
0,PR,San Juan and Vicinity; Northeast; North Central; Northwest; Culebra,High Surf Advisory,Minor,Likely,Expected,2022-01-07T04:35:00-04:00,2022-01-07T18:00:00-04:00,"['* WHAT...For the High Surf Advisory, large breaking waves of 9 to\n11 feet. For the High Rip Current Risk, dangerous rip currents.', '* WHERE...Beaches across the northwest to northeast coast of\nPuerto Rico and Culebra.', '* WHEN...For the High Surf Advisory, until 6 PM AST this\nevening. For the High Rip Current Risk, through late Saturday\nnight.', '* IMPACTS...Dangerous swimming and surfing conditions and\nlocalized beach erosion. Rip currents can sweep even the best\nswimmers away from shore into deeper water.']"
1,PR,Southwest,Rip Current Statement,Moderate,Likely,Expected,2022-01-07T04:35:00-04:00,2022-01-08T06:00:00-04:00,"['* WHAT...Dangerous rip currents expected due to breaking waves\nof 6 to 10 feet.', '* WHERE...Beaches of Cabo Rojo in southwestern Puerto Rico.', '* WHEN...Through late tonight.', '* IMPACTS...Rip currents can sweep even the best swimmers away\nfrom shore into deeper water.']"
2,PR,Mayaguez and Vicinity; Vieques; St.Thomas...St. John.. and Adjacent Islands; St Croix,Rip Current Statement,Moderate,Likely,Expected,2022-01-07T04:35:00-04:00,2022-01-09T06:00:00-04:00,"['* WHAT...Dangerous rip currents expected due to breaking waves\nof 6 to 10 feet.', '* WHERE...Beaches of Rincon and Aguada in western Puerto Rico,\nas well as beaches across the north coast of Vieques, north\nand west coast of Saint Thomas, north coast of Saint John, and\neast coast of Saint Croix.', '* WHEN...Through late Saturday night.', '* IMPACTS...Rip currents can sweep even the best swimmers away\nfrom shore into deeper water.']"
3,PR,San Juan and Vicinity; Northeast; North Central; Northwest; Culebra,Rip Current Statement,Moderate,Likely,Expected,2022-01-07T04:35:00-04:00,2022-01-09T06:00:00-04:00,"['* WHAT...For the High Surf Advisory, large breaking waves of 9 to\n11 feet. For the High Rip Current Risk, dangerous rip currents.', '* WHERE...Beaches across the northwest to northeast coast of\nPuerto Rico and Culebra.', '* WHEN...For the High Surf Advisory, until 6 PM AST this\nevening. For the High Rip Current Risk, through late Saturday\nnight.', '* IMPACTS...Dangerous swimming and surfing conditions and\nlocalized beach erosion. Rip currents can sweep even the best\nswimmers away from shore into deeper water.']"
0,RI,Western Norfolk; Eastern Norfolk; Northern Bristol; Western Plymouth; Eastern Plymouth; Southern Bristol; Southern Plymouth; Northwest Providence; Southeast Providence; Western Kent; Eastern Kent; Bristol; Washington; Newport,Special Weather Statement,Moderate,Observed,Expected,2022-01-07T07:44:00-05:00,,"['At 739 AM EST, radar indicated a roughly 20 mile wide band of heavy\nsnow along a line extending from Quincy to near Providence. This\nband has been producing snowfall at the rate of over 2 inches per\nhour along with very low visibilities. This band will be slowly\ndrifting southeast through mid morning.', 'Locations impacted include...\nProvidence, New Bedford, Brockton, Quincy, Fall River, Warwick,\nCranston, Pawtucket, Plymouth, Taunton, Weymouth, East Providence,\nBraintree, Coventry, Dartmouth, Cumberland, Randolph, North\nProvidence, South Kingstown and West Warwick.', 'Due to the rapid accumulation of snow, hazardous driving conditions\nwill occur. Consider delaying travel if you will be going through\nthis band of heavy snow.']"
1,RI,Western Norfolk; Southeast Middlesex; Suffolk; Eastern Norfolk; Northern Bristol; Western Plymouth; Eastern Plymouth; Southern Bristol; Southern Plymouth; Northwest Providence; Southeast Providence; Western Kent; Eastern Kent; Bristol; Washington; Newport,Winter Storm Warning,Severe,Likely,Expected,2022-01-07T03:26:00-05:00,2022-01-07T16:00:00-05:00,"['* WHAT...Heavy snow. Additional snow accumulations of 5 to 8\ninches. Winds gusting as high as 35 mph.', '* WHERE...Portions of eastern and southeastern Massachusetts and\nnorthern and southern Rhode Island.', '* WHEN...Until 4 PM EST this afternoon.', '* IMPACTS...Travel could be very difficult. The hazardous\nconditions could impact the morning or evening commute.']"
2,RI,Dukes; Block Island,Winter Weather Advisory,Moderate,Likely,Expected,2022-01-07T03:26:00-05:00,2022-01-07T16:00:00-05:00,"['* WHAT...Snow. Additional snow accumulations of 4 to 6 inches.\nWinds gusting as high as 40 mph.', '* WHERE...In Massachusetts, Dukes MA County. In Rhode Island,\nBlock Island RI County.', '* WHEN...Until 4 PM EST this afternoon.', '* IMPACTS...Plan on slippery road conditions. The hazardous\nconditions could impact the morning or evening commute.']"
3,RI,Western Norfolk; Southeast Middlesex; Suffolk; Eastern Norfolk; Northern Bristol; Western Plymouth; Eastern Plymouth; Southern Bristol; Southern Plymouth; Northwest Providence; Southeast Providence; Western Kent; Eastern Kent; Bristol; Washington; Newport,Winter Storm Watch,Severe,Observed,Past,2022-01-06T03:24:00-05:00,2022-01-07T13:00:00-05:00,['The Winter Storm Watch has been replaced. Please see the latest information from NWS Boston/Norton MA on this developing situation.']
