,State,Area,Event,Severity,Certainty,Urgency,Effective,Ends,Description
3,VA,Dorchester; Wicomico; Somerset; Inland Worcester; Maryland Beaches; Accomack; Northampton,Winter Storm Watch,Severe,Possible,Future,2022-01-27T07:01:00-05:00,2022-01-29T19:00:00-05:00,"['* WHAT...Heavy snow possible. Total snow accumulations of 6 to\n10 inches possible with locally higher amounts. Winds could\ngust as high as 45 mph.', '* WHERE...Portions of southeast Maryland and eastern and\nsoutheast Virginia.', '* WHEN...From Friday evening through Saturday evening.', '* IMPACTS...Travel could be very difficult. Gusty winds could\nbring down tree branches.']"
0,WA,Southwest Interior; Everett and Vicinity; Tacoma Area; East Puget Sound Lowlands; Bellevue and Vicinity; Seattle and Vicinity; Bremerton and Vicinity,Dense Fog Advisory,Moderate,Likely,Expected,2022-01-27T03:12:00-08:00,2022-01-27T12:00:00-08:00,"['* WHAT...For the Air Stagnation Advisory, poor air quality. For\nthe Dense Fog Advisory, visibility one quarter mile or less in\ndense fog.', '* WHERE...Tacoma Area, Bellevue and Vicinity, East Puget Sound\nLowlands, Southwest Interior, Everett and Vicinity, Bremerton\nand Vicinity and Seattle and Vicinity.', '* WHEN...For the Air Stagnation Advisory, until 11 AM PST\nFriday. For the Dense Fog Advisory, until noon PST today.', '* IMPACTS...Hazardous driving conditions due to low visibility.\nPoor air quality may cause issues for people with respiratory\nproblems.', '* ADDITIONAL DETAILS...Please delay outdoor burning until\nconditions improve.']"
1,WA,Olympics; West Slopes North Cascades and Passes; West Slopes North Central Cascades and Passes; West Slopes South Central Cascades and Passes,Air Stagnation Advisory,Moderate,Likely,Expected,2022-01-27T03:12:00-08:00,2022-01-28T11:00:00-08:00,"['* WHAT...Poor air quality below 1500 feet.', '* WHERE...Cascades of Pierce and Lewis Counties, Cascades of\nSnohomish and King Counties, Olympics and Cascades of Whatcom\nand Skagit Counties.', '* WHEN...Until 11 AM PST Friday.', '* IMPACTS...Poor air quality may cause issues for people with\nrespiratory problems.', '* ADDITIONAL DETAILS...Please delay outdoor burning until\nconditions improve.']"
2,WA,Southwest Interior; Everett and Vicinity; Tacoma Area; East Puget Sound Lowlands; Bellevue and Vicinity; Seattle and Vicinity; Bremerton and Vicinity,Air Stagnation Advisory,Moderate,Likely,Expected,2022-01-27T03:12:00-08:00,2022-01-28T11:00:00-08:00,"['* WHAT...For the Air Stagnation Advisory, poor air quality. For\nthe Dense Fog Advisory, visibility one quarter mile or less in\ndense fog.', '* WHERE...Tacoma Area, Bellevue and Vicinity, East Puget Sound\nLowlands, Southwest Interior, Everett and Vicinity, Bremerton\nand Vicinity and Seattle and Vicinity.', '* WHEN...For the Air Stagnation Advisory, until 11 AM PST\nFriday. For the Dense Fog Advisory, until noon PST today.', '* IMPACTS...Hazardous driving conditions due to low visibility.\nPoor air quality may cause issues for people with respiratory\nproblems.', '* ADDITIONAL DETAILS...Please delay outdoor burning until\nconditions improve.']"
3,WA,San Juan County; Western Whatcom County; Western Skagit County; Admiralty Inlet Area; Hood Canal Area; Lower Chehalis Valley Area; Eastern Strait of Juan de Fuca; Western Strait of Juan De Fuca,Air Stagnation Advisory,Moderate,Likely,Expected,2022-01-27T03:12:00-08:00,2022-01-28T11:00:00-08:00,"['* WHAT...Poor air quality.', '* WHERE...Western Strait of Juan De Fuca, San Juan County, Lower\nChehalis Valley Area, Western Whatcom County, Hood Canal Area,\nWestern Skagit County, Eastern Strait of Juan de Fuca and\nAdmiralty Inlet Area.', '* WHEN...Until 11 AM PST Friday.', '* IMPACTS...Poor air quality may cause issues for people with\nrespiratory problems.', '* ADDITIONAL DETAILS...Please delay outdoor burning until\nconditions improve.']"
4,WA,Coast Range of Northwest Oregon; Central Coast Range of Western Oregon; Lower Columbia; Greater Portland Metro Area; Central Willamette Valley; Northern Oregon Cascade Foothills; Cascade Foothills in Lane County; Upper Hood River Valley; Central Columbia River Gorge; Willapa Hills; Lower Columbia and I - 5 Corridor in Cowlitz County; Greater Vancouver Area; South Washington Cascade Foothills; Central Columbia River Gorge,Air Stagnation Advisory,Moderate,Likely,Expected,2022-01-27T02:50:00-08:00,2022-01-28T16:00:00-08:00,"['* WHAT...A period of stagnant air with light winds is expected\nbelow 1500 feet.', '* WHERE...Portions of southwest Washington and northwest Oregon.', '* WHEN...Until 4 PM PST Friday.', '* IMPACTS...Air stagnation could result in the development and\npersistence of poor air quality.']"
0,WY,Northeast Johnson County; Southeast Johnson County,Special Weather Statement,Moderate,Observed,Expected,2022-01-27T06:55:00-07:00,,"['This is a special weather statement from the National Weather\nService Office in Riverton.', '* WHAT...Snow showers and blowing snow.', '* WHERE...Johnson County.', '* WHEN...Through 10 am.', '* ADDITIONAL DETAILS...Motorists are urged to watch for rapid\nchanges in visibility as well as slick and snow covered roads.']"
1,WY,Wind River Mountains East; Lander Foothills; Green Mountains and Rattlesnake Range,Special Weather Statement,Moderate,Observed,Expected,2022-01-27T06:55:00-07:00,,"['This is a special weather statement from the National Weather\nService Office in Riverton.', '* WHAT...Snow showers. An additional inch or two of accumulation\nwhere snow bands set up.', '* WHERE...Lander Foothills and Green Mountains.', '* WHEN...Through 10 am.', '* ADDITIONAL DETAILS...Motorists are urged to watch for rapid\nchanges in visibility as well as slick and snow covered roads']"
2,WY,East Sweetwater County,Special Weather Statement,Moderate,Observed,Expected,2022-01-27T06:55:00-07:00,,"['This is a special weather statement from the National Weather\nService Office in Riverton.', '* WHAT...Snow showers. A coating to an inch of snow possible.', '* WHERE...Eastern Sweetwater County, including Interstate 80.', '* WHEN...Through 10 am.', '* ADDITIONAL DETAILS...Motorists are urged to watch for rapid\nchanges in visibility as well as slick and snow covered roads.']"
3,WY,Pryor/Northern Bighorn Mountains; Northeast Bighorn Mountains,Winter Weather Advisory,Moderate,Likely,Expected,2022-01-27T06:14:00-07:00,2022-01-27T12:00:00-07:00,"['* WHAT...Snow occurring. Additional snow accumulations up to two\ninches. Winds gusting as high as 30 mph.', '* WHERE...In Wyoming, Northeast Bighorn Mountains. In Montana,\nPryor/Northern Bighorn Mountains.', '* WHEN...Until Noon MST today.', '* IMPACTS...Travel on Highway 14 through Burgess Junction and in the\nStory area will be impacted by slick roads and poor visibility.']"
4,WY,Southern Rosebud; Southern Big Horn; Bighorn Canyon; Sheridan Foothills,Winter Weather Advisory,Moderate,Likely,Expected,2022-01-27T06:14:00-07:00,2022-01-27T12:00:00-07:00,"['* WHAT...Snow occurring. Additional snow accumulations up to one\ninch. Winds gusting as high as 30 mph.', '* WHERE...In Wyoming, Sheridan Foothills. In Montana, Bighorn\nCanyon, Southern Big Horn and Southern Rosebud.', '* WHEN...Until Noon MST today.', '* IMPACTS...Plan on slick and snow covered road conditions,\nincluding portions of I-90 and highway 212']"
5,WY,Northern Black Hills; Wyoming Black Hills,Winter Weather Advisory,Moderate,Likely,Expected,2022-01-27T01:47:00-07:00,2022-01-27T17:00:00-07:00,"['* WHAT...Snow. Snow accumulations of 2 to 5 inches.', '* WHERE...In Wyoming, the Wyoming Black Hills. In South Dakota,\nthe Northern Black Hills.', '* WHEN...Until 5 PM MST this afternoon.', '* IMPACTS...Plan on slippery road conditions.']"
