,State,Area,Event,Severity,Certainty,Urgency,Effective,Ends,Description
12,IL,"Clark, IL; Crawford, IL; Sullivan, IN; Vigo, IN",Flood Warning,Severe,Observed,Immediate,2021-12-29T21:34:00-06:00,2022-01-07T01:00:00-06:00,"['* WHAT...Minor flooding is occurring and minor flooding is forecast.', '* WHERE...Wabash River at Terre Haute.', '* WHEN...Until Friday, January 07.', '* IMPACTS...At 19.5 feet, Water begins to rise in the Izaak Walton\nLake.  Sheet flowing water begins in the wetland project between\nU.S. 40 and I-70, and during a prolonged flood event project fills\nabout 75 percent.', '* ADDITIONAL DETAILS...\n- At 8:30 PM CST Wednesday /9:30 PM EST Wednesday/ the stage\nwas 17.8 feet.\n- Recent Activity...The maximum river stage in the 24 hours\nending at 8:30 PM CST Wednesday /9:30 PM EST Wednesday/ was\n17.8 feet.\n- Forecast...The river is expected to rise to a crest of 19.7\nfeet early Sunday morning. It will then fall below flood\nstage Thursday, January 06.\n- Flood stage is 16.5 feet.\n- http://www.weather.gov/safety/flood']"
13,IL,"Clark, IL; Crawford, IL; Sullivan, IN; Vigo, IN",Flood Warning,Severe,Observed,Immediate,2021-12-28T21:06:00-05:00,2022-01-05T10:45:00-05:00,"['* WHAT...Minor flooding is forecast.', '* WHERE...Wabash River at Terre Haute.', '* WHEN...From Wednesday morning to Wednesday, January 05.', '* IMPACTS...At 19.5 feet, Water begins to rise in the Izaak Walton\nLake.  Sheet flowing water begins in the wetland project between\nU.S. 40 and I-70, and during a prolonged flood event project fills\nabout 75 percent.', '* ADDITIONAL DETAILS...\n- At 7:15 PM CST Tuesday /8:15 PM EST Tuesday/ the stage was\n13.8 feet.\n- Forecast...The river is expected to rise above flood stage\ntomorrow morning to a crest of 20.0 feet Saturday morning. It\nwill then fall below flood stage late Tuesday evening.\n- Flood stage is 16.5 feet.\n- http://www.weather.gov/safety/flood']"
14,IL,"Crawford, IL; Lawrence, IL; Knox, IN; Sullivan, IN",Flood Warning,Severe,Observed,Immediate,2021-12-28T21:06:00-05:00,2022-01-07T11:30:00-05:00,"['* WHAT...Minor flooding is forecast.', '* WHERE...Wabash River at Hutsonville Legacy Power Plant Site.', '* WHEN...From Wednesday morning to Friday, January 07.', '* IMPACTS...At 20.0 feet, Leaverton Park in Palestine and park in\nHutsonville begin to flood.  Agricultural flooding spreads to\nhigher land.  Seep water is noticeable behind levees.  Some\nelevated river cottages are surrounded by water.  Several county\nor township roads east of Lincoln Heritage Trail between Palestine\nand Hutsonville in Crawford County Illinois are impassable.', '* ADDITIONAL DETAILS...\n- There is no current observed data.\n- Forecast...The river is expected to rise above flood stage\ntomorrow morning to a crest of 19.3 feet early Monday\nafternoon. It will then fall below flood stage Thursday,\nJanuary 06.\n- Flood stage is 16.0 feet.\n- http://www.weather.gov/safety/flood']"
15,IL,"Crawford, IL; Lawrence, IL; Knox, IN; Sullivan, IN",Flood Warning,Severe,Observed,Immediate,2021-12-28T21:06:00-05:00,2022-01-07T12:00:00-05:00,"['* WHAT...Minor flooding is forecast.', '* WHERE...Wabash River at Riverton.', '* WHEN...From Wednesday afternoon to Friday, January 07.', '* IMPACTS...At 18.0 feet, Extensive lowland flooding is in\nprogress.  High water surrounds many river cabins.  Access to most\nriver cabins is by boat only.  Levees begin to protect farmland.\nExtensive flooding of Leaverton Park occurs in Palestine, Illinois.', '* ADDITIONAL DETAILS...\n- At 7:00 PM CST Tuesday /8:00 PM EST Tuesday/ the stage was\n11.6 feet.\n- Forecast...The river is expected to rise above flood stage\nearly tomorrow afternoon to a crest of 18.0 feet Monday\nevening. It will then fall below flood stage Thursday,\nJanuary 06.\n- Flood stage is 15.0 feet.\n- http://www.weather.gov/safety/flood']"
0,IN,"Jackson, IN; Lawrence, IN; Washington, IN",Flood Warning,Severe,Observed,Immediate,2021-12-30T11:18:00-05:00,2022-01-01T09:34:00-05:00,"['* WHAT...Minor flooding is forecast.', '* WHERE...East Fork White River at Seymour.', '* WHEN...Until late Saturday morning.', '* IMPACTS...At 13.5 feet, Lowland flood continues. Jackson County\nRoad 700 E begins to flood.', '* ADDITIONAL DETAILS...\n- At 9:45 AM EST Thursday the stage was 11.7 feet.\n- Forecast...The river will rise above flood stage late this\nmorning to 13.1 feet tomorrow morning. It will then fall\nbelow flood stage late tomorrow evening to 9.9 feet and begin\nrising again Sunday morning. It will rise to 10.1 feet Sunday\nevening. It will then fall again and remain below flood\nstage.\n- Flood stage is 12.0 feet.\n- http://www.weather.gov/safety/flood']"
1,IN,"Greene, IN; Monroe, IN; Owen, IN",Flood Warning,Severe,Observed,Immediate,2021-12-30T11:18:00-05:00,2022-01-01T16:00:00-05:00,"['* WHAT...Minor flooding is forecast.', '* WHERE...White River at Spencer.', '* WHEN...From late tonight to Saturday afternoon.', '* IMPACTS...At 14.0 feet, Lowland flooding begins in the Spencer and\nGosport areas.  The river begins to backup Rattlesnake, Fall,\nMcCormicks, Limestone, Big, and Bean Blossom Creeks.  Spencer\nPublic Access site begins to flood.', '* ADDITIONAL DETAILS...\n- At 10:30 AM EST Thursday the stage was 13.9 feet.\n- Forecast...The river is expected to rise above flood stage\njust after midnight tonight to a crest of 14.3 feet early\ntomorrow afternoon. It will then fall below flood stage early\nSaturday morning.\n- Flood stage is 14.0 feet.\n- http://www.weather.gov/safety/flood']"
2,IN,"Daviess, IN; Greene, IN; Knox, IN",Flood Warning,Severe,Observed,Immediate,2021-12-30T11:18:00-05:00,2022-01-02T21:00:00-05:00,"['* WHAT...Minor flooding is forecast.', '* WHERE...White River at Newberry.', '* WHEN...Until late Sunday evening.', '* IMPACTS...At 13.5 feet, High water may affect CR 550 S in the Mary\nLong Cutoff area.', '* ADDITIONAL DETAILS...\n- At 10:30 AM EST Thursday the stage was 12.4 feet.\n- Forecast...The river is expected to rise above flood stage\nlate this afternoon to a crest of 14.0 feet early tomorrow\nafternoon. It will then fall below flood stage late Sunday\nmorning.\n- Flood stage is 13.0 feet.\n- http://www.weather.gov/safety/flood']"
3,IN,"Daviess, IN; Greene, IN; Knox, IN",Flood Warning,Severe,Observed,Immediate,2021-12-30T11:18:00-05:00,2022-01-03T19:00:00-05:00,"['* WHAT...Minor flooding is occurring and minor flooding is forecast.', '* WHERE...White River at Elliston.', '* WHEN...Until Monday evening.', '* IMPACTS...At 20.0 feet, River Road north of CR 150 W in Greene\nCounty is flooded.  Low agricultural fields flood.', '* ADDITIONAL DETAILS...\n- At 8:00 AM EST Thursday the stage was 19.1 feet.\n- Recent Activity...The maximum river stage in the 24 hours\nending at 8:00 AM EST Thursday was 19.1 feet.\n- Forecast...The river is expected to rise to a crest of 20.3\nfeet just after midnight tonight. It will then fall below\nflood stage Monday morning.\n- Flood stage is 18.0 feet.\n- http://www.weather.gov/safety/flood']"
4,IN,"Parke, IN; Vermillion, IN; Vigo, IN",Flood Warning,Severe,Observed,Immediate,2021-12-30T11:18:00-05:00,2022-01-04T17:00:00-05:00,"['* WHAT...Minor flooding is forecast.', '* WHERE...Wabash River at Clinton.', '* WHEN...Until Tuesday afternoon.', '* IMPACTS...At 18.0 feet, River road near Mecca and lowest areas of\nriver park at Clinton begin to flood.', '* ADDITIONAL DETAILS...\n- There is no current observed data.\n- Forecast...The river is expected to rise to a crest of 18.8\nfeet Sunday morning. It will then fall below flood stage\nearly Tuesday morning.\n- Flood stage is 18.0 feet.\n- http://www.weather.gov/safety/flood']"
5,IN,"Daviess, IN; Gibson, IN; Knox, IN; Pike, IN",Flood Warning,Severe,Observed,Immediate,2021-12-30T11:18:00-05:00,2022-01-05T07:00:00-05:00,"['* WHAT...Minor flooding is occurring and minor flooding is forecast.', '* WHERE...White River at Edwardsport.', '* WHEN...Until Wednesday morning.', '* IMPACTS...At 18.0 feet, Old Vincennes Road and State Road 358 in\nDaviess County and Schaefer Road in Knox County are impassable.\nHigh water affects agricultural bottomlands.  During agricultural\nseason this level is of concern to farmers on the unprotected\nareas along the river.  High water affects river cabins.', '* ADDITIONAL DETAILS...\n- At 7:00 AM EST Thursday /6:00 AM CST Thursday/ the stage was\n15.6 feet.\n- Recent Activity...The maximum river stage in the 24 hours\nending at 7:00 AM EST Thursday /6:00 AM CST Thursday/ was\n15.6 feet.\n- Forecast...The river is expected to rise to a crest of 18.1\nfeet Saturday morning. It will then fall below flood stage\nTuesday evening.\n- Flood stage is 15.0 feet.\n- http://www.weather.gov/safety/flood']"
6,IN,"Fountain, IN; Parke, IN; Vermillion, IN; Warren, IN",Flood Warning,Severe,Observed,Immediate,2021-12-30T11:18:00-05:00,2022-01-06T03:24:00-05:00,"['* WHAT...Minor flooding is occurring and minor flooding is forecast.', '* WHERE...Wabash River at Covington.', '* WHEN...Until early Thursday morning.', '* IMPACTS...At 20.0 feet, A few county roads begin to flood.  Higher\nbottomlands begin to flood.  The first cottage upstream from U.S.\n136 bridge may become isolated by high water.', '* ADDITIONAL DETAILS...\n- At 10:45 AM EST Thursday the stage was 18.8 feet.\n- Recent Activity...The maximum river stage in the 24 hours\nending at 10:45 AM EST Thursday was 18.8 feet.\n- Forecast...The river is expected to rise to a crest of 19.9\nfeet early Saturday morning. It will then fall below flood\nstage Wednesday afternoon.\n- Flood stage is 16.0 feet.\n- http://www.weather.gov/safety/flood']"
7,IN,"Daviess, IN; Gibson, IN; Knox, IN; Pike, IN",Flood Warning,Severe,Observed,Immediate,2021-12-30T11:18:00-05:00,2022-01-06T16:00:00-05:00,"['* WHAT...Minor flooding is forecast.', '* WHERE...White River at Petersburg.', '* WHEN...Until Thursday afternoon.', '* IMPACTS...At 19.0 feet, Low bottomlands flood and flooding begins\non higher bottomlands.  State Road 257 may begin to flood if\nShoals gage reading is over 17 feet.  Private levees may be\novertopped in many cases.', '* ADDITIONAL DETAILS...\n- At 10:30 AM EST Thursday /9:30 AM CST Thursday/ the stage was\n13.1 feet.\n- Forecast...The river is expected to rise above flood stage\nearly tomorrow afternoon to a crest of 19.3 feet Monday\nevening. It will then fall below flood stage early Thursday\nmorning.\n- Flood stage is 16.0 feet.\n- http://www.weather.gov/safety/flood']"
8,IN,"Gibson, IN; Knox, IN",Flood Warning,Severe,Observed,Immediate,2021-12-30T11:18:00-05:00,2022-01-06T23:30:00-05:00,"['* WHAT...Minor flooding is forecast.', '* WHERE...White River at Hazleton.', '* WHEN...From Saturday morning to late Thursday evening.', '* IMPACTS...At 19.0 feet, Flood waters cover the Hazleton softball\nfield. Pottsville Road is underwater and impassable.', '* ADDITIONAL DETAILS...\n- There is no current observed data.\n- Forecast...The river is expected to rise above flood stage\nSaturday morning to a crest of 19.0 feet Tuesday morning. It\nwill then fall below flood stage late Thursday morning.\n- Flood stage is 16.0 feet.\n- http://www.weather.gov/safety/flood']"
9,IN,"Parke, IN; Vermillion, IN; Vigo, IN",Flood Warning,Severe,Observed,Immediate,2021-12-30T11:18:00-05:00,2022-01-07T01:00:00-05:00,"['* WHAT...Minor flooding is occurring and minor flooding is forecast.', '* WHERE...Wabash River at Montezuma.', '* WHEN...Until Friday, January 07.', '* IMPACTS...At 18.0 feet, Montezuma agricultural levee is\novertopped.  Fourteen hundred acres of low bottomlands flood.', '* ADDITIONAL DETAILS...\n- At 10:45 AM EST Thursday the stage was 18.0 feet.\n- Recent Activity...The maximum river stage in the 24 hours\nending at 10:45 AM EST Thursday was 18.0 feet.\n- Forecast...The river is expected to rise to a crest of 18.8\nfeet Sunday morning. It will then fall below flood stage\nearly Thursday afternoon.\n- Flood stage is 14.0 feet.\n- http://www.weather.gov/safety/flood']"
10,IN,"Clark, IL; Crawford, IL; Sullivan, IN; Vigo, IN",Flood Warning,Severe,Observed,Immediate,2021-12-30T11:18:00-05:00,2022-01-07T12:00:00-05:00,"['* WHAT...Minor flooding is occurring and minor flooding is forecast.', '* WHERE...Wabash River at Terre Haute.', '* WHEN...Until Friday, January 07.', '* IMPACTS...At 19.5 feet, Water begins to rise in the Izaak Walton\nLake.  Sheet flowing water begins in the wetland project between\nU.S. 40 and I-70, and during a prolonged flood event project fills\nabout 75 percent.', '* ADDITIONAL DETAILS...\n- At 9:30 AM CST Thursday /10:30 AM EST Thursday/ the stage was\n18.2 feet.\n- Recent Activity...The maximum river stage in the 24 hours\nending at 9:30 AM CST Thursday /10:30 AM EST Thursday/ was\n18.2 feet.\n- Forecast...The river is expected to rise to a crest of 19.3\nfeet early Sunday afternoon. It will then fall below flood\nstage late Thursday evening.\n- Flood stage is 16.5 feet.\n- http://www.weather.gov/safety/flood']"
11,IN,"Crawford, IL; Lawrence, IL; Knox, IN; Sullivan, IN",Flood Warning,Severe,Observed,Immediate,2021-12-30T11:18:00-05:00,2022-01-09T04:26:00-05:00,"['* WHAT...Minor flooding is forecast.', '* WHERE...Wabash River at Hutsonville Legacy Power Plant Site.', '* WHEN...Until Sunday, January 09.', '* IMPACTS...At 20.0 feet, Leaverton Park in Palestine and park in\nHutsonville begin to flood.  Agricultural flooding spreads to\nhigher land.  Seep water is noticeable behind levees.  Some\nelevated river cottages are surrounded by water.  Several county\nor township roads east of Lincoln Heritage Trail between Palestine\nand Hutsonville in Crawford County Illinois are impassable.', '* ADDITIONAL DETAILS...\n- There is no current observed data.\n- Forecast...The river is expected to rise to a crest of 19.2\nfeet Tuesday evening. It will then fall below flood stage\nSaturday, January 08.\n- Flood stage is 16.0 feet.\n- http://www.weather.gov/safety/flood']"
12,IN,"Crawford, IL; Lawrence, IL; Knox, IN; Sullivan, IN",Flood Warning,Severe,Observed,Immediate,2021-12-30T11:18:00-05:00,2022-01-09T07:00:00-05:00,"['* WHAT...Minor flooding is occurring and minor flooding is forecast.', '* WHERE...Wabash River at Riverton.', '* WHEN...Until Sunday, January 09.', '* IMPACTS...At 18.0 feet, Extensive lowland flooding is in\nprogress.  High water surrounds many river cabins.  Access to most\nriver cabins is by boat only.  Levees begin to protect farmland.\nExtensive flooding of Leaverton Park occurs in Palestine, Illinois.', '* ADDITIONAL DETAILS...\n- At 10:00 AM CST Thursday /11:00 AM EST Thursday/ the stage\nwas 16.2 feet.\n- Recent Activity...The maximum river stage in the 24 hours\nending at 10:00 AM CST Thursday /11:00 AM EST Thursday/ was\n16.2 feet.\n- Forecast...The river is expected to rise to a crest of 17.9\nfeet Wednesday morning. It will then fall below flood stage\nSaturday, January 08.\n- Flood stage is 15.0 feet.\n- http://www.weather.gov/safety/flood']"
13,IN,"Fountain, IN; Parke, IN; Tippecanoe, IN; Vermillion, IN; Warren, IN",Flood Warning,Severe,Observed,Immediate,2021-12-30T11:18:00-05:00,,"['* WHAT...Minor flooding is occurring and minor flooding is forecast.', '* WHERE...Wabash River at Lafayette.', '* WHEN...Until further notice.', '* IMPACTS...At 16.0 feet, Lowland flooding is in progress.  Flood\nwaters near SR 225 between Old SR 25 and Battleground.  Warren CR\n350 N near Black Rock Preserve and Tippecanoe CR 950 W in the\nWabash Bottoms, Janssen Tract area may be impassable.  Fort\nOuiatenon grounds begin to flood.  Flooding at the Grandville\nPublic Access site.', '* ADDITIONAL DETAILS...\n- At 10:30 AM EST Thursday the stage was 16.1 feet.\n- Recent Activity...The maximum river stage in the 24 hours\nending at 10:30 AM EST Thursday was 16.1 feet.\n- Forecast...The river is expected to rise to a crest of 16.1\nfeet this afternoon.\n- Flood stage is 11.0 feet.\n- http://www.weather.gov/safety/flood']"
14,IN,"Adams, IN; Wells, IN",Flood Warning,Severe,Observed,Immediate,2021-12-30T11:04:00-05:00,2022-01-02T07:00:00-05:00,"['* WHAT...Minor flooding is occurring and minor flooding is forecast.', '* WHERE...Wabash River near Linn Grove.', '* WHEN...Until Sunday morning.', '* IMPACTS...At 14.0 feet, Secondary roads are blocked. Roads near\nthe east side of Geneva begin to flood. Some evacuations may be\nrequired and property needs to be transferred to higher ground.', '* ADDITIONAL DETAILS...\n- At 9:45 AM EST Thursday the stage was 12.4 feet.\n- Recent Activity...The maximum river stage in the 24 hours\nending at 9:45 AM EST Thursday was 12.4 feet.\n- Forecast...The river is expected to rise to a crest of 12.6\nfeet this evening. It will then fall below flood stage\nSaturday morning.\n- Flood stage is 11.0 feet.\n- Flood History...This crest compares to a previous crest of\n14.4 feet on 06/19/2015.\n- http://www.weather.gov/safety/flood']"
15,IN,"Alexander, IL; Edwards, IL; Franklin, IL; Gallatin, IL; Hamilton, IL; Hardin, IL; Jackson, IL; Jefferson, IL; Johnson, IL; Massac, IL; Perry, IL; Pope, IL; Pulaski, IL; Saline, IL; Union, IL; Wabash, IL; Wayne, IL; White, IL; Williamson, IL; Gibson, IN; Pike, IN; Posey, IN; Spencer, IN; Vanderburgh, IN; Warrick, IN; Ballard, KY; Caldwell, KY; Calloway, KY; Carlisle, KY; Christian, KY; Crittenden, KY; Daviess, KY; Fulton, KY; Graves, KY; Henderson, KY; Hickman, KY; Hopkins, KY; Livingston, KY; Lyon, KY; McCracken, KY; McLean, KY; Marshall, KY; Muhlenberg, KY; Todd, KY; Trigg, KY; Union, KY; Webster, KY; Bollinger, MO; Butler, MO; Cape Girardeau, MO; Carter, MO; Mississippi, MO; New Madrid, MO; Perry, MO; Ripley, MO; Scott, MO; Stoddard, MO; Wayne, MO",Hydrologic Outlook,Unknown,Possible,Future,2021-12-30T03:45:00-06:00,,"['Rain and isolated thunderstorms will overspread southeast Missouri,\nsouthern Illinois, western Kentucky, and southwest Indiana on Friday\nnight and continue into Saturday.', 'Forecast rainfall amounts have trended upward and are now expected\nto range from 1.5 to 3.5 inches. A swath of even higher amounts is\npossible most likely near or south of the Ohio River.', 'Rainfall has been slightly above normal in most areas this month.\nSoil moisture is typically quite high in the winter months due to\nlower evaporation rates, colder temperatures, and dormant vegetation\nthat does not sap moisture from the ground.', 'Confidence is increasing that widespread heavy rainfall will cause\nsome flooding of roads, streams, and flood-prone areas. In cities in\nwestern Kentucky that were affected by the December 10 tornadoes,\ndebris could block drainage. In addition, leaves could clog drainage\nsystems across the region.', 'The widespread heavy rains expected could also lead to significant\nrises on area rivers.', 'Stay tuned to later forecasts and outlooks regarding this situation.']"
16,IN,Orange; Washington; Scott; Jefferson; Dubois; Crawford; Perry; Harrison; Floyd; Clark; Hancock; Breckinridge; Meade; Ohio; Grayson; Hardin; Bullitt; Jefferson; Oldham; Trimble; Henry; Shelby; Franklin; Scott; Harrison; Spencer; Anderson; Woodford; Fayette; Bourbon; Nicholas; Nelson; Washington; Mercer; Jessamine; Clark; Larue; Marion; Boyle; Garrard; Madison; Butler; Edmonson; Hart; Green; Taylor; Casey; Lincoln; Logan; Warren; Simpson; Allen; Barren; Monroe; Metcalfe; Adair; Russell; Cumberland; Clinton,Hydrologic Outlook,Unknown,Possible,Future,2021-12-30T03:31:00-05:00,,"['Widespread moderate to heavy rain showers and perhaps a few\nthunderstorms will overspread the Ohio River Valley later Friday\nnight through Saturday along a stalled frontal boundary. Most\nlocations can expect to receive 1 to 3 inches of rainfall during\nthat time, however a narrower swath of 3 to 4 inches of rain is\npossible. The current forecast would place the heaviest rainfall\nsouth of the Ohio River across central Kentucky, although that axis\ncan still change in the next 48 hours. Stay up to date of the latest\nforecasts.', 'Rainfall totals toward the higher end of the 2 to 4"" range would\nlikely cause some flooding concerns, especially in low lying areas\nand typical flood prone locations. Nighttime flooding will be\nparticularly dangerous, especially with the holiday weekend also\ngoing on. Flood safety messaging would be recommended ahead of the\nexpected rainfall event. As confidence increases, a Flood or Flash\nFlood Watch may be needed.', 'Overall, the month of December has seen rainfall totals near or just\nabove average. However, rainfall between .5"" and 1.25"" in the last\n48 hours has left soils a bit more saturated. There will be around\n36 hours until the heaviest rainfall starts, so there is a bit of\ntime for the region to dry back out a little bit.', 'With the current forecast of the heaviest rainfall falling across\ncentral Kentucky, the river basins most likely to be impacted would\nbe the Green, Salt, Kentucky, and Licking river basins. Runoff would\nthen eventually find its way into the Ohio River later next week\ncausing rises as well. Current ensemble river forecasts do show some\npotential for minor flooding to be reached in the basins mentioned\nabove, but confidence will remain low until the axis of expected\nheavier rain is pinpointed. Stay up to date through the weekend.']"
17,IN,"Jackson, IN; Lawrence, IN; Washington, IN",Flood Warning,Severe,Observed,Immediate,2021-12-29T21:34:00-06:00,2022-01-02T06:00:00-06:00,"['* WHAT...Minor flooding is forecast.', '* WHERE...East Fork White River at Seymour.', '* WHEN...From Thursday morning to Sunday morning.', '* IMPACTS...At 14.0 feet, Pasture lands...agricultural lands and\nseveral County and State Roads begin to flood.  High water\nisolates a few river cabins.  State Road 235 east of Medora and\ncounty roads near Shields and Vallonia flood.  Roads that begin to\nflood include 258 east of Cortland...County Road 725 N just north\nof the gaging site and Ewing Road near Brownstown.', '* ADDITIONAL DETAILS...\n- At 8:45 PM EST Wednesday the stage was 10.2 feet.\n- Forecast...The river is expected to rise above flood stage\nlate tomorrow morning to a crest of 14.0 feet early Friday\nafternoon. It will then fall below flood stage Saturday\nevening.\n- Flood stage is 12.0 feet.\n- http://www.weather.gov/safety/flood']"
18,IN,"Daviess, IN; Greene, IN; Knox, IN",Flood Warning,Severe,Observed,Immediate,2021-12-29T21:34:00-06:00,2022-01-02T20:34:00-06:00,"['* WHAT...Minor flooding is forecast.', '* WHERE...White River at Newberry.', '* WHEN...From Thursday morning to late Sunday evening.', '* IMPACTS...At 15.0 feet, Most lowlands flood.  A few inches of\nwater on County Road 600 W just north of the river in Mary Long\nCutoff Area.', '* ADDITIONAL DETAILS...\n- At 9:30 PM EST Wednesday the stage was 11.8 feet.\n- Forecast...The river is expected to rise above flood stage\ntomorrow morning to a crest of 14.7 feet Friday morning. It\nwill then fall below flood stage late Sunday morning.\n- Flood stage is 13.0 feet.\n- http://www.weather.gov/safety/flood']"
19,IN,"Daviess, IN; Greene, IN; Knox, IN",Flood Warning,Severe,Observed,Immediate,2021-12-29T21:34:00-06:00,2022-01-03T08:15:00-06:00,"['* WHAT...Minor flooding is forecast.', '* WHERE...White River at Elliston.', '* WHEN...Until late Monday morning.', '* IMPACTS...At 21.0 feet, Eastern portion of CR 100 S in Greene\nCounty floods leading to Plummer. Flooding covers all low\nbottomlands.', '* ADDITIONAL DETAILS...\n- At 8:00 AM EST Wednesday the stage was 17.5 feet.\n- Forecast...The river is expected to rise to a crest of 21.2\nfeet Friday morning. It will then fall below flood stage late\nSunday evening.\n- Flood stage is 18.0 feet.\n- http://www.weather.gov/safety/flood']"
20,IN,"Parke, IN; Vermillion, IN; Vigo, IN",Flood Warning,Severe,Observed,Immediate,2021-12-29T21:34:00-06:00,2022-01-04T04:00:00-06:00,"['* WHAT...Minor flooding is forecast.', '* WHERE...Wabash River at Clinton.', '* WHEN...Until early Tuesday morning.', '* IMPACTS...At 20.0 feet, Low bottomlands flood.  Water begins to\nback up local tributaries.  River road near Mecca is impassable.\nHigher county roads and bottomlands begin to flood.', '* ADDITIONAL DETAILS...\n- There is no current observed data.\n- Forecast...The river is expected to rise to a crest of 19.1\nfeet Saturday morning. It will then fall below flood stage\nMonday afternoon.\n- Flood stage is 18.0 feet.\n- http://www.weather.gov/safety/flood']"
21,IN,"Daviess, IN; Gibson, IN; Knox, IN; Pike, IN",Flood Warning,Severe,Observed,Immediate,2021-12-29T21:34:00-06:00,2022-01-04T15:45:00-06:00,"['* WHAT...Minor flooding is forecast.', '* WHERE...White River at Edwardsport.', '* WHEN...Until Tuesday afternoon.', '* IMPACTS...At 18.6 feet, During June 2010 and March 2011 high\nwater...INDOT closed SR 358 between SR 67 at Edwardsport to SR 57\nat Plainville.  SR 358 floods on the east side of the river\nbetween the levees.', '* ADDITIONAL DETAILS...\n- At 7:00 PM EST Wednesday /6:00 PM CST Wednesday/ the stage\nwas 14.8 feet.\n- Forecast...The river is expected to rise to a crest of 18.5\nfeet Saturday morning. It will then fall below flood stage\nearly Tuesday morning.\n- Flood stage is 15.0 feet.\n- http://www.weather.gov/safety/flood']"
