,State,Area,Event,Severity,Certainty,Urgency,Effective,Ends,Description
0,AL,"Dallas, AL; Monroe, AL; Wilcox, AL",Flood Warning,Severe,Observed,Immediate,2022-04-06T09:37:00-05:00,2022-04-10T07:24:00-05:00,"['* WHAT...Minor flooding is forecast.', '* WHERE...Alabama River Near Millers Ferry Dam.', '* WHEN...From Thursday morning to Sunday morning.', '* IMPACTS...At 68.0 feet, Millers Ferry Park begins to flood.', '* ADDITIONAL DETAILS...\n- At 9:15 AM CDT Wednesday the stage was 57.4 feet.\n- Forecast...The river is expected to rise above flood stage\ntomorrow morning to a crest of 68.7 feet early Friday\nafternoon. It will then fall below flood stage early Sunday\nmorning.\n- Flood stage is 66.0 feet.\n- http://www.weather.gov/safety/flood']"
1,AL,"Clarke, AL; Monroe, AL; Wilcox, AL",Flood Warning,Severe,Observed,Immediate,2022-04-06T09:36:00-05:00,,"['* WHAT...Minor flooding is forecast.', '* WHERE...Alabama River Near Claiborne Dam.', '* WHEN...From Friday afternoon until further notice.', '* IMPACTS...At 43.0 feet, Access to Eureka Landing community stops,\nwith access cut off.', '* ADDITIONAL DETAILS...\n- At 8:00 AM CDT Wednesday the stage was 34.6 feet.\n- Forecast...The river is expected to rise above flood stage\nearly Friday afternoon and continue rising to a crest of 45.5\nfeet early Sunday afternoon.\n- Flood stage is 42.0 feet.\n- http://www.weather.gov/safety/flood']"
2,AL,"Escambia, AL; Escambia, FL",Flood Warning,Severe,Observed,Immediate,2022-04-06T09:35:00-05:00,2022-04-09T01:00:00-05:00,"['* WHAT...Minor flooding is forecast.', '* WHERE...Escambia River Near Century.', '* WHEN...From Thursday evening to early Saturday morning.', '* IMPACTS...At 17.0 feet, considerable flooding of lowlands occurs.', '* ADDITIONAL DETAILS...\n- At 9:05 AM CDT Wednesday the stage was 14.5 feet.\n- Forecast...The river is expected to rise above flood stage\ntomorrow evening to a crest of 17.1 feet early Friday\nmorning. It will then fall below flood stage Friday evening.\n- Flood stage is 17.0 feet.\n- http://www.weather.gov/safety/flood']"
3,AL,"Clarke, AL; Washington, AL",Flood Warning,Severe,Observed,Immediate,2022-04-06T09:32:00-05:00,,"['* WHAT...Minor flooding is forecast.', '* WHERE...Tombigbee River Near Leroy.', '* WHEN...Until further notice.', '* IMPACTS...At 24.0 feet, flooding of low lying farm and\npasturelands begins. Cattle in low lying areas should be moved to\nhigher ground.', '* ADDITIONAL DETAILS...\n- At 9:00 AM CDT Wednesday the stage was 23.6 feet.\n- Forecast...The river is expected to rise above flood stage\nlate this afternoon and continue rising to a crest of 26.8\nfeet early Saturday afternoon.\n- Flood stage is 24.0 feet.\n- http://www.weather.gov/safety/flood']"
4,AL,"Choctaw, AL; Clarke, AL; Washington, AL",Flood Warning,Severe,Observed,Immediate,2022-04-06T09:31:00-05:00,,"['* WHAT...Minor flooding is forecast.', '* WHERE...Tombigbee River Near Coffeeville Dam.', '* WHEN...Until further notice.', '* IMPACTS...At 29.0 feet, pastureland becomes flooded. Livestock\nshould be moved to higher ground. Old Ferry Road near the river\nbegins to flood.', '* ADDITIONAL DETAILS...\n- At 8:00 AM CDT Wednesday the stage was 28.6 feet.\n- Forecast...The river is expected to rise above flood stage\nlate this afternoon and continue rising to a crest of 33.7\nfeet early Saturday morning.\n- Flood stage is 29.0 feet.\n- http://www.weather.gov/safety/flood']"
5,AL,Mobile Coastal; Baldwin Coastal; Escambia Coastal; Santa Rosa Coastal; Okaloosa Coastal,Rip Current Statement,Moderate,Likely,Expected,2022-04-06T07:18:00-05:00,2022-04-07T18:00:00-05:00,"['* WHAT...Dangerous rip currents.', '* WHERE...In Alabama, Baldwin Coastal and Mobile Coastal\nCounties. In Florida, Santa Rosa Coastal, Okaloosa Coastal and\nEscambia Coastal Counties.', '* WHEN...Through Thursday afternoon.', '* IMPACTS...Rip currents can sweep even the best swimmers away\nfrom shore into deeper water.']"
6,AL,"Autauga, AL; Dallas, AL; Elmore, AL; Lowndes, AL; Montgomery, AL",Flood Warning,Severe,Likely,Expected,2022-04-05T21:44:00-05:00,2022-04-08T13:00:00-05:00,"['* WHAT...Minor flooding is forecast.', '* WHERE...Alabama River At Montgomery.', '* WHEN...From Wednesday afternoon to early Friday afternoon.', '* IMPACTS...At 35.0 feet, Extensive flooding of low lands in the\narea occurs.', '* ADDITIONAL DETAILS...\n- At 8:00 PM CDT Tuesday the stage was 27.6 feet.\n- Forecast...The river is expected to rise above flood stage\nearly tomorrow afternoon to a crest of 36.5 feet early\nThursday morning. It will then fall below flood stage early\nFriday morning.\n- Flood stage is 35.0 feet.']"
7,AL,"Greene, AL; Hale, AL; Marengo, AL",Flood Warning,Severe,Observed,Immediate,2022-04-05T21:40:00-05:00,2022-04-09T17:00:00-05:00,"['* WHAT...Minor flooding is forecast.', '* WHERE...Black Warrior River At Selden Lock and Dam.', '* WHEN...From Wednesday evening to Saturday afternoon.', '* ADDITIONAL DETAILS...\n- At 9:15 PM CDT Tuesday the stage was 83.7 feet.\n- Forecast...The river is expected to rise above flood stage\nlate tomorrow evening to a crest of 91.8 feet Thursday\nevening. It will then fall below flood stage early Saturday\nmorning.\n- Flood stage is 90.0 feet.']"
8,AL,"Elmore, AL; Montgomery, AL",Flood Warning,Severe,Observed,Immediate,2022-04-05T21:38:00-05:00,2022-04-08T19:25:00-05:00,"['* WHAT...Minor flooding is forecast.', '* WHERE...Tallapoosa River At The Tallapoosa Water Plant.', '* WHEN...From Wednesday morning to Friday evening.', '* ADDITIONAL DETAILS...\n- At 8:15 PM CDT Tuesday the stage was 14.0 feet.\n- Forecast...The river is expected to rise above flood stage\nlate tomorrow morning to a crest of 28.6 feet tomorrow\nevening. It will then fall below flood stage Friday morning.\n- Flood stage is 25.0 feet.']"
9,AL,"Chambers, AL; Randolph, AL; Tallapoosa, AL",Flood Warning,Severe,Likely,Expected,2022-04-05T21:33:00-05:00,2022-04-06T22:52:00-05:00,"['* WHAT...Minor flooding is occurring and minor flooding is forecast.', '* WHERE...Tallapoosa River At Wadley.', '* WHEN...From this evening to late tomorrow evening.', '* IMPACTS...At 13.0 feet, Flooding of pasture lands in the area\noccurs and cattle and farm equipment should be moved to higher\nground if higher stages are forecast.', '* ADDITIONAL DETAILS...\n- At 9:00 PM CDT Tuesday the stage was 13.6 feet.\n- Recent Activity...The maximum river stage in the 24 hours\nending at 9:00 PM CDT Tuesday was 13.6 feet.\n- Forecast...The river is expected to rise to a crest of 14.5\nfeet just after midnight tonight. It will then fall below\nflood stage late tomorrow morning.\n- Flood stage is 13.0 feet.']"
10,AL,"Montgomery, AL",Flood Warning,Severe,Likely,Expected,2022-04-05T14:21:00-05:00,2022-04-07T15:00:00-05:00,"['* WHAT...Minor flooding is forecast.', '* WHERE...Catoma Creek Near The U.S. 331 Highway Bridge.', '* WHEN...From Wednesday morning to Thursday afternoon.', '* IMPACTS...At 20.0 feet, Flooding of agricultural lands in the\nvicinity of the U.S. 331 Highway Bridge occurs.', '* ADDITIONAL DETAILS...\n- At 1:00 PM CDT Tuesday the stage was 12.3 feet.\n- Forecast...The river is expected to rise above flood stage\ntomorrow morning to a crest of 20.3 feet tomorrow evening. It\nwill then fall below flood stage early Thursday morning.\n- Flood stage is 20.0 feet.']"
11,AL,Mobile Coastal; Baldwin Coastal; Escambia Coastal; Santa Rosa Coastal; Okaloosa Coastal,Rip Current Statement,Moderate,Likely,Expected,2022-04-05T12:39:00-05:00,2022-04-07T18:00:00-05:00,"['* WHAT...For the High Surf Advisory, large breaking waves of 4\nto 6 feet in the surf zone. For the High Rip Current Risk,\ndangerous rip currents.', '* WHERE...In Alabama, Baldwin Coastal and Mobile Coastal\nCounties. In Florida, Santa Rosa Coastal, Okaloosa Coastal and\nEscambia Coastal Counties.', '* WHEN...For the High Surf Advisory, until midnight CDT tonight.\nFor the High Rip Current Risk, through Thursday afternoon.', '* IMPACTS...Dangerous swimming and surfing conditions and\nlocalized beach erosion. Rip currents can sweep even the best\nswimmers away from shore into deeper water.']"
12,AL,Mobile Coastal; Baldwin Coastal; Escambia Coastal; Santa Rosa Coastal; Okaloosa Coastal,Rip Current Statement,Moderate,Likely,Expected,2022-04-05T04:22:00-05:00,2022-04-07T18:00:00-05:00,"['* WHAT...For the High Surf Advisory, large breaking waves of 4\nto 6 feet expected in the surf zone. For the High Rip Current\nRisk, dangerous rip currents.', '* WHERE...In Alabama, Mobile Coastal and Baldwin Coastal\nCounties. In Florida, Escambia Coastal, Santa Rosa Coastal and\nOkaloosa Coastal Counties.', '* WHEN...For the High Surf Advisory, from noon today to midnight\nCDT tonight. For the High Rip Current Risk, through Thursday\nafternoon.', '* IMPACTS...Dangerous swimming and surfing conditions and\nlocalized beach erosion. Rip currents can sweep even the best\nswimmers away from shore into deeper water.']"
13,AL,Mobile Coastal; Baldwin Coastal; Escambia Coastal; Santa Rosa Coastal; Okaloosa Coastal,Rip Current Statement,Moderate,Likely,Expected,2022-04-04T12:59:00-05:00,2022-04-07T18:00:00-05:00,"['* WHAT...Dangerous rip currents expected.', '* WHERE...In Alabama, Baldwin Coastal and Mobile Coastal\nCounties. In Florida, Santa Rosa Coastal, Okaloosa Coastal and\nEscambia Coastal Counties.', '* WHEN...From 7 PM CDT this evening through Thursday afternoon.', '* IMPACTS...Rip currents can sweep even the best swimmers away\nfrom shore into deeper water.']"
14,AL,Mobile Coastal; Baldwin Coastal; Escambia Coastal; Santa Rosa Coastal; Okaloosa Coastal,Rip Current Statement,Moderate,Likely,Expected,2022-04-04T04:23:00-05:00,2022-04-07T18:00:00-05:00,"['* WHAT...Dangerous rip currents expected.', '* WHERE...In Alabama, Mobile Coastal and Baldwin Coastal\nCounties. In Florida, Escambia Coastal, Santa Rosa Coastal and\nOkaloosa Coastal Counties.', '* WHEN...From this evening through Thursday afternoon.', '* IMPACTS...Rip currents can sweep even the best swimmers away\nfrom shore into deeper water.']"
0,AK,Dixon Entrance to Cape Decision Coastal Area; Southern Inner Channels,High Wind Warning,Severe,Likely,Expected,2022-04-06T04:59:00-08:00,2022-04-06T23:00:00-08:00,"['* WHAT...Southeast winds 30 to 40 mph with gusts up to 65 mph\nexpected.', '* WHERE...The Southeast Gulf Coast and portions of the southern\nInner Channels including Hydaburg, Craig, Metlakatla,\nKetchikan, Kasaan, and Thorne Bay.', '* WHEN...From 1 PM to 11 PM AKDT Wednesday.', '* IMPACTS...Damaging winds may blow down trees and power lines.\nWidespread power outages are possible. Travel will be difficult,\nespecially for aviation and high profile vehicles. Marine and\naviation transportation will also likely be impacted.']"
1,AK,Upper Kobuk and Noatak Valleys,Winter Weather Advisory,Moderate,Likely,Expected,2022-04-06T03:04:00-08:00,2022-04-07T13:00:00-08:00,"['* WHAT...Snow expected. Plan on difficult travel conditions.\nTotal snow accumulations of 4 to 6 inches, are expected.', '* WHERE...Upper Kobuk and Noatak Valleys.', '* WHEN...7 AM this morning to 1 PM Thursday.', '* ADDITIONAL DETAILS...Look for reduced visibilities at times.']"
2,AK,Dixon Entrance to Cape Decision Coastal Area; Southern Inner Channels,High Wind Watch,Severe,Possible,Future,2022-04-04T18:07:00-08:00,2022-04-07T00:00:00-08:00,"['* WHAT...Southeast winds 25 to 35 mph with gusts up to 60 mph\npossible.', '* WHERE...The southeast Gulf Coast and portions of the southern\nInner Channels including Ketchikan, Craig, Hydaburg, Thorne\nBay, Metlakatla, Hollis, Kasaan, Edna Bay, and adjacent\ncommunities.', '* WHEN...From Wednesday morning through Wednesday evening.', '* IMPACTS...Damaging winds could blow down trees and power\nlines. Widespread power outages are possible. Travel could be\ndifficult, especially for high profile vehicles. Aviation and\nmarine transportation could be impacted.', ""* ADDITIONAL DETAILS...Confidence is highest for western Prince\nof Wales Island, but should the storm take a track close to\nthe coast, then Ketchikan, Metlakatla, and eastern Prince of\nWales Island communities will see impacts. Highest wind gusts\nwill likely occur Wednesday afternoon, but depending on the\nspeed of the storm's arrival and exit time, impactful wind\ngusts could arrive earlier or as late as Wednesday evening.""]"
3,AK,Inner Channels from Kupreanof Island to Etolin Island,High Wind Watch,Severe,Possible,Future,2022-04-04T18:07:00-08:00,2022-04-07T00:00:00-08:00,"['* WHAT...East to southeast winds 20 to 30 mph with gusts up to\n60 mph possible.', '* WHERE...Portions of the south-central Inner Channels including\nWrangell, Kake, Port Protection, and Point Baker.', '* WHEN...From Wednesday morning through Wednesday evening.', '* IMPACTS...Damaging winds could blow down trees and power\nlines. Widespread power outages are possible. Travel could be\ndifficult, especially for high profile vehicles. Aviation and\nmarine transportation could be impacted.', ""* ADDITIONAL DETAILS...Highest wind gusts will likely occur\nWednesday afternoon, but depending on the speed of the storm's\narrival and exit time, impactful wind gusts could arrive\nearlier or as late as Wednesday evening.""]"
4,AK,Cape Decision to Salisbury Sound Coastal Area,High Wind Watch,Severe,Possible,Future,2022-04-04T18:07:00-08:00,2022-04-07T04:00:00-08:00,"['* WHAT...Southeast winds 30 to 40 mph with gusts up to 60 mph\npossible.', '* WHERE...Portions of the eastern Gulf Coast including Sitka and\nPort Alexander.', '* WHEN...From Wednesday morning through late Wednesday night.', '* IMPACTS...Damaging winds could blow down trees and power\nlines. Widespread power outages are possible. Travel could be\ndifficult, especially for high profile vehicles. Aviation and\nmarine transportation could be impacted.', ""* ADDITIONAL DETAILS...Highest wind gusts will likely occur\nWednesday afternoon and Wednesday evening in Port Alexander,\nand Wednesday evening in Sitka, but depending on the speed of\nthe storm's arrival and exit time, impactful wind gusts could\narrive earlier or as late as late Wednesday night.""]"
0,AR,"Jackson, AR; Woodruff, AR",Flood Warning,Severe,Observed,Immediate,2022-04-06T10:47:00-05:00,,"['* WHAT...Minor flooding is occurring and minor flooding is forecast.', '* WHERE...Cache River Near Patterson.', '* WHEN...Until further notice.', '* IMPACTS...At 9.0 feet, Low swampy timberland along the river\nbegins to flood. Flood gates should be closed and equipment moved\nout of the low grounds along the river and tributaries.\nAt 10.0 feet, Pastureland and cropland not protected by levees in\nJackson and Woodruff counties affected. Water is over portions of\nState Highway 37 and deep along the shoulders of State Highway 18\nnear Grubbs. Water over portions of Woodruff County Road 775 north\nof State Highway 260.', '* ADDITIONAL DETAILS...\n- At 10:15 AM CDT Wednesday the stage was 9.9 feet.\n- Forecast...The river is expected to fall to 9.6 feet Monday\nmorning.\n- Flood stage is 9.0 feet.\n- http://www.weather.gov/safety/flood']"
1,AR,"Randolph, AR",Flood Warning,Severe,Observed,Immediate,2022-04-06T10:46:00-05:00,2022-04-09T19:00:00-05:00,"['* WHAT...Minor flooding is occurring and minor flooding is forecast.', '* WHERE...Black River At Pocahontas.', '* WHEN...Until Saturday evening.', '* IMPACTS...At 17.0 feet, Agricultural lands along the river east\nand south of Pocahontas will be impacted by high water. Equipment\nand livestock should be moved to higher ground.', '* ADDITIONAL DETAILS...\n- At 10:00 AM CDT Wednesday the stage was 18.1 feet.\n- Forecast...The river is currently cresting and is expected to\nfall below flood stage early Friday afternoon and continue\nfalling to 15.6 feet Monday morning.\n- Flood stage is 17.0 feet.\n- http://www.weather.gov/safety/flood']"
2,AR,"Independence, AR; Jackson, AR; Lawrence, AR",Flood Warning,Severe,Observed,Immediate,2022-04-06T10:46:00-05:00,,"['* WHAT...Minor flooding is occurring and minor flooding is forecast.', '* WHERE...Black River At Black Rock.', '* WHEN...Until further notice.', '* IMPACTS...At 20.0 feet, Agricultural land is flooding along both\nbanks of the river in Lawrence, Independence, and Jackson\ncounties. Minor flooding in Powhatan Community and Courthouse\nState Park.', '* ADDITIONAL DETAILS...\n- At 10:00 AM CDT Wednesday the stage was 19.5 feet.\n- Forecast...The river is expected to rise to a crest of 20.0\nfeet Wednesday evening.\n- Flood stage is 14.0 feet.\n- http://www.weather.gov/safety/flood']"
3,AR,"Prairie, AR; White, AR; Woodruff, AR",Flood Warning,Severe,Observed,Immediate,2022-04-06T10:43:00-05:00,2022-04-15T13:00:00-05:00,"['* WHAT...Minor flooding is occurring and minor flooding is forecast.', '* WHERE...White River At Georgetown.', '* WHEN...Until Friday, April 15.', '* IMPACTS...At 21.0 feet, Hurricane Lake Wildlife Management Area\nand Raft Creek Bottoms inundated. Roads in the bottoms are flooded.', '* ADDITIONAL DETAILS...\n- At 10:00 AM CDT Wednesday the stage was 21.0 feet.\n- Forecast...The river is expected to rise to a crest of 21.5\nfeet early Monday morning. It will then fall below flood\nstage Thursday, April 14.\n- Flood stage is 21.0 feet.\n- http://www.weather.gov/safety/flood']"
4,AR,"White, AR; Woodruff, AR",Flood Warning,Severe,Observed,Immediate,2022-04-06T10:43:00-05:00,,"['* WHAT...Minor flooding is occurring and minor flooding is forecast.', '* WHERE...White River At Augusta.', '* WHEN...Until further notice.', '* IMPACTS...At 32.0 feet, Thousands of acres of cropland and farm\nroads are flooded in White and Woodruff counties. Water is\nisolating homes and camps along the river in White and Woodruff\ncounties.', '* ADDITIONAL DETAILS...\n- At 10:00 AM CDT Wednesday the stage was 31.5 feet.\n- Forecast...The river is expected to rise to a crest of 32.0\nfeet Saturday morning.\n- Flood stage is 26.0 feet.\n- http://www.weather.gov/safety/flood']"
5,AR,"Prairie, AR",Flood Warning,Severe,Observed,Immediate,2022-04-06T10:43:00-05:00,,"['* WHAT...Minor flooding is occurring and minor flooding is forecast.', '* WHERE...White River At Des Arc.', '* WHEN...Until further notice.', '* IMPACTS...At 24.0 feet, Many acres of farmland flooded within the\nlevees. Water is backing up Bayou Des Arc and Cypress Bayou.', '* ADDITIONAL DETAILS...\n- At 10:00 AM CDT Wednesday the stage was 24.5 feet.\n- Forecast...The river is expected to rise to a crest of 24.6\nfeet early Saturday morning.\n- Flood stage is 24.0 feet.\n- http://www.weather.gov/safety/flood']"
6,AR,"Arkansas, AR; Monroe, AR",Flood Warning,Severe,Observed,Immediate,2022-04-06T10:43:00-05:00,,"['* WHAT...Minor flooding is occurring and minor flooding is forecast.', '* WHERE...White River At Clarendon.', '* WHEN...Until further notice.', '* IMPACTS...At 26.0 feet, River flows in many side channels and\ncreates islands between the river and sloughs and creeks. Flooding\nof cropland and timber is occurring. Portions of the National\nWildlife Refuge downstream of Clarendon flooding.', '* ADDITIONAL DETAILS...\n- At 10:00 AM CDT Wednesday the stage was 27.7 feet.\n- Forecast...The river is expected to remain steady above flood\nstage at 27.6 feet.\n- Flood stage is 26.0 feet.\n- http://www.weather.gov/safety/flood']"
7,AR,"Bradley, AR; Calhoun, AR; Union, AR",Flood Warning,Severe,Likely,Expected,2022-04-06T10:38:00-05:00,,"['* WHAT...Minor flooding is forecast.', '* WHERE...Ouachita River At Thatcher L&D.', '* WHEN...From Saturday morning until further notice.', '* IMPACTS...At 79.0 feet, Property in low lying areas needs to be\nremoved. Access roads to oil and gas rigs may be flooded. Levee\ngates should be closed before the river reaches 80 feet. There is\nminor flooding at this level.', '* ADDITIONAL DETAILS...\n- At 9:30 AM CDT Wednesday the stage was 77.4 feet.\n- Forecast...The river is expected to rise above flood stage\nlate Saturday morning and continue rising to 79.5 feet Sunday\nevening. Additional rises are possible thereafter.\n- Flood stage is 79.0 feet.\n- http://www.weather.gov/safety/flood']"
8,AR,"Columbia, AR; Webster, LA",Flood Warning,Severe,Observed,Immediate,2022-04-06T09:45:00-05:00,,"['* WHAT...Minor flooding is forecast.', '* WHERE...Bayou Dorcheat Near Springhill, Louisiana.', '* WHEN...From Thursday morning until further notice.', '* IMPACTS...At 11 feet, Expect minor lowland flooding.', '* ADDITIONAL DETAILS...\n- At 9:00 AM CDT Wednesday the stage was 9.8 feet.\n- Forecast...Upper Bayou Dorcheat is expected to rise above\nflood stage late Thursday morning and continue rising to a\ncrest of 12.0 feet Friday evening.\n- Flood stage is 11 feet.\n- http://www.weather.gov/safety/flood']"
9,AR,Benton; Washington,Red Flag Warning,Severe,Likely,Expected,2022-04-06T09:38:00-05:00,2022-04-06T21:00:00-05:00,"['The National Weather Service in Tulsa has issued a Red Flag\nWarning, which is in effect until 9 PM CDT this evening.', '* AFFECTED AREA...IN Arkansas, Benton, and Washington AR\ncounties.', '* WIND...Northwest winds 15 to 20 mph with gusts to 30 to 35\nmph.', '* HUMIDITY...Afternoon humidity around 20 percent.', '* TEMPERATURE...High temperatures in the mid to upper 60s.', '* IMPACTS...Any fires that develop will likely spread rapidly.\nOutdoor burning is not recommended.']"
10,AR,"Prairie, AR",Flood Warning,Severe,Observed,Immediate,2022-04-04T19:55:00-05:00,2022-04-14T13:00:00-05:00,"['* WHAT...Minor flooding is occurring and minor flooding is forecast.', '* WHERE...White River At Des Arc.', '* WHEN...Until Thursday, April 14.', '* IMPACTS...At 24.0 feet, Many acres of farmland flooded within the\nlevees. Water is backing up Bayou Des Arc and Cypress Bayou.', '* ADDITIONAL DETAILS...\n- At 7:00 PM CDT Monday the stage was 24.4 feet.\n- Forecast...The river is expected to rise to a crest of 24.5\nfeet Tuesday morning, and remain steady above flood stage\nthrough the remainder of the week. It will then fall below\nflood stage Wednesday, April 13.\n- Flood stage is 24.0 feet.\n- http://www.weather.gov/safety/flood']"
11,AR,"Prairie, AR",Flood Warning,Severe,Observed,Immediate,2022-03-30T22:28:00-05:00,2022-04-10T07:00:00-05:00,"['* WHAT...Minor flooding is occurring and minor flooding is forecast.', '* WHERE...White River At Des Arc.', '* WHEN...Until Sunday, April 10.', '* IMPACTS...At 24.0 feet, Many acres of farmland flooded within the\nlevees. Water is backing up Bayou Des Arc and Cypress Bayou.', '* ADDITIONAL DETAILS...\n- At 10:00 PM CDT Wednesday the stage was 24.4 feet.\n- Forecast...The river is expected to slowly fall to below\nflood stage Saturday, April 9th.\n- Flood stage is 24.0 feet.\n- http://www.weather.gov/safety/flood']"
0,AZ,Lake Mead NRA/Colorado River-AZ side; Lower Colorado River Valley; Lake Mead NRA/Colorado River-NV side,Red Flag Warning,Severe,Likely,Expected,2022-04-06T06:26:00-07:00,2022-04-06T19:00:00-07:00,"['* AFFECTED AREA...In Arizona...Fire weather zone 101. In\nCalifornia...Fire weather zone 229. In Nevada...Fire weather\nzone 466.', '* TIMING...Through early this evening.', '* WIND...North winds 25 to 30 mph with gusts up to 45 mph.', '* HUMIDITY...Daytime humidity less than 10 percent, with poor\novernight recovery.', '* IMPACTS...Any fires that develop will likely spread rapidly.\nOutdoor burning is not recommended.']"
1,AZ,Lake Havasu and Fort Mohave; Lake Mead National Recreation Area; San Bernardino County-Upper Colorado River Valley; Lake Mead National Recreation Area,Lake Wind Advisory,Moderate,Likely,Expected,2022-04-06T06:25:00-07:00,2022-04-06T19:00:00-07:00,"['* WHAT...North winds 25 to 35 mph with gusts up to 50 mph.', '* WHERE...In Nevada, Lake Mead National Recreation Area. In\nCalifornia, San Bernardino County-Upper Colorado River Valley.\nIn Arizona, Lake Mead National Recreation Area and Lake Havasu\nand Fort Mohave.', '* WHEN...Until 7 PM PDT /7 PM MST/ this evening.', '* IMPACTS...Strong winds and rough waves on area lakes will\ncreate hazardous conditions for small craft.']"
0,CA,Lake Mead NRA/Colorado River-AZ side; Lower Colorado River Valley; Lake Mead NRA/Colorado River-NV side,Red Flag Warning,Severe,Likely,Expected,2022-04-06T06:26:00-07:00,2022-04-06T19:00:00-07:00,"['* AFFECTED AREA...In Arizona...Fire weather zone 101. In\nCalifornia...Fire weather zone 229. In Nevada...Fire weather\nzone 466.', '* TIMING...Through early this evening.', '* WIND...North winds 25 to 30 mph with gusts up to 45 mph.', '* HUMIDITY...Daytime humidity less than 10 percent, with poor\novernight recovery.', '* IMPACTS...Any fires that develop will likely spread rapidly.\nOutdoor burning is not recommended.']"
1,CA,Lake Havasu and Fort Mohave; Lake Mead National Recreation Area; San Bernardino County-Upper Colorado River Valley; Lake Mead National Recreation Area,Lake Wind Advisory,Moderate,Likely,Expected,2022-04-06T06:25:00-07:00,2022-04-06T19:00:00-07:00,"['* WHAT...North winds 25 to 35 mph with gusts up to 50 mph.', '* WHERE...In Nevada, Lake Mead National Recreation Area. In\nCalifornia, San Bernardino County-Upper Colorado River Valley.\nIn Arizona, Lake Mead National Recreation Area and Lake Havasu\nand Fort Mohave.', '* WHEN...Until 7 PM PDT /7 PM MST/ this evening.', '* IMPACTS...Strong winds and rough waves on area lakes will\ncreate hazardous conditions for small craft.']"
