,State,Area,Event,Severity,Certainty,Urgency,Effective,Ends,Description
12,CA,San Bernardino and Riverside County Valleys-The Inland Empire; San Bernardino County Mountains; Riverside County Mountains; Santa Ana Mountains and Foothills; Orange County Inland,Wind Advisory,Moderate,Likely,Expected,2022-03-10T02:33:00-08:00,2022-03-11T15:00:00-08:00,"['* WHAT...North winds 20 to 30 mph with gusts to 60 mph expected.', '* WHERE...San Bernardino County Mountains, Santa Ana Mountains\nand Foothills, Riverside County Mountains, Orange County\nInland Areas and San Bernardino and Riverside County Valleys-\nThe Inland Empire.', '* WHEN...From 3 PM this afternoon to 3 PM PST Friday. The\nstrongest winds are expected for tonight.', '* IMPACTS...Gusty winds could blow around unsecured objects.\nTree limbs could be blown down and a few power outages may\nresult.']"
13,CA,Western Mojave Desert,Wind Advisory,Moderate,Likely,Expected,2022-03-10T02:27:00-08:00,2022-03-10T18:00:00-08:00,"['* WHAT...Winds becoming northwest to north 20 to 30 mph with gusts\nup to 50 mph.', '* WHERE...Western Mojave Desert.', '* WHEN...Until 6 PM PST today.', '* IMPACTS...Gusty winds could blow around unsecured objects.\nTree limbs could be blown down and a few power outages may\nresult. Blowing dust may reduce visibilities at times.', '* ADDITIONAL DETAILS...Winds may fall below criteria levels for a\nperiod this morning before increasing again.']"
14,CA,"Northwest Plateau; Owens Valley; White Mountains of Inyo County; Death Valley National Park; Eastern Mojave Desert, Including the Mojave National Preserve; Morongo Basin; Cadiz Basin; Lincoln County; Northeast Clark County; Western Clark and Southern Nye County; Sheep Range; Spring Mountains-Red Rock Canyon; Las Vegas Valley; Southern Clark County",Wind Advisory,Moderate,Likely,Expected,2022-03-10T02:27:00-08:00,2022-03-10T18:00:00-08:00,"['* WHAT...North winds 20 to 30 mph with gusts up to 50 mph\nexpected.', '* WHERE...Portions of northwest Arizona, southeast California\nand south central and southern Nevada.', '* WHEN...From 8 AM PST /9 AM MST/ to 6 PM PST /7 PM MST/ today.', '* IMPACTS...Gusty winds could blow around unsecured objects.\nTree limbs could be blown down and a few power outages may\nresult.', '* ADDITIONAL DETAILS...Blowing dust and sand may reduce\nvisibilities for brief periods of time.']"
15,CA,Lake Havasu and Fort Mohave; Lake Mead National Recreation Area; San Bernardino County-Upper Colorado River Valley; Lake Mead National Recreation Area,Wind Advisory,Moderate,Likely,Expected,2022-03-10T02:27:00-08:00,2022-03-11T04:00:00-08:00,"['* WHAT...North winds 25 to 35 mph with gusts up to 55 mph\nexpected.', '* WHERE...In Arizona, Lake Havasu and Fort Mohave, Lake Mead\nNational Recreation Area. In California, San Bernardino County-\nUpper Colorado River Valley. In Nevada, Lake Mead National\nRecreation Area.', '* WHEN...From 8 AM PST /9 AM MST/ this morning to 4 AM PST /5 AM\nMST/ Friday.', '* IMPACTS...Gusty winds could blow around unsecured objects.\nTree limbs could be blown down and a few power outages may\nresult. Dangerous boating conditions due to enhanced wave\nactivity on areas lakes.', '* ADDITIONAL DETAILS...Blowing dust and sand may reduce\nvisibilities for brief periods of time.']"
16,CA,Greater Lake Tahoe Area; Greater Lake Tahoe Area,Lake Wind Advisory,Moderate,Likely,Expected,2022-03-10T02:22:00-08:00,2022-03-10T16:00:00-08:00,"['* WHAT...East winds 15 to 25 mph with gusts up to 40 mph\nexpected. Waves 2 to 4 feet.', '* WHERE...Lake Tahoe.', '* WHEN...From 4 AM to 4 PM PST Thursday.', '* IMPACTS...Small boats, kayaks and paddle boards will be prone\nto capsizing and should remain off lake waters until\nconditions improve.']"
17,CA,Central Sacramento Valley; Southern Sacramento Valley; Carquinez Strait and Delta,Wind Advisory,Moderate,Likely,Expected,2022-03-10T02:08:00-08:00,2022-03-10T16:00:00-08:00,"['* WHAT...North winds 15 to 30 mph with gusts from 35 to 40 mph\nexpected.', '* WHERE...Central Sacramento Valley, Southern Sacramento Valley\nand Carquinez Strait and Delta Counties.', '* WHEN...From 1 AM to 4 PM PST Thursday.', '* IMPACTS...Gusty winds could blow around unsecured objects.\nTree limbs could be blown down and a few power outages may\nresult.', '* ADDITIONAL DETAILS...The strongest winds are expected this\nmorning into the early afternoon.']"
18,CA,North Bay Mountains; East Bay Hills and the Diablo Range,Wind Advisory,Moderate,Likely,Expected,2022-03-10T01:59:00-08:00,2022-03-10T10:00:00-08:00,"['* WHAT...North winds 20 to 30 mph with gusts up to 50 mph\nexpected. Gusts over the highest peaks could approach 60 to 70\nmph.', '* WHERE...North Bay Mountains and East Bay Hills and the Diablo\nRange.', '* WHEN...Until 10 AM PST Thursday.', '* IMPACTS...Gusty winds could blow around unsecured objects.\nTree limbs could be blown down and a few power outages may\nresult.']"
19,CA,North Bay Interior Valleys; Santa Clara Valley Including San Jose; Southern Salinas Valley/Arroyo Seco and Lake San Antonio; Mountains Of San Benito County And Interior Monterey County Including Pinnacles National Park; Northern Salinas Valley/Hollister Valley and Carmel Valley,Frost Advisory,Minor,Likely,Expected,2022-03-10T01:59:00-08:00,2022-03-11T09:00:00-08:00,"['* WHAT...Temperatures of 30 to 35 degrees will result in frost\nformation.', '* WHERE...North Bay Interior Valleys, Santa Clara Valley\nIncluding San Jose, Southern Salinas Valley/Arroyo Seco and\nLake San Antonio, Mountains Of San Benito County and Interior\nMonterey County Including Pinnacles National Park and Northern\nSalinas Valley/Hollister Valley and Carmel Valley.', '* WHEN...From midnight tonight to 9 AM PST Friday.', '* IMPACTS...Frost could kill sensitive outdoor vegetation if\nleft uncovered.']"
20,CA,Yuma; Salton Sea; Imperial County Southeast; Imperial Valley,Wind Advisory,Moderate,Likely,Expected,2022-03-10T01:43:00-07:00,2022-03-10T22:00:00-07:00,"['* WHAT...For the Blowing Dust Advisory, visibility between one\nquarter mile and one mile in blowing dust possible. For the\nWind Advisory, north winds 20 to 30 mph with gusts up to 45\nmph expected.', '* WHERE...In Arizona, Yuma. In California, Imperial Valley,\nSalton Sea and Southeastern Imperial County.', '* WHEN...From 4 PM MST /3 PM PST/ this afternoon to 10 PM MST /9\nPM PST/ this evening.', '* IMPACTS...Hazardous driving conditions due to reduced\nvisibility. Difficult driving conditions, especially for\nlarger vehicles traveling along roads with crosswinds. Light,\nunsecured objects may become airborne.']"
21,CA,Yuma; Salton Sea; Imperial County Southeast; Imperial Valley,Blowing Dust Advisory,Moderate,Likely,Expected,2022-03-10T01:43:00-07:00,2022-03-10T22:00:00-07:00,"['* WHAT...For the Blowing Dust Advisory, visibility between one\nquarter mile and one mile in blowing dust possible. For the\nWind Advisory, north winds 20 to 30 mph with gusts up to 45\nmph expected.', '* WHERE...In Arizona, Yuma. In California, Imperial Valley,\nSalton Sea and Southeastern Imperial County.', '* WHEN...From 4 PM MST /3 PM PST/ this afternoon to 10 PM MST /9\nPM PST/ this evening.', '* IMPACTS...Hazardous driving conditions due to reduced\nvisibility. Difficult driving conditions, especially for\nlarger vehicles traveling along roads with crosswinds. Light,\nunsecured objects may become airborne.']"
22,CA,Joshua Tree NP East; Chiriaco Summit,Blowing Dust Advisory,Moderate,Likely,Expected,2022-03-10T01:43:00-07:00,2022-03-10T23:00:00-07:00,"['* WHAT...For the Blowing Dust Advisory, visibility between one\nquarter mile and one mile in blowing dust possible. For the\nWind Advisory, north winds 20 to 30 mph with gusts up to 50 mph\nexpected.', '* WHERE...Chiriaco Summit and Eastern portion of Joshua Tree\nNational Park.', '* WHEN...From 11 AM this morning to 10 PM PST this evening.', '* IMPACTS...Hazardous driving conditions due to reduced\nvisibility. Difficult driving conditions, especially for\nlarger vehicles traveling along roads with crosswinds. Light,\nunsecured objects may become airborne.']"
23,CA,Joshua Tree NP East; Chiriaco Summit,Wind Advisory,Moderate,Likely,Expected,2022-03-10T01:43:00-07:00,2022-03-10T23:00:00-07:00,"['* WHAT...For the Blowing Dust Advisory, visibility between one\nquarter mile and one mile in blowing dust possible. For the\nWind Advisory, north winds 20 to 30 mph with gusts up to 50 mph\nexpected.', '* WHERE...Chiriaco Summit and Eastern portion of Joshua Tree\nNational Park.', '* WHEN...From 11 AM this morning to 10 PM PST this evening.', '* IMPACTS...Hazardous driving conditions due to reduced\nvisibility. Difficult driving conditions, especially for\nlarger vehicles traveling along roads with crosswinds. Light,\nunsecured objects may become airborne.']"
24,CA,Joshua Tree NP West,Wind Advisory,Moderate,Likely,Expected,2022-03-10T01:43:00-07:00,2022-03-10T23:00:00-07:00,"['* WHAT...North winds 25 to 35 mph with gusts up to 50 mph\nexpected.', '* WHERE...Western portion of Joshua Tree National Park.', '* WHEN...From 11 AM this morning to 10 PM PST this evening.', '* IMPACTS...Difficult driving conditions, especially for larger\nvehicles traveling along roads with crosswinds. Light,\nunsecured objects may become airborne.']"
25,CA,Parker Valley; Kofa; Central La Paz; Chuckwalla Mountains; Palo Verde Valley; Chuckwalla Valley,Wind Advisory,Moderate,Likely,Expected,2022-03-10T01:43:00-07:00,2022-03-11T02:00:00-07:00,"['* WHAT...For the Blowing Dust Advisory, visibility between one\nquarter mile and one mile in blowing dust possible. For the\nWind Advisory, northwest winds 20 to 30 mph with gusts up to\n50 mph expected.', '* WHERE...In Arizona, Kofa, Parker Valley and Central La Paz\nCounty. In California, Palo Verde Valley, Chuckwalla Valley\nand Chuckwalla Mountains.', '* WHEN...From 2 PM MST /1 PM PST/ this afternoon to 2 AM MST /1\nAM PST/ Friday.', '* IMPACTS...Hazardous driving conditions due to reduced\nvisibility. Difficult driving conditions, especially for\nlarger vehicles traveling along roads with crosswinds. Light,\nunsecured objects may become airborne.']"
26,CA,Parker Valley; Kofa; Central La Paz; Chuckwalla Mountains; Palo Verde Valley; Chuckwalla Valley,Blowing Dust Advisory,Moderate,Likely,Expected,2022-03-10T01:43:00-07:00,2022-03-11T02:00:00-07:00,"['* WHAT...For the Blowing Dust Advisory, visibility between one\nquarter mile and one mile in blowing dust possible. For the\nWind Advisory, northwest winds 20 to 30 mph with gusts up to\n50 mph expected.', '* WHERE...In Arizona, Kofa, Parker Valley and Central La Paz\nCounty. In California, Palo Verde Valley, Chuckwalla Valley\nand Chuckwalla Mountains.', '* WHEN...From 2 PM MST /1 PM PST/ this afternoon to 2 AM MST /1\nAM PST/ Friday.', '* IMPACTS...Hazardous driving conditions due to reduced\nvisibility. Difficult driving conditions, especially for\nlarger vehicles traveling along roads with crosswinds. Light,\nunsecured objects may become airborne.']"
27,CA,Indian Wells Valley; Mojave Desert,Wind Advisory,Moderate,Likely,Expected,2022-03-09T13:58:00-08:00,2022-03-10T18:00:00-08:00,"['* WHAT...Sustained northwest to northerly winds 25 to 35 mph,\nwith gusts around 55 mph expected.', '* WHERE...Indian Wells Valley and Mojave Desert in eastern Kern\nCounty.', '* WHEN...Early Thursday morning through Thursday early evening.', '* IMPACTS...Gusty winds may blow around unsecured objects. Tree\nlimbs could be blown down. Power outages could occur. Blowing\ndust or sand can temporarily cause lowered visibilities.\nTravel may be difficult at times, particularly for high\nprofile vehicles.', '* ADDITIONAL DETAILS...Highways affected include, but are not\nlimited to Highway 58, Highway 178, U.S. Highway 395, and\nHighway 14.']"
28,CA,Mojave Desert Slopes,Wind Advisory,Moderate,Likely,Expected,2022-03-09T13:58:00-08:00,2022-03-10T18:00:00-08:00,"['* WHAT...Sustained northwest to northerly winds 25 to 35 mph,\nwith gusts around 55 mph expected. Highest winds will be\nthrough wind favored passes and canyons.', '* WHERE...Mojave Desert Slopes.', '* WHEN...Early Thursday morning through Thursday early evening.', '* IMPACTS...Gusty winds may blow around unsecured objects. Tree\nlimbs could be blown down. Power outages could occur. Blowing\ndust or sand can temporarily cause lowered visibilities.\nTravel may be difficult at times, particularly for high\nprofile vehicles.', '* ADDITIONAL DETAILS...Highways affected include, but are not\nlimited to Highways 14, 58, and 178.']"
29,CA,Apple and Lucerne Valleys,Wind Advisory,Moderate,Likely,Expected,2022-03-09T13:00:00-08:00,2022-03-10T18:00:00-08:00,"['* WHAT...West winds 20 to 30 mph with gusts to 50 mph through\ntonight, then becoming northerly Thursday afternoon.', '* WHERE...Apple and Lucerne Valleys.', '* WHEN...From 1 PM this afternoon to 6 PM Thursday.', '* IMPACTS...Gusty winds could blow around unsecured objects.\nTree limbs could be blown down and a few power outages may\nresult.']"
30,CA,Coachella Valley; San Gorgonio Pass Near Banning,Wind Advisory,Moderate,Likely,Expected,2022-03-09T13:00:00-08:00,2022-03-10T22:00:00-08:00,"['* WHAT...North winds 20 to 30 mph with gusts to 55 mph expected.', '* WHERE...Coachella Valley and San Gorgonio Pass Near Banning.', '* WHEN...From 10 AM to 10 PM Thursday.', '* IMPACTS...Gusty winds could blow around unsecured objects.\nTree limbs could be blown down and a few power outages may\nresult.']"
31,CA,San Diego County Mountains,Wind Advisory,Moderate,Likely,Expected,2022-03-09T13:00:00-08:00,2022-03-11T15:00:00-08:00,"['* WHAT...Northeast winds 25 to 35 mph with gusts to 55 mph.', '* WHERE...San Diego County Mountains.', '* IMPACTS...Gusty Santa Ana winds could blow around unsecured\nobjects.']"
32,CA,San Bernardino and Riverside County Valleys-The Inland Empire; San Bernardino County Mountains; Riverside County Mountains; Santa Ana Mountains and Foothills; Orange County Inland,Wind Advisory,Moderate,Likely,Expected,2022-03-09T13:00:00-08:00,2022-03-11T15:00:00-08:00,"['* WHAT...North to northeast winds increasing to 20 to 30 mph with\ngusts to 60 mph through Thursday evening. The strongest winds\nwill surface Thursday night and Friday morning with gusts to 70\nmph in the Santa Ana wind prone areas.', '* WHERE...San Bernardino and Riverside County Valleys-The Inland\nEmpire, San Bernardino County Mountains, Riverside County\nMountains, Santa Ana Mountains and Foothills and Orange County\nInland Areas.', '* WHEN...From 3 PM Thursday to 3 PM Friday.', '* IMPACTS...Gusty winds will blow around unsecured objects. Tree\nlimbs could be blown down and a few power outages may result.']"
33,CA,Mojave Desert Slopes,Wind Advisory,Moderate,Likely,Expected,2022-03-08T13:04:00-08:00,2022-03-10T18:00:00-08:00,"['* WHAT...Sustained northwest to northerly winds 25 to 35 mph, with\ngusts around 55 mph expected. Highest winds will be through\nwind favored passes and canyons.', '* WHERE...Mojave Desert Slopes.', '* WHEN...Early Thursday morning through Thursday early evening.', '* IMPACTS...Gusty winds may blow around unsecured objects. Tree\nlimbs could be blown down. Power outages could occur. Blowing\ndust or sand can temporarily cause lowered visibilities. Travel\nmay be difficult at times, particularly for high profile\nvehicles.', '* ADDITIONAL DETAILS...Highways affected include, but are not\nlimited to Highway 58 and Highway 178,']"
34,CA,Indian Wells Valley; Mojave Desert,Wind Advisory,Moderate,Likely,Expected,2022-03-08T13:04:00-08:00,2022-03-10T18:00:00-08:00,"['* WHAT...Sustained northwest to northerly winds 25 to 35 mph,\nwith gusts around 55 mph expected.', '* WHERE...Indian Wells Valley and Mojave Desert in eastern Kern\nCounty.', '* WHEN...Early Thursday morning through Thursday early evening.', '* IMPACTS...Gusty winds may blow around unsecured objects. Tree\nlimbs could be blown down. Power outages could occur. Blowing\ndust or sand can temporarily cause lowered visibilities. Travel\nmay be difficult at times, particularly for high profile\nvehicles.', '* ADDITIONAL DETAILS...Highways affected include, but are not\nlimited to Highway 58, Highway 178, U.S. Highway 395, and\nHighway 14.']"
0,CO,La Garita Mountains Above 10000 Ft; Eastern San Juan Mountains Above 10000 Ft,Winter Weather Advisory,Moderate,Likely,Expected,2022-03-10T06:53:00-07:00,2022-03-10T23:00:00-07:00,"['* WHAT...Snow. Additional snow accumulations of 1 to 6 inches.', '* WHERE...Eastern San Juan Mountains Above 10000 Feet and La\nGarita Mountains Above 10000 Feet Counties.', '* WHEN...Until 11 PM MST this evening.', '* IMPACTS...Plan on slippery road conditions. Patchy blowing\nsnow could significantly reduce visibility. The hazardous\nconditions could impact the morning or evening commute. The\ncold wind chills as low as 20 below zero could cause frostbite\non exposed skin in as little as 30 minutes.']"
1,CO,Eastern Las Animas County; Springfield Vicinity/Baca County,Winter Weather Advisory,Moderate,Likely,Expected,2022-03-10T06:53:00-07:00,2022-03-11T05:00:00-07:00,"['* WHAT...Snow expected. Total snow accumulations of 3 to 6\ninches.', '* WHERE...Eastern Las Animas and Baca Counties.', '* WHEN...From noon today to 5 AM MST Friday.', '* IMPACTS...Plan on slippery road conditions. The hazardous\nconditions could impact the evening commute.', '* ADDITIONAL DETAILS...Banded snow is expected, therefore locally\nheavy snow is possible causing hazardous travel conditions,\nincluding snow covered roads and low visibility.']"
2,CO,Canon City Vicinity/Eastern Fremont County; Pueblo Vicinity/Pueblo County Below 6300 Feet; Walsenburg Vicinity/Upper Huerfano River Basin Below 7500 Ft,Winter Weather Advisory,Moderate,Likely,Expected,2022-03-10T06:53:00-07:00,2022-03-11T05:00:00-07:00,"['* WHAT...Snow. Additional snow accumulations of 1 to 7 inches.', '* WHERE...Eastern Fremont and Pueblo Counties below 6300 feet and\nHuerfano County below 7500 feet.', '\n* WHEN...Until 5 AM MST Friday.', '* IMPACTS...Travel could be very difficult. The hazardous\nconditions could impact the morning or evening commute.']"
3,CO,Northern Sangre de Cristo Mountains Between 8500 And 11000 Ft; Northern Sangre de Cristo Mountains above 11000 Ft; Wet Mountain Valley Below 8500 Ft; Wet Mountains between 6300 and 10000Ft; Wet Mountains above 10000 Ft,Winter Weather Advisory,Moderate,Likely,Expected,2022-03-10T06:53:00-07:00,2022-03-11T05:00:00-07:00,"['* WHAT...Snow. Additional snow accumulations of 2 to 6 inches.', '* WHERE...Northern Sangre de Cristo Mountains, the Wet Mountains,\nand the Wet Mountain Valley.', '* WHEN...Until 5 AM MST Friday.', '* IMPACTS...Plan on slippery road conditions. The hazardous\nconditions could impact the morning or evening commute. The cold\nwind chills as low as 15 below zero could result in hypothermia\nif precautions are not taken.']"
4,CO,Trinidad Vicinity/Western Las Animas County Below 7500 Ft,Winter Storm Warning,Severe,Likely,Expected,2022-03-10T06:53:00-07:00,2022-03-11T05:00:00-07:00,"['* WHAT...Heavy snow expected. Total snow accumulations of 8 to 11\ninches.', '* WHERE...Western Las Animas County below 7500 feet.', '* WHEN...From noon today to 5 AM MST Friday.', '* IMPACTS...Travel could be very difficult. The hazardous\nconditions could impact the evening commute.', '* ADDITIONAL DETAILS...Banded snow is expected, therefore locally\nheavy snow is possible causing hazardous travel conditions,\nincluding snow covered roads and low visibility.']"
5,CO,Southern Sangre De Cristo Mountains Between 7500 and 11000 Ft; Southern Sangre De Cristo Mountains Above 11000 Ft,Winter Storm Warning,Severe,Likely,Expected,2022-03-10T06:53:00-07:00,2022-03-11T05:00:00-07:00,"['* WHAT...Heavy snow. Additional snow accumulations of 8 to 11\ninches.', '* WHERE...Southern Sangre de Cristo Mountains below 11000 feet.', '* WHEN...Until 5 AM MST Friday.', '* IMPACTS...Travel could be very difficult. The hazardous\nconditions could impact the morning or evening commute.', '* ADDITIONAL DETAILS...Banded snow is expected, therefore locally\nheavy snow is possible causing hazardous travel conditions,\nincluding snow covered roads and low visibility.']"
6,CO,Cheyenne County; Greeley; Wichita,Winter Weather Advisory,Moderate,Likely,Expected,2022-03-10T04:39:00-07:00,2022-03-10T11:00:00-07:00,"['* WHAT...light snow will continue into this morning. Additional\nsnow accumulations of up to one inch.', '* WHERE...In Kansas, Wichita and Greeley Counties. In Colorado,\nCheyenne County.', '* WHEN...Until 11 AM MST /noon CST/ this morning.', '* IMPACTS...Plan on slippery road conditions. The hazardous\nconditions could impact the morning commute.']"
7,CO,Northwestern San Juan Mountains; Southwest San Juan Mountains,Winter Weather Advisory,Moderate,Likely,Expected,2022-03-10T03:27:00-07:00,2022-03-10T23:00:00-07:00,"['* WHAT...Snow. Additional snow accumulations of 3 to 7 inches.\nLocally higher amounts possible in the Uncompaghre Gorge and the\neastern San Juans towards Wolf Creek Pass.', '* WHERE...Southwest San Juan Mountains and Northwest San Juan\nMountains.', '* WHEN...Until 11 PM MST this evening.', '* IMPACTS...Travel could be difficult at times due to icy and snow\npacked roadways. A detailed map of the snowfall can be found\nat: www.weather.gov/gjt/winter.']"
0,FL,Inland Dixie; Coastal Dixie,Special Weather Statement,Moderate,Observed,Expected,2022-03-10T09:43:00-05:00,,"['At 943 AM EST, Doppler radar was tracking strong thunderstorms along\na line extending from near Bell to 6 miles east of Cross City to near\nHorseshoe Point. Movement was east at 20 mph.', 'HAZARD...Winds in excess of 40 mph.', 'SOURCE...Radar indicated.', 'IMPACT...Gusty winds could knock down tree limbs and blow around\nunsecured objects.', 'Locations impacted include...\nCross City, Horseshoe Point, Suwannee, Horseshoe Beach, Shamrock,\nCross City Airport, Shired Island, Old Town, Eugene, Fletcher, Yellow\nJacket, Guaranto Springs and Fanning Springs.']"
1,FL,Inland Dixie; Coastal Dixie,Special Weather Statement,Moderate,Observed,Expected,2022-03-10T09:01:00-05:00,,"['At 900 AM EST, Doppler radar was tracking strong thunderstorms along\na line extending from 6 miles south of Steinhatchee to 30 miles west\nof Horseshoe Point. Movement was east at 55 mph.', 'HAZARD...Winds in excess of 40 mph and pea size hail.', 'SOURCE...Radar indicated.', 'IMPACT...Gusty winds could knock down tree limbs and blow around\nunsecured objects. Minor damage to outdoor objects is\npossible.', 'Locations impacted include...\nCross City, Horseshoe Point, Suwannee, Horseshoe Beach, Shamrock,\nCross City Airport, Shired Island, Old Town, Eugene, Yellow Jacket\nand Fanning Springs.']"
2,FL,Gadsden; Leon,Special Weather Statement,Moderate,Observed,Expected,2022-03-10T08:55:00-05:00,,"['At 854 AM EST, Doppler radar was tracking a strong thunderstorm 12\nmiles south of Quincy, moving northeast at 50 mph.', 'HAZARD...Winds in excess of 40 mph and pea size hail.', 'SOURCE...Radar indicated.', 'IMPACT...Gusty winds could knock down tree limbs and blow around\nunsecured objects. Minor damage to outdoor objects is\npossible.', 'Locations impacted include...\nMidway, Quincy, Tallahassee, Havana, Florida State University,\nFlorida A And M, Tallahassee Comm College, Doak Campbell Stadium,\nLake Bradford, Gaither Community Center, Tallahassee Memorial Hosp,\nFlorence, Jamieson, Iamonia, Quincy Airport, Tallahassee Mall,\nBloxham, Tallahassee Regional A/P, Governors Square Mall and Lake\nTalquin.']"
3,FL,South Walton; Coastal Bay; Coastal Gulf; Coastal Franklin,Rip Current Statement,Moderate,Likely,Expected,2022-03-10T04:31:00-05:00,2022-03-12T19:00:00-05:00,"['* WHAT...Dangerous rip currents expected.', '* WHERE...Walton, Bay, Gulf, and Franklin County Beaches.', '* WHEN...From this afternoon through Saturday evening.', '* IMPACTS...Rip currents can sweep even the best swimmers away\nfrom shore into deeper water.', '* ADDITIONAL DETAILS...The rip current risk is expected to\nincrease later this afternoon into tonight, then remain high\nthrough Saturday.']"
0,GA,"Forsyth, GA; Fulton, GA",Flood Warning,Severe,Observed,Immediate,2022-03-10T04:07:00-05:00,2022-03-10T22:00:00-05:00,"['* WHAT...Minor flooding is occurring and minor flooding is forecast\nto continue.', '* WHERE...Big Creek near Alpharetta.', '* WHEN...Until late this evening.', '* IMPACTS...At 7 feet, minor flooding will continue to occur.  Minor\nflooding of woodlands and fields begin along the creek between\nCumming in Forsyth County...to Alpharetta and Roswell in North\nFulton County.  Flooding starts to effect portions of The Big\nCreek Greenway near Alpharetta and some portions may become closed\nwith around one foot of water...especially upstream and downstream\nfrom the gage on Kimball Bridge Road and near Rock Mill Park.\nPortions of the YMCA Campground off Preston Ridge Road will begin\nto flood.', '* ADDITIONAL DETAILS...\n- At 3:45 AM EST Thursday the stage was 7.4 feet.\n- Forecast...The river is expected to fall below flood stage\nlate this afternoon and continue falling to 2.5 feet Monday\nevening.\n- Flood stage is 7 feet.']"
1,GA,"DeKalb, GA; Rockdale, GA",Flood Warning,Severe,Observed,Immediate,2022-03-09T18:42:00-05:00,2022-03-10T19:32:00-05:00,"['* WHAT...Minor flooding is forecast.', '* WHERE...Yellow River near East Lithonia.', '* WHEN...From late tonight to Thursday evening.', '* IMPACTS...At 13 feet, Flood stage is reached. Minor flooding will\noccur in portions of the woodlands and fields near the river\nupstream and downstream from the gage on Pleasant Hill Road.', '* ADDITIONAL DETAILS...\n- At 6:31 PM EST Wednesday the stage was 8.6 feet and rising.\n- Forecast...The river is expected to rise above flood stage\nlate tonight to a crest of 13.2 feet Thursday morning. It\nwill then fall below flood stage Thursday evening.\n- Flood stage is 13 feet.\n- www.weather.gov/safety/flood']"
