,State,Area,Event,Severity,Certainty,Urgency,Effective,Ends,Description
0,TX,Wise; Denton; Collin; Hunt; Parker; Tarrant; Dallas; Rockwall; Kaufman; Hood; Johnson; Ellis; Henderson,Air Quality Alert,Unknown,Unknown,Unknown,2022-06-28T14:21:00-05:00,,"['The Texas Commission on Environmental Quality (TCEQ) has issued\nan Ozone Action Day for the Dallas-Fort Worth area for Wednesday,\nJune 29, 2022.', 'Atmospheric conditions are expected to be favorable for producing\nhigh levels of ozone air pollution in the Dallas-Fort Worth area\non Wednesday. You can help prevent ozone pollution by sharing a\nride, walking, riding a bicycle, taking your lunch to work,\navoiding drive-through lanes, conserving energy, and keeping your\nvehicle properly tuned.', 'For more information on ozone:', 'Ozone: The Facts (www.tceq.texas.gov/goto/ozonefacts)', 'Air North Texas: (www.airnorthtexas.org)', 'EPA Air Now\n(www.airnow.gov/index.cfm?action.local_state&STATEID=45&TAB=0)', 'Take care of Texas (www.takecareoftexas.org)', 'North Central Texas Council of Governments Air Quality\n(www.nctcog.org/trans/air/index.asp)']"
0,VI,North Central; Northwest; Culebra; St Croix,Rip Current Statement,Moderate,Likely,Expected,2022-06-29T04:08:00-04:00,2022-07-01T06:00:00-04:00,"['* WHAT...Dangerous rip currents expected due to breaking waves\nof 6 to 9 feet.', '* WHERE...Beaches along the North Central to Northwestern coast of\nPuerto Rico from Aguadilla to Dorado. Beaches of Culebra and Saint\nCroix.', '* WHEN...Through late Thursday night.', '* IMPACTS...Rip currents can sweep even the best swimmers away\nfrom shore into deeper water.']"
0,WA,"Chelan, WA",Flood Watch,Severe,Possible,Future,2022-06-28T06:05:00-07:00,2022-06-29T14:30:00-07:00,"['* WHAT...Flooding is possible.', '* WHERE...Stehekin River at Stehekin.', '* WHEN...From this evening to early tomorrow afternoon.', '* IMPACTS...At 24.0 feet, The river may be out of its banks in spots\non parts of Stehekin Valley Road and Company Creek Road,\nespecially from Harlequin Bridge to about seven miles upstream.', '* ADDITIONAL DETAILS...\n- At 4:30 AM PDT Tuesday the stage was 23.3 feet.\n- Forecast...The Stehekin River may briefly touch the Flood\nStage of 24 feet Tuesday evening for a short period of time\nbefore lowering below 24 feet by Wednesday morning. It is\nthen expected to remain near 23 feet through the week.\n- Flood stage is 24.0 feet.\n- http://www.weather.gov/safety/flood']"
0,WI,Vilas; Oneida; Forest; Florence; Northern Marinette County; Lincoln; Langlade; Menominee; Northern Oconto County; Door; Marathon; Shawano; Wood; Portage; Waupaca; Outagamie; Brown; Kewaunee; Waushara; Winnebago; Calumet; Manitowoc; Southern Marinette County; Southern Oconto County,Special Weather Statement,Moderate,Observed,Expected,2022-06-29T06:30:00-05:00,,"[""Clearing skies, light winds, and moisture from yesterday's rain\nallowed areas of fog to develop overnight. The fog was dense and\nreduced the visibility to less than 1/4 mile at some locations.\nPatches of dense fog persisted past sunrise, but are expected to\ndissipate fairly quickly in the next hour or two. The fog should\nbe gone by mid-morning."", 'Motorists should exercise caution until the fog dissipates. If\nyou encounter dense fog while driving, be sure to use your low-\nbeam headlights and maintain plenty of distance between your\nvehicle and other vehicles. Drive at a speed that will allow you\nto safely maneuver your vehicle around any object or animal you\nunexpectedly encounter on the road.']"
1,WI,Ashland; Iron; Sawyer; Price,Special Weather Statement,Moderate,Observed,Expected,2022-06-29T05:20:00-05:00,,"['Fog will affect Price county, Sawyer county, and southern Ashland\nand Iron counties this morning. Areas of dense fog will be\npossible. Visibilities may temporarily drop to one half to one\nquarter of a mile at times. If you are traveling tonight, be sure\nto slow down and allow plenty of distance between vehicles.\nVisibilities may change quickly over short distances. The fog is\nexpected to lift within an hour or two of sunrise.']"
2,WI,Winneshiek; Allamakee; Clayton; Wabasha; Olmsted; Winona; Fillmore; Houston; Taylor; Clark; Buffalo; Trempealeau; Jackson; La Crosse; Monroe; Juneau; Adams; Vernon; Crawford; Richland; Grant,Special Weather Statement,Moderate,Observed,Expected,2022-06-29T04:19:00-05:00,,"['Through 7 AM, areas of dense fog will reduce visibilities to a\nquarter mile or less in parts of southeast Minnesota, northeast\nIowa, and western Wisconsin. This fog will quickly dissipate\nbetween 7 AM and 8 AM.', 'If traveling early this morning, be prepared for dense fog that\ncould suddenly reduce visibilities to 1/4 mile or less. Slow down\nand allow extra time to reach your destination.']"
3,WI,Taylor; Clark; Jackson; Monroe; Juneau; Adams,Special Weather Statement,Moderate,Observed,Expected,2022-06-29T03:00:00-05:00,,"['Through 7 AM, areas of dense fog will reduce visibilities to a\nquarter mile or less in central and north central Wisconsin. This\nfog will quickly dissipate between 7 AM and 8 AM.', 'If traveling early this morning, be prepared for dense fog that\ncould suddenly reduce visibilities to 1/4 mile or less. Slow down\nand allow extra time to reach your destination.']"
