,State,Area,Event,Severity,Certainty,Urgency,Effective,Ends,Description
0,AK,Dixon Entrance to Cape Decision Coastal Area; Southern Inner Channels,Dense Fog Advisory,Moderate,Likely,Expected,2022-06-27T03:14:00-08:00,2022-06-27T08:00:00-08:00,"['* WHAT...Visibility one quarter mile or less in dense fog.', '* WHERE...Dixon Entrance to Cape Decision Coastal Area and\nSouthern Inner Channels.', '* WHEN...Until 8 AM AKDT this morning.', '* IMPACTS...Hazardous driving conditions due to low visibility.', '* ADDITIONAL DETAILS...Patchy fog across the area has become\ndense. The fog likely lifts by mid-morning.']"
1,AK,Taiya Inlet and Klondike Highway; Haines Borough and Lynn Canal,Hydrologic Outlook,Unknown,Possible,Future,2022-06-26T13:42:00-08:00,,"['Very warm and well above normal temperatures are expected to\ncontinue into mid week. These near record high temperatures will\nincrease snow and ice melt and subsequent water-levels of area\nrivers including the Chilkat, Klehini, and Taiya.', 'This melt will induce a stair step increase each day through the\nweek. Minor flooding of these rivers are possible and with the\nhighest threat by Tuesday. Interested parties should remain up to\ndate on forecasts over the coming days.']"
0,AR,"White, AR; Woodruff, AR",Flood Warning,Severe,Observed,Immediate,2022-06-26T19:36:00-05:00,,"['* WHAT...Minor flooding is forecast.', '* WHERE...White River At Augusta.', '* WHEN...Until further notice.', '* IMPACTS...At 26.0 feet, Farm ground along the river in White and\nWoodruff counties begin to flood. Seasonal agricultural impacts.', '* ADDITIONAL DETAILS...\n- At 7:00 PM CDT Sunday the stage was 26.0 feet.\n- Forecast...The river will continue to hold nearly steady.\n- Flood stage is 26.0 feet.']"
1,AR,"White, AR; Woodruff, AR",Flood Warning,Severe,Observed,Immediate,2022-06-24T19:35:00-05:00,2022-06-29T01:00:00-05:00,"['* WHAT...Minor flooding is forecast.', '* WHERE...White River At Augusta.', '* WHEN...Until early Wednesday morning.', '* IMPACTS...At 26.0 feet, Farm ground along the river in White and\nWoodruff counties begin to flood. Seasonal agricultural impacts.', '* ADDITIONAL DETAILS...\n- At 7:00 PM CDT Friday the stage was 26.0 feet.\n- Forecast...The river is expected to rise above flood stage by\nearly Saturday morning to a crest of 26.0 feet and remain\nsteady above flood stage at a stage of 26.0 feet through\nSunday.\n- Flood stage is 26.0 feet.']"
0,AZ,"Pima, AZ",Flood Advisory,Minor,Likely,Expected,2022-06-27T02:53:00-07:00,2022-06-27T06:00:00-07:00,"['* WHAT...Flooding caused by excessive rainfall is expected.', '* WHERE...A portion of South Central Arizona, including the\nfollowing county, Pima.', '* WHEN...Until 600 AM MST.', '* IMPACTS...Minor flooding in low-lying and poor drainage areas.\nRises in small streams and normally dry washes.', '* ADDITIONAL DETAILS...\n- At 253 AM MST, Doppler radar and automated rain gauges\nindicated heavy rain due to thunderstorms. Minor flooding is\nongoing or expected to begin shortly in the advisory area. Up\nto 1 inch of rain has fallen.\n- Additional rainfall amounts of 0.5 to 1 inch are expected\nover the area. This additional rain will result in minor\nflooding.\n- Some locations that will experience flooding include...\nTanque Verde, Sabino Canyon Recreation Area, Catalina\nFoothills and Seven Falls.\n- http://www.weather.gov/safety/flood']"
1,AZ,"Maricopa, AZ",Air Quality Alert,Unknown,Unknown,Unknown,2022-06-26T08:36:00-07:00,,"['The Arizona Department of Environmental Quality (ADEQ) has extended\nan Ozone High Pollution Advisory for the Phoenix Metro Area through\nMonday.', 'This means that forecast weather conditions combined with existing\nozone levels are expected to result in local maximum 8-hour ozone\nconcentrations that pose a health risk. Adverse health effects\nincrease as air quality deteriorates.', 'Ozone is an air contaminant which can cause breathing difficulties\nfor children, older adults, as well as persons with respiratory\nproblems. A decrease in physical activity is recommended.', 'You are urged to car pool, telecommute or use mass transit.\nThe use of gasoline-powered equipment should be reduced or done late\nin the day.', 'For details on this High Pollution Advisory, visit the ADEQ internet\nsite at www.azdeq.gov/forecast/phoenix or call 602-771-2300.']"
0,CA,San Diego County Inland Valleys,Heat Advisory,Moderate,Likely,Expected,2022-06-27T03:11:00-07:00,2022-06-27T20:00:00-07:00,"['* WHAT...Temperatures up to 103.', '* WHERE...San Diego County Valleys.', '* WHEN...Until 8 PM PDT this evening.', '* IMPACTS...Hot temperatures may cause heat illnesses to occur.', '* ADDITIONAL DETAILS...Not quite as hot for Tuesday and Wednesday\nwith a cooling trend.']"
1,CA,Santa Ana Mountains and Foothills,Heat Advisory,Moderate,Likely,Expected,2022-06-27T03:11:00-07:00,2022-06-27T20:00:00-07:00,"['* WHAT...Temperatures up to 98.', '* WHERE...Santa Ana Mountains and Foothills.', '* WHEN...Until 8 PM PDT this evening.', '* IMPACTS...Hot temperatures may cause heat illnesses to occur.', '* ADDITIONAL DETAILS...Not quite as hot for Tuesday and Wednesday\nwith a cooling trend.']"
2,CA,Orange County Inland,Heat Advisory,Moderate,Likely,Expected,2022-06-27T03:11:00-07:00,2022-06-27T20:00:00-07:00,"['* WHAT...Temperatures up to 93.', '* WHERE...Orange County Inland Areas.', '* WHEN...Until 8 PM PDT this evening.', '* IMPACTS...Hot temperatures may cause heat illnesses to occur.', '* ADDITIONAL DETAILS...Not quite as hot for Tuesday and Wednesday\nwith a cooling trend.']"
3,CA,San Bernardino and Riverside County Valleys-The Inland Empire,Heat Advisory,Moderate,Likely,Expected,2022-06-27T03:11:00-07:00,2022-06-27T20:00:00-07:00,"['* WHAT...Temperatures up to 105.', '* WHERE...San Bernardino and Riverside County Valleys-The Inland\nEmpire.', '* WHEN...Until 8 PM PDT this evening.', '* IMPACTS...Hot temperatures may cause heat illnesses to occur.', '* ADDITIONAL DETAILS...Not quite as hot for Tuesday and Wednesday\nwith a cooling trend.']"
4,CA,West Side Mountains north of 198; Los Banos - Dos Palos; Merced - Madera - Mendota; Planada - Le Grand - Snelling; Coalinga - Avenal; West Side of Fresno and Kings Counties; Caruthers - San Joaquin - Selma; Fresno-Clovis; West Side Mountains South of 198; Buttonwillow - Lost Hills - I5; Delano-Wasco-Shafter; Hanford - Corcoran - Lemoore; Visalia - Porterville - Reedley; Buena Vista; Bakersfield; Southeast San Joaquin Valley; South End San Joaquin Valley; Mariposa Madera Foothills; Fresno-Tulare Foothills; South End Sierra Foothills; Kern River Valley,Heat Advisory,Moderate,Likely,Expected,2022-06-27T02:20:00-07:00,2022-06-28T21:00:00-07:00,"[""* WHAT...High temperatures of 102 to 107 degrees. Overnight lows\nin the upper 60's to upper 70's."", '* WHERE...San Joaquin Valley, Coastal Range, and Kern River\nValley.', '* WHEN...Until 9 PM PDT Tuesday.', '* IMPACTS...High heat will significantly increase the potential\nfor heat related illnesses, particularly for those working or\nparticipating in outdoor activities.']"
5,CA,Ventura County Mountains; Santa Barbara County Interior Mountains,Heat Advisory,Moderate,Likely,Expected,2022-06-27T01:42:00-07:00,2022-06-27T20:00:00-07:00,"['* WHAT...High temperatures ranging from 90 to 100 degrees. Low\ntemperatures ranging from 70 to 80 degrees.', '* WHERE...Santa Barbara County Interior Mountains and Ventura\nCounty Mountains.', '* WHEN...Until 8 PM PDT this evening.', '* IMPACTS...Hot temperatures may cause heat illnesses to occur.']"
6,CA,Cuyama Valley; Southern Salinas Valley; San Luis Obispo County Interior Valleys; San Luis Obispo County Mountains,Heat Advisory,Moderate,Likely,Expected,2022-06-27T01:42:00-07:00,2022-06-27T20:00:00-07:00,"['* WHAT...High temperatures ranging from 95 to 107 expected.', '* WHERE...Cuyama Valley, San Luis Obispo County Mountains, San\nLuis Obispo County Interior Valleys and Southern Salinas\nValley.', '* WHEN...Until 8 PM PDT this evening.', '* IMPACTS...Hot temperatures may cause heat illnesses to occur.']"
7,CA,Santa Ynez Valley; Santa Ynez Mountains Western Range; Santa Ynez Mountains Eastern Range,Heat Advisory,Moderate,Likely,Expected,2022-06-27T01:42:00-07:00,2022-06-27T20:00:00-07:00,"['* WHAT...High temperatures ranging from 85 to 105 degrees. Low\ntemperatures in the 70s across the foothills.', '* WHERE...Santa Ynez Mountains Western Range, Santa Ynez\nMountains Eastern Range and Santa Ynez Valley.', '* WHEN...Until 8 PM PDT this evening.', '* IMPACTS...Hot temperatures may cause heat illnesses to occur.']"
8,CA,Lake Casitas; Ojai Valley; Central Ventura County Valleys; Southeastern Ventura County Valleys,Heat Advisory,Moderate,Likely,Expected,2022-06-27T01:42:00-07:00,2022-06-27T20:00:00-07:00,"['* WHAT...High temperatures ranging from 88 to 103 degrees.', '* WHERE...Central Ventura County Valleys, Southeastern Ventura\nCounty Valleys, Lake Casitas and Ojai Valley.', '* WHEN...Until 8 PM PDT this evening.', '* IMPACTS...Hot temperatures may cause heat illnesses to occur.']"
9,CA,Los Angeles County Mountains; Santa Clarita Valley; Los Angeles County San Fernando Valley; Los Angeles County San Gabriel Valley,Heat Advisory,Moderate,Likely,Expected,2022-06-27T01:42:00-07:00,2022-06-27T20:00:00-07:00,"['* WHAT...High temperatures ranging from 95 to 105 degrees. Low\ntemperatures 65 to 70 degrees in the valleys, and 70 to 80 in\nthe foothills and mountains.', '* WHERE...Santa Clarita Valley, Los Angeles County San Fernando\nValley, Los Angeles County Mountains and Los Angeles County\nSan Gabriel Valley.', '* WHEN...Until 8 PM PDT this evening.', '* IMPACTS...Hot temperatures may cause heat illnesses to occur.']"
10,CA,Santa Monica Mountains,Heat Advisory,Moderate,Likely,Expected,2022-06-27T01:42:00-07:00,2022-06-27T20:00:00-07:00,"['* WHAT...High temperatures ranging from 90 to 102 degrees. Low\ntemperatures in the 70s.', '* WHERE...Santa Monica Mountains.', '* WHEN...Until 8 PM PDT this evening.', '* IMPACTS...Hot temperatures may cause heat illnesses to occur.']"
11,CA,Modoc County; Northern and Eastern Klamath County and Western Lake County; Central and Eastern Lake County,Heat Advisory,Moderate,Likely,Expected,2022-06-26T21:50:00-07:00,2022-06-27T23:00:00-07:00,"['* WHAT...Temperatures up to 97 degrees on Monday. High\ntemperatures will be slightly cooler at elevation', '* WHERE...In California, all areas except the higher mountains of\nModoc County. In Oregon, Northern and Eastern Klamath County\nand Western Lake County and Central and Eastern Lake County\nincluding Lakeview, Adel, Bly, Beatty, Sprague River, Silver\nLake, Summer Lake, Chemult, and Crescent.', '* WHEN...Until 11 PM PDT Monday.', '* IMPACTS...Hot temperatures could cause heat illness.', '* View the hazard area in detail at\nhttps://www.wrh.noaa.gov/map/?wfo=mfr']"
12,CA,Central Siskiyou County; Central Douglas County; Eastern Curry County and Josephine County; Jackson County,Heat Advisory,Moderate,Likely,Expected,2022-06-26T21:50:00-07:00,2022-06-27T23:00:00-07:00,"[""* WHAT...Overnight lows in the mid 60's with temperatures up to\n100 degrees on Monday. High temperatures will be slightly cooler\nat elevation"", '* WHERE...In California, the Klamath and Shasta valleys. In\nOregon, Central Douglas County including Roseburg, Tri-City,\nTiller, Azalea, Glendale, Camas Valley, Sutherlin, Elkton,\nDrain, and Scottsburg. Also in Oregon, all of Jackson County,\nEastern Curry County and Josephine County including the\nIllinois Valley, Grants Pass, and Agness.', '* WHEN...Until 11 PM PDT Monday.', '* IMPACTS...Hot temperatures could cause heat illness.', '* View the hazard area in detail at\nhttps://www.wrh.noaa.gov/map/?wfo=mfr']"
13,CA,South Central Siskiyou County; North Central and Southeast Siskiyou County; Northeast Siskiyou and Northwest Modoc Counties; South Central Oregon Cascades; Siskiyou Mountains and Southern Oregon Cascades; Klamath Basin,Heat Advisory,Moderate,Likely,Expected,2022-06-26T21:50:00-07:00,2022-06-27T23:00:00-07:00,"[""* WHAT...Overnight lows in the low 60's and lower 50's east of the\nCascades with high temperatures up to 98 degrees on Monday.\nHigh temperatures will be slightly cooler at elevation"", '* WHERE...In California, Dunsmuir, Mount Shasta City, Tennant,\nMacdoel, Dorris, and Tulelake. In Oregon, portions of the\nCascades, including Howard Prairie. Also, much of the Upper\nKlamath Basin including Keno, Klamath Falls, Bonanza, and\nChiloquin.', '* WHEN...Until 11 PM PDT Monday.', '* IMPACTS...Hot temperatures could cause heat illness.', '* View the hazard area in detail at\nhttps://www.wrh.noaa.gov/map/?wfo=mfr']"
14,CA,Southern Salinas Valley/Arroyo Seco and Lake San Antonio; Mountains Of San Benito County And Interior Monterey County Including Pinnacles National Monument,Heat Advisory,Moderate,Likely,Expected,2022-06-26T20:36:00-07:00,2022-06-27T22:00:00-07:00,"['* WHAT...Hot conditions with daytime temperatures from low 90s\nto 104. Overnight lows in the 60s to 70s in the hills.', '* WHERE...Southern Salinas Valley/Arroyo Seco and Lake San\nAntonio and Mountains Of San Benito County and Interior\nMonterey County Including Pinnacles National Monument.', '* WHEN...Until 10 PM PDT Monday.', '* IMPACTS...Extreme heat will significantly increase the\npotential for heat related illnesses, particularly for those\nworking or participating in outdoor activities.', '* ADDITIONAL DETAILS...Hottest locations will be far southern\nSalinas Valley and interior portions of San Benito county.']"
15,CA,Ventura County Mountains; Santa Barbara County Interior Mountains,Heat Advisory,Moderate,Likely,Expected,2022-06-26T09:43:00-07:00,2022-06-27T20:00:00-07:00,"['* WHAT...High temperatures ranging from 90 to 100 degrees. Low\ntemperatures ranging from 70 to 80 degrees.', '* WHERE...Santa Barbara County Interior Mountains and Ventura\nCounty Mountains.', '* WHEN...Until 8 PM PDT Monday.', '* IMPACTS...Hot temperatures may cause heat illnesses to occur.']"
16,CA,Santa Monica Mountains,Heat Advisory,Moderate,Likely,Expected,2022-06-26T09:43:00-07:00,2022-06-27T20:00:00-07:00,"['* WHAT...High temperatures ranging from 90 to 102 degrees.', '* WHERE...Santa Monica Mountains.', '* WHEN...Until 8 PM PDT Monday.', '* IMPACTS...Hot temperatures may cause heat illnesses to occur.']"
17,CA,Santa Ynez Valley; Santa Ynez Mountains Western Range; Santa Ynez Mountains Eastern Range,Heat Advisory,Moderate,Likely,Expected,2022-06-26T09:43:00-07:00,2022-06-27T20:00:00-07:00,"['* WHAT...High temperatures ranging from 85 to 105 degrees.', '* WHERE...Santa Ynez Mountains Western Range, Santa Ynez\nMountains Eastern Range and Santa Ynez Valley.', '* WHEN...Until 8 PM PDT Monday.', '* IMPACTS...Hot temperatures may cause heat illnesses to occur.']"
18,CA,Cuyama Valley; Southern Salinas Valley; San Luis Obispo County Interior Valleys; San Luis Obispo County Mountains,Heat Advisory,Moderate,Likely,Expected,2022-06-26T09:43:00-07:00,2022-06-27T20:00:00-07:00,"['* WHAT...High temperatures ranging from 95 to 107 expected.', '* WHERE...Cuyama Valley, San Luis Obispo County Mountains, San\nLuis Obispo County Interior Valleys and Southern Salinas\nValley.', '* WHEN...Until 8 PM PDT Monday.', '* IMPACTS...Hot temperatures may cause heat illnesses to occur.']"
19,CA,Los Angeles County Mountains; Santa Clarita Valley; Los Angeles County San Fernando Valley; Los Angeles County San Gabriel Valley,Heat Advisory,Moderate,Likely,Expected,2022-06-26T09:43:00-07:00,2022-06-27T20:00:00-07:00,"['* WHAT...High temperatures ranging from 95 to 105 degrees.', '* WHERE...Santa Clarita Valley, Los Angeles County San Fernando\nValley, Los Angeles County Mountains and Los Angeles County\nSan Gabriel Valley.', '* WHEN...Until 8 PM PDT Monday.', '* IMPACTS...Hot temperatures may cause heat illnesses to occur.']"
20,CA,Lake Casitas; Ojai Valley; Central Ventura County Valleys; Southeastern Ventura County Valleys,Heat Advisory,Moderate,Likely,Expected,2022-06-26T09:43:00-07:00,2022-06-27T20:00:00-07:00,"['* WHAT...High temperatures ranging from 88 to 103 degrees.', '* WHERE...Central Ventura County Valleys, Southeastern Ventura\nCounty Valleys, Lake Casitas and Ojai Valley.', '* WHEN...Until 8 PM PDT Monday.', '* IMPACTS...Hot temperatures may cause heat illnesses to occur.']"
21,CA,San Bernardino and Riverside County Valleys-The Inland Empire,Heat Advisory,Moderate,Likely,Expected,2022-06-24T21:37:00-07:00,2022-06-27T20:00:00-07:00,"['* WHAT...High temperatures of 100 to 105 degrees expected.', '* WHERE...San Bernardino and Riverside County Valleys-The Inland\nEmpire.', '* WHEN...From 10 AM Sunday to 8 PM PDT Monday.', '* IMPACTS...Hot temperatures may cause heat illnesses to occur.', '* ADDITIONAL DETAILS...Overnight minimum temperatures will only\ndrop into the low to mid 70s, providing little relief from the\nheat.']"
22,CA,Los Angeles County Mountains; Santa Clarita Valley; Los Angeles County San Fernando Valley; Los Angeles County San Gabriel Valley,Heat Advisory,Moderate,Likely,Expected,2022-06-24T13:45:00-07:00,2022-06-27T20:00:00-07:00,"['* WHAT...High temperatures range from 95 to 105 degrees F.', '* WHERE...Los Angeles County Mountains, Santa Clarita Valley,\nLos Angeles County San Fernando Valley and Los Angeles County\nSan Gabriel Valley.', '* WHEN...From 10 AM Sunday to 8 PM PDT Monday.', '* IMPACTS...Hot temperatures may cause heat illnesses to occur.']"
23,CA,San Bernardino and Riverside County Valleys-The Inland Empire,Heat Advisory,Moderate,Likely,Expected,2022-06-24T13:30:00-07:00,2022-06-27T20:00:00-07:00,"['* WHAT...High temperatures of 100 to 105 degrees expected.', '* WHERE...San Bernardino and Riverside County Valleys-The Inland\nEmpire.', '* WHEN...From 10 AM Sunday to 8 PM PDT Monday.', '* IMPACTS...Hot temperatures may cause heat illnesses to occur.', '* ADDITIONAL DETAILS...Overnight minimum temperatures will only\ndrop into the low to mid 70s, providing little relief from the\nheat.']"
0,CO,"Boulder, CO; Weld, CO; Adams, CO; Denver, CO; Jefferson, CO; Douglas, CO; Arapahoe, CO; Broomfield, CO; Larimer, CO",Air Quality Alert,Unknown,Unknown,Unknown,2022-06-26T16:10:00-06:00,,"['The Colorado Department of Public Health and Environment has\nissued the following...', 'WHAT...Ozone Action Day Alert.', 'WHERE...Douglas, Jefferson, Denver, western Arapahoe, western\nAdams, Broomfield, Boulder, Larimer, and Weld Counties', 'WHEN...400 PM Sunday June 26 to 400 PM Monday June 27', 'IMPACTS...Ozone Action Day Alert is now in effect for the Front\nRange Urban Corridor. Requests to limit driving of non-ZEV\nvehicles (i.e., gas or diesel) are now in effect until at least 4\np.m. Monday, June 27, 2022.  Although air quality will be Good on\nSunday, ozone concentrations are expected to be much higher on\nMonday. Ozone concentrations in the Unhealthy for Sensitive Groups\ncategory will be most likely Monday afternoon and evening for\nsouthern and western portions of the Denver metro area, including\nHighlands Ranch and Golden. For areas included in this advisory\nthat are not expected to reach the Unhealthy for Sensitive Groups\n(USG) air quality designation, we request that activities, such as\ndriving non-ZEV vehicles (i.e., gas or diesel), be reduced to\nlessen the impacts on neighboring air quality. Additional air\npollution in this region may directly worsen air quality or\ncontribute to precursors which may also adversely affect air\nquality.  For Colorado air quality conditions, forecasts and\nadvisories, visit:\nhttps://www.colorado.gov/airquality/colorado_summary.aspx', 'HEALTH INFORMATION...Increasing likelihood of respiratory symptoms\nand breathing discomfort in active children and adults and people\nwith lung disease, such as asthma. Active children and adults, and\npeople with lung disease, such as asthma, should reduce prolonged\nor heavy outdoor exertion.']"
0,FL,Coastal Franklin,Rip Current Statement,Moderate,Likely,Expected,2022-06-26T12:06:00-04:00,2022-06-28T00:00:00-04:00,"['* WHAT...Dangerous rip currents.', '* WHERE...Franklin County Beaches.', '* WHEN...Through Monday evening.', '* IMPACTS...Rip currents can sweep even the best swimmers away\nfrom shore into deeper water.']"
0,HI,Niihau; Kauai Southwest; Waianae Coast; Kahoolawe; Maui Leeward West; Kona; Kauai South; East Honolulu; Honolulu Metro; Ewa Plain; Molokai Leeward South; Lanai Leeward; Lanai South; Maui Central Valley South; South Maui/Upcountry; South Haleakala; Big Island South; Big Island Southeast,High Surf Advisory,Minor,Likely,Expected,2022-06-26T14:02:00-10:00,2022-06-27T18:00:00-10:00,"['* WHAT...Large breaking waves of 7 to 10 feet.', '* WHERE...South facing shores of Kahoolawe, Kauai, Lanai, Maui,\nMolokai, Niihau, Oahu and the Big Island.', '* WHEN...Until 6 PM HST Monday, though another pulse of south\nswell will produce elevated surf on Tuesday.', '* IMPACTS...Moderate. Expect strong breaking waves, shore break,\nand strong longshore and rip currents making swimming difficult\nand dangerous.']"
0,ID,Lewiston Area; Lower Garfield and Asotin Counties,Heat Advisory,Moderate,Likely,Expected,2022-06-26T21:39:00-07:00,2022-06-27T23:00:00-07:00,"['* WHAT...High temperatures 95 to 100.', '* WHERE...Peck, Clarkston, Pomeroy, Gifford, Clarkston Heights,\nLapwai, Culdesac, and Lewiston.', '* WHEN...From 11 AM to 11 PM PDT Monday.', '* IMPACTS...Hot temperatures may cause heat illness especially to\nthose who are heat sensitive and those without effective cooling\nand/or adequate hydration.']"
1,ID,Lower Hells Canyon/Salmon River Region,Heat Advisory,Moderate,Likely,Expected,2022-06-26T14:55:00-06:00,2022-06-27T21:00:00-06:00,"['* WHAT...Temperatures up to 103 expected.', '* WHERE...Lower Hells Canyon/Salmon River Region.', '* WHEN...From 11 AM to 8 PM PDT Monday.', '* IMPACTS...Hot temperatures may cause heat illnesses to occur.']"
2,ID,"Bonner, ID; Pend Oreille, WA",Flood Warning,Severe,Observed,Immediate,2022-06-21T07:46:00-07:00,2022-06-27T19:46:00-07:00,"['* WHAT...Minor flooding is occurring and minor flooding is forecast.', '* WHERE...Pend Oreille River below Albeni Falls.', '* WHEN...Until Monday evening.', '* IMPACTS...At 100,000 cfs, Beehive Lane and Bear Paw Dr will be\nflooded at low spots. Water will be up to several homes on Yergens\nRd, Riverbend Loop Road, and on Highway 20 near Deeter Road. Water\nwill be up to the south end of Riverbend Loop Road. Many yards,\noutbuildings, and recreational sites along the river between\nNewport and Ione will be flooded. This flow corresponds\napproximately to 2042.5 feet (river rising 5/16/1997) to 2045 feet\n(river receding 6/24/1997) at the Cusick gage, based on 1997\nrecords.', '* ADDITIONAL DETAILS...\n- At 7:00 AM PDT Tuesday the flow was 101,700 cfs.\n- Recent Activity...The maximum river flow in the 24 hours\nending at 7:00 AM PDT Tuesday was 101,900 cfs.\n- Forecast...The river is expected to slowly fall, dropping\nbelow flood stage by next week Monday.\n- Flood flow is 95,000 cfs.\n- http://www.weather.gov/safety/flood']"
0,IA,"Clinton, IA; Scott, IA",Flood Warning,Severe,Observed,Immediate,2022-06-26T20:12:00-05:00,2022-07-02T14:20:00-05:00,"['* WHAT...Minor flooding is occurring and moderate flooding is\nforecast.', '* WHERE...Wapsipinicon River near De Witt 4S.', '* WHEN...Until early Saturday afternoon.', '* IMPACTS...At 11.5 feet, Moderate Flood Stage. Water affects homes\nalong old U.S. Highway 61.', '* ADDITIONAL DETAILS...\n- At 7:30 PM CDT Sunday the stage was 11.3 feet.\n- Forecast...The river will fall below flood stage just after\nmidnight tonight to 10.5 feet tomorrow evening. It will then\nrise above flood stage Tuesday evening to 11.7 feet Friday\nmorning. It will fall below flood stage again Friday evening.\n- Flood stage is 11.0 feet.']"
0,ME,Coastal York; Coastal Cumberland; Sagadahoc; Lincoln; Knox; Coastal Waldo,Air Quality Alert,Unknown,Unknown,Unknown,2022-06-26T14:37:00-04:00,,"[""The Maine Department of Environmental Protection's Bureau of Air\nQuality has issued an Air Quality Alert for ozone and particle\npollution from 11 AM this morning to 11 PM EDT this evening."", 'Ozone levels are expected to rise into the Unhealthy for Sensitive\nGroups range along the coast from Kittery through Acadia National\nPark on Sunday June 26. At elevated ozone levels, children, healthy\nadults who exert themselves, and individuals suffering from\nrespiratory disease such as asthma, bronchitis, or COPD can\nexperience reduced lung function and irritation. When this happens,\nindividuals may notice a shortness of breath, coughing, throat\nirritation, and/or experience an uncomfortable sensation to their\nchest. In addition, particulate pollution levels are expected to be\nmoderate for the same area. Although temperatures will not reach the\nHeat Alert levels, it will be warm so it is important to remember\nthat even in areas with moderate ozone and particulate pollution the\nhealth impacts will be compounded by the effects of the heat and\nhumidity.', 'The Maine Department of Environmental Protection recommends that\nindividuals consider limiting strenuous outdoor physical activity to\nreduce the risk of adverse health effects. People who may be\nespecially sensitive to the effects of elevated levels of pollutants\ninclude the very young, the elderly and those with pre-existing\nrespiratory problems such as asthma and or heart disease. Those with\nsymptoms should consider consulting their personal physician.', 'A toll free air quality hotline has been established so Maine\nresidents can stay informed on the air quality situations. The toll\nfree number is: 1-800-223-1196.', 'Additionally the Maine Department of Environmental Protection has\nthe air quality forecast available on the web at\nwww.maine.gov/dep/air/aqforecast.']"
