,State,Area,Event,Severity,Certainty,Urgency,Effective,Ends,Description
17,KS,Phillips; Smith; Jewell; Rooks; Osborne; Mitchell; Furnas,Red Flag Warning,Severe,Likely,Expected,2022-04-06T10:45:00-05:00,2022-04-06T20:00:00-05:00,"['* AFFECTED AREA...In Kansas, Fire Weather Zone 005 Phillips,\nFire Weather Zone 006 Smith, Fire Weather Zone 007 Jewell,\nFire Weather Zone 017 Rooks, Fire Weather Zone 018 Osborne and\nFire Weather Zone 019 Mitchell. In Nebraska, Fire Weather Zone\n082 Furnas.', '* WINDS...Northwest 30 to 40 mph with gusts up to 60 mph.', '* TIMING...For the Red Flag Warning for Today, until 8 PM. For\nthe Red Flag Warning for Thursday, from Noon to 8 PM.', '* RELATIVE HUMIDITY...As low as 20 to 25 percent.', '* IMPACTS...Any fires that ignite may spread rapidly and exhibit\nextreme fire behavior. Use extreme caution if engaging in\nactivities that could result in fire ignition.']"
18,KS,Atchison; Miami; Doniphan; Leavenworth; Wyandotte; Johnson; Holt; Andrew; De Kalb; Buchanan; Clinton; Caldwell; Livingston; Platte; Clay; Ray; Carroll; Chariton; Randolph; Jackson; Lafayette; Saline; Howard; Cass; Johnson; Pettis; Cooper,Special Weather Statement,Moderate,Observed,Expected,2022-04-06T04:43:00-05:00,,"['Sustained westerly winds across the region of 20 to 25 mph will\nbe accompanied by frequent gusts of 30 to 35 mph this afternoon.\nAdditionally, relative humidity values will range from around 30\nto 35 percent this afternoon.', 'This combination of strong wind gusts and fairly dry relative\nhumidity will result in elevated fire weather conditions across\nmuch of the region this afternoon. Outdoor burning of any kind is\nstrongly discouraged and any fire would have the potential to\nrapidly spread.', 'While winds will remain elevated tonight and increase once more\nwith gusts to 40 mph tomorrow afternoon, increased humidity\nvalues will keep fire weather concerns tempered.']"
19,KS,Trego; Ellis; Scott; Lane; Ness; Rush; Hamilton; Kearny; Finney; Hodgeman; Pawnee; Stafford; Stanton; Grant; Haskell; Gray; Ford; Edwards; Kiowa; Pratt; Morton; Stevens; Seward; Meade; Clark; Comanche; Barber,Red Flag Warning,Severe,Likely,Expected,2022-04-06T04:15:00-05:00,2022-04-07T21:00:00-05:00,"['The National Weather Service in Dodge City has issued a Red Flag\nWarning for wind and low relative humidity, which is in effect\nfrom noon CDT /11 AM MDT/ to 9 PM CDT /8 PM MDT/ Thursday. The\nFire Weather Watch is no longer in effect.', '* Affected Area...In Kansas...Fire Weather Zone 030 Trego...Fire\nWeather Zone 031 Ellis...Fire Weather Zone 043 Scott...Fire\nWeather Zone 044 Lane...Fire Weather Zone 045 Ness...Fire\nWeather Zone 046 Rush...Fire Weather Zone 061 Hamilton...Fire\nWeather Zone 062 Kearny...Fire Weather Zone 063 Finney...Fire\nWeather Zone 064 Hodgeman...Fire Weather Zone 065 Pawnee...\nFire Weather Zone 066 Stafford...Fire Weather Zone 074\nStanton...Fire Weather Zone 075 Grant...Fire Weather Zone 076\nHaskell...Fire Weather Zone 077 Gray...Fire Weather Zone 078\nFord...Fire Weather Zone 079 Edwards...Fire Weather Zone 080\nKiowa...Fire Weather Zone 081 Pratt...Fire Weather Zone 084\nMorton...Fire Weather Zone 085 Stevens...Fire Weather Zone 086\nSeward...Fire Weather Zone 087 Meade...Fire Weather Zone 088\nClark...Fire Weather Zone 089 Comanche and Fire Weather Zone\n090 Barber.', '* Winds...Northwest 35 to 45 mph with gusts up to 60 mph.', '* Relative Humidity...As low as 13 percent.', '* Impacts...Any fires that start will have extreme fire behavior\nand spread rapidly. Outdoor burning is not advised.']"
20,KS,Trego; Ellis; Scott; Lane; Ness; Rush; Hamilton; Kearny; Finney; Hodgeman; Pawnee; Stafford; Stanton; Grant; Haskell; Gray; Ford; Edwards; Kiowa; Pratt; Morton; Stevens; Seward; Meade; Clark; Comanche; Barber,Red Flag Warning,Severe,Likely,Expected,2022-04-06T04:15:00-05:00,2022-04-06T20:00:00-05:00,"['The National Weather Service in Dodge City has issued a Red Flag\nWarning for wind and low relative humidity, which is in effect\nfrom noon CDT /11 AM MDT/ to 9 PM CDT /8 PM MDT/ Thursday. The\nFire Weather Watch is no longer in effect.', '* Affected Area...In Kansas...Fire Weather Zone 030 Trego...Fire\nWeather Zone 031 Ellis...Fire Weather Zone 043 Scott...Fire\nWeather Zone 044 Lane...Fire Weather Zone 045 Ness...Fire\nWeather Zone 046 Rush...Fire Weather Zone 061 Hamilton...Fire\nWeather Zone 062 Kearny...Fire Weather Zone 063 Finney...Fire\nWeather Zone 064 Hodgeman...Fire Weather Zone 065 Pawnee...\nFire Weather Zone 066 Stafford...Fire Weather Zone 074\nStanton...Fire Weather Zone 075 Grant...Fire Weather Zone 076\nHaskell...Fire Weather Zone 077 Gray...Fire Weather Zone 078\nFord...Fire Weather Zone 079 Edwards...Fire Weather Zone 080\nKiowa...Fire Weather Zone 081 Pratt...Fire Weather Zone 084\nMorton...Fire Weather Zone 085 Stevens...Fire Weather Zone 086\nSeward...Fire Weather Zone 087 Meade...Fire Weather Zone 088\nClark...Fire Weather Zone 089 Comanche and Fire Weather Zone\n090 Barber.', '* Winds...Northwest 35 to 45 mph with gusts up to 60 mph.', '* Relative Humidity...As low as 13 percent.', '* Impacts...Any fires that start will have extreme fire behavior\nand spread rapidly. Outdoor burning is not advised.']"
21,KS,Cheyenne; Rawlins; Decatur; Norton; Sherman; Thomas; Sheridan; Graham; Wallace; Logan; Gove; Greeley; Wichita; Dundy; Hitchcock; Red Willow,Red Flag Warning,Severe,Likely,Expected,2022-04-06T03:11:00-06:00,2022-04-07T20:00:00-06:00,"['The National Weather Service in Goodland has issued a Red Flag\nWarning for wind and low relative humidity, which is in effect\nfrom 11 AM MDT /noon CDT/ to 8 PM MDT /9 PM CDT/ Thursday. The\nFire Weather Watch is no longer in effect.', '* Affected Area...In Kansas...Fire Weather Zone 001 Cheyenne...\nFire Weather Zone 002 Rawlins...Fire Weather Zone 003\nDecatur... Fire Weather Zone 004 Norton...Fire Weather Zone\n013 Sherman... Fire Weather Zone 014 Thomas...Fire Weather\nZone 015 Sheridan... Fire Weather Zone 016 Graham...Fire\nWeather Zone 027 Wallace... Fire Weather Zone 028 Logan...Fire\nWeather Zone 029 Gove...Fire Weather Zone 041 Greeley and Fire\nWeather Zone 042 Wichita. In Nebraska...Fire Weather Zone 079\nDundy...Fire Weather Zone 080 Hitchcock and Fire Weather Zone\n081 Red Willow.', '* Winds...For Wednesday, northwest 35 to 45 mph with gusts up to\n65 mph. For Thursday, north-northwest 35 to 45 mph with gusts\nup to 60 mph.', '* Relative Humidity...For Wednesday, as low as 16 percent. For\nThursday, as low as 18 percent.', '* Impacts...Any fires that start will have extreme fire behavior\nand spread rapidly. Outdoor burning is not advised. Abrupt\nchanges in wind direction and speed are not expected.']"
22,KS,Trego; Ellis; Scott; Lane; Ness; Rush; Hamilton; Kearny; Finney; Hodgeman; Pawnee; Stanton; Grant; Haskell; Gray; Ford; Edwards; Kiowa; Morton; Stevens; Seward; Meade; Clark; Comanche,High Wind Warning,Severe,Likely,Expected,2022-04-06T04:11:00-05:00,2022-04-07T20:00:00-05:00,"[""* WHAT...For today's High Wind Warning, northwest winds 35 to 45\nmph with gusts up to around 60 mph expected. For Thursday's High\nWind Warning, northwest winds 35 to 45 mph with gusts up to\naround 60 mph expected."", '* WHERE...Portions of central, south central, southwest and west\ncentral Kansas.', '* WHEN...For the first High Wind Warning, from noon CDT /11 AM\nMDT/ today to 8 PM CDT /7 PM MDT/ this evening. For the second\nHigh Wind Warning, from noon CDT /11 AM MDT/ to 8 PM CDT /7 PM\nMDT/ Thursday.', '* IMPACTS...Damaging winds will blow down trees and power lines.\nWidespread power outages are expected. Travel will be\ndifficult, especially for high profile vehicles.']"
23,KS,Cheyenne; Rawlins; Decatur; Norton; Sherman; Thomas; Sheridan; Graham; Wallace; Logan; Gove; Greeley; Wichita; Dundy; Hitchcock; Red Willow,Red Flag Warning,Severe,Likely,Expected,2022-04-06T03:11:00-06:00,2022-04-06T19:00:00-06:00,"['The National Weather Service in Goodland has issued a Red Flag\nWarning for wind and low relative humidity, which is in effect\nfrom 11 AM MDT /noon CDT/ to 8 PM MDT /9 PM CDT/ Thursday. The\nFire Weather Watch is no longer in effect.', '* Affected Area...In Kansas...Fire Weather Zone 001 Cheyenne...\nFire Weather Zone 002 Rawlins...Fire Weather Zone 003\nDecatur... Fire Weather Zone 004 Norton...Fire Weather Zone\n013 Sherman... Fire Weather Zone 014 Thomas...Fire Weather\nZone 015 Sheridan... Fire Weather Zone 016 Graham...Fire\nWeather Zone 027 Wallace... Fire Weather Zone 028 Logan...Fire\nWeather Zone 029 Gove...Fire Weather Zone 041 Greeley and Fire\nWeather Zone 042 Wichita. In Nebraska...Fire Weather Zone 079\nDundy...Fire Weather Zone 080 Hitchcock and Fire Weather Zone\n081 Red Willow.', '* Winds...For Wednesday, northwest 35 to 45 mph with gusts up to\n65 mph. For Thursday, north-northwest 35 to 45 mph with gusts\nup to 60 mph.', '* Relative Humidity...For Wednesday, as low as 16 percent. For\nThursday, as low as 18 percent.', '* Impacts...Any fires that start will have extreme fire behavior\nand spread rapidly. Outdoor burning is not advised. Abrupt\nchanges in wind direction and speed are not expected.']"
24,KS,Trego; Ellis; Scott; Lane; Ness; Rush; Hamilton; Kearny; Finney; Hodgeman; Pawnee; Stanton; Grant; Haskell; Gray; Ford; Edwards; Kiowa; Morton; Stevens; Seward; Meade; Clark; Comanche,High Wind Warning,Severe,Likely,Expected,2022-04-06T04:11:00-05:00,2022-04-06T20:00:00-05:00,"[""* WHAT...For today's High Wind Warning, northwest winds 35 to 45\nmph with gusts up to around 60 mph expected. For Thursday's High\nWind Warning, northwest winds 35 to 45 mph with gusts up to\naround 60 mph expected."", '* WHERE...Portions of central, south central, southwest and west\ncentral Kansas.', '* WHEN...For the first High Wind Warning, from noon CDT /11 AM\nMDT/ today to 8 PM CDT /7 PM MDT/ this evening. For the second\nHigh Wind Warning, from noon CDT /11 AM MDT/ to 8 PM CDT /7 PM\nMDT/ Thursday.', '* IMPACTS...Damaging winds will blow down trees and power lines.\nWidespread power outages are expected. Travel will be\ndifficult, especially for high profile vehicles.']"
25,KS,Linn; Bates; Henry,Red Flag Warning,Severe,Likely,Expected,2022-04-06T03:41:00-05:00,2022-04-06T19:00:00-05:00,"['The National Weather Service in Kansas City/Pleasant Hill has\nissued a Red Flag Warning, which is in effect from noon today to\n7 PM CDT this evening.', '* AFFECTED AREA...Fire weather zone 060.Fire weather zones 053\nand 054.', '* WIND...West winds of 20 to 25 mph with gusts as high as 30 to 35\nmph.', '* HUMIDITY...Humidity values as low as 25% during the afternoon\nhours.', '* IMPACTS...any fires that develop will likely spread rapidly.\nOutdoor burning is not recommended.']"
26,KS,Lincoln; Ellsworth; Saline; Rice; McPherson; Reno; Harvey; Kingman; Sedgwick; Harper; Sumner,Wind Advisory,Moderate,Likely,Expected,2022-04-06T03:29:00-05:00,2022-04-07T20:00:00-05:00,"['* WHAT...For the first Wind Advisory, northwest winds 25 to 35\nmph with gusts up to 55 mph expected. For the second Wind\nAdvisory, northwest winds 25 to 35 mph with gusts up to 50 mph\nexpected.', '* WHERE...Portions of Central and South Central Kansas.', '* WHEN...For the first Wind Advisory, from noon today to 8 PM\nCDT this evening. For the second Wind Advisory, from noon to 8\nPM CDT Thursday.', '* IMPACTS...Gusty winds could blow around unsecured objects. Tree\nlimbs could be blown down and a few power outages may result.', '* ADDITIONAL DETAILS...Blowing dust or smoke from any potential\nwildfires could also reduce visibility.']"
27,KS,Russell; Barton,High Wind Warning,Severe,Likely,Expected,2022-04-06T03:29:00-05:00,2022-04-07T20:00:00-05:00,"['* WHAT...For the first High Wind Warning, northwest winds 30 to 40\nmph with gusts up to 60 mph expected. For the second High Wind\nWarning, northwest winds 30 to 40 mph with gusts up to 60 mph\nexpected.', '* WHERE...Russell and Barton Counties.', '* WHEN...For the first High Wind Warning, from noon today to 8\nPM CDT this evening. For the second High Wind Warning, from\nnoon to 8 PM CDT Thursday.', '* IMPACTS...Damaging winds will blow down trees and power lines.\nWidespread power outages are expected. Travel will be difficult,\nespecially for high profile vehicles.', '* ADDITIONAL DETAILS...Blowing dust or smoke from any potential\nwildfires could also reduce visibility.']"
28,KS,Lincoln; Ellsworth; Saline; Rice; McPherson; Reno; Harvey; Kingman; Sedgwick; Harper; Sumner,Wind Advisory,Moderate,Likely,Expected,2022-04-06T03:29:00-05:00,2022-04-06T20:00:00-05:00,"['* WHAT...For the first Wind Advisory, northwest winds 25 to 35\nmph with gusts up to 55 mph expected. For the second Wind\nAdvisory, northwest winds 25 to 35 mph with gusts up to 50 mph\nexpected.', '* WHERE...Portions of Central and South Central Kansas.', '* WHEN...For the first Wind Advisory, from noon today to 8 PM\nCDT this evening. For the second Wind Advisory, from noon to 8\nPM CDT Thursday.', '* IMPACTS...Gusty winds could blow around unsecured objects. Tree\nlimbs could be blown down and a few power outages may result.', '* ADDITIONAL DETAILS...Blowing dust or smoke from any potential\nwildfires could also reduce visibility.']"
29,KS,Russell; Barton,High Wind Warning,Severe,Likely,Expected,2022-04-06T03:29:00-05:00,2022-04-06T20:00:00-05:00,"['* WHAT...For the first High Wind Warning, northwest winds 30 to 40\nmph with gusts up to 60 mph expected. For the second High Wind\nWarning, northwest winds 30 to 40 mph with gusts up to 60 mph\nexpected.', '* WHERE...Russell and Barton Counties.', '* WHEN...For the first High Wind Warning, from noon today to 8\nPM CDT this evening. For the second High Wind Warning, from\nnoon to 8 PM CDT Thursday.', '* IMPACTS...Damaging winds will blow down trees and power lines.\nWidespread power outages are expected. Travel will be difficult,\nespecially for high profile vehicles.', '* ADDITIONAL DETAILS...Blowing dust or smoke from any potential\nwildfires could also reduce visibility.']"
30,KS,Marion; Chase; Butler; Cowley,Wind Advisory,Moderate,Likely,Expected,2022-04-06T03:29:00-05:00,2022-04-06T20:00:00-05:00,"['* WHAT...Northwest winds 25 to 35 mph with gusts up to 50 mph\nexpected.', '* WHERE...Portions of Central and South Central Kansas.', '* WHEN...From noon to 8 PM CDT Wednesday.', '* IMPACTS...Gusty winds could blow around unsecured objects. Tree\nlimbs could be blown down and a few power outages may result.']"
31,KS,Russell; Lincoln; Barton; Ellsworth; Rice; Reno; Kingman; Harper,Red Flag Warning,Severe,Likely,Expected,2022-04-06T03:24:00-05:00,2022-04-07T20:00:00-05:00,"['The National Weather Service in Wichita has issued a Red Flag\nWarning for extreme grassland fire danger, which is in effect\nfrom noon to 8 PM CDT Thursday. The Fire Weather Watch is no\nlonger in effect.', '* Extreme Grassland Fire Danger...Is forecast.', '* Winds...Northwest 30 to 40 mph with gusts up to 55 mph.', '* Relative Humidity...As low as 18 percent.', '* Impacts...Any fires that develop will likely spread rapidly\nand become very difficult to control. Outdoor burning is not\nrecommended.']"
32,KS,Saline; McPherson; Harvey; Sedgwick; Sumner,Fire Weather Watch,Severe,Possible,Future,2022-04-06T03:24:00-05:00,2022-04-07T20:00:00-05:00,"['* Extreme Grassland Fire Danger...Is forecast.', '* Winds...Northwest 25 to 35 mph with gusts up to 50 mph.', '* Relative Humidity...As low as 19 percent.', '* Impacts...Any fires that develop will likely spread rapidly\nand become very difficult to control. Outdoor burning is not\nrecommended.']"
33,KS,Marion; Chase; Butler; Cowley,Red Flag Warning,Severe,Likely,Expected,2022-04-06T03:24:00-05:00,2022-04-06T20:00:00-05:00,"['* Extreme Grassland Fire Danger...Is forecast.', '* Winds...Northwest 25 to 35 mph with gusts up to 50 mph.', '* Relative Humidity...As low as 18 percent.', '* Impacts...Any fires that develop will likely spread rapidly\nand become very difficult to control. Outdoor burning is not\nrecommended.']"
34,KS,Greenwood; Woodson; Allen; Elk; Wilson; Neosho; Chautauqua; Montgomery; Labette,Red Flag Warning,Severe,Likely,Expected,2022-04-06T03:24:00-05:00,2022-04-06T20:00:00-05:00,"['The National Weather Service in Wichita has issued a Red Flag\nWarning for extreme grassland fire danger, which is in effect\nfrom noon today to 8 PM CDT this evening.', '* Extreme Grassland Fire Danger...Is forecast.', '* Winds...Northwest 20 to 30 mph with gusts up to 45 mph.', '* Relative Humidity...As low as 18 percent.', '* Impacts...Any fires that develop will likely spread rapidly\nand become very difficult to control. Outdoor burning is not\nrecommended.']"
35,KS,Russell; Lincoln; Barton; Ellsworth; Rice; Reno; Kingman; Harper,Red Flag Warning,Severe,Likely,Expected,2022-04-06T03:24:00-05:00,2022-04-06T20:00:00-05:00,"['The National Weather Service in Wichita has issued a Red Flag\nWarning for extreme grassland fire danger, which is in effect\nfrom noon to 8 PM CDT Thursday. The Fire Weather Watch is no\nlonger in effect.', '* Extreme Grassland Fire Danger...Is forecast.', '* Winds...Northwest 30 to 40 mph with gusts up to 55 mph.', '* Relative Humidity...As low as 18 percent.', '* Impacts...Any fires that develop will likely spread rapidly\nand become very difficult to control. Outdoor burning is not\nrecommended.']"
36,KS,Saline; McPherson; Harvey; Sedgwick; Sumner,Red Flag Warning,Severe,Likely,Expected,2022-04-06T03:24:00-05:00,2022-04-06T20:00:00-05:00,"['* Extreme Grassland Fire Danger...Is forecast.', '* Winds...Northwest 25 to 35 mph with gusts up to 50 mph.', '* Relative Humidity...As low as 19 percent.', '* Impacts...Any fires that develop will likely spread rapidly\nand become very difficult to control. Outdoor burning is not\nrecommended.']"
37,KS,Phillips; Smith; Rooks; Valley; Greeley; Nance; Sherman; Howard; Merrick; Dawson; Buffalo; Hall; Hamilton; Gosper; Phelps; Kearney; Adams; Clay; Furnas; Harlan; Franklin; Webster; Nuckolls,High Wind Watch,Severe,Observed,Past,2022-04-06T03:19:00-05:00,2022-04-07T20:00:00-05:00,['The High Wind Watch has been replaced. Please see the latest information from NWS Hastings NE on this developing situation.']
38,KS,Republic; Washington; Cloud; Clay; Riley; Ottawa; Dickinson; Geary; Morris,Wind Advisory,Moderate,Likely,Expected,2022-04-06T03:14:00-05:00,2022-04-06T20:00:00-05:00,"['* WHAT...Northwest winds 25 to 35 mph with gusts around 45 mph\nexpected.', '* WHERE...Republic, Washington, Cloud, Clay, Riley, Ottawa,\nDickinson, Geary and Morris Counties.', '* WHEN...From 10 AM to 8 PM CDT today.', '* IMPACTS...Gusty winds could blow around unsecured objects.\nDriving high profile vehicles will be difficult.']"
39,KS,Republic; Cloud; Ottawa,Fire Weather Watch,Severe,Possible,Future,2022-04-06T03:12:00-05:00,2022-04-07T20:00:00-05:00,"['* AFFECTED AREA...Fire weather zones 008, 020, and 034.', '\n* WIND...Northwest wind 25 to 35 mph with gusts to 45 mph.', '* HUMIDITY...20 to 25 percent in late morning and afternoon.', '* IMPACTS...any fires that develop will likely spread rapidly.\nOutdoor burning is not recommended.']"
40,KS,Lyon; Coffey; Anderson,Red Flag Warning,Severe,Likely,Expected,2022-04-06T03:12:00-05:00,2022-04-06T20:00:00-05:00,"['The National Weather Service in Topeka has issued a Red Flag\nWarning, which is in effect from 10 AM this morning to 8 PM CDT\nthis evening.', '* AFFECTED AREA...Fire weather zones 054, 058, and 059.', '* WIND...Northwest wind 20 to 30 mph with gusts to 40 mph.', '* HUMIDITY...20 to 25 percent in the afternoon.', '* IMPACTS...any fires that develop will likely spread rapidly.\nOutdoor burning is not recommended.']"
41,KS,Republic; Cloud; Ottawa,Red Flag Warning,Severe,Likely,Expected,2022-04-06T03:12:00-05:00,2022-04-06T20:00:00-05:00,"['* AFFECTED AREA...Fire weather zones 008, 020, and 034.', '\n* WIND...Northwest wind 25 to 35 mph with gusts to 45 mph.', '* HUMIDITY...20 to 25 percent in late morning and afternoon.', '* IMPACTS...any fires that develop will likely spread rapidly.\nOutdoor burning is not recommended.']"
42,KS,Washington; Clay; Riley; Dickinson; Geary; Morris,Red Flag Warning,Severe,Likely,Expected,2022-04-06T03:12:00-05:00,2022-04-06T20:00:00-05:00,"['* AFFECTED AREA...Fire weather zones 009, 021, 022, 035, 036, and\n037.', '* WIND...Northwest wind 25 to 35 mph with gusts to 45 mph.', '* HUMIDITY...20 to 25 percent in late morning and afternoon.', '* IMPACTS...any fires that develop will likely spread rapidly.\nOutdoor burning is not recommended.']"
43,KS,Bourbon; Crawford; Cherokee; Vernon; St. Clair; Hickory; Camden; Pulaski; Barton; Cedar; Polk; Dallas; Laclede; Texas; Jasper; Dade; Greene; Webster; Wright; Newton; Lawrence; Christian; Douglas; Howell; McDonald; Barry; Stone; Taney; Ozark,Red Flag Warning,Severe,Likely,Expected,2022-04-06T02:20:00-05:00,2022-04-06T22:00:00-05:00,"['The National Weather Service in Springfield has issued a Red Flag\nWarning, which is in effect from noon today to 10 PM CDT this\nevening.', '* AFFECTED AREA...In Kansas...Fire weather zones 073, 097, and\n101.In Missouri...Fire weather zones 066, 067, 068, 069, 070,\n077, 078, 079, 080, 081, 082, 088, 089, 090, 091, 092, 093,\n094, 095, 096, 097, 101, 102, 103, 104, and 105.', '* WIND...West winds of 20 to 25 mph with gusts of 30 to 35 mph.', '* HUMIDITY...20 to 25 percent.', '* THUNDERSTORMS...No thunderstorms expected.', '* IMPACTS...Any fires that develop will likely spread rapidly.\nOutdoor burning is not recommended.']"
44,KS,Phillips; Smith; Rooks; Valley; Greeley; Nance; Sherman; Howard; Merrick; Dawson; Buffalo; Hall; Hamilton; Gosper; Phelps; Kearney; Adams; Clay; Furnas; Harlan; Franklin; Webster; Nuckolls,High Wind Watch,Severe,Possible,Future,2022-04-05T15:12:00-05:00,2022-04-07T20:00:00-05:00,"['* WHAT...For the High Wind Warning, sustained northwest winds 30\nto 45 MPH with gusts as high as 55 to 65 MPH expected. For the\nHigh Wind Watch, very similar northwest winds sustained at 30 to\n45 mph with gusts as high as 55 to 65 MPH possible.', '* WHERE...Portions of north central Kansas and central and south\ncentral Nebraska.', '* WHEN...For the High Wind Warning, from 10 AM to 8 PM CDT\nWednesday. For the High Wind Watch, from Thursday morning\nthrough Thursday evening.', '* IMPACTS...Damaging winds will blow down trees and power lines. Power\noutages are expected. Travel will be difficult, especially for\nhigh profile vehicles.', '* ADDITIONAL DETAILS...At least patchy blowing dust and minor\nvisibility restrictions will be possible during the high winds.\nLocalized areas of significant blowing dust are possible,\nparticularly south and southwest of the Tri Cities.']"
45,KS,Jewell; Osborne; Mitchell; Polk; York; Fillmore; Thayer,High Wind Warning,Severe,Likely,Expected,2022-04-05T15:12:00-05:00,2022-04-06T20:00:00-05:00,"['* WHAT...Sustained northwest winds 30 to 40 MPH with gusts up to\n55 MPH expected.', '* WHERE...In Kansas, Jewell, Osborne and Mitchell Counties. In\nNebraska, Polk, York, Fillmore and Thayer Counties.', '* WHEN...From 10 AM to 8 PM CDT Wednesday.', '* IMPACTS...Damaging winds will blow down trees and possibly power\nlines. Power outages are possible. Travel will be difficult,\nespecially for high profile vehicles.', '* ADDITIONAL DETAILS...At least patchy blowing dust and minor\nvisibility restrictions will be possible during the high winds.']"
46,KS,Phillips; Smith; Rooks; Valley; Greeley; Nance; Sherman; Howard; Merrick; Dawson; Buffalo; Hall; Hamilton; Gosper; Phelps; Kearney; Adams; Clay; Furnas; Harlan; Franklin; Webster; Nuckolls,High Wind Warning,Severe,Likely,Expected,2022-04-05T15:12:00-05:00,2022-04-06T20:00:00-05:00,"['* WHAT...For the High Wind Warning, sustained northwest winds 30\nto 45 MPH with gusts as high as 55 to 65 MPH expected. For the\nHigh Wind Watch, very similar northwest winds sustained at 30 to\n45 mph with gusts as high as 55 to 65 MPH possible.', '* WHERE...Portions of north central Kansas and central and south\ncentral Nebraska.', '* WHEN...For the High Wind Warning, from 10 AM to 8 PM CDT\nWednesday. For the High Wind Watch, from Thursday morning\nthrough Thursday evening.', '* IMPACTS...Damaging winds will blow down trees and power lines. Power\noutages are expected. Travel will be difficult, especially for\nhigh profile vehicles.', '* ADDITIONAL DETAILS...At least patchy blowing dust and minor\nvisibility restrictions will be possible during the high winds.\nLocalized areas of significant blowing dust are possible,\nparticularly south and southwest of the Tri Cities.']"
0,LA,"East Baton Rouge, LA; Pointe Coupee, LA; West Feliciana, LA",Flood Warning,Severe,Observed,Immediate,2022-04-06T10:17:00-05:00,2022-04-15T01:00:00-05:00,"['* WHAT...Minor flooding is occurring and minor flooding is forecast.', '* WHERE...Mississippi River At Red River Landing.', '* WHEN...Until Friday, April 15.', '* IMPACTS...At 48.0 feet, Access roads will be inundated and\nevacuation of all river islands must be complete. Protection of\npeople and property in the river bottom land on the river side of\nthe levees must be complete.', '* ADDITIONAL DETAILS...\n- At 9:00 AM CDT Wednesday the stage was 50.6 feet.\n- Forecast...The river is expected to fall below flood stage\nThursday, April 14 and continue falling to 33.4 feet\nWednesday, May 04.\n- Flood stage is 48.0 feet.\n- Flood History...This crest compares to a previous crest of\n48.8 feet on 04/22/2014.\n- http://www.weather.gov/safety/flood']"
