,State,Area,Event,Severity,Certainty,Urgency,Effective,Ends,Description
4,SD,"Spink, SD",Flood Warning,Severe,Observed,Immediate,2022-06-21T11:43:00-05:00,,"['* WHAT...Moderate flooding is occurring and moderate flooding is\nforecast.', '* WHERE...James River At Ashton.', '* WHEN...Until further notice.', '* IMPACTS...At 16.5 feet, The water overtops the bridge 3 miles\nnorth and 1 1/2 mile east of Ashton', '* ADDITIONAL DETAILS...\n- At 10:45 AM CDT Tuesday the stage was 15.9 feet.\n- Recent Activity...The maximum river stage in the 24 hours\nending at 10:45 AM CDT Tuesday was 16.1 feet. The river has\njust recently dropped below 16 feet.\n- Forecast...The river is expected to slowly fall through\nmoderate flood stage during the next 7 days.\n- Flood stage is 13.0 feet.\n- http://www.weather.gov/safety/flood']"
0,TX,Montague; Cooke; Grayson; Fannin; Lamar; Young; Jack; Wise; Denton; Collin; Hunt; Delta; Hopkins; Stephens; Palo Pinto; Parker; Tarrant; Dallas; Rockwall; Kaufman; Van Zandt; Rains; Eastland; Erath; Hood; Somervell; Johnson; Ellis; Henderson; Comanche; Mills; Hamilton; Bosque; Hill; Navarro; Freestone; Anderson; Lampasas; Coryell; Bell; McLennan; Falls; Limestone; Leon; Milam; Robertson,Heat Advisory,Moderate,Likely,Expected,2022-06-23T05:44:00-05:00,2022-06-24T19:00:00-05:00,"['* WHAT...Temperatures up to 103 and heat index values up to 108\nexpected.', '* WHERE...Most of North and Central Texas.', '* WHEN...From noon Thursday to 7 PM CDT Friday.', '* IMPACTS...Hot temperatures and high humidity will increase the\nrisk for heat-related illnesses to occur, particularly for\nthose working or participating in outdoor activities.']"
1,TX,Zapata; Jim Hogg; Brooks; Inland Kenedy; Northern Hidalgo,Special Weather Statement,Moderate,Observed,Expected,2022-06-23T05:29:00-05:00,,"['Surface observations and satellite imagery indicate that patchy\nfog, perhaps locally dense, has developed across Zapata, Jim\nHogg, Brooks, Kenedy, and northern Hidalgo Counties. Visibilities\nare generally 5 to 7 miles, but could be as low as 1 mile,\nespecially in the Hebbronville area. These areas of fog should\ndissipate by 8 AM.', 'Morning motorists traveling through these areas are urged to\nreduce speed, use low beam headlights, and avoid following other\nvehicles too closely when encountering fog.']"
2,TX,La Salle; McMullen; Live Oak; Bee; Goliad; Victoria; Webb; Duval; Jim Wells; Inland Kleberg; Inland Nueces; Inland San Patricio; Coastal Aransas; Inland Refugio; Inland Calhoun; Coastal Kleberg; Coastal Nueces; Coastal San Patricio; Coastal Refugio; Coastal Calhoun,Special Weather Statement,Moderate,Observed,Expected,2022-06-23T03:29:00-05:00,,"['The combination of warm temperatures and high dewpoints will\nproduce heat indices between 105 and 109 degrees this afternoon\nacross most of south Texas. Residents with outdoor activities\nplanned are urged to drink plenty of water, wear light weight and\nlight colored clothing and take frequent breaks from the heat.\nYoung children and pets should never be left unattended in\nvehicles under any circumstances. This is especially true during\nwarm or hot weather when car interiors can reach lethal\ntemperatures in a matter of minutes.']"
3,TX,Sevier; Howard; Little River; Hempstead; Nevada; Miller; Lafayette; Columbia; Union; Caddo; Bossier; Webster; Claiborne; Lincoln; Union; De Soto; Red River; Bienville; Jackson; Ouachita; Sabine; Natchitoches; Winn; Grant; Caldwell; La Salle; McCurtain; Red River; Bowie; Franklin; Titus; Camp; Morris; Cass; Wood; Upshur; Marion; Smith; Gregg; Harrison; Cherokee; Rusk; Panola; Nacogdoches; Shelby; Angelina; San Augustine; Sabine,Heat Advisory,Moderate,Likely,Expected,2022-06-23T02:31:00-05:00,2022-06-23T19:00:00-05:00,"['* WHAT...Temperatures up to 102 and heat index values up to 110\nexpected.', '* WHERE...Portions of north central and northwest Louisiana,\nsouth central and southwest Arkansas and east and northeast\nTexas.', '* WHEN...From 11 AM to 7 PM CDT today.', '* IMPACTS...Hot temperatures and high humidity may cause heat\nillnesses to occur.']"
4,TX,Hardin; Jefferson; Orange,Air Quality Alert,Unknown,Unknown,Unknown,2022-06-22T19:00:00-05:00,,"['The Texas Commission on Environmental Quality is forecasting a Code\nOrange Air Quality Alert, from 7 AM to 6 PM CDT Thursday.', 'The Air Quality Index indicates that Ground Level Ozone will be at\nthe Orange level, which means members of sensitive groups may\nexperience health effects. The general public is not likely to be\naffected.', 'More information about current air quality is available at the T C E\nQ website www.tceq.texas.gov/airquality/monops.']"
5,TX,Wise; Denton; Collin; Hunt; Parker; Tarrant; Dallas; Rockwall; Kaufman; Hood; Johnson; Ellis; Henderson,Air Quality Alert,Unknown,Unknown,Unknown,2022-06-22T17:03:00-05:00,,"['The Texas Commission on Environmental Quality (TCEQ) has issued\nan Ozone Action Day for the Dallas-Fort Worth area for Thursday,\nJune 23, 2022.', 'Atmospheric conditions are expected to be favorable for producing\nhigh levels of ozone air pollution in the Dallas-Fort Worth area\non Thursday. You can help prevent ozone pollution by sharing a\nride, walking, riding a bicycle, taking your lunch to work,\navoiding drive-through lanes, conserving energy, and keeping your\nvehicle properly tuned.', 'For more information on ozone:', 'Ozone: The Facts (www.tceq.texas.gov/goto/ozonefacts)', 'Air North Texas: (www.airnorthtexas.org)', 'EPA Air Now\n(www.airnow.gov/index.cfm?action.local_state&STATEID=45&TAB=0)', 'Take care of Texas (www.takecareoftexas.org)', 'North Central Texas Council of Governments Air Quality\n(www.nctcog.org/trans/air/index.asp)']"
6,TX,Inland Harris; Inland Brazoria; Inland Galveston; Coastal Harris; Coastal Brazoria; Coastal Galveston; Brazoria Islands; Galveston Island; Bolivar Peninsula,Air Quality Alert,Unknown,Unknown,Unknown,2022-06-22T17:00:00-05:00,,"['The Texas Commission on Environmental Quality (TCEQ) has issued an\nOzone Action Day for the Houston, Galveston, and Brazoria area for\nThursday, June 23, 2022.', 'Atmospheric conditions are expected to be favorable for producing\nhigh levels of ozone pollution in the Houston, Galveston, and\nsurrounding areas on Thursday. You can help prevent ozone pollution by\nsharing a ride, walking, riding a bicycle, taking your lunch to work,\navoiding drive through lanes, conserving energy and keeping your vehicle\nproper tuned.', 'For more information on ozone:\nOzone: The Facts www.tceq.texas.gov/airquality/monops/ozonefacts.html\nEPA AirNow: www.airnow.gov/?city=Houston&state=TX&country=USA\nTake Care of Texas: www.takecareoftexas.org/conservation-tips/keep-our-\nair-clean']"
7,TX,Upshur; Smith; Gregg; Harrison; Rusk,Air Quality Alert,Unknown,Unknown,Unknown,2022-06-22T16:56:00-05:00,,"['The Texas Commission of Environmental Quality (TCEQ) has declared\nan Ozone Action Day for the Tyler...Longview...Marshall areas of\neast Texas for tomorrow...Thursday, June 23, 2022.', 'Atmospheric conditions are expected to be favorable for producing\nhigh levels of ozone pollution in the Tyler-Longview area on\nThursday. You can help prevent ozone pollution by sharing a ride,\nwalking or riding a bicycle, taking your lunch to work, avoiding\ndrive- through lanes, conserving energy, and keeping your vehicle\nproperly tuned.', 'If required...the next Ozone Action Day notice will be issued by\n300 pm on Thursday afternoon.', 'For more information on ozone:', 'Ozone: the Facts\n(https://www.tceq.texas.gov/airquality/monops/ozonefacts.html)', 'EPA Air Now\n(https://www.airnow.gov/?reportingArea=Tyler-Longview-\nMarshall&stateCode=TX)', 'Take Care of Texas\n(https://takecareoftexas.org/hot-wire/what-ozone-action-day)']"
8,TX,Sevier; Howard; McCurtain; Red River; Franklin; Titus; Camp; Morris; Wood; Upshur,Heat Advisory,Moderate,Likely,Expected,2022-06-22T14:05:00-05:00,2022-06-23T19:00:00-05:00,"['* WHAT...Heat index values up to 106 expected.', '* WHERE...In Oklahoma, McCurtain County. In Arkansas, Sevier\nCounty and Howard County. In Texas, Red River County, Franklin\nCounty, Titus County, Camp County, Morris County, Wood County\nand Upshur County.', '* WHEN...From 11 AM to 7 PM CDT Thursday.', '* IMPACTS...Hot temperatures and high humidity may cause heat\nillnesses to occur.']"
9,TX,Little River; Hempstead; Nevada; Miller; Lafayette; Columbia; Union; Caddo; Bossier; Webster; Claiborne; Lincoln; Union; De Soto; Red River; Bienville; Jackson; Ouachita; Sabine; Natchitoches; Winn; Grant; Caldwell; La Salle; Bowie; Cass; Marion; Smith; Gregg; Harrison; Cherokee; Rusk; Panola; Nacogdoches; Shelby; Angelina; San Augustine; Sabine,Heat Advisory,Moderate,Likely,Expected,2022-06-22T14:05:00-05:00,2022-06-23T19:00:00-05:00,"['* WHAT...For the first Heat Advisory, heat index values up to\n107. For the second Heat Advisory, heat index values up to 109\nexpected.', '* WHERE...Portions of north central and northwest Louisiana,\nsouth central and southwest Arkansas and east and northeast\nTexas.', '* WHEN...For the first Heat Advisory, until 7 PM CDT this\nevening. For the second Heat Advisory, from 11 AM to 7 PM CDT\nThursday.', '* IMPACTS...Hot temperatures and high humidity may cause heat\nillnesses to occur.']"
0,WA,San Juan County; Western Whatcom County; Southwest Interior; Western Skagit County; Everett and Vicinity; Tacoma Area; Admiralty Inlet Area; Hood Canal Area; Lower Chehalis Valley Area; Olympics; Eastern Strait of Juan de Fuca; Western Strait of Juan De Fuca; North Coast; Central Coast; East Puget Sound Lowlands; Bellevue and Vicinity; Seattle and Vicinity; Bremerton and Vicinity; West Slopes North Cascades and Passes; West Slopes North Central Cascades and Passes; West Slopes South Central Cascades and Passes,Special Weather Statement,Moderate,Observed,Expected,2022-06-23T04:40:00-07:00,,"['After an unusually cool and wet spring, a rapid warm-up is\nexpected late this week, with temperatures peaking Saturday\nthrough Monday across western Washington. Most lowland and\nmountain valley locations will see temperatures peaking in the\n80s to around 90 degrees by Sunday.', 'This level of heat will pose a moderate risk of heat-related\nillness to heat-sensitive people and pets. Given the recent cool\nweather there has been little opportunity to acclimate to warm\ntemperatures. As such, there is concern that this rapid warm-up\ncould catch some off guard. Furthermore, area rivers continue to\nrun high as a result of the cool and wet spring and water\ntemperatures are running generally between 40-50 degrees. The\ncombination of these factors significantly increases the concern\nfor cold and or high water-related incidents. Cold water shock and\nhypothermia can quickly result in death during these early season\nheat events. Use extreme caution if recreating near water, wear a\nlife jacket, and keep a close eye on children.']"
1,WA,North Oregon Coast; Central Oregon Coast; Coast Range of Northwest Oregon; Central Coast Range of Western Oregon; Lower Columbia; Greater Portland Metro Area; Central Willamette Valley; South  Willamette Valley; Northern Oregon Cascade Foothills; Northern Oregon Cascades; Cascade Foothills in Lane County; Cascades in Lane County; Upper Hood River Valley; Western Columbia River Gorge; Central Columbia River Gorge; South Washington Cascades; Willapa Hills; South Washington Coast; Lower Columbia and I - 5 Corridor in Cowlitz County; Greater Vancouver Area; South Washington Cascade Foothills; Western Columbia River Gorge; Central Columbia River Gorge,Special Weather Statement,Moderate,Observed,Expected,2022-06-22T19:09:00-07:00,,"['Summer weather is expected to begin in earnest across much of\nsouthwest Washington and northwest Oregon this Friday, continuing\nthrough the weekend. For inland valleys, temperatures will reach\nwell into the 80s Friday, possibly even reaching the lower 90s in\nsome locations. Further warming will make afternoon temperatures\nin the 90s more widespread in the inland valleys over the weekend.\nOffshore flow will bring sunny skies and warm temperatures all\nthe way to the coast, where highs will be in the 70s and 80s this\nweekend. Gradual cooling begins Monday with inland valleys\nreaching the upper 80s to low 90s, and coastal locations topping\nout in the 60s and 70s.', 'With the hot weather expected, now is a good time to make sure\nyou and your neighbors have a way to deal with the heat. If you\nhave fans or air conditioning, now is a good time to make sure\nthose systems are operating properly.', ""Given a much-above normal snowpack in the Cascades, rivers are\nrunning cold and fast, and will continue to do so this weekend.\nNearly every year, people die in rivers in southwest Washington\nand northwest Oregon due to cold water shock during the season's\nfirst heat wave. Hot temperatures can make the cool water seem\ntempting, but river temperatures in the 40s and 50s can easily\nresult in cold water shock that can kill in minutes.""]"
2,WA,"Bonner, ID; Pend Oreille, WA",Flood Warning,Severe,Observed,Immediate,2022-06-22T15:54:00-07:00,2022-06-25T04:00:00-07:00,"['* WHAT...Minor flooding is occurring.', '* WHERE...Pend Oreille River below Albeni Falls.', '* WHEN...Until early Saturday morning.', '* IMPACTS...At 98,500 cfs, Water will be into many yards along the\nriver and approaching some homes on SR 20 near Deeter Road. Creeks\nthat outlet into the river will begin to backup, filling low lying\nareas and roadside ditches. This flow corresponds to approximately\n42.8 feet at the Cusick gage, based on the 2008 recorded peak.', '* ADDITIONAL DETAILS...\n- At 3:00 PM PDT Wednesday the flow was 96,100 cfs.\n- Recent Activity...The maximum river flow in the 24 hours\nending at 3:00 PM PDT Wednesday was 101,000 cfs.\n- Forecast...The river is expected to fall below flood stage\nearly Saturday morning and continue falling to 86,752 cfs\nlate Wednesday morning.\n- Flood flow is 95,000 cfs.\n- http://www.weather.gov/safety/flood']"
3,WA,San Juan County; Western Whatcom County; Southwest Interior; Western Skagit County; Everett and Vicinity; Tacoma Area; Admiralty Inlet Area; Hood Canal Area; Lower Chehalis Valley Area; Olympics; Eastern Strait of Juan de Fuca; Western Strait of Juan De Fuca; North Coast; Central Coast; East Puget Sound Lowlands; Bellevue and Vicinity; Seattle and Vicinity; Bremerton and Vicinity; West Slopes North Cascades and Passes; West Slopes North Central Cascades and Passes; West Slopes South Central Cascades and Passes,Special Weather Statement,Moderate,Observed,Expected,2022-06-22T06:52:00-07:00,,"['After an unusually cool and wet spring, a rapid warm-up is\nexpected late this week, with temperatures peaking Saturday\nthrough Monday across western Washington. Most lowland and\nmountain valley locations will see temperatures peaking in the\n80s to around 90 degrees by Sunday.', 'This level of heat will pose a moderate risk of heat-related\nillness to heat-sensitive people and pets. Given the recent cool\nweather there has been little opportunity to acclimate to warm\ntemperatures. As such, there is concern that this rapid warm-up\ncould catch some off guard. Furthermore, area rivers continue to\nrun high as a result of the cool and wet spring and water\ntemperatures are running generally between 40-50 degrees. The\ncombination of these factors significantly increases the concern\nfor cold and or high water-related incidents. Cold water shock and\nhypothermia can quickly result in death during these early season\nheat events. Use extreme caution if recreating near water, wear a\nlife jacket, and keep a close eye on children.']"
