,State,Area,Event,Severity,Certainty,Urgency,Effective,Ends,Description
0,AL,"Madison, AL",Flood Warning,Severe,Observed,Immediate,2021-12-30T08:33:00-06:00,2021-12-30T22:17:00-06:00,"['* WHAT...Minor flooding is occurring and minor flooding is forecast.', '* WHERE...Flint River at Brownsboro.', '* WHEN...Until late this evening.', '* IMPACTS...At 17.0 feet, Water floods a large field on the upstream\nleft bank and is flooding large portions of the downstream left\nbank.', '* ADDITIONAL DETAILS...\n- At 7:30 AM CST Thursday the stage was 17.2 feet.\n- Recent Activity...The maximum river stage in the 24 hours\nending at 7:30 AM CST Thursday was 17.2 feet.\n- Forecast...The river is expected to rise to a crest of 17.5\nfeet this afternoon. It will then fall below flood stage late\nthis afternoon.\n- Flood stage is 17.0 feet.\n- Flood History...This crest compares to a previous crest of\n17.5 feet on 01/15/2020.\n- http://www.weather.gov/safety/flood']"
1,AL,"Jackson, AL; Madison, AL; Marshall, AL",Flood Warning,Severe,Observed,Immediate,2021-12-30T08:32:00-06:00,2022-01-01T10:40:00-06:00,"['* WHAT...Minor flooding is forecast.', '* WHERE...Paint Rock River NEAR Woodville.', '* WHEN...Until late Saturday morning.', '* IMPACTS...At 15.0 feet, Flood waters affect mostly bottomland\nalong the river...including low lying farm and pasturelands.', '* ADDITIONAL DETAILS...\n- At 8:00 AM CST Thursday the stage was 14.1 feet.\n- Forecast...The river is expected to rise above flood stage\nthis afternoon to a crest of 16.5 feet early tomorrow\nafternoon. It will then fall below flood stage early Saturday\nmorning.\n- Flood stage is 15.0 feet.\n- Flood History...This crest compares to a previous crest of\n16.5 feet on 01/17/1997.\n- http://www.weather.gov/safety/flood']"
2,AL,Blount; Etowah; Calhoun; Cherokee; Cleburne; Pickens; Tuscaloosa; Jefferson; Shelby; St. Clair; Talladega; Clay; Randolph; Sumter; Greene; Hale; Perry; Bibb; Chilton; Coosa; Tallapoosa; Chambers; Autauga; Elmore,Flood Watch,Severe,Possible,Future,2021-12-30T05:53:00-06:00,2021-12-30T18:00:00-06:00,"['* WHAT...Flash flooding caused by excessive rainfall continues to be\npossible.', '* WHERE...Portions of Central Alabama, including the following\ncounties, Autauga, Bibb, Blount, Calhoun, Chambers, Cherokee,\nChilton, Clay, Cleburne, Coosa, Elmore, Etowah, Greene, Hale,\nJefferson, Perry, Pickens, Randolph, Shelby, St. Clair, Sumter,\nTalladega, Tallapoosa and Tuscaloosa.', '* WHEN...Through 6 PM.', '* IMPACTS...Excessive runoff may result in flooding of rivers,\ncreeks, streams, and other low-lying and flood-prone locations.', '* ADDITIONAL DETAILS...\n- Additional heavy rains of near one to two inches with\nisolated higher amounts may occur in the watch area.\n- http://www.weather.gov/safety/flood']"
3,AL,Mobile Coastal; Baldwin Coastal; Escambia Coastal; Santa Rosa Coastal; Okaloosa Coastal,Rip Current Statement,Moderate,Likely,Expected,2021-12-30T05:08:00-06:00,2022-01-02T09:00:00-06:00,"['* WHAT...Dangerous rip currents.', '* WHERE...In Alabama, Baldwin Coastal and Mobile Coastal\nCounties. In Florida, Santa Rosa Coastal, Okaloosa Coastal and\nEscambia Coastal Counties.', '* WHEN...Through Sunday morning.', '* IMPACTS...Rip currents can sweep even the best swimmers away\nfrom shore into deeper water.']"
4,AL,"Jackson, AL; Madison, AL; Marshall, AL",Flood Warning,Severe,Likely,Expected,2021-12-29T19:04:00-06:00,2022-01-01T01:20:00-06:00,"['* WHAT...Minor flooding is forecast.', '* WHERE...Paint Rock River NEAR Woodville.', '* WHEN...From late tonight to early Saturday morning.', '* IMPACTS...At 15.0 feet, Flood waters affect mostly bottomland\nalong the river...including low lying farm and pasturelands.', '* ADDITIONAL DETAILS...\n- At 6:00 PM CST Wednesday the stage was 10.6 feet.\n- Forecast...The river is expected to rise above flood stage\nlate tonight to a crest of 16.5 feet tomorrow evening. It\nwill then fall below flood stage Friday evening.\n- Flood stage is 15.0 feet.\n- Flood History...This crest compares to a previous crest of\n16.5 feet on 01/17/1997.\n- http://www.weather.gov/safety/flood']"
0,AK,Denali,Winter Storm Watch,Severe,Possible,Future,2021-12-30T08:44:00-09:00,2022-01-02T15:00:00-09:00,"['* WHAT...Blizzard conditions possible. North winds gusting as high\nas 60 mph could result in significantly reduced visibility in\nblowing and drifting snow. Dangerously cold wind chills to 60\nbelow are also possible. Plan on very difficult to impossible\ntravel conditions.', '* WHERE...Parks Highway south of the Denali Park Entrance.', '* WHEN...From late Friday night through Sunday afternoon.', '* ADDITIONAL DETAILS...Strong north winds gusting as high as 60\nmph could cause areas of blowing and drifting snow and near\nwhiteout conditions at times. Cold wind chills as low as 60\nbelow zero could cause frostbite in as little as 10 minutes to\nexposed skin.']"
1,AK,Eastern Alaska Range,Winter Storm Watch,Severe,Possible,Future,2021-12-30T08:44:00-09:00,2022-01-02T15:00:00-09:00,"['* WHAT...Blizzard conditions possible. North winds gusting as high\nas 60 mph could result in whiteout conditions in blowing and\ndrifting snow. Dangerously cold wind chills to 60 below are also\npossible. Plan on very difficult to impossible travel\nconditions.', '* WHERE...Eastern Alaska Range south of Black Rapids.', '* WHEN...From late Friday night through Sunday afternoon.', '* ADDITIONAL DETAILS...Strong north winds gusting as high as 60\nmph could cause areas of blowing and drifting snow and near\nwhiteout conditions at times. Cold wind chills as low as 60\nbelow zero could cause frostbite in as little as 10 minutes to\nexposed skin.']"
2,AK,Cape Decision to Salisbury Sound Coastal Area; Dixon Entrance to Cape Decision Coastal Area,Winter Storm Watch,Severe,Possible,Future,2021-12-30T06:40:00-09:00,2022-01-01T03:00:00-09:00,"['* WHAT...Heavy snow possible. Total snow accumulations of 4 to 9\ninches possible.', '* WHERE...The Southeast Gulf Coast and portions of the Eastern\nGulf Coast including Sitka, Port Alexander, Craig, and Klawock.', '* WHEN...From Friday morning through late Friday night.', '* IMPACTS...Travel could be very difficult to impossible.', '* ADDITIONAL DETAILS...Snow may mix with or change to rain\nsometime Friday afternoon or Friday night.']"
3,AK,Cape Fairweather to Cape Suckling Coastal Area; Taiya Inlet and Klondike Highway; Haines Borough and Lynn Canal; Glacier Bay; Eastern Chichagof Island; Salisbury Sound to Cape Fairweather Coastal Area; Eastern Baranof Island and Southern Admiralty Island; Juneau Borough and Northern Admiralty Island; Inner Channels from Kupreanof Island to Etolin Island,Winter Storm Watch,Severe,Possible,Future,2021-12-30T06:40:00-09:00,2022-01-01T09:00:00-09:00,"['* WHAT...Heavy snow possible. Total snow accumulations of 6 to\n16 inches possible.', '* WHERE...Northeast Gulf coast and northern Panhandle including\nJuneau, Petersburg, Wrangell, and Haines among other nearby\ncommunities.', '* WHEN...From Friday morning through Saturday morning.', '* IMPACTS...Travel could be very difficult to impossible.', '* ADDITIONAL DETAILS...Heaviest snowfall rates Friday evening to\nvery early Saturday. Snow will spread from NW to SE over the\narea.']"
4,AK,Southern Inner Channels; Misty Fjords,Winter Storm Watch,Severe,Possible,Future,2021-12-30T06:40:00-09:00,2022-01-01T15:00:00-09:00,"['* WHAT...Heavy snow possible. Total snow accumulations of 8 to\n15 inches possible for Ketchikan and Metlakatla. Hyder may see\naccumulations of 20 to 26 inches.', '* WHERE...Southern Inner Channels and Misty Fjords, including\nKetchikan, Metlakatla, Thorne Bay, Kasaan, Hollis, and Hyder.', '* WHEN...From Friday afternoon through Saturday afternoon.', '* IMPACTS...Travel could be very difficult.', '* ADDITIONAL DETAILS...Heaviest rates expected Friday night to\nearly Saturday. A transition or changeover to rain is expected\nin Ketchikan and much of the southern Inner Channels Friday\nnight; however, Hyder will remain all snow.']"
5,AK,Southeastern Brooks Range; Upper Koyukuk Valley; Yukon Flats and Surrounding Uplands; Central Interior; Middle Tanana Valley; Deltana and Tanana Flats; Upper Tanana Valley and the Fortymile Country; Denali; Eastern Alaska Range,Special Weather Statement,Moderate,Observed,Expected,2021-12-30T06:00:00-09:00,,"['The series of winter storms that impacted the Eastern Interior of\nAlaska since Christmas have now ended. Fairbanks received over 23\ninches of snow since Christmas, with over 3 tenths of an inch of\nice accumulation, along with significant sleet and rain. These\nstorms have now moved east, and only an inch of additional snow\naccumulation is expected this morning.', 'Much colder air will be moving over Interior Alaska over the next\nseveral days, with temperatures falling into the 30s below over\nthe weekend. Residents needing to clear snow and ice may want to\ntake advantage of the warmer temperatures today and Friday.']"
6,AK,Chukchi Sea Coast,Wind Chill Advisory,Moderate,Likely,Expected,2021-12-30T04:58:00-09:00,2021-12-31T11:00:00-09:00,"['* WHAT...Very cold wind chills expected. The cold wind chills will\ncause frostbite in as little as 10 minutes to exposed skin.\nExpect wind chills to range from 40 below zero to 55 below\nzero.', '* WHERE...Chukchi Sea Coast.', '* WHEN...Now to 11 AM Friday.']"
7,AK,St Lawrence Island and Bering Strait Coast,Wind Chill Advisory,Moderate,Likely,Expected,2021-12-30T04:58:00-09:00,2021-12-31T11:00:00-09:00,"['* WHAT...Very cold wind chills expected. The cold wind chills will\ncause frostbite in as little as 10 minutes to exposed skin.\nExpect wind chills to range from 40 below zero to 55 below\nzero.', '* WHERE...St Lawrence Island and Bering Strait Coast.', '* WHEN...Now to 11 AM Friday.']"
8,AK,Western Arctic Coast,Wind Chill Advisory,Moderate,Likely,Expected,2021-12-30T04:58:00-09:00,2021-12-31T22:00:00-09:00,"['* WHAT...Very cold wind chills expected. The cold wind chills will\ncause frostbite in as little as 10 minutes to exposed skin.\nExpect wind chills to range from 50 below zero.', '* WHERE...From Point Lay and areas south.', '* WHEN...6 PM this evening to 10 PM Friday.']"
9,AK,Kuskokwim Delta,Winter Weather Advisory,Moderate,Likely,Expected,2021-12-30T04:29:00-09:00,2021-12-31T06:00:00-09:00,"['* WHAT...Blowing snow expected. Total snow accumulations of 4 to\n6 inches. Northeast winds 20 to 30 mph with gusts as high as 40\nmph.', '* WHERE...Kuskokwim Delta.', '* WHEN...From noon Thursday to 6 AM AKST Friday.', '* IMPACTS...Plan on difficult travel conditions. Areas of\nblowing snow will reduce visibilities to as low as one half\nmile.', '* ADDITIONAL DETAILS...A front will begin to push onshore of the\nKuskokwim Delta Coast midday Thursday bringing snow and gusty\nwinds which are expected to reduce visibility as a result of\nblowing snow. The heaviest snow, and accompanying worst\nvisibility, will move from south to north across the Delta\nthrough Thursday night. Late Thursday night, snowfall rates and\nwinds will decrease, leading to improved conditions.']"
10,AK,Bristol Bay,Special Weather Statement,Moderate,Observed,Expected,2021-12-30T04:26:00-09:00,,"['Another round of winter weather is set to affect the Bristol Bay\narea this morning through Friday evening. Snow accumulations of 2\nto 4 inches are expected for most of Bristol Bay north of King\nSalmon as a front moves ashore from south to north Thursday and\nThursday night. Farther south, snow may mix with or transition\nentirely to rain, leading to lower snowfall totals. Some\nuncertainty remains regarding how and where this transition will\nsetup, although current thinking places this between Pilot Point\nand King Salmon. Within this transition zone, the potential for a\nshort period of a wintry mix of freezing rain, sleet and snow will\nexist. The wintry mix is expected to be brief and produce only\nminimal ice accumulation before temperatures warm above freezing\nbehind the front late this afternoon. Precipitation will taper\noff this evening as the front pushes north into the Kuskokwim\nValley.', 'Thursday night through Friday, precipitation becomes showery in\nnature. Low level moisture surging off the eastern Bering will\nremain in place as the mid-levels dry out, leading to the\npotential for freezing drizzle along the Bristol Bay coast as a\ncooler airmass moves in behind the front.']"
0,AR,"Jackson, AR; Woodruff, AR",Flood Warning,Severe,Observed,Immediate,2021-12-30T10:27:00-06:00,2021-12-31T18:00:00-06:00,"['* WHAT...Minor flooding is occurring and minor flooding is forecast.', '* WHERE...Cache River Near Patterson.', '* WHEN...Until tomorrow evening.', '* IMPACTS...At 9.0 feet, Low swampy timberland along the river\nbegins to flood. Flood gates should be closed and equipment moved\nout of the low grounds along the river and tributaries.', '* ADDITIONAL DETAILS...\n- At 10:15 AM CST Thursday the stage was 9.0 feet.\n- Recent Activity...The maximum river stage in the 24 hours\nending at 10:15 AM CST Thursday was 9.1 feet.\n- Forecast...The river is expected to fall below flood stage\nthis afternoon and continue falling to 7.5 feet Tuesday\nmorning.\n- Flood stage is 9.0 feet.\n- Flood History...This crest compares to a previous crest of\n9.9 feet on 04/01/2017.\n- http://www.weather.gov/safety/flood']"
1,AR,Benton; Carroll; Washington; Madison; Crawford; Franklin; Sebastian; Pushmataha; Choctaw; Osage; Washington; Nowata; Craig; Ottawa; Pawnee; Tulsa; Rogers; Mayes; Delaware; Creek; Okfuskee; Okmulgee; Wagoner; Cherokee; Adair; Muskogee; McIntosh; Sequoyah; Pittsburg; Haskell; Latimer; Le Flore,Special Weather Statement,Moderate,Observed,Expected,2021-12-30T04:27:00-06:00,,"['A strong cold front is expected to move into northeast Oklahoma\nlate Friday night and then cross all of eastern Oklahoma and\nnorthwest Arkansas by later Saturday. Strong to severe storms\nwill be possible Friday night, mainly across southeast Oklahoma\ninto west central Arkansas. Continue to check the forecast\nregularly.', 'Temperatures will start falling by early Saturday morning north\nof Interstate 44 and will begin falling during the morning and\nearly afternoon farther south and east. Temperatures will continue\nto fall through Sunday morning with most locations seeing\ntemperatures in the teens. Dangerous wind chills of zero to five\nabove zero will be possible from Interstate 40 and points north\nSaturday night into Sunday morning.', ""While there remains uncertainty, there is higher confidence in\nsome wintry precipitation occurring Saturday and Saturday night.\nSome light ice and snow accumulation will be possible in some\nplaces. The drastic temperature change, however, is the main\nfocus at the moment. If you have things outdoors that have been\nfine during the record warm December, such as garden hoses,\nirrigation systems, or sensitive plants, precautions should be\ntaken to protect them. Don't forget about your outdoor pets as\nwell! Keep up with the latest forecasts as additional information\ncontinues to stream in.""]"
0,AZ,"Gila, AZ",Flood Warning,Severe,Likely,Immediate,2021-12-30T08:00:00-07:00,2022-01-03T15:00:00-07:00,"['* WHAT...Flooding caused by recent excessive rainfall continues.\nAdditional rainfall amounts on Friday will cause levels to rise an\nadditional 2 to 3 feet by Saturday morning, to around 6.5 feet.', '* WHERE...Primarily low water crossings along Tonto Creek in\nsouthern Gila county.', '* WHEN...Until 300 PM MST Monday.', '* IMPACTS...High flow in Tonto Creek will keep unbridged crossings\nimpassable.', '* ADDITIONAL DETAILS...\n- At 753 AM MST, gauge reports indicated that Tonto Creek\nremains in Action Stage.\n- Action stage means that low water crossings along Tonto Creek\nare being impacted.\n- Some locations that will experience flooding include...\nTonto Creek.\n- http://www.weather.gov/safety/flood']"
1,AZ,Kaibab Plateau; Grand Canyon Country; Coconino Plateau; Yavapai County  Mountains; Western Mogollon Rim,Winter Weather Advisory,Moderate,Likely,Expected,2021-12-30T03:19:00-07:00,2022-01-01T05:00:00-07:00,"['* WHAT...Snow expected above 6000 feet. Total snow accumulations\nof 2 to 8 inches, with locally higher amounts over mountain\npeaks and the Kaibab Plateau above 8000 feet. The most hazardous\ntravel conditions are likely Friday afternoon and evening.\nWinds gusting as high as 30 mph.', '* WHERE...Areas above 6000 feet near Doney Park, Flagstaff,\nGrand Canyon, Jacob Lake, North Rim, Prescott, Valle and\nWilliams.', '* WHEN...From 5 PM this afternoon to 5 AM MST Saturday.', ""* IMPACTS...Travel could be very difficult. The hazardous\nconditions could impact the morning or evening commute and any\nNew Year's Eve travel plans."", 'Snow forecast from 5 PM Today to 5 AM Saturday:', 'Doney Park  1 to 3  inches       Flagstaff  4 to 8  inches\nGrand Canyon  3 to 5  inches      Jacob Lake  4 to 8  inches\nNorth Rim  6 to 10 inches        Prescott  0 to 1  inches\nValle  1 to 3  inches        Williams  4 to 6  inches\n.']"
2,AZ,Black Mesa Area; Northeast Plateaus and Mesas South of Hwy 264,Winter Weather Advisory,Moderate,Likely,Expected,2021-12-30T03:19:00-07:00,2022-01-01T11:00:00-07:00,"['* WHAT...Snow expected above 6000 feet. Total snow accumulations\nof 1 to 4 inches. Winds gusting as high as 30 mph.', '* WHERE...Areas above 6000 feet near Dilkon and Shonto.', '* WHEN...From 5 AM Friday to 11 AM MST Saturday.', ""* IMPACTS...Plan on slippery road conditions. The hazardous\nconditions could impact the morning or evening commute, and any\nNew Year's Eve travel plans."", 'Snow forecast from 5 AM Friday to 11 AM Saturday:', 'Dilkon  1 to 2  inches          Shonto  1 to 3  inches\n.']"
3,AZ,Little Colorado River Valley in Apache County; Eastern Mogollon Rim; White Mountains; Northern Gila County,Winter Storm Watch,Severe,Possible,Future,2021-12-30T03:19:00-07:00,2022-01-01T11:00:00-07:00,"['* WHAT...Heavy snow possible above 6000 feet. Total snow\naccumulations of 3 to 11 inches possible, with 12 to 20 inches\nabove 8000 feet. For locations between 6000 and 7000 feet\nincluding Show Low, Springerville, and Pinetop-Lakeside, snow\naccumulation will be minimal until after 5 PM Friday as colder\nair arrives. Winds could gust as high as 35 mph.', '* WHERE...Areas above 6000 feet near Alpine, Eagar-\nSpringerville, Forest Lakes, Heber-Overgaard, Pine-Strawberry,\nPinetop-Lakeside and Show Low.', '* WHEN...From late tonight through Saturday morning.', ""* IMPACTS...Travel could be very difficult to impossible. Patchy\nblowing snow could significantly reduce visibility. The\nhazardous conditions could impact the morning or evening\ncommute, and any New Year's Eve travel plans."", 'Snow forecast from 5 AM Friday to 11 AM Saturday:', 'Alpine  6 to 10 inches Eagar-Sprgrvlle  2 to 4  inches\nForest Lakes  7 to 11 inches Heber-Overgaard  2 to 4  inches\nPine-Strawberry  1 to 3  inches  Pinetop-Lkside  6 to 10 inches\nShow Low  3 to 5  inches.']"
4,AZ,Chuska Mountains and Defiance Plateau,Winter Storm Watch,Severe,Possible,Future,2021-12-30T03:19:00-07:00,2022-01-01T11:00:00-07:00,"['* WHAT...Heavy snow possible above 6000 feet. Total snow\naccumulations of 3 to 7 inches possible, with up to a foot above\n8000 feet. Winds could gust as high as 35 mph.', '* WHERE...Areas above 6000 feet near Buffalo Pass, Ganado and\nWindow Rock.', '* WHEN...From late tonight through Saturday morning.', '* IMPACTS...Plan on slippery road conditions. The hazardous\nconditions could impact the morning or evening commute.', 'Snow forecast from 5 AM Friday to 11 AM Saturday:', 'Buffalo Pass  4 to 8  inches          Ganado  2 to 4  inches\nWindow Rock  2 to 4  inches.']"
5,AZ,Northwest Plateau; Lincoln County; Sheep Range; Spring Mountains-Red Rock Canyon,Winter Storm Warning,Severe,Likely,Expected,2021-12-30T02:06:00-08:00,2021-12-31T16:00:00-08:00,"['* WHAT...Snow will continue through the morning before starting\nto diminish this afternoon. Total snow accumulations of 8 to 12\ninches in the Spring Mountains, Sheep Range, and the mountains\nof southeast Lincoln County. 5 to 10 inches for northern Mohave\nCounty plateaus and mountains.', '* WHERE...In Nevada, Spring Mountains-Red Rock Canyon, Sheep\nRange and Lincoln County. In Arizona, Northwest Plateau.', '* WHEN...Until 4 PM PST /5 PM MST/ Friday.', '* IMPACTS...Travel could be very difficult, especially on Highway\n160 across Mountain Spring Summit. Also, Highway 156, 157 and\n158 into Kyle and Lee Canyons. All highways throughout Lincoln\nCounty and Highway 389 and Mount Trumbull Loop in northern\nMohave County.']"
6,AZ,White Mountains of Graham and Greenlee Counties including Hannagan Meadow,Winter Storm Watch,Severe,Possible,Future,2021-12-30T02:19:00-07:00,2022-01-01T11:00:00-07:00,"['* WHAT...Heavy wet snow possible. Total snow accumulations of 12\nto 24 inches are possible above 7000 ft. Winds could gust as\nhigh as 40 mph Friday and Friday night.', '* WHERE...White Mountains of Graham and Greenlee Counties.', '* WHEN...From early Friday morning through Saturday morning.', '* IMPACTS...Plan on slippery road conditions and significantly\nreduced visibility in any blowing snow. Bursts of heavy snow\nmay make travel very difficult at best.']"
7,AZ,Galiuro and Pinaleno Mountains including Mount Graham; Chiricahua Mountains including Chiricahua National Monument; Dragoon/Mule/Huachuca and Santa Rita Mountains including Bisbee/Canelo Hills/Madera Canyon; Santa Catalina and Rincon Mountains including Mount Lemmon/Summerhaven,Winter Storm Watch,Severe,Possible,Future,2021-12-30T02:19:00-07:00,2022-01-01T11:00:00-07:00,"['* WHAT...Heavy wet snow possible. Total snow accumulations of 12\nto 24 inches are possible above 7000 ft. Winds could gust as\nhigh as 40 mph Friday and Friday night.', '* WHERE...Galiuro and Pinaleno Mountains, Chiricahua Mountains,\nHuachuca and Santa Rita Mountains and Catalina and Rincon\nMountains above 7000 ft.', '* WHEN...From late tonight through Saturday morning.', '* IMPACTS...Plan on slippery road conditions and significantly\nreduced visibility in any blowing snow. Bursts of heavy snow\nmay make travel very difficult at best.']"
0,CA,South End of the Lower Sierra; South End of the Upper Sierra; Kern River Valley; Piute Walker Basin; Tehachapi; Grapevine; Frazier Mountain Communities,Winter Weather Advisory,Moderate,Likely,Expected,2021-12-30T09:57:00-08:00,2021-12-30T14:00:00-08:00,"['* WHAT...Snow. Additional snow accumulations one to three\ninches. Snow level near pass level around 4500 feet.', '* WHERE...Portions of central California.', '* WHEN...Until 2 PM PST this afternoon.', '* IMPACTS...Plan on slippery road conditions.']"
1,CA,Los Angeles County Mountains excluding the Santa Monica Range; Antelope Valley; Los Angeles County San Gabriel Valley,Flash Flood Watch,Severe,Possible,Future,2021-12-30T05:25:00-08:00,2021-12-30T16:00:00-08:00,"['* WHAT...Flash flooding and debris flows caused by excessive\nrainfall continue to be possible over the Lake, Bobcat, Dam, and\nRanch 2 burn scar.', '* WHERE...The following recent burn areas of Los Angeles County, the\nLake burn area near Lake Hughes, and the Bobcat, Dam, and Ranch 2\nburns in the eastern San Gabriel Mountains and foothills.', '* WHEN...Until 4 PM PST this afternoon.', '* IMPACTS...Heavy rainfall could trigger flash flooding and debris\nflows in and around these recent burn scars. Roads may be impacted\nor closed and vehicles may be stranded. Localized damage to\nstructures is possible. Residents near these burn scars should\nprepare for potential flash flooding and debris flow impacts. Be\nsure to stay up to date with information and orders from local\nauthorities.', '* ADDITIONAL DETAILS...\n- National Weather Service Meteorologists are forecasting heavy\nrainfall over the burn scar, which may lead to flash flooding\nand debris flows.\n- http://www.weather.gov/safety/flood']"
2,CA,"Los Angeles, CA; Ventura, CA",Flood Advisory,Minor,Likely,Expected,2021-12-30T04:54:00-08:00,2021-12-30T10:45:00-08:00,"['* WHAT...Flooding caused by moderate to locally heavy rainfall is\nexpected.', '* WHERE...A portion of southwest California, including eastern\nVentura County and the coast, valleys, and mountain slopes of Los\nAngeles County.', '* WHEN...Until 1045 AM PST.', '* IMPACTS...Moderate rainfall, heavy at times could trigger shallow\ndebris flows in and near recent wildfire burn scars. Minor\nflooding in low-lying and poor drainage areas. Ponding of water in\nurban or other areas is occurring or is imminent.', '* ADDITIONAL DETAILS...\n- At 448 AM PST, Doppler radar and automated rain gauges\nindicated moderate to locally heavy rain falling across the\nregion. Rainfall rates as high as 0.25 to 0.50 inch per hour\nhave been observed. Between 1.25 and 3.00 inches of rain have\nfallen over the advisory and more rain is still expected\nacross the Southland this morning. Minor flooding of roadways\nis ongoing or expected to begin shortly in the advisory area.\n- Some locations that will experience flooding include...\nLong Beach, Thousand Oaks, Simi Valley, Camarillo, Fillmore,\nMalibu, Acton, Wrightwood, North Hollywood, Burbank,\nUniversal City, Griffith Park, Van Nuys, Hollywood, Beverly\nHills, Encino, Northridge, Downtown Los Angeles, Culver City\nand Pasadena.\n- http://www.weather.gov/safety/flood']"
