,State,Area,Event,Severity,Certainty,Urgency,Effective,Ends,Description
3,MT,Butte/Blackfoot Region; Potomac/Seeley Lake Region,Winter Weather Advisory,Moderate,Likely,Expected,2021-12-29T08:15:00-07:00,2021-12-29T11:00:00-07:00,"['* WHAT...Snow. Additional snow accumulations of up to one inch.', '* WHERE...Butte, Georgetown Lake, Highway 12 Garrison to\nElliston, Homestake Pass, MacDonald Pass, Highway 200 Bonner\nto Greenough, Highway 83 Seeley Lake to Condon, and I-90 East\nMissoula to Bearmouth.', '* WHEN...Until 11 AM MST this morning.', '* IMPACTS...Travel could be affected. The cold wind chills as\nlow as 30 below zero could cause frostbite on exposed skin in\nas little as 30 minutes.']"
4,MT,Bitterroot/Sapphire Mountains,Winter Weather Advisory,Moderate,Likely,Expected,2021-12-29T08:15:00-07:00,2021-12-29T11:00:00-07:00,"['* WHAT...Snow. Additional snow accumulations of up to one inch.', '* WHERE...Bitterroot/Sapphire Mountains.', '* WHEN...Until 11 AM MST this morning.', '* IMPACTS...Travel could be affected. The cold wind chills as\nlow as 20 below zero could cause frostbite on exposed skin in\nas little as 30 minutes.']"
5,MT,Missoula/Bitterroot Valleys,Winter Weather Advisory,Moderate,Likely,Expected,2021-12-29T08:15:00-07:00,2021-12-29T11:00:00-07:00,"['* WHAT...Snow. Additional snow accumulations of up to one inch.', '* WHERE...Missoula/Bitterroot Valleys.', '* WHEN...Until 11 AM MST this morning.', '* IMPACTS...Travel could be affected. The cold wind chills as\nlow as 10 below zero could result in hypothermia if\nprecautions are not taken.']"
6,MT,Cascade; Chouteau; Central and Southern Lewis and Clark; Southern Rocky Mountain Front; Eastern Teton; Judith Basin; Fergus; Meagher,Wind Chill Advisory,Moderate,Likely,Expected,2021-12-29T02:57:00-07:00,2021-12-30T06:00:00-07:00,"['* WHAT...Very cold wind chills. Wind chills as low as 35 below zero.', '* WHERE...Portions of central, north central, and west central\nMontana.', '* WHEN...Until 6 AM MST Thursday.', '* IMPACTS...The dangerously cold wind chills could cause frostbite\non exposed skin in as little as 15 minutes.', '* ADDITIONAL DETAILS...Occasional light snow may cause roads to\nremain slippery. Use caution while driving.']"
7,MT,Northern Rocky Mountain Front; Eastern Glacier; Hill; Toole; Liberty; Eastern Pondera; Blaine,Wind Chill Warning,Severe,Likely,Expected,2021-12-29T02:57:00-07:00,2021-12-30T06:00:00-07:00,"['* WHAT...Dangerously cold wind chills. Wind chills as low as 50\nbelow zero.', '* WHERE...A portion of north central Montana.', '* WHEN...Until 6 AM MST Thursday.', '* IMPACTS...The dangerously cold wind chills could cause frostbite\non exposed skin in as little as 10 minutes.', '* ADDITIONAL DETAILS...Occasional light snow may cause roads to\nremain slippery. Use caution while driving.']"
8,MT,Central and Southeast Phillips; Central and Southern Valley; Daniels; Sheridan; Western Roosevelt; Northern Phillips; Northern Valley; Eastern Roosevelt,Wind Chill Warning,Severe,Likely,Expected,2021-12-29T02:56:00-07:00,2021-12-30T08:00:00-07:00,"['* WHAT...Dangerously cold wind chills. Wind chills as low as 50\nbelow zero.', '* WHERE...Portions of northeast Montana north of the Missouri\nRiver.', '* WHEN...Until 8 AM MST Thursday.', '* IMPACTS...The dangerously cold wind chills could cause\nfrostbite on exposed skin in as little as 10 minutes.']"
9,MT,Petroleum; Garfield; McCone; Richland; Dawson; Prairie; Wibaux; Southwest Phillips,Wind Chill Advisory,Moderate,Likely,Expected,2021-12-29T02:56:00-07:00,2021-12-30T08:00:00-07:00,"['* WHAT...Very cold wind chills. Wind chills as low as 35 below\nzero.', '* WHERE...Portions of northeast Montana south of the Missouri\nRiver.', '* WHEN...Until 8 AM MST Thursday.', '* IMPACTS...The dangerously cold wind chills could cause\nfrostbite on exposed skin in as little as 10 minutes.']"
10,MT,Musselshell; Northern Rosebud; Custer; Fallon; Golden Valley; Judith Gap; Southern Wheatland,Wind Chill Advisory,Moderate,Likely,Expected,2021-12-29T01:56:00-07:00,2021-12-29T14:00:00-07:00,"['* WHAT...Very cold wind chills of 20 to 30 below zero.', '* WHERE...Portions of Central and Southeast Montana.', '* WHEN...Until 2 PM MST Wednesday.', '* IMPACTS...The cold wind chills could cause frostbite on\nexposed skin in as little as 30 minutes.']"
0,NV,Humboldt County; Northern Elko County; Southeastern Elko County; Ruby Mountains and East Humboldt Range; White Pine County; Northern Lander County and Northern Eureka County; Southern Lander County and Southern Eureka County; Southwest Elko County; South Central Elko County; Northwestern Nye County; Northeastern Nye County,Special Weather Statement,Moderate,Observed,Expected,2021-12-29T05:45:00-08:00,,"['A series of short waves will bring snow showers to much of\nnorthern and central Nevada today through Friday. The first system\nwill impact the region today and tonight, while the second\nsystem looks to arrive later Thursday and last into Friday. Snow\naccumulations should be on the light side, with generally less\nthan an inch in the valleys with each system. Mountains could see\n1-4+ inches with each system. While the holiday weekend looks to\nbe on the drier side, much colder temps expected. Nighttime lows\nexpected to dip into the single digits Friday and Saturday night,\nwith some sub-zero temps likely.', 'Visit www.weather.gov/elko for the latest weather information.']"
1,NV,Esmeralda and Central Nye County,Winter Weather Advisory,Moderate,Likely,Expected,2021-12-29T02:21:00-08:00,2021-12-30T16:00:00-08:00,"['* WHAT...Snow expected above 4500 feet. Total snow accumulations\nof up to 8 inches on the mountains of the Nevada National\nSecurity Site.', '* WHERE...Esmeralda and Central Nye County.', '* WHEN...From 7 AM Wednesday to 4 PM PST Thursday.', '* IMPACTS...Plan on slippery road conditions.']"
2,NV,Northwest Plateau; Lincoln County; Sheep Range; Spring Mountains-Red Rock Canyon,Winter Storm Warning,Severe,Likely,Expected,2021-12-29T02:21:00-08:00,2021-12-31T16:00:00-08:00,"['* WHAT...Heavy snow expected. Total snow accumulations as high as\n12 to 24 inches in the Spring Mountains, Sheep Range, and the\nmountains of southeast Lincoln County and northern Mohave County.', '* WHERE...Lincoln County, Sheep Range, Spring Mountains-Red Rock\nCanyon and Northwest Plateau.', '* WHEN...From 10 AM Wednesday to 4 PM PST Friday.', '* IMPACTS...Travel could be very difficult, especially on Highway\n160 across Mountain Spring Summit. Also, Highway 156, 157 and\n158 into Kyle and Lee Canyons. Higher elevations of Red Rock\nLoop may also be impacted. All highways throughout Lincoln\nCounty and Highway 389 and Mount Trumbull Loop in northern\nMohave County.']"
3,NV,Greater Lake Tahoe Area; Greater Lake Tahoe Area,Winter Weather Advisory,Moderate,Likely,Expected,2021-12-29T02:06:00-08:00,2021-12-29T22:00:00-08:00,"['* WHAT...Snow expected. Total snow accumulations of 2 to 6\ninches for communities around Lake Tahoe, with 6 to 12 inches\nabove 7000 feet.', '* WHERE...Greater Lake Tahoe Area.', '* WHEN...Until 10 PM PST this evening.', '* IMPACTS...Widespread travel impacts are already ongoing due to\nrecent heavy snowfall. Plan on more travel impacts including\nvery long delays and additional potential road closures.']"
4,NV,Surprise Valley California; Lassen-Eastern Plumas-Eastern Sierra Counties; Greater Lake Tahoe Area; Mono; Mineral and Southern Lyon Counties; Greater Lake Tahoe Area; Greater Reno-Carson City-Minden Area; Western Nevada Basin and Range including Pyramid Lake; Northern Washoe County,Special Weather Statement,Moderate,Observed,Expected,2021-12-29T01:51:00-08:00,,"['* Periods of snow and snow showers will continue through this\nevening, producing additional travel impacts and delays,\nprimarily in the Sierra. For western Nevada, areas of snow may\nproduce icy patches on pavement for both the morning and evening\ncommutes. Bands of enhanced snowfall this afternoon may lead to\nroads becoming icy and hazardous after sunset.', ""* Coldest air in nearly 5 years set to arrive for the end of the\nweek into the New Year's weekend, with frigid temperatures most\nlikely Saturday and Sunday mornings. Forecast lows are in the\nsingle digits for much of western Nevada and well below zero in\nSierra communities."", ""* Vulnerable and homeless populations could be significantly\nimpacted. People traveling to the Sierra ski areas should\nprepare for very cold wind chills. New Year's Eve at this point\nlooks dry but quite chilly for outdoor activities, with wind\nchills ranging from near zero to 15 degrees above zero by\nmidnight.""]"
5,NV,Surprise Valley California; Lassen-Eastern Plumas-Eastern Sierra Counties; Greater Lake Tahoe Area; Mono; Mineral and Southern Lyon Counties; Greater Lake Tahoe Area; Greater Reno-Carson City-Minden Area; Western Nevada Basin and Range including Pyramid Lake; Northern Washoe County,Special Weather Statement,Moderate,Observed,Expected,2021-12-28T14:09:00-08:00,,"['* Periods of snow and snow showers will return from late tonight\nthrough Wednesday evening, producing additional travel impacts\nand delays, primarily in the Sierra. For western Nevada, areas\nof snow could produce icy patches on pavement for the Wednesday\nmorning commute, while bands of enhanced snowfall Wednesday\nafternoon could lead to roads becoming icy and hazardous after\nsunset through Wednesday evening.', ""* Even colder air will arrive for the end of the week into the New\nYear's weekend, with frigid temperatures most likely Saturday\nand Sunday mornings. These could be the coldest nights in nearly\nfive years for many areas, with lows in the single digits for\nmuch of western Nevada and well below zero in Sierra\ncommunities."", ""* Vulnerable and homeless populations could be significantly\nimpacted. People traveling to the Sierra ski areas should\nprepare for very cold wind chills. New Year's Eve at this point\nlooks dry but quite chilly for outdoor activities, with wind\nchills ranging from near zero to 15 degrees above zero by\nmidnight.""]"
0,NM,East Slopes Sangre de Cristo Mountains; Northeast Highlands,Wind Advisory,Moderate,Likely,Expected,2021-12-29T04:02:00-07:00,2021-12-29T15:00:00-07:00,"['* WHAT...West winds 25 to 35 mph with gusts up to 50 mph expected.', '* WHERE...East Slopes Sangre de Cristo Mountains and Northeast\nHighlands.', '* WHEN...From 10 AM this morning to 3 PM MST this afternoon.', '* IMPACTS...Gusty winds will blow around unsecured objects. Tree\nlimbs may be blown down. Expect strong cross winds on area\nroadways, including portions of Interstate 25.']"
1,NM,Far Northwest Highlands; Tusas Mountains Including Chama; Jemez Mountains; Northern Sangre de Cristo Mountains; Southern Sangre de Cristo Mountains,Winter Storm Warning,Severe,Likely,Expected,2021-12-29T03:03:00-07:00,2021-12-29T11:00:00-07:00,"['* WHAT...Snow and blowing snow expected. Additional snow\naccumulations of 2 to 5 inches, except 5 to 10 inches above 9,000\nfeet. The combination of snow and blowing snow will lead to poor\nvisibility, especially through mountainous terrain.', '* WHERE...Northern and Southern Sangre de Cristo Mountains, Far\nNorthwest Highlands, Tusas Mountains Including Chama, and Jemez\nMountains.', '* WHEN...Until 11 AM MST this morning.', '* IMPACTS...Travel could be very difficult, especially along U.S.\nHighway 64. Some roads may be closed and significant travel delays\nare possible. Tire chains may be necessary if traveling through\nmountain passes.']"
2,NM,Northwest Plateau; Chuska Mountains; Northwest Highlands; West Central Plateau; West Central Mountains; Southwest Mountains,Winter Weather Advisory,Moderate,Likely,Expected,2021-12-29T03:03:00-07:00,2021-12-29T11:00:00-07:00,"['* WHAT...Snow and blowing snow expected. Additional snow\naccumulations of 1 to 3 inches. The combination of snow and\nblowing snow will lead to poor visibility, especially through\nmountainous terrain.', '* WHERE...Western Mountains, Northwest Plateau, Northwest Highlands,\nand West Central Plateau.', '* WHEN...Until 11 AM MST this morning.', '* IMPACTS...Plan on snow packed and icy road conditions. This\nincludes portions of Interstate 40 and U.S. Highway 550. Travel\ncould be difficult at times with low visibility and areas of\nblowing snow.']"
3,NM,Guadalupe Mountains of Eddy County; Guadalupe Mountains Above 7000 Feet; Guadalupe and Delaware Mountains,High Wind Warning,Severe,Likely,Expected,2021-12-29T01:56:00-06:00,2021-12-29T20:00:00-06:00,"['* WHAT...For the High Wind Warning, west winds 35 to 45 mph with\ngusts up to 70 mph. For the High Wind Watch, west winds 35 to\n45 mph with gusts up to 60 mph possible.', '* WHERE...Guadalupe and Delaware Mountains.', '* WHEN...For the High Wind Warning, until 8 PM CST /7 PM MST/\nWednesday. For the High Wind Watch, from Thursday afternoon\nthrough Thursday evening.', '* IMPACTS...Travel will be difficult, especially for high\nprofile vehicles. Severe turbulence near the mountains will be\nhazardous for low flying light aircraft.']"
4,NM,Guadalupe Mountains of Eddy County; Guadalupe Mountains Above 7000 Feet; Guadalupe and Delaware Mountains,High Wind Watch,Severe,Possible,Future,2021-12-29T01:56:00-06:00,2021-12-30T22:00:00-06:00,"['* WHAT...For the High Wind Warning, west winds 35 to 45 mph with\ngusts up to 70 mph. For the High Wind Watch, west winds 35 to\n45 mph with gusts up to 60 mph possible.', '* WHERE...Guadalupe and Delaware Mountains.', '* WHEN...For the High Wind Warning, until 8 PM CST /7 PM MST/\nWednesday. For the High Wind Watch, from Thursday afternoon\nthrough Thursday evening.', '* IMPACTS...Travel will be difficult, especially for high\nprofile vehicles. Severe turbulence near the mountains will be\nhazardous for low flying light aircraft.']"
0,ND,McKenzie; Dunn; Mercer; Oliver; Golden Valley; Billings; Stark; Morton; Slope; Hettinger; Grant; Bowman; Adams; Sioux,Wind Chill Advisory,Moderate,Likely,Expected,2021-12-29T06:51:00-06:00,2021-12-29T18:00:00-06:00,"['* WHAT...Dangerously cold. Wind chills 25 to 35 below zero.', '* WHERE...South and west of the Missouri River.', '* WHEN...Until 6 PM CST/5 PM MST/ this evening.', '* IMPACTS...Frostbite on exposed skin in as little as 15 minutes.']"
1,ND,Divide; Burke; Renville; Bottineau; Rolette; Williams; Mountrail; Ward; McHenry; Pierce; McLean; Sheridan; Wells; Foster; Burleigh; Kidder; Stutsman; Emmons; Logan; La Moure; McIntosh; Dickey,Wind Chill Warning,Severe,Likely,Expected,2021-12-29T06:51:00-06:00,2021-12-29T18:00:00-06:00,"['* WHAT...Dangerous to life threatening cold. Wind chills in the 40s\nbelow zero.', '* WHERE...North and east of the Missouri River.', '* WHEN...Until 6 PM CST this evening.', '* IMPACTS...Frostbite on exposed skin in as little as 10 minutes.']"
2,ND,West Polk; Norman; Clay; Kittson; West Marshall; Wilkin; Towner; Cavalier; Pembina; Benson; Ramsey; Eastern Walsh County; Eddy; Nelson; Grand Forks; Griggs; Steele; Traill; Barnes; Cass; Ransom; Sargent; Richland; Western Walsh County,Wind Chill Warning,Severe,Likely,Expected,2021-12-29T04:00:00-06:00,2021-12-29T18:00:00-06:00,"['* WHAT...Dangerously cold wind chills. Wind chills as low as 50\nbelow zero.', '* WHERE...Portions of northwest and west central Minnesota and\nnortheast and southeast North Dakota.', '* WHEN...Until 6 PM CST this evening.', '* IMPACTS...The dangerously cold wind chills could cause\nfrostbite on exposed skin in as little as 10 minutes.']"
0,OK,Benton; Carroll; Washington; Madison; Crawford; Franklin; Sebastian; Pushmataha; Choctaw; Osage; Washington; Nowata; Craig; Ottawa; Pawnee; Tulsa; Rogers; Mayes; Delaware; Creek; Okfuskee; Okmulgee; Wagoner; Cherokee; Adair; Muskogee; McIntosh; Sequoyah; Pittsburg; Haskell; Latimer; Le Flore,Special Weather Statement,Moderate,Observed,Expected,2021-12-29T04:25:00-06:00,,"['A strong cold front is expected to move into northeast Oklahoma\nlate Friday night and then cross all of eastern Oklahoma and\nnorthwest Arkansas by later Saturday morning. Temperatures will\nstart falling by early Saturday morning north of Interstate 40\nand begin falling during the morning and early afternoon farther\nsouth and east.', 'While there remains uncertainty, there is some chance of light\nwintry precipitation early Saturday. But the focus at the moment\nis the temperature change. If you have things outdoors that have\nbeen fine during the recent mild conditions, but may be impacted\nduring a hard freeze, you should keep up with the latest forecast\nand prepare outdoor items like faucets and plants for the cold\nfront.']"
0,OR,South Central Oregon Coast; Curry County Coast,Freeze Watch,Severe,Possible,Future,2021-12-29T04:50:00-08:00,2021-12-30T07:00:00-08:00,"['* WHAT...Sub-freezing temperatures as low as 25 possible.', '* WHERE...Southern Oregon coast including Coos Bay, Bandon, and\nGold Beach.', '* WHEN...From this evening through Thursday morning.', '* IMPACTS...Frost and freeze conditions could kill crops, other\nsensitive vegetation and possibly damage unprotected outdoor\nplumbing.', '* ADDITIONAL DETAILS...Increasing clouds early Thursday morning is\nmaintaining some uncertainty in low temperatures tonight into\nThursday morning.', '* View the hazard area in detail at\nhttps://www.wrh.noaa.gov/map/?wfo=mfr']"
1,OR,Northern Oregon Cascade Foothills; Northern Oregon Cascades,Winter Weather Advisory,Moderate,Likely,Expected,2021-12-29T04:02:00-08:00,2021-12-30T22:00:00-08:00,"['* WHAT...Snow expected. Total snow accumulations 3 to 7 inches for\nthe Cascade foothills and 6 to 12 inches for the Cascades.', '* WHERE...Northern Oregon Cascade Foothills and Northern Oregon\nCascades.', '* WHEN...From 7 AM to 10 PM PST Thursday.', '* IMPACTS...Travel could be very difficult.', '* ADDITIONAL DETAILS...Snow levels rise to about 1500 feet\nThursday afternoon, then gradually lower Thursday night.']"
2,OR,Foothills of the Northern Blue Mountains of Oregon; Foothills of the Southern Blue Mountains of Oregon; Foothills of the Blue Mountains of Washington,Winter Weather Advisory,Moderate,Likely,Expected,2021-12-29T02:28:00-08:00,2021-12-29T10:00:00-08:00,"['* WHAT...Snow. Additional snow accumulations of 1 to 2 inches.', '* WHERE...In Washington, Foothills of the Blue Mountains of\nWashington. In Oregon, Foothills of the Northern Blue\nMountains of Oregon and Foothills of the Southern Blue\nMountains of Oregon.', '* WHEN...Until 10 AM PST this morning.', '* IMPACTS...Plan on slippery road conditions. The hazardous\nconditions could impact the morning commute, especially along\nInterstate 84.']"
3,OR,Lower Columbia Basin of Oregon,Winter Weather Advisory,Moderate,Likely,Expected,2021-12-29T02:28:00-08:00,2021-12-29T10:00:00-08:00,"['* WHAT...Snow. Additional snow accumulations of 1 to 2 inches.', '* WHERE...Lower Columbia Basin of Oregon.', '* WHEN...Until 10 AM PST this morning.', '* IMPACTS...Plan on slippery road conditions. The hazardous\nconditions could impact the morning commute, especially long\nInterstate 84.']"
4,OR,John Day Basin,Winter Weather Advisory,Moderate,Likely,Expected,2021-12-29T02:28:00-08:00,2021-12-29T10:00:00-08:00,"['* WHAT...Snow with accumulations of up to 1 to 3 inches.', '* WHERE...John Day Basin.', '* WHEN...Until 10 AM PST this morning.', '* IMPACTS...Plan on slippery road conditions. The hazardous\nconditions could impact the morning commute.']"
5,OR,Eastern Douglas County Foothills,Winter Weather Advisory,Moderate,Likely,Expected,2021-12-29T01:40:00-08:00,2021-12-29T10:00:00-08:00,"['* WHAT...Snow. Additional snow accumulations of 1 to 3 inches.', '* WHERE...All of Eastern Douglas County Foothills, including\nSteamboat and Toketee Falls.', '* WHEN...Until 10 AM PST this morning.', '* IMPACTS...Plan on slippery road conditions. The hazardous\nconditions could impact the morning commute.', '* View the hazard area in detail at\nhttps://www.wrh.noaa.gov/map/?wfo=mfr']"
6,OR,Western Siskiyou County; Central Douglas County; Eastern Curry County and Josephine County; Jackson County,Winter Weather Advisory,Moderate,Likely,Expected,2021-12-29T01:40:00-08:00,2021-12-29T10:00:00-08:00,"['* WHAT...Snow. Snow accumulations of 1 to 3 inches.', '* WHERE...In California, Western Siskiyou County. This includes\nKlamath River, Happy Camp, Fort Jones and Etna. In Oregon,\nCentral Douglas County, Eastern Curry County and Josephine\nCounty and Jackson County. This includes Medford, Central Point,\nAshland, Talent, Jacksonville, Ruch, and passes on I-5 north of\nGrants Pass. It also includes portions of Highway 199 between\nGrants Pass and Obrien.', '* WHEN...Until 10 AM PST this morning.', '* IMPACTS...Plan on slippery and icy road conditions. The\nhazardous conditions could impact the morning commute.', '* ADDITIONAL DETAILS...We now think snow will impact elevations\ndown to valley floors. Snow impacts will gradually subside from\nnorth to south later this morning.', '* View the hazard area in detail at\nhttps://www.wrh.noaa.gov/map/?wfo=mfr']"
7,OR,West Central Mountains; Baker County,Winter Weather Advisory,Moderate,Likely,Expected,2021-12-29T02:28:00-07:00,2021-12-29T11:00:00-07:00,"['* WHAT...Snow expected. Additional snow accumulations of 2 to\n4 inches, except up to 6 inches over the mountains.', '* WHERE...West Central Mountains zone.', '* WHEN...Through 11 AM MST Wednesday morning.', '* IMPACTS...Plan on slippery road conditions.']"
8,OR,Lower Treasure Valley; Boise Mountains; Malheur County; Oregon Lower Treasure Valley,Winter Weather Advisory,Moderate,Likely,Expected,2021-12-29T02:28:00-07:00,2021-12-29T17:00:00-07:00,"['* WHAT...Snow expected. Total snow accumulations of 2 to 4 inches,\nexcept up to 6 inches over the mountains.', '* WHERE...Portions of southeast Oregon and southwest and west\ncentral Idaho. The heavier amounts will be in Idaho north of\nthe Snake Basin.', '* WHEN...Through 5 PM MST /4 PM PST/ Wednesday afternoon.', '* IMPACTS...Plan on slippery road conditions, which may impact\nthe morning commute.']"
9,OR,Eastern Columbia River Gorge of Oregon; Lower Columbia Basin of Oregon; Grande Ronde Valley; Wallowa County; Northern Blue Mountains of Oregon; Southern Blue Mountains of Oregon; John Day Basin; Ochoco-John Day Highlands; Foothills of the Northern Blue Mountains of Oregon; Foothills of the Southern Blue Mountains of Oregon; East Slopes of the Oregon Cascades; North Central Oregon; Central Oregon; Eastern Columbia River Gorge of Washington; Kittitas Valley; Yakima Valley; Lower Columbia Basin of Washington; Foothills of the Blue Mountains of Washington; Northwest Blue Mountains; East Slopes of the Washington Cascades; Simcoe Highlands,Special Weather Statement,Moderate,Observed,Expected,2021-12-28T23:51:00-08:00,,"['An Arctic airmass will hold its grip on much of the Pacific\nNorthwest through the remainder of the work week with prolonged\nsubfreezing temperatures and bouts of snow. Daytime highs will\nstruggle to rise into the 20s and low 30s with lows in the single\ndigits and low teens. Areas in the mountains, and those that\nreceive heavier snowfall in the lower elevations, may even see\ntemperatures slip below zero with rapid loss of heat during the\novernight and early morning hours. While winds are expected to\nremain light, event winds of 10 mph will make single digit wind\nchills common, with some areas seeing wind chills below zero.', 'These extremely cold temperatures can lead to rapid onset of\nfrost bite and hypothermia for those without adequate clothing and\nprotection from the cold. If outdoors, remember to dress in\nlayers and cover exposed skin. Due to the prolonged nature of sub\nfreezing temperatures, uncovered pipes will be susceptible to\nfreezing and bursting. Take steps to ensure pipes are protected\nand outdoor faucets are covered.']"
0,PR,San Juan and Vicinity; Northeast; North Central; Northwest; Mayaguez and Vicinity; Culebra; St.Thomas...St. John.. and Adjacent Islands,Rip Current Statement,Moderate,Likely,Expected,2021-12-29T10:41:00-04:00,2021-12-30T18:00:00-04:00,"['* WHAT...Dangerous rip currents expected due to breaking waves\ngreater than 8 feet.', '* WHERE...North-facing beaches of Puerto Rico, Culebra and\nnorthern St. Thomas.', '* WHEN...Through Thursday afternoon.', '* IMPACTS...Rip currents can sweep even the best swimmers away\nfrom shore into deeper water.']"
0,SD,Corson; Campbell; Walworth; Edmunds; Day; Potter; Faulk; Spink; Clark; Codington; Grant; Deuel,Wind Chill Advisory,Moderate,Likely,Expected,2021-12-29T04:12:00-06:00,2021-12-29T12:00:00-06:00,"['* WHAT...Very cold wind chills. Wind chills as low as 30 below\nzero.', '* WHERE...Portions of north central and northeast South Dakota.', '* WHEN...Until noon CST /11 AM MST/ today.', '* IMPACTS...The dangerously cold wind chills could cause\nfrostbite on exposed skin in as little as 10 minutes.']"
1,SD,Traverse; Big Stone; McPherson; Brown; Marshall; Roberts,Wind Chill Warning,Severe,Likely,Expected,2021-12-29T04:12:00-06:00,2021-12-29T12:00:00-06:00,"['* WHAT...Dangerously cold wind chills. Wind chills as low as 40\nbelow zero.', '* WHERE...Portions of north central and northeast South Dakota\nand west central Minnesota.', '* WHEN...Until noon CST today.', '* IMPACTS...The dangerously cold wind chills could cause\nfrostbite on exposed skin in as little as 10 minutes.']"
0,TX,Val Verde; Edwards; Real; Kinney; Uvalde; Maverick; Zavala; Dimmit,Special Weather Statement,Moderate,Observed,Expected,2021-12-29T09:56:00-06:00,,"['Areas of fog remain locally dense along and west of a Rocksprings\nto Uvalde to Carrizo Springs line. Some locations are seeing\ndense fog, reducing visibility to 1/4 mile. Motorists are urged to\nslow down, use low beams, and allow extra time to reach their\ndestinations. Visibility is forecast to improve by 1130 AM.']"
