,State,Area,Event,Severity,Certainty,Urgency,Effective,Ends,Description
6,NV,White Pine County; Southern Lander County and Southern Eureka County,Special Weather Statement,Moderate,Observed,Expected,2022-03-10T02:20:00-08:00,,"['Snow showers, some moderate at times, this morning will diminish\nby midday. Up to an inch or so of additional snow possible for\nvalleys, with 1-3 inches possible in the mountains. In addition,\ngusty northerly winds could result in blowing and drifting snow,\nespecially on passes and summits. Road conditions could be\nhazardous this morning and travelers should exercise caution.', 'Visit www.weather.gov/elko for the latest weather information.']"
7,NV,Northwestern Nye County,Wind Advisory,Moderate,Likely,Expected,2022-03-10T02:12:00-08:00,2022-03-10T18:00:00-08:00,"['* WHAT...North winds 20 to 30 mph with gusts up to 50 mph\nexpected.', '* WHERE...Northwestern Nye County.', '* WHEN...From 6 AM this morning to 6 PM PST this evening.', '* IMPACTS...Gusty winds could blow around unsecured objects. A\nfew power outages are possible.', '* ADDITIONAL DETAILS...Blowing dust may reduce visibilities for\nbrief periods of time.']"
0,NH,Northern Oxford; Northern Franklin; Central Somerset; Northern Coos; Southern Coos; Northern Grafton; Northern Carroll; Southern Grafton,Winter Storm Watch,Severe,Possible,Future,2022-03-10T02:58:00-05:00,2022-03-12T23:00:00-05:00,"['* WHAT...Heavy snow possible. Total snow accumulations of 6 inches\nor more possible. Winds could gust over 35 mph as the storm exits\nthe region early Sunday morning.', '* WHERE...Portions of west central and western Maine. Portions of\nnorthern New Hampshire.', '* WHEN...From late Friday night through Saturday evening.', '* IMPACTS...The potential exists for snowbands that will bring\nperiods of locally heavy snowfall, which will lead to rapid snow\naccumulations and extremely dangerous travel conditions. Travel\nwill be very difficult due to low visibility and snow covered\nroads.']"
0,NM,Northern Sangre de Cristo Mountains,Avalanche Warning,Unknown,Unknown,Unknown,2022-03-10T05:53:00-07:00,,"['The following message is transmitted at the request of the Taos\nAvalanche Center.', 'The Taos Avalanche Center in Taos has issued a Backcountry\nAvalanche Warning.', '* WHAT...The avalanche danger will rise to high today into the\nevening.', '* WHERE...Wheeler Peak Wilderness Area and Columbine Hondo\nWilderness above 9,000 feet.', '* WHEN...In effect from 6 AM MST today through 5 AM MST Friday.', '* IMPACTS...Up to 2 feet of snow and wind today will continue to\nadd to snow totals over the last week that will be approaching 5\nfeet. This will likely create widespread areas of unstable snow.\nBoth human triggered and natural avalanches are likely. Stay off\nof slopes steeper than 30 degrees. This warning does not apply\nto ski areas where avalanche hazard reduction measures are\nperformed. Similar avalanche danger may exist at locations\noutside the coverage area of this or any avalanche center.']"
1,NM,Uplands of the Bootheel,Wind Advisory,Moderate,Likely,Expected,2022-03-10T05:17:00-07:00,2022-03-10T19:00:00-07:00,"['* WHAT...Southwest winds 25 to 35 mph with gusts up to 45 to 50\nmph expected.', '* WHERE...Higher terrain of the New Mexico Bootheel in far\nsouthwest New Mexico', '* WHEN...From 11 AM this morning to 7 PM MST this evening.', '* ADDITIONAL DETAILS...Strong winds will make driving hazardous.\nThe strong winds will also create areas of blowing dust which\nwill cause quickly changing visibilities Wild fire danger will\nbe elevated.']"
2,NM,Southwest Deserts and Lowlands; South Central Lowlands And Southern Rio Grande Valley,Red Flag Warning,Severe,Likely,Expected,2022-03-10T05:14:00-07:00,2022-03-10T19:00:00-07:00,"['* AFFECTED AREA...Fire weather zone 111, in southwest New\nMexico.', '* WIND... Southwest winds between 20 and 25 mph gust up to 40\nmph.', '* HUMIDITY...10 to 15 percent', '* HIGHEST THREAT...is located across the lowlands west of the\nRio Grande Valley including Hidalgo, Luna and southern Grant\ncounties where the winds will be stronger, the relative\nhumidity will be low and the temperatures will be warmer.', '* IMPACTS...any fires that develop will likely spread rapidly.\nOutdoor burning is not recommended.']"
3,NM,East Slopes Sangre de Cristo Mountains,Winter Storm Warning,Severe,Likely,Expected,2022-03-10T02:13:00-07:00,2022-03-11T05:00:00-07:00,"['* WHAT...Heavy snow expected. Total snow accumulations of 6 to 12\ninches.', '* WHERE...East Slopes Sangre de Cristo Mountains.', '* WHEN...From noon today to 5 AM MST Friday.', '* IMPACTS...Travel could be very difficult to impossible with very\nlow visibility. Some roads may be closed. Tire chains may be\nnecessary if traveling through mountain passes. Frostbite and\nhypothermia are possible from wind chill values below zero.']"
4,NM,Johnson and Bartlett Mesas Including Raton Pass,Winter Storm Warning,Severe,Likely,Expected,2022-03-10T02:13:00-07:00,2022-03-11T05:00:00-07:00,"['* WHAT...Heavy snow expected. Total snow accumulations of 4 to 8\ninches.', '* WHERE...Johnson and Bartlett Mesas Including Raton Pass.', '* WHEN...From noon today to 5 AM MST Friday.', '* IMPACTS...Travel could be very difficult to impossible with very\nlow visibility. Some roads may be closed. Frostbite and\nhypothermia are possible from wind chill values below zero.']"
5,NM,Glorieta Mesa Including Glorieta Pass,Winter Weather Advisory,Moderate,Likely,Expected,2022-03-10T02:13:00-07:00,2022-03-11T05:00:00-07:00,"['* WHAT...Snow expected. Total snow accumulations of 3 to 6\ninches.', '* WHERE...Glorieta Mesa Including Glorieta Pass.', '* WHEN...From noon today to 5 AM MST Friday.', '* IMPACTS...Plan on slippery road conditions. This includes I-25\nbetween Santa Fe and Pecos.']"
6,NM,Northwest Plateau; Far Northwest Highlands; Northwest Highlands,Winter Weather Advisory,Moderate,Likely,Expected,2022-03-10T02:13:00-07:00,2022-03-11T05:00:00-07:00,"['* WHAT...Snow expected. Total snow accumulations of 2 to 4\ninches.', '* WHERE...Northwest Plateau, Far Northwest Highlands and\nNorthwest Highlands.', '* WHEN...Until 5 AM MST Friday.', '* IMPACTS...Plan on slippery road conditions with low visibility.\nThis includes U.S. Highway 550. Hazardous travel conditions will\nimpact the Thursday morning commute.']"
7,NM,West Central Plateau; West Central Mountains; West Central Highlands; Espanola Valley; Santa Fe Metro Area; Middle Rio Grande Valley/Albuquerque Metro Area; Sandia/Manzano Mountains Including Edgewood; Estancia Valley; Guadalupe County; Quay County,Winter Weather Advisory,Moderate,Likely,Expected,2022-03-10T02:13:00-07:00,2022-03-11T05:00:00-07:00,"['* WHAT...Snow expected. Total snow accumulations of 1 to 3 inches\nbelow 6,500 feet with 3 to 6 inches above 6,500 feet.', '* WHERE...West Central Plateau, West Central Mountains, West\nCentral Highlands, Espanola Valley, Santa Fe Metro Area,\nMiddle Rio Grande Valley including the Albuquerque Metro Area,\nSandia and Manzano Mountains including Edgewood, Estancia\nValley, Guadalupe County and Quay County.', '* WHEN...From 6 PM this evening to 5 AM MST Friday.', '* IMPACTS...Plan on slippery road conditions. This includes I-40\nfrom Gallup to Grants, Albuquerque, Edgewood, Santa Rosa, and\nTucumcari. Hazardous travel conditions will impact the Friday\nmorning commute.']"
8,NM,Central Highlands; Northeast Highlands; Union County; Harding County; Eastern San Miguel County,Winter Weather Advisory,Moderate,Likely,Expected,2022-03-10T02:13:00-07:00,2022-03-11T05:00:00-07:00,"['* WHAT...Snow expected. Total snow accumulations of 2 to 4\ninches.', '* WHERE...Central Highlands, Union County, Harding County,\nEastern San Miguel County and Northeast Highlands.', '* WHEN...From 3 PM this afternoon to 5 AM MST Friday.', '* IMPACTS...Plan on slippery road conditions with low visibility\nand areas of blowing snow. Frostbite and hypothermia are\npossible with wind chill values below zero.']"
9,NM,Far Northeast Highlands,Winter Storm Warning,Severe,Likely,Expected,2022-03-10T02:13:00-07:00,2022-03-11T05:00:00-07:00,"['* WHAT...Heavy snow expected. Total snow accumulations of 4 to 8\ninches.', '* WHERE...Far Northeast Highlands.', '* WHEN...From noon today to 5 AM MST Friday.', '* IMPACTS...Travel could be very difficult to impossible with very\nlow visibility. Some roads may be closed. Tire chains may be\nnecessary if traveling through mountain passes. Frostbite and\nhypothermia are possible from wind chill values below zero.']"
10,NM,Chuska Mountains; Jemez Mountains,Winter Weather Advisory,Moderate,Likely,Expected,2022-03-10T02:13:00-07:00,2022-03-11T05:00:00-07:00,"['* WHAT...Snow. Additional snow accumulations of 2 to 6 inches.', '* WHERE...Jemez Mountains and Chuska Mountains.', '* WHEN...Until 5 AM MST Friday.', '* IMPACTS...Plan on slippery road conditions with low visibility.']"
11,NM,Tusas Mountains Including Chama; Northern Sangre de Cristo Mountains; Southern Sangre de Cristo Mountains,Winter Storm Warning,Severe,Likely,Expected,2022-03-10T02:13:00-07:00,2022-03-11T05:00:00-07:00,"['* WHAT...Heavy snow. Additional snow accumulations of 5 to 10\ninches, except 10 to 18 inches above 8,500 feet.', '* WHERE...Northern and Southern Sangre de Cristo Mountains and\nthe Tusas Mountains Including Chama.', '* WHEN...Until 5 AM MST Friday.', '* IMPACTS...Travel could be very difficult to impossible with very\nlow visibility. Some roads may be closed. Tire chains may be\nnecessary if traveling through mountain passes. Frostbite and\nhypothermia are possible from wind chill values below zero.']"
12,NM,Upper Rio Grande Valley,Winter Storm Warning,Severe,Likely,Expected,2022-03-10T02:13:00-07:00,2022-03-11T05:00:00-07:00,"['* WHAT...Heavy snow expected. Total snow accumulations of 4 to 8\ninches.', '* WHERE...Upper Rio Grande Valley.', '* WHEN...From noon today to 5 AM MST Friday.', '* IMPACTS...Travel could be very difficult to impossible with very\nlow visibility. Some roads may be closed. Frostbite and\nhypothermia are possible from wind chill values below zero.']"
13,NM,Northern Sangre de Cristo Mountains,Avalanche Watch,Unknown,Unknown,Unknown,2022-03-09T19:12:00-07:00,,"['The following message is transmitted at the request of the Taos\nAvalanche Center.', 'The Taos Avalanche Center in Taos has issued a Backcountry\nAvalanche Watch.', '* WHAT...The avalanche danger is currently Considerable. Another\nwinter storm may increase the avalanche danger to High at all\nelevations Thursday, March 10th, 2022.', '* WHERE...Wheeler Peak Wilderness Area and Columbine Hondo\nWilderness above 9500 feet.', '* WHEN... In effect from Wed 19:00 MST to Thu 08:00 MST.', '* IMPACTS...Another winter storm is on tap tonight into Thursday,\nMarch 10th where we could see an additional 1 to 2 feet of snow\nand strong winds through mid-day Thursday. This will bring storm\ntotals close to 4 feet of snow in the last week. Large dangerous\nnatural and human-triggered avalanches are likely throughout the\nday Thursday.']"
14,NM,Southwest Deserts and Lowlands,Red Flag Warning,Severe,Likely,Expected,2022-03-09T14:25:00-07:00,2022-03-10T17:00:00-07:00,"['The National Weather Service in El Paso Tx/Santa Teresa has\nissued a Red Flag Warning, which is in effect from 11 AM to 5 PM\nMST Thursday. The Fire Weather Watch is no longer in effect.', '* AFFECTED AREA...Fire weather zone 111, in southwest New Mexico.', '* WIND... Southwest winds between 20 and 25 mph gust up to 40\nmph.', '* HUMIDITY...10 to 15 percent', '* HIGHEST THREAT...is located across the lowlands west of the\nRio Grande Valley including Hidalgo, Luna and southern Grant\ncounties where the winds will be stronger, the relative\nhumidity will be low and the temperatures will be warmer.', '* IMPACTS...any fires that develop will likely spread rapidly.\nOutdoor burning is not recommended.']"
15,NM,South Central Lowlands And Southern Rio Grande Valley,Red Flag Warning,Severe,Likely,Expected,2022-03-09T14:25:00-07:00,2022-03-10T17:00:00-07:00,"['The National Weather Service in El Paso Tx/Santa Teresa has\nissued a Red Flag Warning, which is in effect from 11 AM to 5 PM\nMST Thursday.', '* AFFECTED AREA...Fire weather zone 112 in south central New\nMexico.', '* WIND...Southwest winds between 20 and 25 mph gust up to 40\nmph.', '* HUMIDITY...10 to 15 percent', '* HIGHEST THREAT...is located across the lowlands along the Rio\nGrande Valley including Dona Ana, Sierra, and portions of Otero\nCounties where the winds will be stronger, the relative\nhumidity will be low and the temperatures will be warmer.', '* IMPACTS...any fires that develop will likely spread rapidly.\nOutdoor burning is not recommended.']"
0,NY,Northern Saratoga; Northern Warren; Northern Washington; Eastern Schenectady; Southern Saratoga; Eastern Albany; Western Rensselaer; Eastern Rensselaer; Eastern Greene; Western Columbia; Eastern Columbia; Southeast Warren; Southern Washington,Special Weather Statement,Moderate,Observed,Expected,2022-03-10T08:42:00-05:00,,"['Some patchy dense freezing fog is continuing in the Capital\nRegion, eastern Mohawk Valley, northern and central Taconics,\nUpper Hudson Valley and the Lake George Saratoga Region this\nmorning. The fog should begin to burn off between 10 am and noon.\nPlease use caution on the roadways, if you encounter any dense\nfog a quarter mile or less in visibility. Leave extra space\nbetween cars and adjust speed accordingly.']"
1,NY,Chemung; Chenango; Otsego; Tioga; Broome; Delaware; Bradford; Susquehanna; Northern Wayne; Wyoming,Winter Storm Watch,Severe,Possible,Future,2022-03-10T03:16:00-05:00,2022-03-13T01:00:00-05:00,"['* WHAT...Heavy snow possible. Total snow accumulations of 7 inches\nor more are possible. Winds could gust as high as 40 mph.', '* WHERE...In Pennsylvania, Bradford, Susquehanna, Northern Wayne\nand Wyoming counties. In New York, Chemung, Chenango, Otsego,\nTioga, Broome and Delaware counties.', '* WHEN...From late Friday night through late Saturday night.', '* IMPACTS...Travel could be very difficult. Areas of blowing\nsnow could significantly reduce visibility.', '* ADDITIONAL DETAILS...Temperatures start off in the 30s Friday\nnight, but are then forecast to fall through the 20s during the\nday on Saturday.']"
2,NY,Northern Oneida; Yates; Seneca; Southern Cayuga; Onondaga; Steuben; Schuyler; Tompkins; Madison; Southern Oneida; Cortland,Winter Storm Watch,Severe,Possible,Future,2022-03-10T03:16:00-05:00,2022-03-13T01:00:00-05:00,"['* WHAT...Heavy snow possible. Total snow accumulations of 7 to\n12 inches possible. Winds could gust as high as 40 mph.', '* WHERE...Northern Oneida, Yates, Seneca, Southern Cayuga,\nOnondaga, Steuben, Schuyler, Tompkins, Madison, Southern\nOneida and Cortland counties.', '* WHEN...From Friday evening through late Saturday night.', '* IMPACTS...Travel could be very difficult to impossible. Areas of\nblowing snow could significantly reduce visibility.', '* ADDITIONAL DETAILS...Temperatures are forecast to fall through\nthe 20s during the day on Saturday.']"
3,NY,Northern Herkimer; Hamilton; Southern Herkimer; Southern Fulton; Montgomery; Northern Warren; Schoharie; Northern Fulton; Bennington; Western Windham,Winter Storm Watch,Severe,Possible,Future,2022-03-10T03:12:00-05:00,2022-03-13T01:00:00-05:00,"['* WHAT...Heavy snow possible. Total snow accumulations of 6 to 12\ninches possible, with potentially up to 15 inches over the\nwestern Adirondacks. Winds could gust as high as 35 mph.', '* WHERE...The southern and western Adirondacks, the central and western\nMohawk Valley and Schoharie County of eastern New York and the\nsouthern Greens Mountains of southern Vermont.', '* WHEN...Friday night through late Saturday evening.', '* IMPACTS...Travel could be very difficult and potentially\ndangerous due to snow covered roadways and reduced visibility.', '* ADDITIONAL DETAILS...Snow rates may exceed one inch per hour\nduring the day on Saturday.']"
4,NY,Wayne; Northern Cayuga; Oswego; Jefferson; Lewis; Livingston; Ontario; Allegany,Winter Storm Watch,Severe,Possible,Future,2022-03-10T03:03:00-05:00,2022-03-13T01:00:00-05:00,"['* WHAT...Heavy snow possible. Total snow accumulations in excess\nof 7 inches possible. Winds could gust as high as 45 mph.', '* WHERE...Wayne, Northern Cayuga, Oswego, Jefferson, Lewis,\nLivingston, Ontario, and Allegany counties.', '* WHEN...From Friday evening through late Saturday night.', '* IMPACTS...Travel could be very difficult to impossible. Areas\nof blowing snow could significantly reduce visibility. The\nhazardous conditions could impact the evening commute.']"
5,NY,Northern St. Lawrence; Northern Franklin; Eastern Clinton; Southeastern St. Lawrence; Southern Franklin; Western Clinton; Western Essex; Eastern Essex; Southwestern St. Lawrence; Grand Isle; Western Franklin; Orleans; Essex; Western Chittenden; Lamoille; Caledonia; Washington; Western Addison; Orange; Western Rutland; Windsor; Eastern Franklin; Eastern Chittenden; Eastern Addison; Eastern Rutland,Winter Storm Watch,Severe,Possible,Future,2022-03-10T02:59:00-05:00,2022-03-13T01:00:00-05:00,"['* WHAT...Heavy snow possible. Total snow accumulations of 8 to 15\ninches possible except 5 to 10 inches possible across portions\nof eastern Windsor and Orange Counties. Winds could gust as\nhigh as 40 mph.', '* WHERE...Portions of central, northeast, northwest and southern\nVermont and northern New York.', '* WHEN...From Friday evening through late Saturday night.', '* IMPACTS...Travel could be very difficult to impossible.', '* ADDITIONAL DETAILS...Light snow will overspread the region late\nFriday night into early Saturday morning. Periods of moderate to\nheavy snow will develop by late Saturday morning and continue\nthrough Saturday afternoon with snowfall rates in excess of 1\ninch per hour possible. A mix of rain and snow will be seen\nacross the Connecticut River Valley Saturday morning before\nswitching over to all snow Saturday afternoon. Snowfall will\ntaper off Saturday night with gusty northwest winds between 25\nand 40 mph developing Saturday night. This could lead to blowing\nsnow which could significantly reduce visibility across the\nregion. These winds will weaken through the morning hours on\nSunday.']"
0,ND,Divide; Burke; Renville; Bottineau; Rolette; Williams; Mountrail; Ward; McHenry; Pierce; McLean; Sheridan; Wells; Foster; Burleigh; Kidder; Stutsman; Logan; La Moure; McIntosh; Dickey,Wind Chill Advisory,Moderate,Likely,Expected,2022-03-10T08:36:00-06:00,2022-03-10T09:00:00-06:00,"['Wind chills will continue to improve this morning, therefore the\nWind Chill Advisory will be allowed to expire.']"
1,ND,West Polk; Norman; Clay; Kittson; Roseau; Lake Of The Woods; West Marshall; East Marshall; North Beltrami; Pennington; Red Lake; East Polk; North Clearwater; Mahnomen; Wilkin; Towner; Cavalier; Pembina; Benson; Ramsey; Eastern Walsh County; Eddy; Nelson; Grand Forks; Griggs; Steele; Traill; Barnes; Cass; Ransom; Sargent; Richland; Western Walsh County,Special Weather Statement,Moderate,Observed,Expected,2022-03-10T06:22:00-06:00,,"['A clipper and associated strong cold front move into eastern ND and\nnorthwest MN later today through Friday, bringing several periods of\npossible winter travel impacts. Snow squalls may develop along the\nfront after 4 PM in the Devils Lake Basin and spread east over\nthe Red River Valley through the evening commute. These type of\nconvective snow systems can result in a sudden brief periods of\nintense snowfall and whiteout conditions as winds gust as high as\n45 mph. After this initial period of snow and strong winds, there\nmay be a slight decrease in winds and impacts. Isolated to\nscattered snow showers may continue into Friday, and where snow\nshowers track brief whiteout conditions will remain possible.\nWinds then increase once again Friday morning and may lead to\nadditional blowing snow impacts mainly north of Highway 200 in the\nopen country of the Red River Valley.', 'The older snow pack is unlikely to respond to the periods of windy\nconditions, however where snow showers or freshly fallen snow of 1\ninch or more occurs blizzard conditions may develop. This is hard to\nanticipate at this time and conditions may be highly variable by\nlocation and duration. At this time there is a 30 percent chance for\nblizzard conditions along and west of the Red River Valley this\nevening. There is a 40 percent chance for blizzard conditions\nnorth of Highway 200 in the Red River Valley starting again Friday\nmorning.']"
2,ND,West Polk; Norman; Clay; Kittson; Roseau; West Marshall; East Marshall; Pennington; Red Lake; East Polk; Mahnomen; West Becker; Wilkin; Towner; Cavalier; Pembina; Benson; Ramsey; Eastern Walsh County; Eddy; Nelson; Grand Forks; Griggs; Steele; Traill; Barnes; Cass; Ransom; Sargent; Richland; Western Walsh County,Wind Chill Advisory,Moderate,Likely,Expected,2022-03-10T04:45:00-06:00,2022-03-10T12:00:00-06:00,"['* WHAT...Very cold wind chills expected. Wind chills as low as\n35 below zero.', '* WHERE...Portions of northwest and west central Minnesota and\nnortheast and southeast North Dakota.', '* WHEN...Until noon CST today.', '* IMPACTS...The dangerously cold wind chills could cause\nfrostbite on exposed skin in as little as 10 minutes.']"
0,OH,"Holmes, OH; Wayne, OH",Flood Warning,Severe,Observed,Immediate,2022-03-10T07:49:00-05:00,2022-03-11T13:00:00-05:00,"['* WHAT...Minor flooding is occurring and minor flooding is forecast.', '* WHERE...Killbuck Creek Near Killbuck.', '* WHEN...Until early tomorrow afternoon.', '* IMPACTS...At 16.0 feet, Flooded roads in and near Killbuck include\nWater Street, County Road 621, State Route 60 south, State Route\n520, as well as local low lying roads.', '* ADDITIONAL DETAILS...\n- At 7:00 AM EST Thursday the stage was 16.4 feet.\n- Recent Activity...The maximum river stage in the 24 hours\nending at 7:00 AM EST Thursday was 16.5 feet.\n- Forecast...The river is expected to fall below flood stage\ntomorrow morning and continue falling to 12.1 feet Monday\nmorning.\n- Flood stage is 15.0 feet.\n- http://www.weather.gov/safety/flood']"
1,OH,Bracken; Robertson; Mason; Lewis; Pickaway; Fairfield; Ross; Hocking; Brown; Highland; Adams; Pike; Scioto,Winter Storm Watch,Severe,Possible,Future,2022-03-10T03:21:00-05:00,2022-03-12T13:00:00-05:00,"['* WHAT...Heavy snow possible. Total snow accumulations of 3 to 5\ninches possible.', '* WHERE...Portions of Central, South Central and Southwest Ohio\nand Northeast and Northern Kentucky.', '* WHEN...From Friday evening through Saturday afternoon.', '* IMPACTS...Travel could be very difficult.', '* ADDITIONAL DETAILS...After warm temperatures on Friday,\ntemperatures will fall below freezing Friday night as much\ncolder air moves in. Brisk conditions are then expected on\nSaturday with high temperatures remaining in the 20s.']"
2,OH,"Coshocton, OH",Flood Warning,Severe,Observed,Immediate,2022-03-09T21:10:00-05:00,,"['* WHAT...Minor flooding is occurring and minor flooding is forecast.', '* WHERE...Muskingum River at Coshocton.', '* WHEN...Until further notice.', '* IMPACTS...At 13.0 feet, Water reaches low lying areas between\nTuscarawas and Walhonding Rivers just upstream of the confluence\nof the two rivers.\nAt 15.0 feet, Low areas are flooded and water reaches a few homes\nalong Route 16 south of Coshocton and along County Route 1A north\nof Coshocton.\nAt 16.0 feet, Flood waters begin to affect the Lake Park area\nalong the Walhonding River and begins backwater flooding along\nMill Creek north of Lake Park and along Route 83. Flood waters\nwill begin to enter yards in low-lying areas along County Route 1A.', '* ADDITIONAL DETAILS...\n- At 8:00 PM EST Wednesday the stage was 15.6 feet.\n- Recent Activity...The maximum river stage in the 24 hours\nending at 8:00 PM EST Wednesday was 15.6 feet.\n- Forecast...The river will remain nearly steady at around 15.5\nfeet over the next several days.\n- Flood stage is 15.0 feet.\n- Flood History...This crest compares to a previous crest of\n16.9 feet on 02/13/2019.\n- http://www.weather.gov/safety/flood']"
3,OH,"Holmes, OH; Wayne, OH",Flood Warning,Severe,Observed,Immediate,2022-03-08T15:44:00-05:00,2022-03-11T13:00:00-05:00,"['* WHAT...Minor flooding is occurring and minor flooding is forecast.', '* WHERE...Killbuck Creek Near Killbuck.', '* WHEN...Until early Friday afternoon.', '* IMPACTS...At 17.0 feet, Private property on Water Street in the\nVillage of Killbuck flooded. Several county and local roads\nimpassable including State Route 60 south and County Road 621.', '* ADDITIONAL DETAILS...\n- At 3:00 PM EST Tuesday the stage was 16.8 feet.\n- Recent Activity...The maximum river stage in the 24 hours\nending at 3:00 PM EST Tuesday was 16.8 feet.\n- Forecast...The river is expected to fall below flood stage\nFriday morning and continue falling to 12.9 feet Sunday\nmorning.\n- Flood stage is 15.0 feet.\n- Flood History...This crest compares to a previous crest of\n16.8 feet on 02/24/1975.\n- http://www.weather.gov/safety/flood']"
