,State,Area,Event,Severity,Certainty,Urgency,Effective,Ends,Description
0,AK,Haines Borough and Lynn Canal,Winter Weather Advisory,Moderate,Likely,Expected,2022-01-27T04:00:00-09:00,2022-01-28T09:00:00-09:00,"['* WHAT...Snow expected. Total snow accumulations of up to 7\ninches.', '* WHERE...Haines Highway near the Canadian Border.', '* WHEN...From 3 PM this afternoon to 9 AM AKST Friday.', '* IMPACTS...Travel could be very difficult.', '* ADDITIONAL DETAILS...Snow amounts will be highest at elevation.\nRain is expected in Haines near sea level.']"
1,AK,Taiya Inlet and Klondike Highway,Winter Weather Advisory,Moderate,Likely,Expected,2022-01-27T04:00:00-09:00,2022-01-28T09:00:00-09:00,"['* WHAT...Snow expected. Total snow accumulations of up to 7\ninches. Winds gusting as high as 35 mph.', '* WHERE...Klondike Highway near White Pass.', '* WHEN...From 3 PM this afternoon to 9 AM AKST Friday.', '* IMPACTS...Travel could be very difficult.', '* ADDITIONAL DETAILS...Snow amounts will be highest at elevation.\nRain is expected in Skagway near sea level.']"
2,AK,Copper River Basin,Winter Weather Advisory,Moderate,Likely,Expected,2022-01-27T03:36:00-09:00,2022-01-28T06:00:00-09:00,"['* WHAT...Snow and blowing snow expected. Total snow\naccumulations of 6 to 12 inches. Visibility reduced to one\nhalf mile at times in blowing snow.', '* WHERE...Copper River Basin. Snow expected for the southern\nportion of the basin, mainly Glennallen south. Blowing snow\nexpected from Paxson north to Isabel Pass.', '* WHEN...Until 6 AM AKST Friday.', '* IMPACTS...Plan on slippery road conditions. Areas of blowing\nsnow could significantly reduce visibility to one half mile or\nless at times.', '* ADDITIONAL DETAILS...Falling snow has started across the area\nand will persist into Friday morning. Highest accumulations\nwill generally be from Glennallen south. Meanwhile, north\nwinds are expected to increase from Paxson to Isabel Pass\nmidday Thursday. Winds are expected to gust as high as 35 mph\nwhich could reduce visibility in blowing snow.']"
3,AK,Western Kenai Peninsula,Winter Weather Advisory,Moderate,Likely,Expected,2022-01-27T03:36:00-09:00,2022-01-28T06:00:00-09:00,"['* WHAT...Blowing snow expected. Total snow accumulations of 5 to\n10 inches. Visibility reduced to one half mile at times in\nblowing snow.', '* WHERE...Western Kenai Peninsula. Worst conditions expected\nalong the Sterling Highway from Nikiski to Anchor Point.', '* WHEN...Until 6 AM AKST Friday.', '* IMPACTS...Plan on slippery road conditions and greatly reduced\nvisibility. The hazardous conditions could impact the morning\nor evening commute.', '* ADDITIONAL DETAILS...Snow and isolated pockets of blowing snow\nwill be possible for inland areas. However, the combination of\nwinds gusting to 30 mph and falling snow, will produce the\nworst conditions near the Cook Inlet.']"
4,AK,Northeast Prince William Sound,Winter Weather Advisory,Moderate,Likely,Expected,2022-01-27T03:36:00-09:00,2022-01-28T09:00:00-09:00,"['* WHAT...Blowing snow expected. Total snow accumulations of 6 to\n12 inches. Winds gusting as high as 35 mph.', '* WHERE...Thompson Pass.', '* WHEN...From 6 AM Thursday to 9 AM AKST Friday.', '* IMPACTS...Plan on slippery road conditions. Areas of blowing\nsnow could significantly reduce visibility to one half mile or\nless at times.', '* ADDITIONAL DETAILS...Gusty winds and snowfall will continue\nthrough Friday morning. Snow becomes light and begins tapering\noff by Friday afternoon. Winds will continue to be gusty beyond\nFriday and any transportable snow on the ground may result in\nperiods of reduced visibilities.']"
5,AK,Central Interior,Winter Weather Advisory,Moderate,Likely,Expected,2022-01-27T03:32:00-09:00,2022-01-28T18:00:00-09:00,"['* WHAT...Blowing snow expected. Plan on difficult travel\nconditions. Winds gusting as high as 45 mph will cause areas\nof blowing and drifting snow. Visibility will be one half mile\nor less at times.', '* WHERE...Elliott Highway Summits.', '* WHEN...10 AM today to 6 PM Friday.', '* ADDITIONAL DETAILS...Winds gusting as high as 45 mph will\ncause areas of blowing and drifting snow. Cold wind chills as\nlow as 45 below zero will cause frostbite in as little as 10\nminutes to exposed skin.']"
6,AK,Yukon Flats and Surrounding Uplands,Winter Weather Advisory,Moderate,Likely,Expected,2022-01-27T03:32:00-09:00,2022-01-28T18:00:00-09:00,"['* WHAT...Blowing snow expected. Plan on difficult travel\nconditions. Winds gusting as high as 35 mph will cause areas\nof blowing and drifting snow. Visibility will be one half mile\nor less at times.', '* WHERE...Steese Highway Summits.', '* WHEN...10 AM today to 6 PM Friday.', '* ADDITIONAL DETAILS...Winds gusting as high as 35 mph will\ncause areas of blowing and drifting snow over Steese Highway\nSummits. Cold wind chills as low as 40 below zero will cause\nfrostbite in as little as 10 minutes to exposed skin.']"
7,AK,Upper Tanana Valley and the Fortymile Country,Winter Weather Advisory,Moderate,Likely,Expected,2022-01-27T03:32:00-09:00,2022-01-28T18:00:00-09:00,"['* WHAT...Snow occurring. Plan on difficult travel conditions.\nAdditional snow accumulations of 2 to 6 inches are expected.\nThe heaviest snow totals are expected south of Chicken.', '* WHERE...Upper Tanana Valley and the Fortymile Country.', '* WHEN...Until 6 PM Friday.', '* ADDITIONAL DETAILS...Look for reduced visibilities at times.']"
8,AK,Deltana and Tanana Flats,Winter Weather Advisory,Moderate,Likely,Expected,2022-01-27T03:32:00-09:00,2022-01-28T18:00:00-09:00,"['* WHAT...Snow occurring. Plan on difficult travel conditions.\nAdditional snow accumulations of 3 to 6 inches, are expected.\nThe heaviest snow totals are expected southeast of Salcha.', '* WHERE...Deltana and Tanana Flats, including Delta Junction.', '* WHEN...Until 6 PM Friday.', '* ADDITIONAL DETAILS...Look for reduced visibilities at times.']"
9,AK,Central Beaufort Sea Coast,Wind Chill Advisory,Moderate,Likely,Expected,2022-01-27T03:32:00-09:00,2022-01-28T18:00:00-09:00,"['* WHAT...Very cold wind chills expected. The cold wind chills\nwill cause frostbite in as little as 10 minutes to exposed\nskin. Expect wind chills as cold as 55 below zero.', '* WHERE...Central Beaufort Sea Coast.', '* WHEN...Now to 6 PM Friday.']"
10,AK,Eastern Beaufort Sea Coast,Wind Chill Advisory,Moderate,Likely,Expected,2022-01-27T03:32:00-09:00,2022-01-29T06:00:00-09:00,"['* WHAT...Very cold wind chills expected. The cold wind chills\nwill cause frostbite in as little as 10 minutes to exposed\nskin. Expect wind chills as cold as 55 below zero.', '* WHERE...Eastern Beaufort Sea Coast.', '* WHEN...Now to 6 AM Saturday.']"
11,AK,Eastern Alaska Range,Winter Weather Advisory,Moderate,Likely,Expected,2022-01-27T03:32:00-09:00,2022-01-29T18:00:00-09:00,"['* WHAT...Snow and blowing snow occurring. Plan on difficult\ntravel conditions with reduced visibility to a half mile or\nless at times. Additional snow accumulations of 4 to 8 inches\nare expected.', '* WHERE...Eastern Alaska Range including Isabel Pass and\nMentasta Pass.', '* WHEN...Until 6 PM Saturday.', '* ADDITIONAL DETAILS...Look for reduced visibilities at times.\nNorth winds gusting to 40 mph from Trims Camp south will\nresult in significant blowing and drifting snow at times.']"
12,AK,Middle Tanana Valley,Air Quality Alert,Unknown,Unknown,Unknown,2022-01-26T11:24:00-09:00,,"['The Department of Environmental Conservation has issued an Air\nQuality Alert which is in effect until 2 PM AKST Thursday.', 'North Pole has a Stage 2 alert.', 'Fairbanks has a Stage 1 alert.']"
0,AR,"Arkansas, AR; Monroe, AR",Flood Warning,Severe,Observed,Immediate,2022-01-26T20:36:00-06:00,2022-01-30T12:00:00-06:00,"['* WHAT...Minor flooding is occurring and minor flooding is forecast.', '* WHERE...White River At Clarendon.', '* WHEN...Until early Sunday afternoon.', '* IMPACTS...At 26.0 feet, River flows in many side channels and\ncreates islands between the river and sloughs and creeks. Flooding\nof cropland and timber is occurring. Portions of the National\nWildlife Refuge downstream of Clarendon flooding.', '* ADDITIONAL DETAILS...\n- At 8:00 PM CST Wednesday the stage was 26.4 feet.\n- Forecast...The river is expected to fall below flood stage\nSaturday morning and continue falling to 25.4 feet by Monday\nmorning.\n- Flood stage is 26.0 feet.\n- http://www.weather.gov/safety/flood']"
1,AR,"Jackson, AR; Woodruff, AR",Flood Warning,Severe,Observed,Immediate,2022-01-26T20:32:00-06:00,2022-01-28T06:00:00-06:00,"['* WHAT...Minor flooding is occurring and minor flooding is forecast.', '* WHERE...Cache River Near Patterson.', '* WHEN...Until Friday morning.', '* IMPACTS...At 9.0 feet, Low swampy timberland along the river\nbegins to flood. Flood gates should be closed and equipment moved\nout of the low grounds along the river and tributaries.', '* ADDITIONAL DETAILS...\n- At 8:15 PM CST Wednesday the stage was 9.0 feet.\n- Forecast...The river is expected to fall below flood stage\nearly Thursday morning and continue falling to 6.8 feet\nSunday morning.\n- Flood stage is 9.0 feet.\n- http://www.weather.gov/safety/flood']"
2,AR,"White, AR; Woodruff, AR",Flood Warning,Severe,Observed,Immediate,2022-01-24T18:46:00-06:00,2022-01-27T10:00:00-06:00,"['* WHAT...Minor flooding is occurring and minor flooding is forecast.', '* WHERE...White River At Augusta.', '* WHEN...Until late Thursday morning.', '* IMPACTS...At 26.0 feet, Farm ground along the river in White and\nWoodruff counties begin to flood. Seasonal agricultural impacts.', '* ADDITIONAL DETAILS...\n- At 6:00 PM CST Monday the stage was 27.3 feet.\n- Forecast...The river is expected to fall below flood stage\nearly Wednesday morning.\n- Flood stage is 26.0 feet.\n- http://www.weather.gov/safety/flood']"
0,AZ,Lake Havasu and Fort Mohave; Lake Mead National Recreation Area; San Bernardino County-Upper Colorado River Valley; Lake Mead National Recreation Area,Lake Wind Advisory,Moderate,Likely,Expected,2022-01-27T01:06:00-08:00,2022-01-27T19:00:00-08:00,"['* WHAT...North winds 20 to 30 mph with gusts up to 45 mph\nexpected.', '* WHERE...In Arizona, Lake Havasu and Fort Mohave and Lake Mead\nNational Recreation Area. In California, San Bernardino County-\nUpper Colorado River Valley. In Nevada, Lake Mead National\nRecreation Area.', '* WHEN...From 11 AM PST /noon MST/ to 7 PM PST /8 PM MST/ today.', '* IMPACTS...Strong winds and rough waves on area lakes will\ncreate hazardous conditions for small craft.']"
1,AZ,Western Mogollon Rim; Eastern Mogollon Rim,Wind Advisory,Moderate,Likely,Expected,2022-01-27T01:33:00-07:00,2022-01-28T06:00:00-07:00,"['* WHAT...Northeast winds increasing rapidly this evening. Expect\nwinds speeds of 15 to 25 mph, with gusts up to 45 mph. Localized\ngusts of 50 to 60 mph near southwest facing terrain, with even\nhigher speeds over the San Francisco Peaks.', '* WHERE...Areas immediately south and southwest of the San\nFrancisco Peaks and Mt Elden. Areas from Stoneman Lake northward\nto Munds Park. Areas just southwest of the Mogollon Rim, but\ngenerally north of Payson.', '* WHEN...From 6 PM this evening to 6 AM MST Friday.', '* IMPACTS...Gusty winds could blow around unsecured objects.\nWinds this strong can make driving difficult, especially for\nhigh profile vehicles.', '* ADDITIONAL DETAILS...Localized damage possible in Skyline\nEstates, Mt Elden Estates and Schultz Creek Road. Localized\ndamage possible near Washington Park, Kohls Ranch and Stoneman\nLake.']"
0,CA,Ventura County Mountains; Los Angeles County Mountains excluding the Santa Monica Range,Wind Advisory,Moderate,Likely,Expected,2022-01-27T05:09:00-08:00,2022-01-28T16:00:00-08:00,"['* WHAT...Northeast winds 25 to 35 mph with gusts up to 55 mph\nexpected.', '* WHERE...Ventura County Mountains and Los Angeles County\nMountains excluding the Santa Monica Range.', '* WHEN...From 7 PM this evening to 4 PM PST Friday.', '* IMPACTS...Gusty winds will blow around unsecured objects and\nmake driving difficult, especially for high profile vehicles.\nTree limbs could be blown down and a few power outages may\nresult. Major roadways that could be impacted by the gusty winds\ninclude Interstate 5 and Highways 14 and 33.']"
1,CA,Santa Clarita Valley,Wind Advisory,Moderate,Likely,Expected,2022-01-27T05:09:00-08:00,2022-01-28T16:00:00-08:00,"['* WHAT...Northeast winds 25 to 35 mph with gusts up to 50 mph\nexpected.', '* WHERE...Santa Clarita Valley.', '* WHEN...From 7 PM this evening to 4 PM PST Friday.', '* IMPACTS...Gusty winds will blow around unsecured objects and\nmake driving difficult, especially for high profile vehicles.\nTree limbs could be blown down and a few power outages may\nresult. Major roadways that could be impacted by the gusty winds\ninclude Interstate 5, as well as Highways 14 and 126.']"
2,CA,Santa Monica Mountains Recreational Area,Wind Advisory,Moderate,Likely,Expected,2022-01-27T05:09:00-08:00,2022-01-28T16:00:00-08:00,"['* WHAT...Northeast winds 15 to 25 mph with gusts up to 45 mph\nexpected.', '* WHERE...Santa Monica Mountains.', '* WHEN...From 7 PM this evening to 4 PM PST Friday.', '* IMPACTS...Gusty winds will blow around unsecured objects and\nmake driving difficult, especially for high profile vehicles.\nTree limbs could be blown down and a few power outages may\nresult. Roadways that could be impacted by the gusty winds\ninclude canyon roads such as Kanan, Malibu Canyon, Topanga, and\nDecker Canyon.']"
3,CA,Ventura County Interior Valleys; Ventura County Coastal Valleys; Los Angeles County San Fernando Valley,Wind Advisory,Moderate,Likely,Expected,2022-01-27T05:09:00-08:00,2022-01-28T16:00:00-08:00,"['* WHAT...Northeast winds 20 to 30 mph with gusts up to 45 mph\nexpected. Strongest winds across eastern Ventura County\nvalleys and western San Fernando Valley.', '* WHERE...Ventura County Interior Valleys, Ventura County\nCoastal Valleys and San Fernando Valley.', '* WHEN...From 7 PM this evening to 4 PM PST Friday.', '* IMPACTS...Gusty winds will blow around unsecured objects and\nmake driving difficult, especially for high profile vehicles.\nTree limbs could be blown down and a few power outages may\nresult. Major roadways that could be impacted by the gusty winds\ninclude Interstate 5, as well as Highways 23, 101, 118 and 126.']"
4,CA,Ventura County Coast; Los Angeles County Coast including Downtown Los Angeles,Wind Advisory,Moderate,Likely,Expected,2022-01-27T05:09:00-08:00,2022-01-28T16:00:00-08:00,"['* WHAT...Northeast winds 15 to 25 mph with gusts up to 40 mph\nexpected. Strongest for coastal Los Angeles County from Malibu\nto the Hollywood Hills.', '* WHERE...Ventura County Coast and Los Angeles County Coast\nincluding Downtown Los Angeles.', '* WHEN...From 7 PM this evening to 4 PM PST Friday.', '* IMPACTS...Gusty winds will blow around unsecured objects and\nmake driving difficult, especially for high profile vehicles.\nTree limbs could be blown down and a few power outages may\nresult. Major roadways that could be impacted by the gusty winds\ninclude Highways 1 and 101.']"
5,CA,San Bernardino and Riverside County Valleys-The Inland Empire; San Bernardino County Mountains; Riverside County Mountains; Santa Ana Mountains and Foothills; San Gorgonio Pass Near Banning; Orange County Inland,Wind Advisory,Moderate,Likely,Expected,2022-01-27T02:16:00-08:00,2022-01-28T22:00:00-08:00,"['* WHAT...Northeast winds 20 to 30 mph with gusts to 55 mph\nexpected.', '* WHERE...Orange County Inland Areas, San Gorgonio Pass Near\nBanning, Santa Ana Mountains and Foothills, Riverside County\nMountains, San Bernardino County Mountains and San Bernardino\nand Riverside County Valleys-The Inland Empire.', '* WHEN...From 7 PM this evening to 10 PM PST Friday.', '* IMPACTS...Gusty winds could blow around unsecured objects.\nTree limbs could be blown down and a few power outages may\nresult.']"
6,CA,San Diego County Inland Valleys; San Diego County Mountains,High Wind Warning,Severe,Likely,Expected,2022-01-27T02:16:00-08:00,2022-01-29T04:00:00-08:00,"['* WHAT...East winds 25 to 35 mph with gusts to 60 mph expected.', '* WHERE...San Diego County Valleys and San Diego County\nMountains.', '* WHEN...From 10 PM this evening to 4 AM PST Saturday.', '* IMPACTS...Damaging winds will blow down trees and power lines.\nPower outages are possible. Travel will be difficult,\nespecially for high profile vehicles.']"
7,CA,Lake Havasu and Fort Mohave; Lake Mead National Recreation Area; San Bernardino County-Upper Colorado River Valley; Lake Mead National Recreation Area,Lake Wind Advisory,Moderate,Likely,Expected,2022-01-27T01:06:00-08:00,2022-01-27T19:00:00-08:00,"['* WHAT...North winds 20 to 30 mph with gusts up to 45 mph\nexpected.', '* WHERE...In Arizona, Lake Havasu and Fort Mohave and Lake Mead\nNational Recreation Area. In California, San Bernardino County-\nUpper Colorado River Valley. In Nevada, Lake Mead National\nRecreation Area.', '* WHEN...From 11 AM PST /noon MST/ to 7 PM PST /8 PM MST/ today.', '* IMPACTS...Strong winds and rough waves on area lakes will\ncreate hazardous conditions for small craft.']"
8,CA,Western Siskiyou County; Central Siskiyou County; South Central Siskiyou County; Northeast Siskiyou and Northwest Modoc Counties; Modoc County; Central Douglas County; Eastern Curry County and Josephine County; Eastern Douglas County Foothills; Jackson County; Klamath Basin; Northern and Eastern Klamath County and Western Lake County; Central and Eastern Lake County,Air Stagnation Advisory,Moderate,Likely,Expected,2022-01-26T11:25:00-08:00,2022-01-30T10:00:00-08:00,"['* WHAT...Stagnant air is expected, which may lead to\ndeteriorating air quality.', '* WHERE...Portions of northern California and south central and\nsouthwest Oregon, mostly in valley locations.', '* WHEN...Until 10 AM PST Sunday.', '* IMPACTS...Air stagnation can result in diminishing air\nquality, especially in and near areas with significant sources\nof air pollution. Diminished air quality is likely to cause\nhealth issues for people with respiratory problems if\nprecautions are not taken.', '* View the hazard area in detail at\nhttps://www.wrh.noaa.gov/map/?wfo=mfr']"
9,CA,Western Siskiyou County; Central Siskiyou County; South Central Siskiyou County; Northeast Siskiyou and Northwest Modoc Counties; Modoc County; Eastern Douglas County Foothills; Jackson County; Klamath Basin; Northern and Eastern Klamath County and Western Lake County; Central and Eastern Lake County,Air Stagnation Advisory,Moderate,Likely,Expected,2022-01-25T05:11:00-08:00,2022-01-29T04:00:00-08:00,"['* WHAT...A period of stagnant air with light winds and poor\nmixing is expected.', '* WHERE...Portions of northern California and south central and\nsouthwest Oregon, mostly in valley locations.', '* WHEN...Until 4 AM PST Saturday.', '* IMPACTS...Air stagnation could result in the development and\npersistence of deteriorating air quality.', '* View the hazard area in detail at\nhttps://www.wrh.noaa.gov/map/?wfo=mfr']"
0,CO,Larimer and Boulder Counties Between 6000 and 9000 Feet; Jefferson and West Douglas Counties Above  6000 Feet/Gilpin/Clear Creek/Northeast Park Counties Below 9000 Feet; Boulder And Jefferson Counties Below 6000 Feet/West Broomfield County; North Douglas County Below 6000 Feet/Denver/West Adams and Arapahoe Counties/East Broomfield County; Elbert/Central and East Douglas Counties Above 6000 Feet; Central and South Weld County; Central and East Adams and Arapahoe Counties,Winter Weather Advisory,Moderate,Likely,Expected,2022-01-27T03:55:00-07:00,2022-01-27T15:00:00-07:00,"['* WHAT...Snow expected. Total snow accumulations 2 to 4 inches.\nLocally higher amounts expected in the foothills. Winds gusting as\nhigh as 35 mph.', '* WHERE...Portions of central, north central, and northeast Colorado.', '* WHEN...From 7 AM this morning to 3 PM MST this afternoon.', '* IMPACTS...Roads will likely become slick and hazardous. The\nhazardous conditions could impact the Thursday morning commute.']"
0,CT,Tolland; Windham; Northern Worcester; Central Middlesex County; Western Essex; Southern Worcester; Northwest Middlesex County,Winter Storm Watch,Severe,Possible,Future,2022-01-27T03:33:00-05:00,2022-01-30T00:00:00-05:00,"['* WHAT...Heavy snow possible. Total snow accumulations of 8 to 17\ninches possible. Winds could gust as high as 60 mph, especially\non Cape Cod.', '* WHERE...Portions of northern Connecticut and central, eastern\nand northeastern Massachusetts.', '* WHEN...From late Friday night through Saturday evening.', '* IMPACTS...Travel could be very difficult to impossible. Strong\nwinds could cause tree damage.']"
1,CT,Northern Fairfield; Northern New Haven; Northern Middlesex; Northern New London; Southern Fairfield; Southern New Haven; Southern Middlesex; Southern New London; Hudson; Northern Westchester; Southern Westchester; New York (Manhattan); Bronx; Richmond (Staten Is.); Kings (Brooklyn); Northwest Suffolk; Northeast Suffolk; Southwest Suffolk; Southeast Suffolk; Northern Queens; Northern Nassau; Southern Queens; Southern Nassau,Winter Storm Watch,Severe,Possible,Future,2022-01-27T03:30:00-05:00,2022-01-29T19:00:00-05:00,"['* WHAT...Heavy snow possible. Total snow accumulations of 6 to 12\ninches possible. Winds could gust as high as 45 mph.', '* WHERE...Portions of northeast New Jersey, southern Connecticut\nand southeast New York.', '* WHEN...From Friday evening through Saturday evening.', '* IMPACTS...Travel could be very difficult. Gusty winds could\nbring down tree branches.', '* ADDITIONAL DETAILS...There continues to be greater than usual\nforecast uncertainty with the track of this storm, and the axis\nof heaviest snowfall may shift in subsequent forecast updates.']"
0,DE,Inland Sussex; Delaware Beaches; Western Monmouth; Eastern Monmouth; Ocean; Atlantic; Cape May; Atlantic Coastal Cape May; Coastal Atlantic; Coastal Ocean; Southeastern Burlington,Winter Storm Watch,Severe,Possible,Future,2022-01-27T03:13:00-05:00,2022-01-29T19:00:00-05:00,"['* WHAT...Heavy snow possible. Total snow accumulations of 6 to 12\ninches possible. Winds could gust as high as 45 mph.', '* WHERE...The coastal counties of New Jersey and Sussex County in\nDelaware.', '* WHEN...From Friday evening through Saturday evening.', '* IMPACTS...Travel could be very difficult to impossible.', '* ADDITIONAL DETAILS...Snow is expected to begin Friday evening in\nDelmarva and southern New Jersey, spreading northward overnight\ninto Saturday morning. Snow may be heavy at times through mid\nafternoon before diminishing Saturday evening. Strong winds may\ngenerate blowing snow and very low visibilities at times. The\nstorm total snow forecast remains very uncertain, so stay tuned\nto the latest forecasts.']"
1,DE,New Castle; Kent; Kent; Queen Anne's; Talbot; Caroline; Middlesex; Mercer; Salem; Gloucester; Camden; Northwestern Burlington; Cumberland; Delaware; Philadelphia; Eastern Montgomery; Lower Bucks,Winter Storm Watch,Severe,Possible,Future,2022-01-27T03:13:00-05:00,2022-01-29T19:00:00-05:00,"['* WHAT...Heavy snow possible. Total snow accumulations of 4 to 9\ninches possible. Winds could gust as high as 40 mph.', '* WHERE...The eastern shore of Maryland, northern and central\nDelaware, far southeastern Pennsylvania, and much of central and\nsouthern New Jersey.', '* WHEN...From Friday evening through Saturday evening.', '* IMPACTS...Travel could be very difficult.', '* ADDITIONAL DETAILS...Snow is expected to begin Friday evening in\nDelmarva and southern New Jersey, spreading northward overnight\ninto Saturday morning. Snow may be heavy at times through early\nafternoon before diminishing late in the day. Winds may generate\nareas of blowing snow and low visibilities at times. The storm\ntotal snow forecast remains very uncertain, so stay tuned to the\nlatest forecasts.']"
0,FL,Coastal Volusia; Northern Brevard County,Beach Hazards Statement,Moderate,Likely,Expected,2022-01-27T04:08:00-05:00,2022-01-28T04:00:00-05:00,"['* WHAT...Gusty northeast winds will produce choppy surf and\nbreaking waves of 4 to 6 feet. There will also be a Moderate\nrisk of dangerous rip currents.', '* WHERE...Coastal Volusia and Northern Brevard Counties.', '* WHEN...Through late tonight.', '* IMPACTS...Large breaking waves can knock you off your feet and\nmake you even more susceptible to being caught in the seaward\npull of a rip current.']"
1,FL,Coastal Nassau; Coastal Duval; Coastal St. Johns; Coastal Flagler; Coastal Glynn; Coastal Camden,Rip Current Statement,Moderate,Likely,Expected,2022-01-27T01:56:00-05:00,2022-01-28T03:00:00-05:00,"['* WHAT...Dangerous rip currents expected. Rough surf also\nexpected, especially for NE FL beaches.', '* WHERE...Southeast Georgia and Northeast Florida Beaches.', '* WHEN...Through late tonight.', '* IMPACTS...Rip currents can sweep even the best swimmers away\nfrom shore into deeper water.']"
